comment_text,comment_speed,comment_service,comment_taste,comment_time
Çok iyiydi.,10.0,10.0,10.0,1606517222
"Çok uzun zamandır yemeğe verdiğim para boşa gitti hissi yaşamamıştım. 20-30dk gönderim süresi yazıp 1 saat 15dkda ulaştırdığınız buz gibi patates kızartması bunu yaşattı bana. Pizza güzeldi, teşekkürler.",1.0,8.0,8.0,1606430822
Hız konusunda hep en iyisi ayrica bbq chick pizza imzalari kesinlikle yemelisiniz.,10.0,10.0,10.0,1606430822
Sufleyi ilk kez deneyimledik mü kem mel!,10.0,10.0,10.0,1606344422
Daha önce kötü tecrübem olmuştu ama bu sefer güzeldi baya. Bbq tavuk.,9.0,9.0,9.0,1606344422
İdare eder.,7.0,7.0,7.0,1606344422
En doyurucu ve en iyi pizza. Emsallerine göre daha iyi olduğundan hep burayı tercih ediyorum. Hamur ve lezzet gayet iyi. Tebrik ederim.,10.0,10.0,10.0,1606344422
Çok iyi sıcak geldi lezzetliydi.,10.0,10.0,10.0,1606258022
Servis lezzet gayet iyi sadece hamurlar poğaça gibi çok kötü şimdilik not kırmadım kuryeniz mağara ayısı gibi kolay gelsin diyoruz pizzayı bırakıp kaçıyor kurye dışında çok büyük bir sorun yoktu.,1.0,10.0,10.0,1606258022
Lezzetli ve hızlı ama seçtiğimiz ekstra malzemeler biraz az konuyor.,10.0,10.0,9.0,1606258022
Çok iyiydi.,10.0,10.0,10.0,1606171622
Çok beğendik ellerinize emeğinize sağlık.,10.0,10.0,10.0,1606171622
Harika güzel pizzalar çok beğendik.,10.0,10.0,10.0,1606171622
Porsiyonlar iyice küçülmüş büyük boy diye sattıkları pizzaya 40 lira alıyorlar orta boydan azcık büyük bir pizza geliyor 40 liraya başka zincir restorantlarda tıka basa doyarsınız burda aç kalıyorsunuz.,8.0,1.0,8.0,1606171622
"Maalesef, pizza timedan beklediğimiz bu değildi.",8.0,8.0,8.0,1606085222
Bonfile li pizza oldukça lezzetli.,10.0,10.0,9.0,1605998822
"Hep bir ortalaması var, seviyorum bu işletmeyi.",9.0,9.0,9.0,1605998822
"Hadi pizzayı elle yedik, sufleyi nasıl yemeliyiz acaba servis göndermezseniz? Gerçi sağolun, düşünüp suflenin çikolatasını suflenin içine değil de kartonuna dökmüşsünüz, kartonu yalayıp yiyelim diye heralde.",4.0,1.0,6.0,1605998822
Pek lezzetli değildi.,10.0,10.0,7.0,1605998822
Güzel.,10.0,10.0,10.0,1605998822
"Biraz soğuktu sufleler ama güzeldi, hava da zaten buz gibi, soğuması normal.",9.0,9.0,9.0,1605826022
Pizza güzel servis hızlı.,8.0,8.0,8.0,1605653222
Kuru.,7.0,7.0,7.0,1605480422
Kurye abi sıcacık getirmiş yine çok teşekkürler.,10.0,10.0,10.0,1605307622
"Barbekü tavuk efsane, keşke karışık pizza da onun kadar iyi olsa. Ellerinize sağlık.",10.0,10.0,10.0,1605221222
Yanlış pizza gelmiş ama olsun.,10.0,1.0,10.0,1605221222
Teşekkürler..,10.0,10.0,10.0,1605048423
Servisten bir puan kırmamım sebebi sufleler kaba saçılmış şekilde gelmesi. Her şey çok lezzetliydi. Çikolatalı calzone başka firmalarınkisine göre daha büyük ve hamuru lezzetliydi. Ben marshmallow sevmediğim için içinde olmasından çok hoşlanmadım ama sıcakken pek fark edilmediğinden o da iyiydi.,10.0,9.0,10.0,1604962023
"Yapanın ellerine, getirenin ayaklarına sağlık. Bbq tavuklu pizza çok güzel özellikle tavsiye ediyorum.",10.0,10.0,10.0,1604875623
Cok guzel.,10.0,10.0,10.0,1604875623
Pizzanın malzemeleri azdı özellikle mangal etine pek rastlayamadım. İç malzemelerini ve kalitesini artırmanızı istiyorum.,8.0,8.0,7.0,1604875623
Servis elemanınızın neşesine hayran kaldım :).,10.0,10.0,10.0,1604875623
Artık hep buradan istiyoruz hem hızlı hem lezzetli geliyor.,10.0,10.0,10.0,1604789223
Elınıze saglık uzun zamandır boyle guzel bı pızza yememıştık.,10.0,10.0,10.0,1604789223
Çok beğeniyoruz. Tşk.,10.0,10.0,10.0,1604702823
1 saat 17 dk geldi. Dükkan ile evimin aynı sokakta olmasından başka problem yok.,2.0,2.0,4.0,1604702823
Yerinizle evim arasında 300 metre mesafe var. Nasıl bu kadar soğuk getirebiliyorsunuz anlamıyorum. Kaliteyi düşürmemenizi öneriyorum.,8.0,5.0,1.0,1604616423
Çok lezzetliydi teşekkürler emeğinize sağlık.,10.0,10.0,10.0,1604530023
Çok hızlı ve sıcaktı herşey için teşekkürler.,10.0,10.0,10.0,1604530023
Elınıze saglık i8.,10.0,10.0,10.0,1604530023
Sipariş tam bir saat sonra geldi. Abartmıyorum gerçekten 1 kmlik yola bir saatte teslim edildi. Pizza buz gibiydi.,1.0,1.0,1.0,1604530023
Harika.,10.0,10.0,10.0,1604443623
İç malzeme çok azdı bence.,9.0,7.0,7.0,1604357223
Şaka gibi ama mozerella yoktu pizzada bildiğiniz peynir olan mozarella.,10.0,10.0,4.0,1604357223
Harikasınız.,10.0,10.0,10.0,1604357223
Biraz tuzsuz gibi geldi bize ama her zamanki gibi çok lezzetliydi.,10.0,10.0,10.0,1604357223
Elinize sağlık.,8.0,8.0,8.0,1604270823
Mahalledeki diğer zincir pizzacı feyz alsın.,10.0,10.0,10.0,1604270823
Bbq chic en iyisi!,10.0,10.0,10.0,1604270823
Gayet doyurucu ve güzeldi. Hamurun kıvamını ve kalınlığını lütfen bozmayın. Bu muhitte pizzada en iyisi.,10.0,10.0,10.0,1604270823
Siparişim tam olarak 1. 40 saatte geldi. Canlı yardıma ulaştığımda restoran sisteme giriş yapmadığını belirtti ancak sonradan şikayet için aradığımda siparişimi verdikten 1 dakika sonra restoranın onay verdiğini öğrendim. Kısacası yalan söylemişler. Normalde çok sevdiğim bir yerdi ama bu çok yanlış!,1.0,1.0,7.0,1604184423
Sıradan ve lezzetsiz bir pizzaydı.,2.0,2.0,1.0,1604184423
Pizza buz gibi geldi :(.,9.0,9.0,7.0,1604184423
Genel olarak güzel rahatlıkla sipariş verilebilir yalnız zeytinsiz istedim zeytinli geldi daha dikkat edilebilir.,10.0,10.0,9.0,1604098023
"Daha önce büyük boy pizza yiyip bu kadar doyduğum olmamıştı. Hamuruyla, içindekilerle, lezzetiyle, hızıyla gayet iyi. Beğendim. Pizza yiyimde karnım doysun dediğimde tek adres. Helal olsunnn. Doydum vallahi :).",10.0,10.0,10.0,1604098023
Sufleler iyiydi.,9.0,9.0,9.0,1604011623
Mantarsız pizza istemiştim mantarlı geldi.,9.0,5.0,4.0,1604011623
Eskiden bayılırdım buranın pizzasına ama son siparişimden sonra biraz hayal kırıklığı yaşadım. Pizza sıcak değildi lezzeti eskisi gibi değildi.,8.0,8.0,7.0,1604011623
İyi.,9.0,9.0,9.0,1604011623
Burası pizza satıyosa diğer dükkanlar kaşarlı ekmek falan satıyor. Çok kaliteli.,10.0,10.0,10.0,1604011623
Elinize saglık 20 dk da geldi.,10.0,10.0,10.0,1604011623
Her zaman yorumum sabit bölgedeki en iyisi.,10.0,10.0,10.0,1604011623
Hep güzel.,10.0,10.0,10.0,1603925223
Siparisi getiren kurye çok kibardı. Pizza da lezzetliydi.,10.0,10.0,10.0,1603925223
Baya iyi yedik valla.,10.0,10.0,10.0,1603887477
Klasını bozmuyor.,10.0,10.0,10.0,1603887477
Yediğimiz en güzel pizza emeklerinize saglik.,10.0,10.0,10.0,1603887477
Çok lezzetli bol malzemeliydi.,5.0,9.0,9.0,1603887477
"Geçen hafta 20 dakikada gelen sipariş son seferde 1 saatte geldi, onun haricinde güzeldi.",5.0,9.0,9.0,1603887477
"Siparişin geliş hızına servisine diyecek yok, keşke pizzayıda yakmadan getirseydiniz.",10.0,9.0,2.0,1603887477
İdare eder.,7.0,6.0,7.0,1603887477
Mahallemiz pizzacisi yine on numero.,10.0,10.0,10.0,1603887477
Tavsiye edeceğim pizzacı... Kalitesi değişmez.,10.0,10.0,10.0,1603887477
İlk kez sipariş verdim ne desem bilmiyorum oh be dedim pizzayı yedikten sonra. Uzun zamandır böyle keyif almadım yediğim pizzadan. Tesekkurler.,10.0,10.0,10.0,1603887477
 yanına ketçap mayonez koysanız daha da güzel olur.,10.0,9.0,10.0,1603887477
Pandemi nedeniyle uzun zamandır sipariş veremiyordum. Hala 100. Yılda yiyebileceğiniz en lezzetli pizza. Emeğinize sağlık.,10.0,10.0,10.0,1603887477
Pizzaya eklediğim malzemeler unutulmuştu ama kurye çok kibar ve hızlıydı teşekkür ediyorum.,10.0,10.0,8.0,1603887477
Fena değildi.,9.0,9.0,9.0,1603887477
Jokerle verdiğim büyük boy siparişim beklemediğim şekilde iyi geldi. Bozmazsanız siparişlere devam.,10.0,10.0,10.0,1603887477
Pizzanin malzemesi daha once istedigimiz pizzaya gore daha azdi eski kalitesine donmesi dilegiyle.. Tatlisi ise cok guzeldi hava serin olmasina ragmen sicacik geldi tesekkurler.,10.0,10.0,8.0,1603887477
Güzeldi.,10.0,10.0,10.0,1603887477
1 saatten uzun sürede geldi ama sıcak ve güzeldi.,1.0,10.0,10.0,1603887477
Pizza dilimleri birbirinden tam ayrılmamıştı iyi kesilmemişti ama çok lezzetliydi.,10.0,8.0,10.0,1603887477
Özlemişim.,10.0,10.0,10.0,1603887477
Hep en iyisi sizsiniz ya! Yemeksepetinden pizza soyledigim tek yer.,10.0,10.0,10.0,1603887477
Teşekkürler.,10.0,10.0,10.0,1603887478
Hocam bu sufle değildi bilginiz olsun.,1.0,1.0,1.0,1603887478
Harıka.,10.0,10.0,10.0,1603887478
Hızlı ve güzel.,9.0,9.0,9.0,1603887478
Pizzanın yarısı düz kuru hamurdu malzeme koymayı unuttular zanırım.,8.0,5.0,4.0,1603887478
"Malzemeyi azaltmislar, hamur ve lezzetsizdi.",7.0,7.0,7.0,1603887478
Sufleniz harika.,10.0,10.0,10.0,1603887478
Harikaydi.,10.0,10.0,10.0,1603887478
İyiydi.,10.0,10.0,10.0,1603887478
İki farklı tür pizza söyledik fakat ikisi de aynı geldi.,8.0,6.0,9.0,1603887478
Sanki lezzette biraz azalma vardi ama belki o gune has da olabilir.,8.0,10.0,8.0,1603887478
Hız lezzet güzeldi fakat bir öneri. Peynirsever pizzada biraz daha çalışılması gerekli bence. Yani daha baskın olabilecek peynir seçilmeli. Teşeklürler.,10.0,10.0,10.0,1603887478
Sıcak hızlı lezzetli.,10.0,10.0,10.0,1603887478
Lezzetli ama accık ılık geldi.,9.0,8.0,10.0,1603887478
Tesekkurler çok guzeldi.,10.0,10.0,10.0,1603887478
Ankaranın en iyi pizzacısı.,10.0,10.0,10.0,1603887478
Biraz sunum biraz daha.,10.0,10.0,10.0,1603887478
"Pizzadan bir dilim alıyorum, diğer dilimlerin üstünde ne varsa o dilime geliyor. Aldığım dilimden bir ısırık alıyorum, tüm malzeme geliyor. Bir ısırık pizza yiyip hamurla devam ediyorum yemeğe...",9.0,1.0,1.0,1603887478
Çok iyiydi yine.,10.0,9.0,10.0,1603887478
Normalde açıkta duran baharati yediğimiz şeyin içine koymasaniz çok iyi olacak.,10.0,1.0,7.0,1603887478
İkramınız için çok teşekkür ederim harika lezzet süper ikram daha ne olsun.,10.0,10.0,10.0,1603887478
"Buradan daha once cok kez siparis vermeme ragmen pandemi boyunca ara vermistim. Uzun zaman sonraki ilk ve son olacak siparisimde pizzanin icindeki malzemeler cig, orta boy pizza kucuk boy bile denemeyecek kadar komik bir boyutta kucuk, icececek secimimiz yanlis geldi. Hayal kirikligi.",7.0,1.0,1.0,1603887478
Hızlı teslim edildi. Kurye çok güleryüzlü ve saygılıydı.,10.0,10.0,10.0,1603887478
Geç geldi tadı iyiydi.,5.0,5.0,9.0,1603887478
Cok iyii.,10.0,10.0,10.0,1603887479
Öncelikle pizza time 100. Yıl çalışanlarına ilgi ve alakaları için teşekkur ederim. Pizzam çok hızlı geldi keşke biraz daha sıcak olsaydı daha güzel olurdu ama olsun lezzetliydi. 10 yıldır pizza time dan pizza yerim hiç pişman olmadım lezzet her zaman aynı güzellikte. Ayrıca engin abiye de tesekkürle.,10.0,10.0,10.0,1603887479
"Kac kere siparis verdim bilmiyorum, bir kez bile ne hız ne lezzet ne eksik ürün problemi yasamadim. Ev degistirdim pizzacimi degistirmedim harikasınız...",10.0,10.0,10.0,1603887479
Patateslerin yarisini atmak zorunda kaldim. Ya tam pismemisti ya da ezilmisti. Patateslerin kalitesine biraz daha ozen gosterilebilir.,9.0,8.0,4.0,1603887479
Ellerinize sağlık gerçekten çok lezzetliydi. Kurye abi de çok nazik ve güleryüzlüydü.,10.0,10.0,10.0,1603887479
Basarili.,9.0,9.0,9.0,1603887479
Süperdi.,10.0,10.0,10.0,1603887479
Kötü.,1.0,1.0,1.0,1603887479
Çok hızlı geldi teşekkürler.,10.0,10.0,10.0,1603887479
Her şey harikaydı teşekkürler.,10.0,10.0,10.0,1603887479
Gayet güzeldi.,8.0,8.0,8.0,1603887479
"4 peynirli pizza, susam kenar, biber, enfesti :).",10.0,10.0,10.0,1603887479
Kuryeniz çok kibar.,10.0,10.0,10.0,1603887479
Gayet iyiydi her şey.,10.0,9.0,10.0,1601257733
Harikaaa.,10.0,10.0,10.0,1601257733
Gayet güzeldi.,9.0,10.0,10.0,1601257733
"Karışık pizzayı büyük boy, peynirli pizzayı orta boy istemiştim ama tam tersi şekilde geldi. Ayrıca, ince hamurlu istemiştim ama normal geldi. Sipariş detayını daha dikkatli okuyun lütfen. Normal sürede, 30 dkda, geldi. Lezzet olarak da normaldi, diğer pizzalardan üstün değildi.",8.0,4.0,8.0,1601257733
Dışardan pizza sipariş edeceksem bu pizza timedir.,8.0,10.0,10.0,1601257733
Yillardir ayni pizzayi siparis ederim hic sorun yasamadim. Bu sipariste tadi cok degisikti. Zeytinler bozulmak uzereydi kullanilan butun malzemeyi kalitesizlestirmissiniz. Lutfen bi an once bu sorunu duzeltin.,8.0,8.0,1.0,1601257733
1. 5 saatte geldi. Sufle ikramı yapmaları hoştu.,1.0,9.0,9.0,1601257733
Üç peynirli pizzası iyiydi. Küp sucuk koydurdum. Daha da iyi oldu...,9.0,9.0,9.0,1601257733
Ekstra malzeme kömür parçaları eklenmişti.,5.0,2.0,4.0,1601257733
Kalitesini begeniyorum.,10.0,10.0,10.0,1601257733
Basarılı e. K.,10.0,10.0,10.0,1601257733
Hamur her zamankine göre biraz yumuşak kalmıştı.,8.0,9.0,8.0,1601257733
Bol malzemeli geldi çok iyi.,10.0,10.0,10.0,1601257733
İyii.,10.0,10.0,10.0,1601257733
Pizzaları harika.,10.0,10.0,10.0,1601257733
Peynir sever cok iyi.,9.0,9.0,9.0,1601257734
Hızlı ve güzeldi.,9.0,9.0,9.0,1601257734
Pizzanin altini yakmissiniz.,10.0,1.0,1.0,1601257734
Temassız teslim istiyince bir poşete koyup kapıya asmak yerine ya yere kutu konuyor ya da elden teslim ediliyor. Temassız sipariş usulüne dikkat edilirse daha iyi olur.,8.0,8.0,10.0,1601257734
Elma dilim ikinci kez yanık geldi.,10.0,10.0,10.0,1601257734
Sıcacık ve hızlı geldii...,9.0,9.0,9.0,1601257734
Tadı güzel.,9.0,9.0,9.0,1601257734
Uygun güzel ve doyurucuydu :).,9.0,10.0,10.0,1601257734
Pizza yine harikaydı ancak bu sefer ki siparişte çok gecikti biraz.,6.0,10.0,10.0,1601257734
Temassız diye kutunun üzerine altın harflerle yazabilir miyiz bundan sonra?,6.0,8.0,7.0,1601257734
Eksik malzeme vardi ve yanmısti.,10.0,3.0,3.0,1601257734
20-30 dk yazıyordu ama 1 saatte geldi:(.,5.0,10.0,10.0,1601257734
Gerçekten lezzet patlaması yaşandı. O kadar sıcak ve taze geldi ki elimde dağılıyordu. Ankaranın en iyi pizzacısı. Kurye abimize de teşekkürler nazik ve özverili olduğu için.,10.0,10.0,10.0,1601257734
Eksik sipariş getirdiniz... Siparişime ek 1 adet kola eklemiştim. Ama gelmedi. Canınız sağolsun dedim.. Ama bir daha sipariş vermeyi düşünmüyorum.. Değerlendirmeyi hak geçmesin diye yapıyorum... Küçük bir hata üzdü.,10.0,10.0,10.0,1601257734
Ünal beye selam.,10.0,10.0,10.0,1601257734
Civarın en güzel pizzacısı. Ellerinize sağlık.,10.0,10.0,10.0,1601257734
Her zamanki gibi akliteli.,10.0,10.0,9.0,1601257734
Yani ekmek hamurundan pizza işte. Yalnız mantarlı pizzada hiç domates sosu yoktu kısaca pizzayla alakası yoktu.,7.0,7.0,5.0,1601257734
"Hocam pizza timeın nasıl çalıştığını biliyorum ancak bu seferki siparişimden pek memnun kaldığımı söyleyemicem, pizza hem soğuktu hemde kuruydu pek lezzetini alamadım.",9.0,8.0,6.0,1601257734
Notlarımda sıcak gelmesini istedim pizzanın. 50 dk da buz gibi pizza geldi.,1.0,2.0,1.0,1601257734
Elma dilim patates.,10.0,10.0,10.0,1601257734
"İlk denemede notumu önemsemesi, zamanı ideal kullanması ve lezzeti ile beğenin kazandı. Teşekkür ederim.",10.0,10.0,10.0,1601257734
"Hocam pizzalarınız harika ve çok seviyoruz ama her siparişimizde yanlış geliyor. Her zaman aynı pizzayı söylüyorum acı biber istemediğmi belirtiyorum, not yazıyorum ve hep biberli geliyor. Hevesle söylediğim yemeği yiyemiyorum boşa gidiyor:(.",10.0,4.0,8.0,1601257734
Çok güzeldi ama geç geldi.,7.0,10.0,10.0,1601257734
Kaliteli.,10.0,10.0,10.0,1601257734
Nota yazmayı unutmuşum o yüzden getirilmemiş olabilir ama elle yenilen pizza siparişi yanında mutlaka peçete ve ıslak mendil olmalı.,10.0,9.0,10.0,1601257734
Çok geç geldi. Pizza soğudu.,8.0,8.0,8.0,1601257734
Çok lezzetliydi ince hamurlu olabilir.,9.0,9.0,9.0,1601257734
Elınıze saglık daha iyisi yok bence.,10.0,10.0,10.0,1601257734
Immmh.,10.0,10.0,10.0,1601257734
Temassız seçimini dikkate almayan kuryeler :(.,10.0,10.0,10.0,1601257734
Ankaranın en iyi pizzası.,10.0,10.0,10.0,1601257734
Allah standarttan ayırmasın.,10.0,10.0,10.0,1601257734
Sufle keyf.,10.0,10.0,10.0,1601257734
Güzeldi.,10.0,10.0,10.0,1601257734
Ton balıklı pizza nerede hocam :((.,10.0,10.0,10.0,1601257734
"Harikaydı, beğenmeyenlere inat 10-10-10.",10.0,10.0,10.0,1601257734
İlk defa tercih etmeme rağmen beğendim gerçekten herşey yeteri düzeydeydi.,9.0,8.0,8.0,1601257734
Kurye abimize zam lütfen! Çünkü hak ediyor.,10.0,10.0,10.0,1601257734
Teslimat çok geç geldi 25/30 dk yazarken 23:23 de verdiğimiz sipariş 00:20 de elimize geldi. Gelen arkadaşta hiç bir tedbir yoktu maske. Vstemasız ödeme dememize rağmen ısrarla kart istemesi tuhaf oldu temas olmasın diye fişi atabilirsiniz demiştik tutmuş daire kapımızın önüne atmış tam bir rezilik.,1.0,1.0,1.0,1601257734
Tavuk kesinlikle çiğ kalmış patateslerde ve pizzanın içinde değişik bir tat vardı.,10.0,10.0,4.0,1601257734
"Pizzalarin lezzeti guzel ancak patates kizartmasi kotuydu. Iki buyuk pizza, patates, tavuk yaninda sadece iki paket mayonez vardi.",9.0,5.0,8.0,1601257734
Islak mendil konmamıştı ama çok lezzetliydi.,8.0,8.0,10.0,1601257734
Ricamız üzerine torpil geçtiler siparişlerde :) müthiş sevindik havalara uçtuk 10 üzerinden 15.,10.0,10.0,10.0,1598627988
Herzaman iyi her zaman lezzetli.,10.0,10.0,10.0,1598627988
Kola da içmeye hazır soğuklukta olsa kusursuz olacak.,10.0,8.0,10.0,1598627988
Getiren kurye nazikti ancak 20-30 dk belirtilen servis süresi aşıldı 1saat sürdü siparişimin gelmesi. İnce hamur istemiştim ancak kalın hamurdu. Ege pizzası imalzeme seviyesi yönünden iyiydi ama lezzeti çok güzel diyemem. İyileştirilmeli.,1.0,10.0,5.0,1598627988
Memnunuz.,10.0,10.0,10.0,1598627988
Siparişle birlikte peçete de gelse güzel olacak. Bunun dışında en iyi pizza yapan firmalardan birisiniz. Elinize sağlık.,9.0,8.0,9.0,1598627988
Kurye kabaydı.,8.0,1.0,10.0,1598627988
"İçecek soğutulmuş gelseydi, daha iyi olurdu.",8.0,8.0,9.0,1598627988
"Tavuklar çok kötüydü, garip bir koku vardı. Patatesler normalde çıtır çıtır olurken bu sefer neredeyse lapa gibi geldi. Pizza güzeldi.",10.0,9.0,5.0,1598627988
Çok geç geldi fakat sıcaklığı ve lezzeti ile değerdi.,10.0,10.0,10.0,1598627988
Plastik koymayın dediğimiz halde plastik kaşık konmuştu. Sufle dağılmış olarak geldi. Servis puanı pizzanın sıcak gelmesine ve kuryenizin kibarlığı ve güleryüzüne verildi.,8.0,7.0,8.0,1598627988
"Karnımız doydu ama fiyatını hak eden bir pizza değil, hamurunu beğenmedik. Ayrıca bilkente 20-30 dakika süre verilmişken 50 dakikada getirildi.",5.0,7.0,7.0,1598627988
"Odtukente sicacik geldi, hizliydi... Tesekkurler.",10.0,10.0,10.0,1598627988
Extra mozarella ile beyaz peynir karismisti ama guzeldi sagolun.,9.0,9.0,8.0,1598627988
Müthişti.,10.0,10.0,10.0,1598627988
En iyisi bence..,10.0,10.0,10.0,1598627988
"Pizza sosu çok azdı, böyle olmasa 10 numara bir lezzet.",10.0,10.0,8.0,1598627988
Tsk.,10.0,10.0,9.0,1598627989
Sıcacık geldi ürünler. Getiren arkadaş çok kibardı. Ama pizza okadar lezzetli değil.,10.0,9.0,7.0,1598627989
Oldukça hızlı bir servisti ilk kez denediğimiz tatlar çok lezzetliydi siparişe birebir uyulmuştu muhteşemsiniz.,10.0,10.0,10.0,1598627989
Elinize sağlık hocam.,10.0,10.0,10.0,1598627989
"Her şeyiyle mükemmeldi, teşekkürler.",10.0,10.0,10.0,1598627989
İyi.,9.0,9.0,8.0,1598627989
Pizzanın malzemeleri çok kolay dağılıyor. Hamur sanki lavaşmış gibi malzemeler üstünden dökülüyordu. Teşekkür ederim.,9.0,9.0,7.0,1598627989
Tavukların tadı bazen çok güzel bazen çok kötü. İstikrarsız.,10.0,7.0,7.0,1598627989
Begendim.,9.0,8.0,8.0,1598627989
İncecik ve tadı gayet güzeldi. Ellerinize sağlık. Kuryenizin güler yüzlülüğü için de teşekkürler.,10.0,10.0,10.0,1598627989
Gece aşerilen sufle için iyi işte.,10.0,10.0,8.0,1598627989
Hf.,9.0,9.0,9.0,1598627989
Gelen pizza yanıktı maalesef.,8.0,2.0,2.0,1598627989
Çok güzel.,10.0,10.0,10.0,1598627989
Peynirsever ince hamurlu tavsiyem baya keyifli pizza.,10.0,10.0,10.0,1598627989
Çok geç gelmesi dışında bir sorun yoktu.,7.0,10.0,10.0,1598627989
"Lezzeti, malzemesi ve hızı kurumsal pizzaların hepsinin önünde.",10.0,10.0,10.0,1598627989
Meksika da kıymada koku vardı hiç güzel değildi eski meksikayı özledik!,10.0,10.0,1.0,1598627989
"Pizzalar gayet sıcak ve lezzetliydi, 20 dk da geldi ve kuryeniz çok iyi ve güler yüzlüydü.",10.0,10.0,10.0,1598627989
İyiydi.,9.0,10.0,10.0,1598627989
Mükemmel.,7.0,9.0,10.0,1598627989
F/p pizzası.,9.0,8.0,8.0,1598627989
Pizzalar çok lezzetli ve sıcacıktı. Hemen geldi. Bu restorandan çok memnunuz.,10.0,10.0,10.0,1598627989
Hsbs.,10.0,10.0,10.0,1598627989
Klasiği çok kalın incesinin tadı kötü yenebilir.,10.0,9.0,4.0,1598627989
Her zaman verdigim sipariş. Yan urun tavukların tadını beğenmedim ve yiyemedim malesef..,10.0,10.0,8.0,1598627989
Patateslerde 3 4 ay önceki güzelliği bulamıyoruz hep hamur gibi geliyor.,10.0,10.0,7.0,1598627989
Pizza hızlı pizza güzel.,10.0,10.0,10.0,1598627989
"Yanlış pizza gönderilmiş. Arayarak durumu bildirdim, hatalarını kabul edip hemen yenisini gönderdiler. Çok teşekkürler, çok da hızlı ve lezzetliydi.",10.0,10.0,10.0,1598627989
Güzel.,10.0,10.0,10.0,1598627990
"Kesinlikle uzun zamandır yediğim en lezzetli pizzaydı. Elinize sağlık. Bir de siparişle peçete, ıslak mendil vs gönderseniz süper olacaktı.",10.0,8.0,10.0,1598627990
"Vejeteryan olduğum için akdeniz pizza sipariş ettim, onun yerine alaturka ismiyle bana şarküteri tabağı yolladırlar resmen.",1.0,1.0,1.0,1598627990
Tek sorun pizzanın boyutu orta boy sipariş ettim fakat yine de küçük geldi.,10.0,10.0,10.0,1598627990
İyi pizzalar.,8.0,8.0,8.0,1598627990
Sakın almayın hayatımda yediğim en kötü şey.,1.0,1.0,1.0,1598627990
Çok hızlı ve sıcak geldi. Ellerinize sağlık.,10.0,10.0,10.0,1598627990
"Farkını verdik, ayran istedik ama kola geldi. Öyle uygun görmüşler, ne diyim...",8.0,6.0,8.0,1598627990
Daha iyi olabilir.,8.0,8.0,7.0,1598627990
Bu aralar pizzalar neden çok fazla pişmiş yanık bir halde geliyor?,9.0,9.0,5.0,1598627990
Bugün vardı belli ki bi sıkıntı :(.,8.0,7.0,6.0,1598627990
"Nays, nays, nays.",10.0,10.0,10.0,1595998244
Patatesler çok yumuşak ve yağlıydı ona dikkat ederssniz herşey süper.,8.0,8.0,8.0,1595998244
İstemediğim malzemeyi yine koymuşlardı.,10.0,4.0,4.0,1595998244
Teşekkürler.,10.0,10.0,10.0,1595998244
"Chicken pizza ve tavuk almıştık. Tavukların tadı kötüydü ve ilginç kokuyordu, alışılagelmiş çıtır tavuk değiller. Pizza malzemesi boldu ancak kuru bir pizzaydı.",8.0,8.0,5.0,1595998244
"Adama bahsis verdik donup artist artist bu ne deyor, bahsis dyince de gene artist peki dyorkuryeniz yanis yerde calisyor.",9.0,1.0,9.0,1595998244
Arkadas hızlı getirmiş olmasına rağmen biraz soğumuştu pizza ama yine de lezzeti güzeldi.,9.0,8.0,8.0,1595998244
"Hızı, tadı ve lezzeti gerçekten çok iyi yiyin yedirin :).",10.0,10.0,10.0,1595998244
Pizza yanında patates ve tavuk kızartma istemiştim. Gelen kızartma çok bayattı. Tadına baktıktan sonra çöpe atmak zorunda kaldım.,4.0,5.0,2.0,1595998244
Biraz soğumuş ve pizzaların şekli bozulmuştu.,6.0,7.0,6.0,1595998244
"Patatesler, tavuklar ve soğan halkalarından almanızı tavsiye etmem.",6.0,10.0,6.0,1595998244
Biraz yanmıştı.,9.0,9.0,8.0,1595998244
Gayet güzel servis sunum lezzet.,10.0,10.0,10.0,1595998244
Bs.,10.0,10.0,10.0,1595998244
Kötü.,1.0,1.0,2.0,1595998244
Pizzayı soğansız istedim soğanlı göndermişler geri arayip iade etmek istedigimi soyleyince kadın oyle bisey yapamayacaklarini ellerinden bir sey gelmeyecegini söyledi musteri memnuniyeti 0 hiç memnun kalmadım.,1.0,1.0,2.0,1595998244
Elinize emeğinize sağlık hocam.,10.0,10.0,10.0,1595998244
Sipariş yanlış geldi. 2 peynirsever 1 karışık istemiştim. 2 karışık 1 peynirsever geldi. Pandemi süreci nedeniyle bir düzeltme talebinde bulunmak istemedim.,10.0,5.0,10.0,1595998244
