comment_text,comment_speed,comment_service,comment_taste,comment_time
İçli köftesi çok güzel tavsiye ederim arkadaşlar...,10.0,10.0,10.0,1606770425
Çok beğendim kanatlar taze ve sıcaktı.,8.0,9.0,9.0,1606770425
Lahmacunu koyduğunuz kağıt sıcaklıktan dağılıyor sanırım.,10.0,8.0,9.0,1606684025
Karışık ızgara denedim memnun kaldım. Ayrıca çok hızlı geldi tavsiye ederim.,9.0,9.0,9.0,1606511225
Gayet iyi.,10.0,10.0,10.0,1606252025
Başarılı.,10.0,10.0,10.0,1606252025
Gerçekten güzel içli köftesi tam istediğim gibi hava soğuk olduğu için biraz soğumuş olabilir ama olsun onlarda bir insan.,10.0,10.0,10.0,1606079225
Çöp şiş söyledik ciğer şiş geldi.,1.0,1.0,1.0,1606079225
Mikimmel.,10.0,10.0,10.0,1605820025
On numara avcılar tek.,10.0,10.0,10.0,1605820025
Sipariş notu olarak yemeği getirdiğinde arayabilir misiniz diyoruz gece diye buna rağmen zile basılıyor da.,1.0,1.0,1.0,1605733625
Hic olmamis bozulmuş.,1.0,1.0,1.0,1605474425
Buz gibi durum geldi.,1.0,1.0,1.0,1605474425
Berbat yazik dunya para verdik bu gibi geldi sanki bir istanbulu dolastirmis.,1.0,1.0,1.0,1605474425
Ayran gelmemisti.,2.0,2.0,2.0,1605388025
En kötü deneyim.,1.0,1.0,1.0,1605301625
Elbette çok güzeldi. Faruk ağbime selamlar.,9.0,9.0,9.0,1605215225
Teşekkürler.,10.0,10.0,10.0,1605042425
Yanına haydari falan olsa daha iyi olabilirdi eskiden koyardınız.,9.0,6.0,9.0,1604783225
Urfa resmen incecik yarım lavaşa sarılmış incecikti ve sondaki o tuhaf tattan sonra midemde 5 dakikadan daha fazla tutamadım. Daha önce de yedim ama bu defa çok rezildi. Son siparisimdir.,5.0,1.0,1.0,1604696825
Çok soğuktu.,6.0,6.0,8.0,1604696825
Durumden hic tad alamadim.. Hic bir lezzet yok..,10.0,5.0,1.0,1604610425
Surekli iyiler ya tek yorumum budur.,10.0,10.0,10.0,1604610425
İnanılmaz güzeldi ve çok sıcak sanki kapının önünde paketlediler hayatımda ilk defa yorum yapıyorum yazmadan yapamadım o kadar söyleyim.,10.0,10.0,10.0,1604610425
Notları dikkate alıyorlar teşekkürler.,10.0,10.0,10.0,1604524025
Çorba su gibi berbat dürüm kupkuru inanılmaz kötüsünüz.,1.0,1.0,1.0,1604437625
Domates çok fazla dürümde dürümü sulandırıyor maydonozu çoğaltın bence çorba un kokuyordu iyi kavurmamışsınız pek mrmnun kalmadım başarılar.,8.0,8.0,6.0,1604437625
Bu sorunu ikinci defa yaşadığım için 1 veriyorum servise. Ayran söylüyoruz gelmiyor. Siparişleri bakmadan mı yolluyorsunuz?,8.0,1.0,8.0,1604437625
Dürümler oldukça küçük doyurucu değil.,8.0,8.0,9.0,1604264825
"Kanat istedim, tavuk şiş geldi.",1.0,1.0,1.0,1604178425
Fena değil beğendim.,9.0,8.0,8.0,1604140680
Güzelll.,10.0,10.0,10.0,1604140680
Bayılıyoruz. Hastasıyız:):).,10.0,10.0,10.0,1604140680
Durum yiyilecek gibi degildi.,7.0,6.0,1.0,1604140680
Çok güzeldi.,10.0,10.0,10.0,1604140680
On numara.,10.0,10.0,10.0,1604140680
Avcılarda daha iyi dürümcü yok.,10.0,9.0,9.0,1604140680
Geçen sefer de 4 adana söyledim meze çiğköfte vs vardı yanında bu sefer hiçbirşey yoktu yanında acısı da geçen sefere göre daha azdı.,5.0,1.0,1.0,1604140680
Ellerınıze saglık çok güzaldi.,10.0,10.0,10.0,1604140680
Çöp şiş güzeldi. Salatanın geliştirilmesi lazım. Iceberg marul ile kebap salatası olmaz.,9.0,9.0,9.0,1604140680
Lezzetin tadi super.,10.0,10.0,10.0,1604140680
Harika mükemmel lezzet hızlı servis.,10.0,10.0,10.0,1604140680
Adana ve çö şiş dürüm söyledim. 2 side çöp şiş dürüm olarak geldi ve bir güzeldi diğeri cok kötü yanlış sipariş getirip aynı anda gelen 2 tane dürümü nasıl bu kadar tat farkı olabildi hayretler içindeyim.,7.0,7.0,7.0,1604140680
Çorba sabahtan kalma tavuk suyuna yapılmış ve bozulmak üzereydi rezaletti kısacası.,1.0,1.0,1.0,1604140680
Kuryeniz maske niye takmiyor anlamak mumkun degil..,8.0,2.0,8.0,1604140680
En iyi dürümcü ellerinize sağlık. Helal adnan baba.,10.0,10.0,10.0,1604140680
Harika mükkemmel lezzet teşekkürler.,10.0,10.0,10.0,1604140680
Hızlı ve lezzetli.,10.0,10.0,10.0,1604140680
Güzel.,9.0,9.0,9.0,1604140680
"İçinde adanayı denk gelemedik koymamışsınız hiç, sadece dometes soğan doldurmuşlar.",5.0,5.0,5.0,1604140680
Guzeldi.,10.0,10.0,10.0,1604140680
Eh.,9.0,9.0,9.0,1604140680
Yediğim uzun süredir en iyi kebaptı:).,10.0,10.0,10.0,1604140680
Not ilettim ama notu dikkate alan kimse olmamis.,8.0,7.0,9.0,1604140680
Ara notlari es geciyolar ama lezzet güzel.,10.0,10.0,10.0,1604140680
Lezzette hizda harika yanliz sogansiz secmistim soganli gelmis sogan sevmeyen icin -1 puan servisten.,10.0,9.0,10.0,1604140680
İçinde sadece köfte vardı dürüm dediğin bol olur.,6.0,5.0,6.0,1604140680
Uf.,10.0,10.0,10.0,1604140680
Hastası oldm.,10.0,10.0,10.0,1604140680
Avcıların en eski mekanlarından biri çizgisini hiç bozmadı hala leziz hala temiz hala kaliteli.,10.0,10.0,10.0,1604140680
Yıllardır kendini bozmayan efsane mekan.,10.0,10.0,10.0,1604140681
"Lezzetliydi, hızlı ve sıcak geldi.",9.0,9.0,9.0,1604140681
Servisi hızlı.,10.0,10.0,10.0,1604140681
Ha-ri-ka.,10.0,10.0,10.0,1604140681
Lezzetli ama dürümler soğuk geldi.,8.0,7.0,6.0,1604140681
Yemeğin yanında bişey koyulmamiş.,8.0,6.0,8.0,1604140681
Lezzetli.,8.0,6.0,10.0,1604140681
Ellerinize sağlık gayet lezzetliydi.,8.0,10.0,10.0,1604140681
Kuryesi cok kotu.,1.0,3.0,5.0,1604140681
Gelen ikramlık gelmese daha iyi yollamak için yollamayın bence. Salata çok sulanmisti doğal olarak sabah kutulanip hazırlanmış. Zaten gönderdiğiniz salata ustanız taze doğrasa kutulasa 30 sn de hazırlar bu zaman kazanmanıza değil müşteri kazanmanıza yarar. Ben pek beyenmedim birdaha sipariş vermem.,8.0,5.0,5.0,1604140681
Dürümü kağıda sarıp göndermek servis değildir. Ne meze var ne biber var ne turşu var. Lavaşa da basmışlar baharatı. Hız dışında kötü.,10.0,1.0,6.0,1604140681
Güzeldi.,10.0,10.0,10.0,1604140681
Çok guzaldi.,10.0,10.0,10.0,1604140681
Kalitenin tek adresi.,10.0,10.0,10.0,1604140681
Cok kötü kesinlikle bir daha sipariş vermem.,1.0,1.0,1.0,1604140681
Sıcak geldi. Paketleme iyiydi. Mercimek çorbası çok lezzetliydi. Adana çok acı olmuştu. Yine de güzeldi. Ellerinize sağlık.,9.0,10.0,9.0,1601510935
Adana dürüm söyledim ve meze istemiştim yanına koymuşlar notları dikkate alıyorlar. Lezzeti de muazzam.,10.0,10.0,10.0,1601510935
Çok güzeldi.,10.0,10.0,10.0,1601510935
Avcıların en iyisi en hızlısı.,10.0,10.0,10.0,1601510935
Lezzet kısmında sadece acı oranı azdı onun için puan kırdım mekanda yediğimiz zaman daha acılı oluyor adana olduğu için acısı bol olmalı diye düşünüyorum ama lezzetliydi tavsiye ederim.,10.0,9.0,8.0,1601510935
"Dürümleri başarılı, hızlı geldi..",10.0,10.0,10.0,1601510935
Yediğim en iyi adana dürümdü bu civarda. Hızlı ve sıcak geldi. Teşekkür ederim.,10.0,10.0,10.0,1601510935
Sodekso var diyor ama yok.,1.0,1.0,1.0,1601510935
Hızlı geldi mezeler lezzetliydi tesekkurler.,10.0,10.0,10.0,1601510935
İşlerini layıkıyla yapan lezzetleri harika bir mekan. Hızda gayet iyi.,10.0,10.0,10.0,1601510935
Maşşallah maşşallah muhteşem.,10.0,10.0,10.0,1601510935
Avcılardaki en iyi hatay usulü dürümcü.,10.0,10.0,10.0,1601510935
Cok leziz.,10.0,10.0,10.0,1601510935
İşinize verdiğiniz değer bumu yazıklar olsun.,2.0,1.0,1.0,1601510935
Avcıların tek lezzeti çok lezzetli kebapları var elinize sağlık çok güzel.,10.0,10.0,10.0,1601510935
3 dürüm bir sütlaç istedik. Dürümlerin yanında turşu ve tuz bile yoktu. 10 tl ye sütlaç aldık bir kaşık vurunca çöpe attık yazık oldu.,9.0,1.0,5.0,1601510935
Soğansız yazılanlar soğanlı geldi onun dışında başarılı.,10.0,8.0,10.0,1601510935
Porsiyonlar çok küçük özensiz sarılmış sunum berbat 2 tane dürümle anca doyarsınız.,8.0,5.0,6.0,1601510935
Çöp şiş değil et şiş geldi ve ayranlar gelmemişti yemek bitti ayranlar anca geldi.,10.0,10.0,5.0,1601510935
Çöp şiş ve tavuk dürüm çok güzeldi adananın içinedeki limon biraz fazlaydı teşekkürler.,10.0,10.0,10.0,1601510935
Etin lezzeti süper. İyi pişmişti.,10.0,10.0,10.0,1601510935
Size helal olsun sınıf arkadaşım sizin yeğen onurhan negenç saygılar.,10.0,9.0,10.0,1601510935
Yillardir devam.,9.0,9.0,9.0,1601510935
Teşekkürler.,10.0,10.0,10.0,1601510935
Elinize sağlık yıllardır değişmeyen tat.,10.0,10.0,10.0,1601510935
Turşu biber olsa iyiydi.,10.0,8.0,10.0,1601510935
Notlari unutmayin abi lavaslar aci olmasin yazıyorum lütfen dikkat.,8.0,1.0,10.0,1601510935
Abi kekik paharat cok fazla.,10.0,10.0,8.0,1601510935
10 numara lezzet.,10.0,10.0,10.0,1601510935
"Şiş dürüm adanadan beter acıydı, kredi kartı ile ödeme seçeneğini seçmeme rağmen klasik bir numara olan pos makinesini unuttuk sözü ile karşılaştık, lezzette hizmette cok kötüydü, eski lezzetten eser yok.",1.0,1.0,1.0,1601510935
Turşu istedim gelmedi onun dışında güzel.,8.0,8.0,8.0,1601510935
Soguk yiyemedigimi not olarak yazmistim ve bu kadar hizli olamazdi gercekten tesekkur ederim.,10.0,10.0,10.0,1601510935
Hızlı tadı güzel içinde acı biber tuz vs eskikti o kadar.,9.0,6.0,9.0,1601510935
Harikaydi.,10.0,10.0,10.0,1601510935
Notlara dikkat ediyolar hizmet 10 numara lezzet 10 numara kuyruk yagi icinde teşekkür ediyorum.,10.0,10.0,10.0,1601510935
Güzeldi.,8.0,7.0,7.0,1598881189
Sütlaç ehhhh... Adana bir tık daha iyidi eskiden.,10.0,10.0,6.0,1598881189
Kekiği azaltmanız lazım.,7.0,7.0,7.0,1598881189
Hiz harika servis cok zayif paketleme biberlerin servisi poset yerine kucuk bi pakette gelebilirdi lezzet güzel iyi calismalar.,10.0,4.0,8.0,1598881189
Çok hızlı geldi notlara dikkat ediliyor. Lezzetliydi. Tavsiye edilir.,10.0,10.0,10.0,1598881189
Hoşuma gitmedi.,7.0,7.0,7.0,1598881189
Servisi bolluğu çok iyiydi.,10.0,10.0,10.0,1598881189
Sıcak ve lezzetliydi teşekkürler.,10.0,10.0,10.0,1598881189
Okadar soğan atmak nedir soğan ekmek yedim.,8.0,7.0,1.0,1598881190
Özellikle notta belirttim pirinç pilavı istediğimi ama bulgur pilavı geldi pilav seçeneği sunmanız yada hangisini gönderdiğinizi seçenekler kısmında belirtmeniz gerekli hiç memnun kalmadım.,6.0,2.0,2.0,1598881190
3 farklı siparişte biber istememe rağmen biber yollanmadı.,10.0,1.0,10.0,1598881190
Notları dikkate alıyorlar ve hızlılar.,10.0,10.0,10.0,1598881190
Turşu biberi istedim gelmemişti.,10.0,4.0,10.0,1598881190
Lezzetliyditeşekkür ederim.,10.0,10.0,10.0,1598881190
Dediğim hiç bir şeyi yapmamışlar ezme vs yok maydanoz yok demiştim dürümün içinde maydanoz car. Kurye hitap şekli kötüydü kebap tadı zaten yoktu bile vel hasıl buradan sipariş vermeyin.,1.0,1.0,1.0,1598881190
Yanında yazıldıgı gibi ezme salatası ve patlıcan salatası gelmedi göndermiycekseniz yazmasaydınız iyi olurdu.,8.0,1.0,3.0,1598881190
Notları okuyorlar. Son zamanlarda yediğim en iyi ciğer şişti.,10.0,10.0,10.0,1598881190
Devamlı yediğimi yer ama bu sefer mahçup ettiler bizi tadı kötü gitmiş ayrıca yanında istediğimiz turşuda gitmemiş en azından haber verseydiniz yok diye başka yerden sipariş verirdik.,10.0,1.0,3.0,1598881190
Her zaman sürekli müşteriyiz dürümler harika o kadar sıcak geldi ki elime alamadım harikasınız.,9.0,10.0,10.0,1598881190
Dürüm ler güzeldi bildiğimiz yer zaten.,8.0,8.0,8.0,1598881190
Kanka içine domatesi büyük büyük koymuşsunuz kebaba biraz daha ufak olsa harika olur ama her halükarda 10/10 lezzet.,10.0,10.0,10.0,1598881190
Bu sefer hic iyi değildi.,1.0,1.0,1.0,1598881190
Pek beyenmedim.,7.0,7.0,7.0,1598881190
Harika.,10.0,10.0,10.0,1598881190
Senelerdir sipariş veriyordm servis konusunda hep sıkıntıları vardı lezzet iyi diye pek takmadm ama dun online ödeme yapip temassiz işlem istememe rağmen guya zile basip kimsenin açmadığını iddia ederek yemeği komşuya bırakmış hayatmda servis konusunda iletişim konusunda bu kadar kötü bi yer gormedm.,1.0,1.0,1.0,1598881190
Çok geç geliyor ama lezzetli.,6.0,7.0,8.0,1598881190
Cok güzeldir. Elinize sağlık.,10.0,10.0,10.0,1598881190
Kredi kartı istedik makine yok nakit vermek zorunda kaldık dürümlerin yanında hiç bişe yok ne turşu ne salata.,10.0,1.0,6.0,1596251444
Tavuk şiş çok çok acıydı. Midemi yaktı.,8.0,8.0,1.0,1596251444
Lezzet güzel düzenli olarak yıllardır gittigim ve sipariş verdiğim bir mekan ancak eksilerine gelecek olursak ezmesi cok lezzetsiz kesinlikle üzerinde durulmalı ve ikram mezeleri ketcap kutusunda gelıyor cok az birde lavasları soslamasanız harika olacak acılı isteyen belirtir zaten hayırlı işler.,8.0,8.0,10.0,1596251444
"Son zamanlarda yediğimiz en iyi, en bol kepçe, en acı adana kebabı yedik. Ellerinize sağlık.",9.0,9.0,10.0,1596251444
Bu sefer olmamis abi kusura bakma kekik paharat doldurmusunuz.,10.0,9.0,4.0,1596251444
Ellerinize sağlık.,8.0,10.0,10.0,1596251444
Kotu.,1.0,1.0,1.0,1596251444
Herşey mükemmel.,10.0,10.0,10.0,1596251444
Teşekkürler emeğinize sağlık.,10.0,10.0,10.0,1596251444
Adana kebap menüsü hakkında daha ne diyebilirim.. Mükemmell..,10.0,10.0,10.0,1596251445
Yaprak kanat istedim but ve kanat karisik gonderdiniz ozellikle kanat istedim bu haranizdan dolayi 1 bile cok.,1.0,1.0,1.0,1596251445
Mezeleri efsaneee.,9.0,10.0,10.0,1596251445
Lezzetine ve hızına gerçekten diyecek laf yok tek kelime ile harikaydı. Fakat özellikle acı biber istediğimi belirtmeme rağmen hiç biber gönderilmedi.,10.0,3.0,10.0,1596251445
Sipariş ettiğimz 3 adet kolayı maalesef getirmediler :(.,5.0,1.0,10.0,1596251445
Porsiyon az lavaşlar ince.,8.0,8.0,6.0,1596251445
Porsiyon az lavaş ince doyurmuyor.,7.0,7.0,7.0,1596251445
"İki tane de su söylemiştim, onlar gelmedi.",8.0,3.0,7.0,1596251445
2 adet adana dürüm siparişi verdim. Yemeğim 55 dakika sonrasında kapıma geldi ve bildiğiniz buz gibiydi.,1.0,1.0,1.0,1596251445
Bence çok iyiler tam bir fiyat performans restorantı 3.,10.0,10.0,10.0,1596251445
Siparisimiz eksik geldi ayrica yemek soğuktu ve sadece 1er adet islak mendil vardi.,8.0,6.0,7.0,1596251445
Kürdan yoktu ama abimiz semtimizin simgesi.,10.0,10.0,10.0,1596251445
Adana soyledik acidan sikayet etme hakkimiz yok ama tavuk da bu kadar acı olmaz ya olmamali.,10.0,7.0,5.0,1596251445
"Hizmet, hız, lezzet mükemmeldi teşekkür ederim ellerinize sağlık.",10.0,10.0,10.0,1596251445
Muhteşemsiniz hızlı ve sıcak ayrıca ikramlar için teşekkürler.,10.0,10.0,10.0,1596251445
Tadına diyecek birşey yok ama yanında hla biber turşu veya meze vermemeniz saçma.,4.0,3.0,5.0,1596251445
İyi.,9.0,9.0,9.0,1596251445
Avcılarda kendını bozmayan bir burası kaldı on numara.,10.0,10.0,10.0,1596251445
Notlarim 2. 3 dür dikkate alınmamış malesef istediğimiz gibi gelmyr.,3.0,3.0,3.0,1596251445
Bu kadar kötü bir işletme görmedim! Ürünleri de çok kötü kimseye tavsiye etmiyorum!,1.0,1.0,1.0,1596251445
Harika.,10.0,10.0,10.0,1596251445
Maskesiz kurye hiç hoş değil ama siz hoşsunuz kolay gelsin.,10.0,4.0,10.0,1596251445
Çorbanız bana biraz yağlı geldi.,10.0,10.0,7.0,1596251445
Kıyak.,10.0,10.0,10.0,1596251445
Süper.,10.0,10.0,10.0,1596251445
Orta.,9.0,8.0,8.0,1596251445
Tşkler.,10.0,10.0,10.0,1596251445
Elinize sağlık.,10.0,10.0,10.0,1596251445
Güzeldu.,10.0,10.0,10.0,1596251445
Efsane.,10.0,10.0,10.0,1596251445
Avcılardaki en güzel dürümü yapıyorlar.,9.0,9.0,10.0,1596251445
Her şey güzeldi ama sadece menüde pilav yazıyordu pilavsız geldi.,10.0,7.0,10.0,1596251445
Sevmem öyle.,1.0,1.0,1.0,1593621699
Tşkler.,10.0,10.0,10.0,1593621699
Gayet güzeldi. Teşekkürler.,10.0,10.0,10.0,1593621699
Güxel.,10.0,10.0,10.0,1593621699
Her şey kötü. Asla tavsiye etmeyin. Kötü bir deneyimdi.,1.0,1.0,1.0,1593621699
"Lezzet çok iyyidi aç olduğumuzdan sanırım biraz sürdü gibi geldi getirmeleri ama tadı süper, restoranına da gideriz, sevilen mekan.",8.0,10.0,10.0,1593621699
Adam sağolsun yürüyerek getirdi beş dakika sürmedi tadı da güzeldi valla helal olsun.,10.0,10.0,10.0,1593621699
Eski lezzti bulamadım.,8.0,8.0,8.0,1593621699
Notlara dikkat edilmiş ve çok hızlı bir sipariş oldu. Bundan sonra tercihim burası.,10.0,10.0,10.0,1593621699
Servisi kötüydü.,1.0,1.0,1.0,1593621699
Lezzet porsiyonlar çok iyi doyurucu teşekkürler.,10.0,10.0,10.0,1593621699
İdare eder.,10.0,10.0,7.0,1593621699
Elinize saglik. Kuryebeye teşekkürler.,10.0,10.0,10.0,1593621699
Nasıl puan kırabiliyorlar anlamıyorum. Biraz vicdan.,10.0,10.0,10.0,1593621699
20 dakilık bir sürede geldi dürümüde güzeldi notları dikkate alıyorlar.,10.0,10.0,10.0,1593621699
Durumler çok lezzetliydi. Elinize sağlık.,10.0,10.0,10.0,1593621699
Mükemmel işletme.,10.0,10.0,10.0,1593621699
Avcıların en iyisi.,10.0,10.0,10.0,1593621699
Avcıların bir numaralı dürümcüsü bence...,10.0,10.0,10.0,1593621699
"Lavaş kuruydu, sadece soğan tadı aldık.",7.0,1.0,1.0,1593621699
Tavuk şiş istedim ama adana geldi ne hikmetse bu defa hiç memnun kalamadım.,1.0,1.0,1.0,1593621699
Çok iyi.,10.0,10.0,10.0,1593621699
"50dkda geldi. Sadece 2. 5km uzağınızdayım, bunu nasıl başardınız bilmiyorum.",1.0,6.0,8.0,1593621699
Hic sevmedim ayranda unutdilar.,1.0,1.0,1.0,1593621699
Adana iyi pişmemişti özellikle belirtmeme rağmen ayrıca sütlaç istedim resmen keşkül geldi sallaya sallaya sütleç kutunun içinde ters dönmüş.,6.0,4.0,4.0,1593621699
Efsaane! Notu dikkate aldığınız için teşekkür ederiim. Sıcacık ve çok hızlı geldi.,10.0,10.0,10.0,1593621699
En sevdiğim dürümcü..,9.0,9.0,9.0,1593621699
"Çöp şişin porsiyonu çok küçük, ellerinize sağlık yinede.",10.0,5.0,5.0,1593621699
Elinize sağlık efsane herşey çok güzel.,10.0,10.0,10.0,1593621700
Hiç bi tebessum yok abi be.,10.0,1.0,10.0,1593621700
Her çok iyi fakat notları hiç bir zaman dikkate almıyorsunuz.,10.0,10.0,10.0,1590991954
Hic olmamis uzgunum.,8.0,4.0,3.0,1590991954
Standart.,7.0,7.0,7.0,1590991954
Hersey çok güzel fakat sogansız yazdımız halde hep soganlı geliyor :).,10.0,10.0,10.0,1590991954
3 puan kırıyorum çünkü üstüne basa basa sadece domatesli olsun dediğim halde içinde her şey vardı. Lezzet konusunda mükemmel lafım olamaz.,10.0,7.0,10.0,1590991954
Lezzet on numara.,10.0,10.0,10.0,1590991954
"Tavuk şişi hergün olsa hergün yerim, çok leziz.",10.0,10.0,10.0,1590991954
Servis kalite hız mükemmel teşekkürlerr.,10.0,10.0,10.0,1590991954
Herzaman mükemmel.,10.0,10.0,10.0,1590991954
