comment_text,comment_speed,comment_service,comment_taste,comment_time
Sanki bu künefeyi hatayda yedim.,10.0,10.0,10.0,1606673731
On numara beş yıldız kiloluk tavuk aldık çok güzeldi ikramlar harikaa teşekkürler..,10.0,10.0,10.0,1606500931
Kıymanın tadı farklıydı.,2.0,2.0,2.0,1606500931
Künefelerden birisinin içindeki peynir gayet iyi erimişken diğeri çok iyi erimemişti ama tadı kötü sayılmazdı ortalama bir künefeydi. Tavuk dürümü de denemek için aldım ancak çok beğenemedim.,8.0,7.0,7.0,1606155331
İyi.,10.0,10.0,10.0,1606068931
Sıcacık ve lezzetliydi elinize sağlık.,10.0,10.0,10.0,1605896131
Güzeldi.,10.0,10.0,10.0,1605809731
Lahmacun eti çig tadı kötü ve soguk geldı. Sipariş vermeseydim keşke cok pişmanım.,5.0,1.0,1.0,1605723331
Güzeldi.,10.0,10.0,10.0,1605464131
Karışık ızgara hızlı ve lezzetlliydi.,10.0,10.0,8.0,1605377731
Antep lahmacun enfesti.,10.0,10.0,10.0,1605377731
Lezzet de hız da kurye de çok iyiydi allah razı olsun.,10.0,10.0,10.0,1605118531
Çok küçük fiyat pahalı.,1.0,1.0,1.0,1604859331
Hızlı ve sıcak geldi cig köfte fena acıydı:) lezzetleri guzeldi bit suru de ikram göndermişler tesekkur ederiz.,10.0,10.0,10.0,1604513731
Memnun kaldık ama biraz soguktu.,9.0,9.0,6.0,1604130385
"Sütlaçın içinde tarçını ilk defa tattım keşke bir sorsaydınız, hiçbirimiz yiyemedik tarçınla aramız olmadığından, maalesef hem sütlaçlar hem paramız ziyan oldu :(.",7.0,7.0,7.0,1604130385
Gercektennnnn coooookkk hızlı bir sipariş oldu 18 dk da ulaştı evime çok teşekkür ederim. Elinize sağlık. Servis konusunda da herhangi bir skinti sorun yoktu. Lezzet konusunda özellikle kebaplar için soyluyorum biraz daha iyi olabilirler çok küçük ve yetersiz kaldıklari için tatları alınamıyor.,10.0,10.0,10.0,1604130385
Yoğunlugu sebebi ile siparisim bir saat 15 dakika sonra geldi yinede tessekur ediyorum lezzeti çok güzeldi sipariş duzgundu ancak sipariş üzerinde gelen fişte fiyat yazmiyordu.. ?,2.0,9.0,10.0,1604130385
Lahmacun geldiğinde soğuktu ve kuruydu.,1.0,1.0,1.0,1604130385
1 saatte de geldi siparisim. Bursaya gider orda iskender yerdim o saate kimse kusura bakmasin 5 dakika mesafeye bu kadar uzun sürede getiren hiçbir müessese yok.,1.0,1.0,1.0,1604130385
Hızlı ve sıcak geldi verdiğim şiparişler sizden ricam imrahor mahallesi için minimum sipariş tutarını 50 tl yapmayın cidden çok fazla.,10.0,10.0,10.0,1604130385
Kelle paca corbasi muhtesem güzellikte ellerinize saglik.,10.0,10.0,10.0,1604130385
1 saatten fazla bekledim ve ayrıca lahmacunnun yanında şalgam da sipariş ettim lakin şalgam gelmedi şalgamin parasını dahi ödedim.,1.0,1.0,9.0,1604130385
Geç geldi ama adana dürüm guzeldi sıcak geldi bu arada kunefeyi begenmedim.,4.0,10.0,7.0,1604130385
Sparisin tm bir satte geldi ve sogumustu buna birazdaha dikkat edilirse daha guzel olabilir.,1.0,4.0,5.0,1604130385
Şerbetsizdi.,3.0,10.0,1.0,1604130385
Menüler doyurucu ve lezzetli hız ve serviste çok iyi kesinlikle tavsiye ederim.,10.0,10.0,10.0,1604130385
"2 acisiz salgam siparisi verdim 1 tane acili geldi ne para iadesi ne ürün getirme olmadi. Siz bu servis isini beceremiyorsunuz. Tuz, kürdan o kadar eksik var ki... Yani arkadaşlar özenilmiyor.",1.0,1.0,1.0,1604130385
Sıcak ve hızlı geldi.,10.0,10.0,9.0,1604130385
Buz gibiydi 1 saat 25 dakikada geldi. Çok kötüydü.,1.0,1.0,1.0,1601500639
Karışık kebap harika ve ikramlar çok güzel tebrik ediyorum. Ama ciğer gelmiyor bazen unutmayın ciğeri.,10.0,10.0,10.0,1601500643
Jsjdjd.,10.0,10.0,10.0,1601500643
Yemek 1 saate yakın bir sürede geldi. Bundan sonra acıkmadan sipariş vercem gelene kadar acıkırım.,2.0,5.0,7.0,1601500643
Bu sitede her siparişimde temassız teslim işaretliyorum ama ilk defa gerçekten temassız teslim siparişim geldi. Teşekkürler.,10.0,10.0,10.0,1601500643
"İkram olarak sütlaç göndermişlerdi, tadını çok beğenmesem de ikram edilmesi nazik bir davranıştı. Menü olarak karışık kebap ve lahmacun söyledik. Karışığın içerisindeki pide ve fındık lahmacunlara bayıldım. Ama menü lahmacun tam pişmemişti. Lahmacuna tekrar şans vermek istedim. Umarım güzel gelir :).",8.0,8.0,7.0,1601500643
Herşey çok güzel ve sıcaktı çok tesekkürler ellerinize sağlık :).,10.0,10.0,10.0,1601500643
Kıyma çiğdi.,1.0,2.0,3.0,1601500643
İkramlar ve yemek harikaydi cok tesekkur ederiz.,10.0,10.0,10.0,1601500643
Lezzet sıfır pide yanık çorba değişik çorbanın yanında gelen pideler bayat.,4.0,1.0,1.0,1601500643
"Lahmacunlar tamamen yanıktı, ve yemek tabağı boyutundaydı. İskender de lezzet yoktu, evde daha iyisi yapılır.",1.0,1.0,1.0,1601500643
Et döner adı altında bu kadar kötü bir tat daha önce yemedim kimse sipariş vermesin.,8.0,5.0,1.0,1601500643
Gayet başarılı.,7.0,7.0,7.0,1598870897
Hızlı geldi lezzeti güzel ama yemeklerin yeri değişmişti karmançorman olmuştu.,8.0,4.0,9.0,1598870897
"Tek kelimeyle şahaneydi. Hem hızlı, hem sıcacık, hem de lezzetliydi. Biz bayıldık.",9.0,10.0,9.0,1598870897
İşini özveriyle yapıyor.,10.0,10.0,10.0,1598870897
Pide aşırı tuzluydu.,9.0,6.0,3.0,1598870897
Sütlaç berbattı. Tadı çok kötüydü. Ayrıca ekşimişti yemeğin yanına yolladıkları çiğ köfte bozuktu döner ve lahmacun fena değil çorba da iyi sayılır.,5.0,5.0,3.0,1598870897
Sipariş ettigim yemekler soguk geldi.,1.0,1.0,1.0,1598870897
Hiç begenmedim.,5.0,1.0,1.0,1598870897
Tek kelime ile süper di.,10.0,10.0,10.0,1598870897
Buz gibi geldi yemek et pişmemiş.,1.0,1.0,1.0,1598870897
Karisik verip vermemekle tereddut etmistik ama tereddut etmemek gerekmis lezzetiyle ozenilmis bir tabak geldi cesitler on numara lezzet on numara hersey icin tesekkurler bir dahaki siparistr gorusmek dilegiyle.,8.0,8.0,8.0,1596241151
Eskiden daha lezzetliydi. Özen göstermemişlrr.,1.0,1.0,1.0,1596241151
Çok lezzetliydi yanında çiğ köfte getirmişler sıcacıktı. Daima sipariş verirken hiç tereddüt etmeden veriyorum lahmacununa müptelayız.,10.0,10.0,10.0,1596241151
Karısık ızgarayı açtıgımda cesitleri gorünce hecanlanmiştım ama pişmemişti kendim pişırdim evde.,8.0,9.0,1.0,1596241151
Restoranın sistemine yanlıs adres girmis kurye geldi artis artis konusuyo. Kendi sıkıntılarını gelmis ben yapmısım gibi artisleniyo. Bidaha burdan hic bişey siparis etmem.,1.0,1.0,1.0,1596241151
Cok kotu.,1.0,1.0,1.0,1596241151
Kanatları biraz daha bekletıp tam kömür halinde getırmenizi beklıyodum bide bundan sonra diye bişey olmıcak tavugu pişirıp buzluga koydunuz heralde oyle bi soguktu.,1.0,1.0,1.0,1596241151
Lezzet konusunda sınıfta kaldınız.,1.0,1.0,1.0,1593611405
Sıcak ve lezzetliydi.,10.0,10.0,10.0,1593611405
Elinize sağlık.,10.0,10.0,10.0,1593611405
O nasıl acıydı kardeşim. Resmen lahmacunlu acı olmuş. Ama lezzeti iyiydi.,10.0,10.0,8.0,1593611405
Very bad taste so so so different and smells so bad.,3.0,1.0,1.0,1593611405
"Lahmacunları için, servis ne hızlı ne de yavaştı ortalama bir vakitte geldi lahmacunlar hala sıcaktı. Lezzet olarak orta derecenin üstü lakin 9 için malzemeler biraz daha bol olabilirdi.",10.0,10.0,8.0,1593611405
Paket servis aşırı geç geliyor ve soğuk geliyor.,1.0,1.0,1.0,1593611405
Gayet hızlı lezzetli.,7.0,7.0,7.0,1593611405
Berbat cigkoftesi var.,1.0,1.0,1.0,1593611405
Çok kötüydü. İçinde kıyma değil parça et var gibiydi.,9.0,8.0,1.0,1593611405
Normal.,5.0,8.0,5.0,1593611405
"Lahmacun soğuktu, az pişmişti, ben plastik çatal kaşık vs istemememe rağmen yolladılar sağolsunlar.",4.0,3.0,2.0,1593611405
Teşekkürler çok güzel lahmacun ellerinize sağlık yalnız az biraz pahalı.,10.0,10.0,10.0,1593611405
İlk siparişi cok güzel di daha sonraki siparişim de tam porsiyon iskender yarım porsiyon gibi geldi.,1.0,1.0,1.0,1593611405
Pide sürekli veriyoruz sipariş hızı iyi fakat fiyatlara zam yanındaki ürünler sıfır yanında hiçbirşey gelmedi. Künefe ise tam bir fiyasko haşlanmış gibi bir kıtrlık bile yoktu ve orda yerken öylece mi koyuyorsun uz milletin önüne üzerinde sıfır malzeme. Birdaha sizden birşey almayı düşünmüyorum...,7.0,1.0,5.0,1593611405
İç harcı daha iyi olur diye yüksek puan veriyorum. Umarım yorumları okuyorsunuzdur.,10.0,10.0,10.0,1593611405
Olan olumsuzlukları bu günlerde ki yoğunluğa yoruyorum.,4.0,8.0,7.0,1590981659
Sürekli sipariş veriyorum ama köfteyi hiç beğenmedm yani anlamadım köfte tadı yoktu içi bir tuhaftı. Bir daha burdan köfte almam ama diğer siparişlerimden memnununum özellikle pide si.,7.0,7.0,5.0,1590981659
