comment_text,comment_speed,comment_service,comment_taste,comment_time
Kurye aşırı kibardı çok beğendim ürünler tazeydi tavsiye ederim kesinlikle.,10.0,10.0,10.0,1606260588
Güzel.,8.0,10.0,10.0,1606087788
Güzel.,10.0,10.0,10.0,1606001388
Ayran almıştım ödemesi yapıldı fakat koyulmamis.,8.0,2.0,7.0,1606001388
Tadı hiç güzel değildi.,1.0,1.0,1.0,1606001388
Açısı çok iyi.,10.0,10.0,10.0,1605828588
Siparişim 1 sat geldi dağılmıştı toplayıp yedik ve waffle kutusu yoktu bende bu bir şaka plastik tabak koymuş ve öyle gönderildi gerçekten bu bir rezillik memnon kalmadım.,1.0,1.0,1.0,1605742188
Yazılan notu gerçekten her seferinde dikkate alan sayılı iyi mekanlardan ayrıca çok hızlı geliyor.,10.0,10.0,10.0,1605742188
Standart.,8.0,8.0,8.0,1605655788
Bir çiğköfte sevdalısı olarak şunu söyleyebilirim ki: oldukça lezzetli. Ayrıca fiyat bakımından da uygun ve servis de hızlı. Tavsiye edilir.,10.0,10.0,10.0,1605655788
Güzeldi ama mega boy durum biraz daha buyuyebilir. Elinize sağlık.,10.0,10.0,10.0,1605655788
"Çok lezzetliydi, pandemi sürecinde çalışan bütün restoranlara ve kuryelere teşekkür ederim :).",10.0,10.0,10.0,1605569388
"Çok hızlı geldi, kuryeye selamlar. Sadece büyük boy ayran ödememe rağmen küçük boy yollamışlar, dalgınlık sanırım gece gece. Ciddi ciddi 6 dk civarında geldi sanırım.",10.0,10.0,10.0,1605569388
"Ayran bozuktu, çiğ köfte de her zaman ki gibi iyi değildi.",8.0,3.0,8.0,1605137388
Teşekkürler.,10.0,10.0,10.0,1605050988
Güzell.,9.0,9.0,9.0,1604964588
Çok lezzetli olmuş çiğköfteniz ellerinize sağlık. Ayrıca kuryeye çok teşekkür ederim.,10.0,10.0,10.0,1604791788
"Çok lezzetliydi, kurye de çok nazikti.",10.0,10.0,10.0,1604791788
"50 dakikada geldi, ayran da eksikti. Bir daha sipariş vermeyi düşünmüyorum.",1.0,1.0,1.0,1604705388
Tam istediğim gibi hazırlamışlardı. Malzeme çeşitliliği çok iyi.,10.0,10.0,10.0,1604618988
Lezzetli ama beytiye daha fazla ödeyince insan dürümden bir farkı olmasını bekliyor.,8.0,6.0,8.0,1604618988
Gayet güzeldi elinize sağlık.,10.0,10.0,10.0,1604618988
Bozuk ayran getirmişlerdi. Pandemi döneminde yapılacak iş değil. Erkenden fark ettiğime sevindim.,1.0,1.0,1.0,1604532588
Gerçekten güzel.,10.0,10.0,10.0,1604446188
Teşekkür ederim çok lezzetliydi.,10.0,10.0,10.0,1604446188
Sushi çiğ köfte çok iyi kuryeye de güleryüzü ve hızından dolayı teşekkürler.,10.0,10.0,10.0,1604446188
Doritoslu çiğ köfte dürüm nefis.,10.0,10.0,10.0,1604359788
Çiğ köfte çok güzel kazandibi de cok başarılı.,10.0,10.0,10.0,1604273388
Güzel.,8.0,8.0,8.0,1604273388
Güzeldi.,10.0,10.0,10.0,1604273388
Atom waffleınızı çok beğendik. Ama waffleı köpük tabağa koyup streçle sarmayın lütfen. Maliyeti 1 lira arttırabilir belki ama diğer waffle yerlerinin kutularından koyabilirseniz daha iyi olur. Elinize sağlık.,10.0,9.0,10.0,1604186989
Çiğ köftesi kötü.,1.0,1.0,1.0,1604100589
Pek lezzetli bir çiğköfte değildi ama 5 tl tabi.,9.0,8.0,7.0,1604014189
"Waffle sipariş etmişitim, paketlemeden önce soğumadığı için aldıktan hemen sonra açmama rağmen hamur olmuş. Hamur yemektense geç olsada soğuduktn sonra gelmesini tercih ederdim.",7.0,7.0,6.0,1603890043
Favori çiğköftecim.,10.0,10.0,10.0,1603890043
Domates bütün koyulmuş herhalde marul da almayı unutmuş elemanlar. Ve en önemlisi maydanoz bedava bir kilo maydanoz bolluğu var sadece.,1.0,1.0,1.0,1603890043
"Çiğ köfte hafif ve doyurucu, kazandibi de güzeldi. Hızlı geldi kurye de güleryüzlü biriydi.",10.0,10.0,10.0,1603890043
Kurye selim abi hızlıydı.,10.0,8.0,7.0,1603890043
Bazı malzemeler gönderilmemişti.,10.0,2.0,5.0,1603890043
Cebecide yediğim en güzel çiğköftelerdendi. Daha önce neden söylememişim burdan dedirten bi lezzet. Çalışanları da gayet samimi ve kibardı teşekkürler. :)):).,10.0,10.0,10.0,1603890043
"Barbunya pilaki diye bimde hazir satilan konserveyi koymuslar salata istedim butun butun marullarin ustune havucu dorde bolup gondermisler, menude yazan malzemeler yoktu salatanin icinde.",5.0,1.0,1.0,1603890043
Başarılıydı.,10.0,10.0,10.0,1603890043
9 dakikada geldigi için kurye abime teşekkür ederim :) l.,10.0,10.0,8.0,1603890043
Siparişi çok hızlı geldi ayrıca getiren kişi çok nazik biriydi. Lezzette gayet iyi. Teşekkürler.,10.0,10.0,10.0,1603890043
Kurye çok iyiydi.,10.0,10.0,10.0,1603890043
Doritoslu çiğköfte harikaydı. Çok teşekkür ederim.,10.0,10.0,10.0,1603890043
Muhteşem bir lezzet ve hız tebrikler.,10.0,10.0,10.0,1603890043
Teşekkür.,10.0,10.0,10.0,1603890043
"Çiğ köfte sushi.. Oryantalist bir füzyon, beğendim.",10.0,10.0,10.0,1603890043
Bu paraya bu waffle harbiden iyi.,9.0,10.0,10.0,1603890043
Hızı kötü değildi ancak dürümün içinde istemediğimiz her şey koyulmuştu. Dürümün içinden cips dahil birçok şey cıktı ve bunların hiçbirini istememiştik. Niye öyle oldu hiç anlamadım.,8.0,8.0,1.0,1603890043
Teşekkürler.,10.0,10.0,10.0,1603890043
Suşi çok güzel tavsiye edilir.,10.0,10.0,10.0,1603890043
Çiğ köftesi iyiydi doğruya doğru waffle pek başarılı değil.,8.0,8.0,10.0,1603890043
Domates ve turşu nasıl olmaz.. Çiğ köftenin en önemli tatları. Ek olarak marul daha dikkatli seçilmeli. Geri kalan iyiydi. 10 dkda geldi.,10.0,6.0,9.0,1601260297
Çatal ve bıçak yoktu ne yazık ki.,10.0,1.0,8.0,1601260297
Çok lezzetliydi sushi çiğ köfte.,10.0,10.0,10.0,1601260297
Kuryenizin güler yüzlü olması ilgisi için kendisine teşekkür ediyoruz.,10.0,10.0,10.0,1601260297
Tatsız tutsuz az yeşillikli bişeydi beğenemedim üzgünüm.,10.0,10.0,5.0,1601260297
Leziz.,10.0,10.0,10.0,1601260298
Suşi tavsiye edilir.,10.0,10.0,10.0,1601260298
Paketci selim beye güleryüzlülüğü için çok teşekkürler...,10.0,10.0,10.0,1601260298
Notları dikkate alıyorlar malzemeden kaçınmıyorlar lezzeti de iyi yeniden teşekkürler.,10.0,10.0,10.0,1601260298
Nar ekşisi poşetin içinde açılmıştı her yer nar ekşisi oldu.,10.0,7.0,10.0,1601260298
Çiğköfte lezzetli ve yanındali yeşillikler boldu gayet güzeldi sadece biraz geç geldi.,8.0,10.0,10.0,1601260298
Sipariş hızlı geldi. Kurye arkadaş çok kibardı. Teşekkürler.,10.0,10.0,10.0,1601260298
Waffle beklediğim kadar iyi değildi yine de elinize sağlık.,10.0,10.0,10.0,1601260298
"Kurye arkadaşa teşekkürler, hızlıydı.",10.0,10.0,10.0,1601260298
"Dün gece söyledim, kurye beyefendi oldukça iyi bi insandı kendisine ve size teşekkürler.",10.0,10.0,10.0,1601260298
"10 dakikada teslimat on numara güler yüz, on numara sosyal mesafeye 10 tam puan.",10.0,10.0,10.0,1601260298
Her şey iyi hoş da bu kadar nar ekşisine bulamanın manası nedir sakın yanlış anlaşılmasın çiğköfte ve malzemeleri lezeettsiz değildi sadece nar ekişi aşırı fazlaydı zehir etti.,9.0,9.0,7.0,1601260298
"Çiğ köfte vasattı, waffle kesinlikle insanlarla dalga geçer vaziyette hazırlanmıştı, kaldırılmalı kesinlikle. Verilen parayı asla hak etmiyor.",1.0,1.0,1.0,1601260298
Yeşillikler tazeydi ayrıca çok hızlı geldi.,10.0,10.0,10.0,1601260298
Hızlı ve güzel.,10.0,10.0,10.0,1601260298
Köftenin lezzeti iyiydi. Ekmeği çok kötü ve bayattı üzülürek. Notu dikkate almışlar nar ekşisi koymamışlar ama içinde cin biber istemiştim yoktu maalesef. İlginç bir şekilde sosu güzeldi. Kurye çok kibardı. Ekmeği o kadar kötüydü ki 1 puan vermeyi düşündüm lezzete.,10.0,10.0,6.0,1601260298
5 dakikada geldi yok böyle hızlı servis. Uzun süreden sonra ilk defa bir hizmetten bu kdar memnun kaldım. Kazancınız bol olsun.,10.0,10.0,10.0,1601260298
Hız iyi fakat çiğköfte yanında ayran gelmedi kuryenin ağzında maske yoktu.. Lezzet iyiydi.,8.0,7.0,7.0,1601260298
Teşekkürler.,10.0,10.0,10.0,1601260298
Çiğ köfte gerçekten a kalite hız şahane fovorilerim arasında.,10.0,10.0,10.0,1601260298
10 numara 5 yıldızdı.,10.0,10.0,10.0,1601260298
Böylesini daha önce hiç yememiştim tek kelime ile muazzamdı.,10.0,10.0,10.0,1601260298
Hızlı ve lezzetli.,10.0,10.0,10.0,1601260298
"2 farklı dürüm söyledim birini ters sarmışlar içeriğini nasıl bileyim ben? Servis o yüzden 1. , lezzete gelince içine aşırı fazla marul koymuşlar boşaltıp yedim ve çiğköftenin de tadını beğenmedim lezzet 3. , hızlıydı ama kurye maske takmıyordu.",8.0,1.0,3.0,1601260298
"Kurye beyefendi çok kibar, nazik ve hızlıydı.",10.0,10.0,10.0,1601260298
4 dakikada geldi hızlı hizmet için teşekkürler.,10.0,10.0,10.0,1601260298
Kivi yoktu beyaz çikolata istemiştik normal geldi beyaz çikolata harici tüketemiyorum alerjim var harici tabanı lezzetliydi meyveler tazeydi bence sadece çigköfte satışı yapın ve içli köfte eklenirse daha iyi olacagını düşünüyorum.,10.0,8.0,7.0,1601260298
Çok hızlı geldi ve lezzetliydi.,10.0,10.0,10.0,1601260298
Kurye adam.,10.0,8.0,6.0,1601260299
Harika.,10.0,10.0,10.0,1601260299
Tadı güzel ve çok hızlı tavsiye ederim.,10.0,10.0,10.0,1601260299
Kuryeci abi cok anlayıslıydı.,10.0,10.0,10.0,1601260299
Yoğurtlu beytinin paketlenmesi çok kötüydü. Nar ekşisi filan altına akmış. Biriken yerler fazla yumuşamış. Çiğköfte güzel. Fakat paketleme konusunda daha özenli olmalarını dilerim.,10.0,8.0,8.0,1601260299
Başarılı.,10.0,10.0,10.0,1601260299
11 dkda geldi :d.,10.0,10.0,9.0,1601260299
Teşekkür ederim çok hızlı ve lezzetliydi.,10.0,10.0,10.0,1601260299
Sipariş 1 saate geldi.,1.0,3.0,5.0,1601260299
"Çiğ köfte bildiğimiz dışarda yediğimiz çiğ köfteydi. Waffle da çok lezzetliydi ama aynı fiyata başka yerlerde daha büyüklerini yedim. Joker diye eksik göndermemişler, herşey güzel ve tamdı.",10.0,10.0,10.0,1601260299
"Bence waffli kaldırılmalı şekli çok komikti tabağı da çok değişikti, ondan servisi çok kötüydü tabi kivi de yoktu tek muz yapmış yarıs boştu wafflin, çiğ köfte konusunda bilmem ama waffle için kesinlikle tavsiye etmem, ah hamuru ve çikolatası da garibti biraz, ama allah var çok hızlı geldi.",10.0,1.0,5.0,1601260299
Herşey çok güzeldi malzemeler boldu acısı harbi acı bilginize:).,10.0,10.0,10.0,1601260299
Harika.,10.0,10.0,10.0,1601260299
Lezzetli ve hızlı.,10.0,10.0,10.0,1601260299
"Bazlama tost küçüktü, waffle lezzetsizdi. Kurye ısrarla yorum yapmamı istedi.",1.0,1.0,1.0,1601260299
On numara.,10.0,10.0,10.0,1601260299
Gayet hızlı geldi çiğ kofte ise lezzetliydi kuryeniz güler yüzlüylu elinize sağlık.,10.0,10.0,10.0,1601260299
Siparişi 7 dakikada getirdiler çok hızlı ve lezzetli.,10.0,10.0,10.0,1601260299
"İyi bir şey yemek için harika bir yer, mükemmel fiyatlar ve mükemmel hizmet.",10.0,10.0,10.0,1601260299
Lezzeti çok güzeldi waffle malzemesi boldu tazeydi hızı güzel beğendim tavsiye ederim.,10.0,10.0,10.0,1601260299
Geç saatlerde sipariş veriyoruz arkadaşlarla ve hızlı bir şekilde ulaşıyor siparişimiz hamburger ve çiğköftenize bayılıyoruz sipariş yanında verilen bolca yeşillik bu dükkan neyden kr ediyor dedirten cinsten kalitenizi bozmamanız dileğiyle.,10.0,10.0,10.0,1601260299
Getiren kurye abimiz çok kibardı. Çiğ köfte de çok lezzetliydi ve söylenen zaman aralığında getirildi. Teşekkür ederim.,10.0,9.0,10.0,1601260299
Kurye beye teşekkürler gayet hızlıydı.,10.0,9.0,8.0,1601260299
Hızlı geldi malzemeleri özenle koymuşlar ve bol bol koymuşlar açıkçası şaşırdım çamur gibi olan çiğ köfteler den değildi tane tane ve çok güzel tavsiye ederim ustanın ellerine sağlık.,10.0,10.0,10.0,1601260299
Çok hızlılar.,10.0,10.0,10.0,1601260299
Hızlı geldi ve lezzetliydi.,10.0,10.0,10.0,1598630553
Güzeldi.,10.0,10.0,10.0,1598630553
Hamuru çok sert geldi ve çok geç geldi 30 dk diyor 47 dk geldi.,1.0,10.0,4.0,1598630553
Aldığınız paraya degmiyor wafle hamurunu testere bıcakla kestik.,9.0,1.0,1.0,1598630553
Sğper.,10.0,10.0,10.0,1598630553
Komageneden 10 kat daha güzel kuryeniz de çok hızlı.,10.0,10.0,10.0,1598630553
Çiğköftenin çok güzeldi tadı. Ben klasik çiğköfte tadı sevenlerdenim gayet memnun kaldım. Bir de üstüne ayran hediye etmişlerdi. Teşekkür ederim.,9.0,10.0,10.0,1598630553
Köpük tabakta çikolatalı ekmek.,1.0,1.0,1.0,1598630553
Notu okuduğunuz için çok teşekkürler :).,10.0,10.0,10.0,1598630553
Waffle porsiyonu çok küçüktü.,10.0,10.0,10.0,1598630553
Waffle konuşuyordu çok büyük hayal kırıklığı.,8.0,1.0,1.0,1598630553
Ellerinize saglik hemcok taze hem cok guzel sekerler icin de cok tesekkur ederiiim.,10.0,10.0,10.0,1598630553
5 dakika içinde geldi oldukça lezzetliydi lavaşlar kolay dağılıyordu onu düzeltebilirseniz 10/10.,10.0,10.0,10.0,1598630553
Çok hızlı geldi her şey harika.,10.0,10.0,10.0,1598630553
"Çiğ köfte menunun ayranını unutmuslar, içinde seçtiğimiz hiç bir mağzeme yoktu, waffel korkunç ötesi, birde 10 puan istiyorlar?",1.0,1.0,1.0,1598630553
"Öncelikle siparişim hızlı ve servis olarak çok güzel bir şekilde geldi. Sadece 7-8 dakika bekledim, lezzet bakımından çiğköfte aroması ve lavaş gayet güzeldi. Ellerinize sağlık çiğköfte üzerine favori mekanım oldu.",10.0,10.0,10.0,1598630553
Ben ömrümde böyle waff yemedim.,1.0,1.0,1.0,1598630553
İlk siparisimdi hızlı teslimat ve çok lezzetliydi.,10.0,10.0,10.0,1598630553
Waffle ı kaldırın lutfen ayıptır.,9.0,7.0,5.0,1598630553
Gönderilen ayran bozuktu. Tarihi geçmemiş ama dışarda kalmış veya markanın kalitesizliği olabilir.,9.0,8.0,7.0,1598630553
Sanki lastik kemirdim. Benim seçtiğim malzemelerin hiçbiri yoktu.,1.0,1.0,1.0,1598630553
"Geç saate rağmen hızlı geldi, tebrik ederim.",10.0,10.0,10.0,1598630553
Çok geç geldi zaten çok beklemiş çiğ köfte erimiş lavaşa geçmiş çok kötüydü waffle d berbattı ne lezzet ne bişey.,1.0,1.0,3.0,1596000807
Çiğ köfte güzeldi ancak yarım kiloluk çiğköftenin yanında gelen yeşillik çok azdı üstelik not yazmıştık. Dürüm çiğköftelerin tamamı çok ıslanmış ve nar ekşisi akmış halde kağıda yapışmıştı altındaki poşetler dağılmıştı. Servis konusu düzelirse çiğköfte için iyiydi.,10.0,5.0,8.0,1596000807
Ciğköftesi güzel fakat mezeleri tavsiye etmem.,9.0,9.0,8.0,1596000807
İçinden limon çekirdekleri çıkmasa çok daha iyiydi.,10.0,4.0,10.0,1596000807
Hızlı ve güzeldi.,10.0,9.0,10.0,1596000807
Selim beye tesekkurler.,10.0,10.0,10.0,1596000807
Waffle güzel.,7.0,10.0,8.0,1596000807
Sütaş ayran yerine başka bir ayran geldi onun dışında mega dürüm yememe rağmen marul ekmek yedim gibi.,10.0,4.0,5.0,1596000807
Muhteşemdi.,10.0,10.0,10.0,1596000807
"Gelen kurye samimi, güler yüzlü ve nazikti. Çiğköfte ise çok lezzetliydi. Daha ne olsun.",10.0,10.0,10.0,1596000807
İşletmenin waffle konusunu geliştirmesi gerekiyor...,8.0,8.0,8.0,1596000807
"Herzaman sipariş veriyorrum güzel, iyi...",10.0,10.0,10.0,1596000807
Joker olmasına rağmen özenle hazırlanmış teşekkürler.,8.0,8.0,8.0,1596000808
"Waffle da yazan muz çilek vs, gelen waffleın içinde şeftali, kiraz ve muz vardı. Tadı güzel değildi.",8.0,3.0,2.0,1596000808
Hızı iyi fakat servis ve lezzetten memnun kalmadım.,9.0,4.0,3.0,1596000808
Efsane.,10.0,10.0,10.0,1596000808
Hayatımda gördüğüm en hızlı teslimattı. 8 dkde geldi. Helal olsun. Lezzet daha iyi olabilir. Bazı malzemeler eksikti durumde.,10.0,10.0,8.0,1596000808
Normalde 20-30 dakikada teslimat olması gerekirken siparişim tam 54 dakikada geldi. Onun harici çiğköftesi ve yeşillikler ortalama. Ayrıca turşu yok.,1.0,8.0,8.0,1596000808
"Çiğ köfte sushi istedik, normal çiğ köfte dürümü kesip göndermişsiniz. Bu kadarı da olmaz artık..",9.0,5.0,1.0,1596000808
"Joker geldi iyiki de gelmiş. Çiğ köfteye denecek yok. Beyaz atom waffle da denemiş oldum. 2 kat idi ama çikolatası az bence, meyveler taze ve lezzetliydi, hamuruna da unu fazla gelmiş sanırım. Yine de dibini sıyırdım, geliştirilebilir diye yazdımve30cl ayran yerine 2x20cl göderen işletme gibi işletme.",9.0,10.0,10.0,1596000808
Harikaydı. Kurye arkadaş da çok kibardı. Teşekkürler.,10.0,10.0,10.0,1596000808
"Mega çiğ köfte dürüm söyledim güzeldi iç miktarı, yeşilliği de bolca koymuşlar. Ayran ikramları için teşekkür ederim. Popüler zincir firmalardan bir eksiği yokmuş fiyatı da daha uygun. Temassız teslim de sorun olmadı.",10.0,10.0,10.0,1596000808
Cok lezzetli be arkadas gercekten cok iyi.,10.0,10.0,10.0,1596000808
Çiğköftenn içinde iceberk değil kıvırcık vardı neyse olabilir ama hem yeşil yeriydi hem de hiç doğramadan bütün konmştu açıp çıkarmak zorunda kaldık.,7.0,3.0,5.0,1596000808
Lezzetli çiğköfte.,9.0,9.0,9.0,1596000808
Hızlı ve güzel.,10.0,10.0,10.0,1596000808
Lezzeti mükemmel servis şahane daha hızlısını ise henüz görmedim 20 puan olsa 20 verirdimhizmette sınır tanımayan bir işletme.,10.0,10.0,10.0,1596000808
Gercekten cigkofte mukemmel lezzetli en sevdigim cigkoftecilerden.,10.0,9.0,10.0,1596000808
Efsane..,10.0,10.0,10.0,1596000808
Ciğ köfte dürümün içerisine sectigimiz ürünler koyulmamıştı. Daha dikkatli olunursa iyi olur.,10.0,9.0,7.0,1596000808
Gayet hızlı bir ulaşım lezzet normal ama hızlı gelmesi lezzeti bastırdı teşekkürler.,10.0,10.0,10.0,1596000808
Kurye çok güleryüzlüydü çiğköfte lezzetliydi elinize sağlık.,10.0,10.0,10.0,1596000808
"Temassız teslimat seçtim. Kurye arkadaş geldi, apartman kapısında zile bastı, tamam. Yukarı çıktı ev kapısında zile bastı. Temassız seçtim açmama gerek yok dedim. Bir de inerken tekrar apartman kapısında zile basmak nedir hocam? Saat gecenin 3ü. İlk zili duymasam apartmanın kapısını nasıl açayım?",8.0,1.0,7.0,1596000808
10/10 puan istiyorsunuz sunum rezalet pecete yok pipet yok hız desen hak getire lezzet iyi ama maalesef...,7.0,3.0,10.0,1596000808
"Kurye güleryüzlüydü, şekerler için teşekkürler :).",10.0,10.0,10.0,1596000808
Hızlı geldi. Kurye güler yüzlü. Lezzetinde de bir problem yok. Yeni açmışlar sanırım şans vermenizi tavsiye ederim. Gecenin bir yarısı 15 dakikada sipariş yetiştirmek kolay değil.,10.0,10.0,10.0,1596000808
Çiğköftesi güzeldi. Ama ben barbunya vs gibi şeyler de söylemiştim kendilerinin yaptığını düşünerek onlar hazır geldi tekrar söylemem o yüzden ama çiğköftede tercih edebilirim.,10.0,10.0,10.0,1596000808
10 numara 5 de yıldız.,10.0,10.0,10.0,1596000808
İdare ederdi joker oldugu için pek önemsemmemiş gibi olmuş neyse artık.,10.0,8.0,8.0,1596000808
Menude belirtilenden fazla sebze çeşidi vardı. Fakat domates ve turşu yoktu. Çiğköfte gayet lezzetli. Çok hızlı bir şekilde geldi. Gayet memnunum.,10.0,10.0,10.0,1593371062
Çok memnun kaldım.,10.0,10.0,10.0,1593371062
"10 numara, 5 dkda geldi.",10.0,10.0,10.0,1593371062
Hızlı ve lezzetli.,10.0,10.0,10.0,1593371063
Başarılı.,10.0,10.0,10.0,1593371063
"Kurye selim beye çok teşekkürler. Hızlı, kibar.",10.0,8.0,9.0,1593371063
Güzeldi. Teşekkürler. :).,10.0,10.0,10.0,1593371063
4 dakika da kapidaydi. Ne ara hazırladınız ne ara yola çıkıp geldiniz vallahi tebrikler.,10.0,10.0,10.0,1593371063
Kuryeci arkadaş çok iyi davrandı bize.,10.0,10.0,10.0,1593371063
"Genel olarak iyiydi, kuponla soylememize ragmen hic bir seyi eksik koymamislardi fakat lavaslarına dikkat etmenizi oneririm arada bazilarinda sıkntılar vardi, kurye guler yuzluydu..",10.0,7.0,10.0,1593371063
Çok hızlılar gayet iyi.,10.0,10.0,10.0,1593371063
Çok kötü ve marul göndermişsiniz.,6.0,5.0,1.0,1593371063
20 tl ye waffle söyledik ama bazlama üzerine konulmuş meyveler geldi vasadın altıydı.,7.0,1.0,1.0,1593371063
5 dakikada geldi sanki kapımın önünden geçerken uğramış gibiydi kurye.,10.0,10.0,10.0,1593371063
"Servispaketleme çok kötüydü, waffle tavsiye etmiyorum. Umarım dikkate alırlar, hızda problem yok.",9.0,5.0,7.0,1593371063
"Hızlıydı, çatal bıçak çıkmadı paketin içinden nişanlım waffle beğenmedi çiğköfte harikaydı.",10.0,9.0,5.0,1593371063
"Kurye abimiz ışık hızında getirdi, mega dürüm doyurucu teşekkürler.",10.0,10.0,10.0,1593371063
İçin de eklettiğim 7 malzemeden biri vardı sadece çiğ köftenin lezzetine değil istediğim şeyden çok uzak gelmesine puanım :).,10.0,8.0,1.0,1593371063
Mukemmel restoran hiz servis lezzet 10 numara :).,10.0,10.0,10.0,1593371063
Çok hızlı geldi tskler.,10.0,10.0,10.0,1593371063
"Merhaba, yaklaşık olarak 5 saat bekledim (ürünü yedikten sonra) ve objektif olarak değerlendiriyorum. Kurye arkadaş: saygılı, efendimli konuşan hızlı ve atik. Ürün içeriği: gayet bol, temiz ve özenli. Lezzet: lezzetli ve doyurucu. Sağlık: yaklaşık 5 saat geçti midemde herhangi bir ekşime olmadı.",10.0,10.0,10.0,1593371063
En sevdiğim çiğ köftecisi.,10.0,10.0,10.0,1593371063
Begenmedim.,8.0,8.0,6.0,1593371063
Başarılı.,10.0,10.0,10.0,1593371063
İnanılmaz hızlı geldi. Ama paketleme çok kötüydü. Ayrıca içine koyacak malzemeniz yoksa oraya seçenek koymayın. İşaretlediğim malzemeleri koklatmışsınız. Marul yoktu en başta. İnanılmaz pişman oldum. Sevdiğim tek şey kuryenizdi.,10.0,5.0,5.0,1593371063
"Waffle son derece lezzetli, doyurucu, aşırı şekerli değil.",10.0,10.0,10.0,1593371063
Çiğköfte az gibi geldi ama güzel.,10.0,10.0,7.0,1593371063
Gönderdiğiniz profiteroller ekşiydi. Bozuk ürün göndermeniz hoş olmadı.,10.0,10.0,5.0,1590741317
Çok hızlı geldi.,10.0,10.0,10.0,1590741317
Süper.,10.0,10.0,10.0,1590741317
Gecenin 3 ünde getirmenize ragmen cok bayıldık hediyeler icin de teşekkür ederiz.,10.0,10.0,10.0,1590741317
Çok fazla iyi kibar bir kurye süper bir servis on numara lezzet.,10.0,9.0,9.0,1590741317
Çok güzel servisiniz var. Ve yapmış olduğunuz paket servisteki küçük jestler için ayrıca teşekkürler.,10.0,10.0,9.0,1590741317
