comment_text,comment_speed,comment_service,comment_taste,comment_time
Sıcacık geldi.,10.0,10.0,10.0,1606619981
Gecenin 3ünde bile sıcacık poğaçalar geldi teşekkür ederim.,10.0,10.0,10.0,1606533581
"On numara hız, izmir bomba efsane.",10.0,10.0,10.0,1606447181
Çok hızlı geldi kurye abimiz güler yüzlüydü teşekkürler.,10.0,10.0,8.0,1606447181
İyi.,9.0,9.0,9.0,1606447181
Harika taptaze bir pastaydi elinize saglik.,10.0,10.0,10.0,1606360781
Gayet iyiydi teşekkürler.,9.0,9.0,9.0,1606360781
Çok hızlı ve eksiksiz geldi çok teşekkürler.,10.0,10.0,10.0,1606274381
"Tek favorim :) sıcacık çay, aşırı güzel börekler.",10.0,10.0,10.0,1606015181
Çok güzel gozlemeleri var isletme sahipleri de cok iyi ilgililer ellerinize sağlik.,10.0,10.0,10.0,1605928781
Çok çok iyiler ve hızlılar sürekli sipariş vereceğim yeri bulmuş olabilirim.,10.0,10.0,10.0,1605842381
"Tahinli boyoz yerine tahinli çörek göndermişler, sade boyozlar lezzetliydi. Börekleri biraz yağlıydı.",9.0,7.0,8.0,1605842381
"Notlar dikkate alınıyor, teşekkürler.",10.0,10.0,10.0,1605755981
Kıymalı gözlemeyi hiç beğenmedim.,10.0,1.0,1.0,1605669581
Süper.,10.0,10.0,10.0,1605583181
Sabah sabah keyfinize keyif katiyorlar. Gercekten mukemmel hizmet mukemmel insanlar. Hepsine minnettarim.,10.0,10.0,10.0,1605583181
10 numara 5 yildiz.,10.0,10.0,10.0,1605496781
Belirttikleri sürede getiriyorlar. Güzel.,8.0,8.0,10.0,1605496781
"Böreğin kıyması az, bombanın hamuru kalın.",10.0,8.0,6.0,1605410381
Tadı güzeldi serviste hızlı güler yüzlü anlayisli.,10.0,10.0,10.0,1605410381
Börekler sıcak ve ef sa ne.,10.0,10.0,10.0,1605064781
Siz bu işi biliyorsunuz izmir bomba çok iyiydi fakat parçalanmış haldeydi yine de çok iyiydi.,10.0,8.0,10.0,1604891981
"Hızda sıkıntı yok kaşarlı poğaça, kaşarlı sosisli poğaça ve pastiç güzel fakat iki seferdir ıspanaklı gül böreği yerine farklı ıspanaklı börekler geliyor geçen gelenler güzeldi bişey demedim ama bu seferki hiç iyi değildi. Mevcut değilse yemek sepetinden de kaldırın ürünleri ya da arayıp sorun...",10.0,8.0,6.0,1604805581
Kaliteli.,10.0,10.0,10.0,1604632781
Ben mozaik pastayı önermiyorum değişik bi tadı var çözemedim.,9.0,7.0,6.0,1604632781
Simiti 1 tane istemiştik 2 tane koyulmuş teşekkür ederiz. Ama simit aşırı kuruydu inceydi boyoz da daha çok börek gibiydi kusura bakmayın.,9.0,7.0,5.0,1604546381
Peynirli gozleme siparisi verdim bildigin yufkadan borek gibi bsey gondermisler buz gibi simit desen dunden kalms gibiydi.,7.0,8.0,4.0,1604459981
"Kabaklı gözleme çok karabiberliydi, karabiber yoğunluğundan lezzet alınamıyordu.",7.0,8.0,7.0,1604459981
Dondurmanın içinde ne olduğunu anlayamadığım garip parçacıklar vardı ve tadı hiç hoş değildi.,5.0,4.0,1.0,1604373581
Enfesti.,10.0,10.0,10.0,1604373581
Gözlemeci ablamın ellerine sağlıkkk.,10.0,10.0,10.0,1604373582
"Gece yarısı sıcak taze ürünler müthiş hızlı ve kibar montu ciks kurye müthiş çok teşekkür ellerinize sağlık,.",10.0,10.0,10.0,1604287182
İlk defa bir konuda eleştireceğim. Sipariş ettiğimiz pastanın dışında kaplı beyaz çikolatanın tadından hoşlanmadım. Çok yapay bir tadı vardı. İstediğim diğer tatlı ise her zamanki gibi güzeldi.,9.0,9.0,5.0,1604200782
Vallahi yediğim en kötü baklavaydi tazeydi ama glikoz şurubu ile yapıldığı cok belli.,9.0,9.0,2.0,1604114382
Her zamanki gibi başarılı.,10.0,10.0,10.0,1604027982
Kıyması azdı yaa.,10.0,10.0,5.0,1603990236
Peynirli bükmeyi pek sevemedim tereyağı yok denecek kadar azdı ama gözlemeleri ve poğaçaları efsane.,6.0,6.0,7.0,1603990236
İyiydi.,10.0,10.0,10.0,1603990236
Sütlü tatlı söyledik. Sütle yapsalarmış iyiymiş güzel olurdu gibi geldi. Birde porsiyonları küçük söylerken dikkat edin.,8.0,6.0,1.0,1603990236
"Her şey sıcak ve tazeydi, bu gidişle her sabah sosisli poğaça sipariş verip kilo alacağım :)) ellerize sağlık.",10.0,10.0,10.0,1603990236
1 porsiyon patates kızartması söyledim 12 tl ye satıyorsunuz ve gönderdiğiniz patates o kadar az ki 12 tl yi haketmiyor. Bence ya fiyatı düşürün ya da ürünün gramajını yükseltin. Tostçular tostun yanına tadımlık patates koyuyorlar ondan biraz daha fazla koymuşsunuz. Bence bununla ilgilenin.,8.0,6.0,6.0,1603990236
Boyozu nırmalde çok beğeniyoruz ama ısıtmadan getirilseydi daha iyi olurdu. Çünkü ısıtınca hamur gibi olmuş yine dr iyiydi bir de eve yakın olmasına rağmen geç geldi.,6.0,10.0,8.0,1603990236
İyidi.,10.0,10.0,10.0,1603990236
"Gayet hızlılar, gözlemeler genelde baya iyi, lakin bazı ürünlerde ciddi sıkıntılar var bomba bomba değil asla, domatesli kaşarlı poğaçada domates yok fakat sosislisi çok iyi mesela. Bildiğiniz ürünleri tercih edin derim.",10.0,7.0,7.0,1603990236
Şimdiye kadar gördüğüm en hızlı ulaşan siparişlerimi buradan aldım. Lezzet açısından da tatmin edici. Tavsiye ederim.,10.0,8.0,8.0,1603990236
Güzeldiii patatesli börek haricinde.,10.0,10.0,10.0,1603990236
Ekler ortalama lezzette.,10.0,10.0,6.0,1603990236
Peynirli börek isteseydim olsam onu seçebilirdim. Elinizdeki ürünleri yollayıp insanları mağdur etmeyin. Telafi etmek sizin için alışkanlığa dönüşmüş.,8.0,1.0,5.0,1603990236
Çok güzeldi özellikle izmir bombası(-).,10.0,10.0,10.0,1603990236
"Tekrar 12, 5 yapın bence sipariş fiyatını.",10.0,10.0,10.0,1603990236
Gül böreği yerine iki tane rulo böreğimsi bir börek gelmiş benim için sorun değil tadı da güzeldi zaten. Fakat önceden bilgilendirilse daha iyi de olabilir. Boyozda baya sıkıntı var bir gözden geçirin derim. Sosisli poğaçalarınız baya iyi ve eşsiz. Çikolatalı açma da gayet lezzetli. Hızlı geldi.,10.0,8.0,10.0,1603990236
Adamsınız.,10.0,10.0,10.0,1603990236
"Poğaçalar yine leziz, porsiyonlar yeterli, kurye abimde çok iyi. Ama o karamelli pasta iki gündür bitirdi midemi.",10.0,10.0,6.0,1603990236
Herşey çok güzel de bu sefer simidi beğenmedim ben hamurdan mı nedir anlamadım bi ekşilik vardı.,10.0,10.0,9.0,1603990236
Pasta çok taze ve lezzetliydi. Söylenen süreden daha önce geldi. Teşekkürler.,10.0,10.0,10.0,1603990236
Notlara ozen gösteriyorlar. Acil cikmam lazim hizli bir kahvaltiya ihtiyacim var dedim aninda geldiler tam bir kurtarici.,10.0,10.0,8.0,1603990236
Bir insan poğaçadan ne bekliyorsa hepsi vardı.,10.0,10.0,10.0,1603990236
Patatesli börek daha iyi olabilirdi.,10.0,9.0,6.0,1603990236
Pasta bayattı.,1.0,1.0,1.0,1603990236
"Kola yanlış geldi, açma yerine poğaça gönderildi.",8.0,2.0,2.0,1603990236
Yediğim en kötü baklavalardan birisiydi. Baklava degil baska bir tatliydi sanki.,10.0,8.0,2.0,1603990237
Sarma baklavanızı beğenmedim şerbetinde resmen su tadı aldım böyle bsy beklemiyordum.,6.0,7.0,2.0,1603990237
Teşekkürler.,8.0,8.0,7.0,1603990237
Gayet iyi.,10.0,8.0,9.0,1603990237
Tek sorunum nota dikkat etmemeniz bombalar sıcak olsun demistim soguk geldi.,9.0,5.0,9.0,1603990237
"Çok taze pasta, kibar kurye. Teşekkürler.",10.0,10.0,10.0,1603990237
5dakika da gelen tazecik yaş pasta için teşekkürler.,10.0,10.0,10.0,1603990237
Usta sadece pastanın dış kaplamasinin tadını beğenmedikpasta çok tazeydi istediğimiz gibi.,10.0,8.0,8.0,1601360491
O çikolatalı açma yokmu ya beni delii etti başta ustamın ellerini sağlık sonrada sizlerin ellerine sağlık.,10.0,10.0,10.0,1601360491
"Trilece tabanı kuruydu, pek beğenmedim.",10.0,10.0,7.0,1601360491
"Siparişler güzel olduğu gibi notta ihtiyacim olduğu için bir tane yara bandı istemiştim, iki tane göndermisler. Daimi bir müşteri kazandınız. Hayırlı işler :).",10.0,10.0,10.0,1601360491
Hizli geldi kurye börekler oldukça sıcak ve kıymalı çatal boregine bayıldım bol kıymalı yapmışlar elinize sağlık.,10.0,10.0,10.0,1601360491
Hızlı ve sıcak servisiniz için çoook teşekkür ederiz bol bereketli işleriniz olsun inşallah.,10.0,10.0,10.0,1601360491
Poğaçaları pamuk gibi ve tazecik ellerinize sağlık :).,9.0,10.0,10.0,1601360491
Beğendim. Ürünler güzel. Mide yakmıyor.,10.0,10.0,10.0,1601360491
Valla çok hızlı geldi ben bile anlamadım.,10.0,10.0,10.0,1601360491
İyiydi.,10.0,10.0,10.0,1601360491
Poğaçaları çok taze ve lezzetliydi. Keşke her saat açık olsanız.,9.0,10.0,10.0,1601360491
55 dakikada gelmesi dışında sorun yok.,5.0,10.0,10.0,1601360491
İyiydi.,10.0,10.0,10.0,1601360491
Çok güzel di ellerinize emeğinize sağlık.,10.0,10.0,10.0,1601360491
"Bir değişiklik var gibi, zaten hızlıydılar ama poğaçalar falan bayağı iyi pişmiş ve lezzetli geldi. Minimum tutar artmış biraz, o üzdü.",10.0,10.0,10.0,1601360491
Abi süpersiniz.,10.0,10.0,10.0,1601360491
Güzeldi.,10.0,10.0,10.0,1601360491
Böreği ısıtsaydınız daha iyi olabilirdi. :).,10.0,10.0,9.0,1601360491
Çok iyiydi.,10.0,10.0,10.0,1601360491
"Çok sevdiğim bir fırındır kendileri, geceleri de taze simit çıkarsanız efsane olur ya.",10.0,10.0,10.0,1601360491
Patatesler yol demcek kadar az be tatsızdı boyoz da aşırı yağlı yapılmış.,10.0,7.0,5.0,1598730745
Siparişim yanlış geldi.,1.0,1.0,1.0,1598730745
Guzeldi.,10.0,10.0,10.0,1598730745
"Kıymalı börek sanki bozulmuş gibiydi, tadı ekşidiydi. Bir daha soylemem.",7.0,2.0,2.0,1598730745
Müko.,10.0,10.0,10.0,1598730745
Yeni sahibine hayırlı olsun hızlı ve tatlı.,10.0,10.0,10.0,1598730745
Bir daha asla! Uzun uzun yazmak isterdim sinirleniyorum o yüzden susuyorum. Olumsuz yorumların fazlası var eksiği yok. Peki telafi edilemez miydi? Şöyle söyleyeyim hazırlayan görme engelli değilse bilerek bayat gönderilmiş siparişin telafisi olmaz bu resmen ayıptı ürün çöpte! Kurye servis lezzet 0.,1.0,1.0,1.0,1598730745
Güzel.,10.0,10.0,10.0,1598730745
Pizza bozuktu...,10.0,10.0,1.0,1598730745
Çok teşekkür ederim çok lezzetliydi.,10.0,10.0,10.0,1598730745
Her zaman ki gibi sıcacık ürünler geçen siparişteki yoğunluğunuzdan dolayı küçük yanlışlığı telafi etriğiniz için de.,10.0,10.0,10.0,1598730745
Hem bayat hem yavas soguk sandivic istedik 5 dklik mesafeden 30 dk da geldi 6 adet zeytinede 2tl odemek de ne bileyim.,3.0,2.0,1.0,1598730745
3/4 karışık 2 tane tost söylemiştim sabah. Yarım tost ve patatesli börek geldi. Kurye gitmişti o yüzden bir şey yapamadım. Keske daha dikkatli olunsaydı 35 tly yarım tost ve börek yemiş olduk.,10.0,1.0,7.0,1598730745
Kötü idi.,1.0,1.0,1.0,1598730745
"4 poğaça söyledim, 3 tane gelmişpatatesli poğaça poşetsiz gelmiş ve çok tuzlu olmuş.",10.0,1.0,2.0,1598730745
Guzel gayet begendim.,10.0,10.0,10.0,1598730745
Güzel.,10.0,10.0,10.0,1598730745
Güzel.,10.0,10.0,10.0,1598730745
"Hayatımda yediğim en kötü bülbül yuvası ve dondurma, tatlı bildiğiniz şebetli hamur, dondurma ise ne olduğunu anlayamadım.",7.0,7.0,1.0,1598730745
"Kaşarın tadı bi garip, simiti yine beğenmedim, bayattı ama poğaçalar güzel.",8.0,8.0,8.0,1598730745
"Simitleriniz daha iyiydi önceleri, çıtır ve lezzetli değiller :(.",10.0,8.0,7.0,1598730745
Güzeldi.,10.0,10.0,10.0,1598730745
İyi ki sizi tercih etmişim teşekkür ederim.,10.0,10.0,10.0,1598730745
Poğaçalar kokuyor.,1.0,1.0,1.0,1598730745
Güzeldi.,9.0,8.0,8.0,1598730745
İş yeri sahibi değişmiş on numara olmuş hayırlı olsun ustam.,10.0,10.0,10.0,1598730745
Ellerinize sağlık çok güzeldi herşey.,10.0,10.0,10.0,1598730746
Güzel.,10.0,10.0,10.0,1596101000
Bir cok ürününü denrdim hepsi birbirinden lezzetlidir cok tesekkurler.,10.0,10.0,10.0,1596101000
Güzeldi.,10.0,10.0,10.0,1596101000
Severek yiyoruz ama simitler daha çıtır olabilir.,9.0,8.0,8.0,1596101000
Bombalar çok soğuk geldi çok köyüydü.,7.0,5.0,1.0,1596101000
"Geçen aylardaki gibi lezzetli gelmedi bana poğaçalarınız, simitleriniz ve özellikle patatesli poğaça çok daha güzeldi.",10.0,9.0,6.0,1596101000
İyi.,10.0,10.0,10.0,1596101000
Güzeldi.,10.0,10.0,10.0,1596101000
Herzaman ki gibi mükemmelsebiliyorsunuz.,10.0,10.0,10.0,1596101000
Muhteşemdi bayıldımm gece sıcacık poğaçalar ve taze pastanız.. Hayırlı işler diliyorum.,10.0,10.0,10.0,1596101000
 hizmet sektöründe mütevazi ve düzgün bir firma işletme sahibinden kurye arkadaşa kadar tüm çalışanlarına teşekkür ediyorum.,10.0,10.0,10.0,1596101000
Güzeldi.,10.0,10.0,10.0,1596101000
Hayırlı işler kolay gelsin dungece sparis verdim 23. 30 du guzeldi ayrica soylemeliyim kurye abi guler yüzlü böyle kurye bulmak su anda bakiyorum cok zor sanlisiniz abiye ayrica teşekkür ederim.,10.0,10.0,9.0,1596101000
Sarma baklavayı ya siz yanlış biliyorsunuz ya da ben :).,10.0,9.0,6.0,1596101000
Sütlacın pirinçleri biraz azdı. Kıvamı da biraz suluydu. Lezzeti güzeldi.,9.0,10.0,8.0,1596101000
"Domates ve salatalık dünden kalmış, domates bozuktu.",9.0,9.0,7.0,1596101000
Çok lezzetli tazeydi çabucak geldi kurye güler yüzlüydü teşekkür fatih ünlü mamulleri.,10.0,10.0,10.0,1596101000
Ellerinize sağlık çok güzeldi.,10.0,10.0,10.0,1596101000
3 tane üçgen peynir söylememize rağmen 2 tane geldi. Onun dışında ürünleri güzeldi fakat çikolatalı açmaya resmen çikolatayı koklatmışlar.,10.0,8.0,6.0,1596101000
Harika.,10.0,10.0,10.0,1596101000
Son dakikaya kadar gelmesini bekledik son dakika getirdiler.,1.0,1.0,1.0,1596101000
Online yardıma çıktıklarını söyleyip 20 dakika sonra beni arayıp istediklerimizden kalmadığını söylediler daha sonra açlıktan ne varsa onları getirmelerini söyledik ve 1 saati aşkın sürede getirdiler rezalet.,1.0,1.0,1.0,1596101000
Antep fıstıklı 500 gr baklava söyledik cevizli geldi diğer verdiğimizi ürünler gayet güzeldi ama o hata üzdü fiyat farkına baya var hani.,8.0,7.0,7.0,1593471254
20 dk da gelmesi gereken sipariş 2. 30 saatte geldi. Berbat ötesi bi işletme anlayışları var.,1.0,1.0,1.0,1593471254
Güzeldi.,8.0,8.0,8.0,1593471254
Aldığınız para ile yolladığınız patates miktarı çok az bilerek yapılmış gibi kocaman kutuya 100 gram patates konmuş.,10.0,5.0,5.0,1593471254
Güzel.,10.0,10.0,10.0,1593471254
Öncelikle ürünler çok güzel ve lezzetliydi fakat bende bu sektörde yönetici pozisyonunda çalışan biri olarak sizden ricam siparişi 80 dakika da teslim etmemeye çalışın. Kahvaltıya söyledim ama bir an akşam yemeğine anca yetişecek sandım.,1.0,7.0,10.0,1593471254
"1 saatte geldi, sıcaktı fakat lezzet ve hız zayıf.",1.0,1.0,3.0,1593471255
59 dk da geldi.,5.0,8.0,8.0,1593471255
Kokerççi osman ve akçeşme kokoreç dahil yediğim en güzel kokoreçti bugünde söylicektim ama kaldırdınız heralde.,10.0,10.0,10.0,1593471255
Köftesi 10 numara.,10.0,10.0,10.0,1593471255
Sucuklu yumurta az daha iyi pisebilir di.,8.0,8.0,8.0,1593471255
Güzel.,10.0,10.0,10.0,1593471255
Güzel.,10.0,10.0,10.0,1593471255
Yaşanılabilinecek en kötü deneyimdi 1 saati geçkin bir bekleme süresi nin ardından paketçinin seni ukela bir şekilde araması da extrası..,1.0,1.0,1.0,1593471255
Fevkalade.,10.0,10.0,10.0,1593471255
Verdiğim sipariş eksik geldi ve parasında aldınız.,1.0,1.0,1.0,1593471255
Bir tost söyledik ne yağı var ne tuzu hem 1 saatte geldi buz gibi hemde yarım ekmeğe 12 lira para verdik yazık başka bişey demiyorum. Rezalet.,1.0,1.0,3.0,1593471255
Her zaman ki gibi rezalet.,1.0,1.0,1.0,1593471255
Tebrikler başarılı fiyat kısmı hariç:).,10.0,10.0,10.0,1593471255
Çok iyi.,10.0,9.0,10.0,1593471255
Asla vazgeçemediğim sade açması bile mükemmel olan yer:).,10.0,10.0,10.0,1593471255
Aramamla gelmesi bir oldu.,10.0,10.0,10.0,1593471255
Hızlı.,9.0,8.0,8.0,1593471255
"Oldukça hızlı teslimat yapıldı ve sipariş notu dikkate alınmış, teşekkür ederim.",10.0,10.0,10.0,1593471255
Ürünler sanki dünden kalmış da ısıtıp getirmişler gibiydi beğenmedim.,8.0,8.0,6.0,1593471255
Kalite.,9.0,8.0,8.0,1593471255
Cok hizlisiniz. Kurye arkadas cok iyi. Ürünlerim icine biraz daha malzeme lutfen. İyi calismalar.,9.0,8.0,5.0,1593471255
Güzel.,10.0,9.0,10.0,1593471255
Güzel.,10.0,10.0,10.0,1593471255
İzmir bombalar biraz mide yaktı haberiniz olsun.,10.0,9.0,6.0,1593471255
Herşey çok güzeldi. Ellerinize sağlık.,9.0,9.0,9.0,1593471255
Gelen arkadaşlar köpekten korkmasa daha iyi :).,10.0,10.0,10.0,1593471255
Bulbul yuvasini da dondurmayi da cok begendim. Tavsiye ederim.,10.0,10.0,10.0,1593471255
Eksi.,1.0,1.0,1.0,1593471255
Güzel.,8.0,8.0,8.0,1593471255
"Her zaman en iyisi, teşekkürler.",10.0,10.0,10.0,1593471255
Burayı ve hizmetini seviyorum.,10.0,10.0,10.0,1593471255
Pastalar çok lezzetliydi. Çok teşekkürler.,10.0,10.0,10.0,1590841509
Güzeldi.,10.0,9.0,10.0,1590841509
"Kıymalı çatal böreğini adet değilde porsiyon şeklinde yapsanız keşke 1, buçuk yetecek ama 2 fazla gelecek.",10.0,10.0,10.0,1590841509
Güzeldi.,10.0,10.0,10.0,1590841509
Buz gibi tadı tuzu yok.,8.0,1.0,1.0,1590841509
Güzel.,10.0,10.0,10.0,1590841509
Güzeldi.,8.0,8.0,8.0,1590841509
On numara.,9.0,9.0,9.0,1590841509
Güzeldi.,10.0,10.0,10.0,1590841509
