comment_text,comment_speed,comment_service,comment_taste,comment_time
Tombik döner lezzetliydi.,9.0,9.0,9.0,1606392963
Hiç bu kadar kötü tombik yememistim teşekürler.,2.0,2.0,1.0,1606133763
"10-10-10 cunku 20 dakikada geldi, tursuyla geldi, acayip lezzetliydi. Sosu biraz fazla koymaniz harika olmustu, lavaslar yumusacikti. Enfes!",10.0,10.0,10.0,1606133763
Tombik doner ve kofte harikaydi ama kavurmali pide icin ayni seyi soyleyemeyecegim. Pideyi keske kapali olarak belirtseniz menude. Kapali pide sevmiyorum oyle oldugunu bilseydim baska birsey siparis ederdim. Kavurmalarda pidenin icinde kurumustu. Onun haricinde hersey iyidi.,10.0,10.0,8.0,1605528963
Süperdi... Çok hızlı geldi ve çok sıcaktı.,10.0,10.0,10.0,1605442563
Hız servis lezzet hepsi süperdi teşekkür ederim.,10.0,10.0,10.0,1605442563
Tuğrul beye siparişimi hızlı özenli ve sıcak getirdiği için teşekkür ederim.,10.0,10.0,10.0,1605356163
Hız dışında herşey mükemmeldi.,6.0,10.0,10.0,1604492163
Sonunda izmit te hakiki bir iskender yedim elinize sağlık.. Kurye arkadaşa da teşekkürler.,10.0,10.0,10.0,1604319363
20-30 dk yazmasına rqğmen 1 saati geçti gelmesi buz gibi geldi çok pişman oldum.,1.0,1.0,1.0,1604319363
"Lezzeti çok güzeldi. Özellikle kuryenizin nezaketi bizi daha çok cezbetti, bebeğimiz olduğunu belirttik çok sessiz davrandı dış kapıyı bile çok yavaş kapattı. Önder arkadaşımıza çok teşekkür ederiz, böyle insanlarla çalısmanız bizi çok mutlu etti..",10.0,10.0,10.0,1604146563
Bekletmediler. Lezzetliydi de. Memnun kaldik tesekkurler.,9.0,9.0,9.0,1604108817
Et döner çok kezzetli fakat ekmeğin içi çok ıslaktı buharda ısıtılmış gibiydi ve içerisinde marul yazmasına rağmen yalnızca biber ve domates vardı.,8.0,7.0,6.0,1604108817
Cok lezzetliydi.,10.0,10.0,10.0,1604108817
Mükemmel ötesi bir lezzet ama öğrenciler için birazcık pahalı olabilir ).,10.0,10.0,10.0,1604108817
Bu kadarmi kötü ve ozensiz paketleme yapilir. Butun yag tasmis ve tum paket yag icinde. Birde pilav ustu ve iskender donerler yetmedide uzerine ince dilimlenmis et parcalarimi kondu. Olmaz bu sekilde. Dikkat edelim lutfen. Yakismadi sizin gibi köklu bir firmaya.,5.0,1.0,7.0,1604108817
"10 dakikada sıcacık servis eksiği olmadan geliyor, lezzete zaten diyecek yok.",10.0,10.0,10.0,1604108817
"Bağımlılık yapıyor, fiyatlar biraz yüksek.",9.0,8.0,10.0,1604108817
Pilav üstü et döner çok yağlı yapıldığı için yiyemedim.,10.0,10.0,1.0,1604108817
Bu kadar kötü iskender yapılmaz kokudan yiyemedim olduğu gibi çöpe attım saygısızlık yapmak istemem ama param resmen çöpe gitmiş olması bir yana aç kalmam bir yana.,3.0,1.0,1.0,1601479071
Teşekkür ederiz herşey mükemmeldi.,10.0,10.0,10.0,1601479071
İskenderin yanında yoğurt yoktu.,1.0,1.0,1.0,1601479071
Gerçekten çok lezzetli.,10.0,10.0,10.0,1601479071
Çok soğuk geldi ve döneri çok sertti.,5.0,5.0,5.0,1601479071
"İskenderin sıfır sos, sıfır yağ ve yoğurtsuz gelmesi dışında bir problem yok.",10.0,6.0,5.0,1601479071
Gerçekten çok lezzetliydi.,10.0,10.0,10.0,1601479071
Gerçekten beğendim elinize sağlık sosu biraz daha fazla koyabilirsiniz ama yinede afiyet yedim çok güzel olmuştu.,10.0,10.0,10.0,1601479071
Lezzetli.,10.0,10.0,10.0,1601479071
"Sağolun, varolun. Ustaya saygılar.",10.0,10.0,10.0,1598849326
Gayet lezzetli ve gayet hızlı geldi güler yüzünüz ve ilginiz için teşekkürler.,10.0,10.0,10.0,1598849326
Herşey 10 ama dürüm döner değil dönercik demek lazım yada büyünce dürüm döner olcak bilemeyiz yani gördüğğm en küçük dürüm döner pardon dürümcük.,10.0,10.0,10.0,1598849326
Sipariş sadece beyaz poşette geldi ve siparişim karşı komşuya teslim edildi. Lezzet çok iyi ama bu dediklerim servis konusunda zayıflık.,1.0,1.0,10.0,1598849326
Hızlı ve lezzetli.,10.0,10.0,10.0,1598849326
"Sizi tercih edenler bu yüksek fiyatı ödeyenler o mis gibi kuzunun ve tereyağın kombinasyonunu sevenler, millet ağır diyo yorum yapıyo tereyağını kesiyonuz sonra eski tat olmuyo.",9.0,9.0,5.0,1598849326
Biraz geç kaldı ama fazla degil. Sosu azdı. Hatta hiç yoktu sanki. Muhtemelen paket olduğu içindir. Diğer açılardan çok iyi.,9.0,9.0,7.0,1598849326
İyiydi.,10.0,10.0,10.0,1598849326
Döner ve köfte siparişi verdim su ve kola siparişi verdim kola soğuktu ve güzeldi döneri lezzetliydi köftesi dolgundu yani ekmeğin içinde kaybolan köfte değil dolgundu teşekkür ederim.,10.0,10.0,10.0,1598849326
1. Bursaya gelinde size bi pideli köfte öğretelim. Tam bir fiyasko2. Engelli bi insanı kuryenız asagı cagırdi yukarıya cıkmadı bu da tam bir saygısızlık onlıne ödedık diye mi bu rahatlık? Emek var eyvallah ama tövbe bır daha sipariş vermem asla da tavsıye etmıyorum.,1.0,1.0,1.0,1596219580
"Sağolsunlar, teşekkürler ederiz. İşiniz gücünüz daim olsun.",10.0,10.0,10.0,1596219580
Hızlı bir şekilde geldi tadıda güzel.,10.0,10.0,10.0,1596219580
"İnanılmaz kuyruk yağı kokusu ve damakta donma yaşadık. Sürekli söylediğimiz yer, hayal kırıklığına uğradık.",8.0,6.0,4.0,1596219580
"Eti güzeldi ancak çok yağlıydı, bitiremedim yazık oldu. Yağa boğmak yerine sosunu biraz daha koyarsanız pideler lezzetli ve ıslak olur zaten.",8.0,7.0,7.0,1596219580
Ev adresi yerine is adresimi yazmama ragmen arayip ilgilenip siparisimi en kisa zamanda getirdiniz ve hersey cok lezzetliydi. Kurye arkadasa ayrica tesekkur ederim. Elinize saglik.,10.0,10.0,10.0,1596219580
Tek kelimeyle sahane.,10.0,10.0,10.0,1593589834
Sadece dürümler sade olsun demiştim ekmeklerde sade geldi.. Bol turşu koymaları hoşuma gitti.. Lezzete diyecek bir şeyim yok her zaman çok lezzetli..,9.0,8.0,10.0,1593589834
Enfessssss.,10.0,10.0,10.0,1593589834
Teşekkür ederiz. Pilav üstü döneri sipariş olarak değil yerinde yemek lazım sanırız... İster istemez yolda gelirken pilav ile yağ değişik bir hal alıyor mecburen galiba.. Kokusuda hoş olmuyor... Sıcak ve hızlı geldi emeğinize sağlık. İskender dahil sos koymayı unutmamalısınız.. Teşekkürler..,10.0,10.0,5.0,1593589834
Tombik et döneri mutlaka deneyin.,9.0,10.0,10.0,1593589834
Güzell.,10.0,10.0,10.0,1593589834
Herşey harika ellerinize sağlık.,10.0,10.0,10.0,1593589834
İyi.,10.0,10.0,10.0,1593589834
Lezzetli.,8.0,8.0,8.0,1593589834
"Notlarımız dikkate alındığı için teşekkür ederiz. Siparişimizden memnun kaldık. Sadece 2 yemekte de salçalı sos yok kadar azdı. ( eminim düzeltilir. ) bunun haricinde hız, lezzet, servis süper her zamanki gibi. Herkese tavsiye eder yeni siparişlerde görüşmek üzere iyi çalışmalar dileriz :).",10.0,10.0,10.0,1593589834
Sayın ilgili son 1 haftadır siparişler özensiz ve çok aşırı sıvı yağlı geliyor. İnanın paketlerin dışına taşıyor heryer yağ oluyor. Dürüm dönerde uyarmama rağmen şıpır şıpır yağ problemi yaşadık. İskender söyledik az sos full sıvı yağ. Yoğunluğunuzla alakalı sanırım. Lütfen lezzette dengeye dikkat. !,10.0,1.0,5.0,1593589834
"Döner cok lezzetli ve cok hizli geliyor, bursalı olarak surekli siparis veriyorum.",10.0,10.0,10.0,1593589834
Lavasiniz biraz kuruydu ama tombik ekmeginiz ve döneriniz mukemmel gercekten fakat keske 1 saatte gelmeseydi.,4.0,8.0,9.0,1593589834
Çok hızlı geldi. Lezzetliydi.,10.0,10.0,10.0,1593589834
"Öncelikle kurye beye çok teşekkür ederim. Maalesef, restoran seçmiş olduğum iki adet kolayı yollamamış. Kurye bey siteden çıkmadan arayıp ulaştım. Sağolsun marketler kapalı olmasına rağmen kolaları buldu ve getirdi. Yemekler ılık. Biber seçmedim, biberli gelmiş. Ağzım yandı acıdan. Şaka mısınız?",10.0,5.0,1.0,1593589834
Harika.,10.0,10.0,10.0,1593589835
Lezzet hız servis gayet iyiydi. Paket servisine gelen arkadaş çok nazikti teşekkür ederim.,10.0,10.0,10.0,1593589835
Mukemmel yine.,10.0,10.0,10.0,1593589835
Lezzeti sıfırdı.,1.0,1.0,1.0,1590960089
Yeterince doyduk tadı anlatılmaz yaşanır vaktinde geldiği için de ayrıca teşekkür ediyorum...,10.0,10.0,10.0,1590960089
"Geldiğinde buz gibi olmuştu, etin tadını da beğenmedim.",7.0,7.0,7.0,1590960089
Tesekkurler.,9.0,9.0,9.0,1590960089
