comment_text,comment_speed,comment_service,comment_taste,comment_time
Değişmeyen lezzet yılların altınmaşası hayırlı işler.,10.0,10.0,10.0,1606689396
Sandviçleri yaparken bone kullanmaya özen gösterirseniz daha iyi olabilir...,10.0,5.0,9.0,1606602996
Tek kelimeyle mükemmel.,10.0,10.0,10.0,1606602996
Her zaman ki gibi lezzet servis hiz 10/10.,10.0,10.0,10.0,1606602996
Gayet iyidi.,8.0,10.0,9.0,1606430196
Çok lezzetli.,9.0,9.0,9.0,1606430196
Dolu dolu geliyor ama mezeler biraz daha lezzetli olabilir.,8.0,8.0,8.0,1606430196
Tek kelimeyle berbat. Hem geç geldi hem buz gibi geldi peynirler erimemişti çedar olduğu gibi duruyodu. Soğuk az kalır gerçekten gelen sandviçleri anlatmaya. Spor olsun diye yürüyerek getirseler bu kadar geç gelmezdi. İlk defa verdiğim sipariş son oldu bir daha kesinlikle sipariş vermem!,1.0,1.0,1.0,1606343796
Civardan yediğim en iyi kumpir. Yalnız mezelere bide süryani ekleseniz şahane olur bence.,9.0,10.0,10.0,1606343796
İyi.,9.0,9.0,9.0,1606343796
Patatesler bayat gibiydi ama yemekler güzeldi. Elinize sağlık.,9.0,10.0,10.0,1606343796
Hamburger ekmeği şok soğuktu.,2.0,8.0,5.0,1606343796
Eski halinize geri dönün lütfen.,10.0,8.0,5.0,1606343796
Ürün soğuktu kurye arkadaşa sordum hatta abi yeni çıktı direk getirdim dedi ama yine de soğuktu bence ürünü alüminyum folyoya da sarın direk kağıda sarıp paket yapmayın iyi çalışmalar.,8.0,8.0,5.0,1606257396
Buz gibi geldi.,8.0,1.0,8.0,1606257396
"Karışık sandviç menü ısmarladım, ekmeği oldukça bayattı ve içinde sosis dışındaki diğer malzemeler yok gibiydi.. Mecburen sipariş tutarın�� tamamlamak için rus salatası ekledim kaşık konmamıştı yiyemedim... Maalesef eski altınmaşa nın yerinde yeler esiyor... Üzüldüm..",7.0,7.0,4.0,1606257396
Aksini isterseniz iddia edebilirsiniz ama 10 yıldır sizden sipariş veren birisi olarak bu sefer karışığın içerisinde neredeyse yarı yarı düşüş vardı ve kuru geldi tek seferlik olduğunu düşünüyorum iyi çalışmalar.,9.0,9.0,7.0,1606170996
Soğuktu ek ücret ödenen turşu biberler yollanmamıştı.,5.0,7.0,2.0,1606170996
Güzeldi.,10.0,9.0,9.0,1606170996
"Beni üzmeyin arkadaşlar bagimlinizim fakat beni bekletmeyin, sandviç imi sogutmayin bu sefer tat alamadım çok soğuktu ve bu beni üzdü.",3.0,8.0,8.0,1606170996
Uçakla gelse bu kadar hızlı gelemezdi. Çok ciddiyim. Paket servise bu kadar önem vermeniz çok iyi. Kurye arkadaşada selamlar.,10.0,10.0,10.0,1606084596
Kumru istedim hamburger ekmeği geldi. Kumpir ve gönderdikleri sandiviçin tadı çok kötüydü değmez.,8.0,8.0,1.0,1606084596
Lezzetliydi ancak tost çok soğuk geldi.,7.0,7.0,9.0,1606084596
"Son zamanlarda notlara dikkat edilmiyor onun dışında hız ve lezzet gayet iyi, notları dikkate alırsanız sevinirim.",10.0,3.0,9.0,1605998196
Mesafe uzun olmasına rağmen erken geldi ve kurye arkadaş çok samimiydi böyle kuryelere karşılaşmak güzel.,10.0,10.0,10.0,1605998196
Muhteşeem.,10.0,10.0,10.0,1605998196
"Verdiğimiz sipariş 2x28 tl 56 tl, kullanılan sosisin maliyetini düşünmek dahi istemem. Tanesi 10 kuruş olan ketçabın sipariş anında hesabı yapılıyor. Kaldı ki 2 mayonez 1 ketçap göndermişsiniz. Colorado! Marka :)).",9.0,1.0,3.0,1605911796
Kumpirin tadı güzeldi porsiyon da gayet büyük.,9.0,10.0,9.0,1605911796
Burgerin ekmeği soğuktu.,8.0,7.0,2.0,1605911796
Herzamaki gibi altınmaşa kalitesi.,10.0,10.0,10.0,1605911797
Karışıkta indirim yapınız. Getiren kurye arkadaşa zam yapınız. İkisini de aynı anda yapamıyorsanız öncelikle kurye arkadaşa zam yapınız.,10.0,10.0,10.0,1605911797
Buz gibi bir sandwich geldi.,6.0,6.0,5.0,1605825397
"Notlar dikkate alınmamış, soğuk geldi.",4.0,2.0,4.0,1605825397
Cok mu pişiriyosunuz sosisleri acaba bi bakın derim kupkuru olmasa da hafif kuruydu.,9.0,9.0,7.0,1605825397
Pandemi sayesinde sipariş alanını genişlettiler de bu lezzetten mahrum kalmadık. Bu adresleri yok saymayın minimum 50tl getiriyorsunuz zaten sipariş ağı devamlı böyle kalma dileğiyle..,10.0,10.0,10.0,1605825397
Sucuklar iyi pişmemişti.,10.0,10.0,8.0,1605738997
Her siparişte gittikçe daha güzel ve lezzetli geliyor. Müdavimi olduk. İlk siparişte bazlama ekmeği fazla yağlıydı. Sonra yağı azaldı en son marul ve domates eklenmesiyle harika olmuş. Ellerinize sağlık. Kavurmanın lezzeti de çok iyi güvenilir.,7.0,10.0,10.0,1605738997
Güzel.,10.0,10.0,10.0,1605652597
Kumpir biraz küçük ama güzel.,10.0,10.0,7.0,1605652597
Malzemesi baya boldu güzeldi tatları. Servis ve kargo hızı iyiydi. Ama tek kötü yanı soğuk geldi malesef.,9.0,9.0,9.0,1605652597
Güzel.,10.0,10.0,10.0,1605652597
"Kumpirin içinden sanırım konserve açarken ufak bir teneke parçası çıktı, allahtan dilimi kesmeden fark ettim, telefon açtım ama bakan olmadı.",9.0,8.0,8.0,1605652597
Sucuklar pişmemiş ve ekmek bayattı. Çok şaşırdık. Altınmaşayı çok severiz daha önce hiç böyle bir şey yaşamamıştık ama bu sefer üzdü.,10.0,10.0,3.0,1605652597
Sırf eskinin hatrına bu puan. Ama malesef buz gibi geldi.,10.0,10.0,10.0,1605652597
Sipariş hem geç hem soğuk hem de eksik geldi. 3 kumpir istedik 2 tane geldi ve kurye iptal ettirin isterseniz dedi. Bir daha sipariş vermeyi asla düşünmem.,4.0,1.0,6.0,1605652597
Biraz gramaj ufalmiş karışıkta. Eskiden zor yerdik simdi bitirebiliyoruz lezzetini seviyorum ben diğer karışıkçılara göre. Gayet de hızlı geldi.,9.0,9.0,9.0,1605652597
Harika.,10.0,10.0,10.0,1605652597
Kullandıkları sucuk kaliteli ama sosis ve salam için pek aynı şeyi söyleyemeyeceğim. Kaliteli mekan.,8.0,8.0,9.0,1605652597
Kumpir çok başarılı sizin üstünüze yokk.,10.0,10.0,10.0,1605566197
Kumpir ve frambuazlı chesecake siparişi verdim aradılar frambuazlı ellerinde olmadığını söylediler süre 20-30 dk olmasına rağmen 1 saate yakın sürede geldi kumpir buz gibi ve komple kağıda yapışmış bi şekilde geldi frambuazlı yerine gönderdikleri oreolu donuktu bıçakla bile kesmedik...,1.0,1.0,2.0,1605566197
Mükemmel.,10.0,10.0,10.0,1605566197
Her zamanki gibi kumpiri efsaneeee.,10.0,10.0,10.0,1605566197
Kaliteli hizmet ve ürünleriniz için teşekkürler.,9.0,9.0,9.0,1605566197
Kaşarı çok azalttınız eskisi gibi değil.,9.0,8.0,7.0,1605566197
Porsiyon kucuk ama lezzetli.,9.0,7.0,9.0,1605566197
"Bir saatten uzun sürdü gelmesi, soğuk, kuru, tatsız.",1.0,1.0,1.0,1605566197
Güzel.,7.0,9.0,9.0,1605566197
"Yan apartmanlarında oturmama rağmen siparişim 30 dakikayı geçkin geldi. Sadece sucuklu istemiştim, kaşarlı sucuklu geldi. Aradığımda kendi siparişlerinin yoğunluğundan, gecikme yaşandığını söyledilerdemek ki yemeksepeti müşterileri müşteri değil!",5.0,6.0,8.0,1605479797
Güzel.,9.0,9.0,9.0,1605479797
Bu sefer yavaş geldi ve pek sıcak değildi.,6.0,7.0,7.0,1605479797
Eğer gereçekten yemek istiyorsanız buradan güvenli bir şekilde sipariş edebilirsiniz ben gece 1 de bile sipariş verdim ellerinize sağlık :).,9.0,10.0,10.0,1605479797
Paketçi abinin kusuru yok. Dükkanda paketleme yapanlar yanlış ürünleri koymuşlar bu yüzden gecikmiş. Malesef beklediğimiz özeni bulamadık. Saygılar.,7.0,1.0,5.0,1605479797
Yemek tam 1 saat sonra geldi.,3.0,10.0,10.0,1605479797
Hızlı lezzetli.,10.0,10.0,10.0,1605479797
Biraz daha hızlı olabilir.,10.0,8.0,10.0,1605479797
İi.,8.0,8.0,8.0,1605479797
Her zamanki gibi efsane...,10.0,10.0,10.0,1605393397
"Buradan herzaman sipariş veririm fakat bu defa siparişe dikkat edilmemiş. Ekstra ücret verip ekstra turşu istedim, gönderilmemiş. Sandviçte cheddar, kaşar eritilmemişti.",7.0,5.0,7.0,1605393397
Güzel.,10.0,10.0,10.0,1605393397
Tam olarak 55 dakikada geldi. Geç gelmesi çok mühim değil ama buz gibi geldi arkadaş ekmek bayatlıktan mı öyle yoksa soğuktan mı dişlerim kesmedi anlamadım uzun zamandır dışarıdan bir şey yemiyordum neden yemediğimi şimdi hatırladım.,1.0,5.0,1.0,1605306997
Süper.,10.0,10.0,10.0,1605306997
Soğuk geldi ama iyiydi.,10.0,8.0,10.0,1605306997
"Her türden mezesi efsanedir, tartışmasız :).",10.0,10.0,10.0,1605220597
10/10.,10.0,10.0,10.0,1605134197
Kumpiri soğuk yapmayı becerebilen nadir yerlerden :).,9.0,9.0,4.0,1605134197
1 saat 10 dakika içinde geldi ve buz gibi.,1.0,7.0,3.0,1605134197
Yemeğin güzelliğine laf etmiyorum o 10/10 ama lezzeti malesef kötüydü çünkü soğuktu ve ayrıca notuma dikkat etmemişler ve kurye abi de 10 tl para üstü bile veremediği için puanım bu yönde...,10.0,1.0,7.0,1605134197
Aşırı kuruydu ve ekmeği taze değildi.,9.0,6.0,5.0,1605134197
Gece saatlerinde kumpir söyledik o saatte yoğunluk nasıl oluyor anlamadım ama 1 saat sonra soğuk bir şekilde geldi. Yavan bir patates tadı geliyordu neredeyse hiç kaşar peyniri atılmamış. Başka bir yer olsa anlarım ama altınmaşadan beklentim bu değildi.,1.0,8.0,5.0,1605134197
Eskiye nazaran düzelme var. Hatalardan ders çıkarıldığı ve yanlışlardan dönülmesi güzel iştir. Böyle devam edin.,9.0,9.0,9.0,1605134197
Fiyat joker diye az koymuşlar.,10.0,1.0,9.0,1605134197
Lezzetsizdi.,10.0,10.0,5.0,1605047797
Kumpiri hızı servisi mükemmel.,10.0,10.0,10.0,1605047797
Yumurtalı söylediğimiz halde yumurtasiz gelmesine mi yoksa iki kola solrdigimiz halde tek adet gelmesi mi yoksa ayvalik tostunun takir takir olmasına mi... Gerçekten el mi değiştirdi bilmiyorum eskiden baya beğendiğim bir yerdi şimdi vasata bile tekabül etmiyor.,1.0,1.0,1.0,1604961397
Kaşarlı sucuklu tost geldiğinde soğuktu. İçinde sucuk malzemesi azdı. Onun dışında sorun yoktu.,9.0,10.0,7.0,1604961397
25 dakikada geldi içindeki et harikaydı yarısında tıkandım fiyatına göre mükemmeldi.,10.0,10.0,10.0,1604961397
Güzel.,6.0,9.0,10.0,1604961397
Çok iyi.,10.0,10.0,10.0,1604874997
Birde sıcak gelse süper olacak ellerinize sağlık.,10.0,10.0,10.0,1604874998
Efsane.,10.0,10.0,10.0,1604874998
Başarılı karışık tebrikler.,10.0,10.0,10.0,1604788598
Ayvalik tostunu ayvalikta yiyin burdan degil.,5.0,5.0,1.0,1604788598
İi.,10.0,10.0,10.0,1604788598
Patates konusunda çok sorun yaşıyoruz. Sanki sabah kızartılan patates ve bize gönderiliyor. Yenilince plastik yiyormuşum hissi alıyorum. Onun dışında memnunum.,9.0,9.0,8.0,1604788598
Geç geldi maalesef :( notları okuduğunuz için teşekkürler fakat geç bir saatte sipariş vermemden olsa gerek kumpir çok kötüydü :( yiyemedim attım...,7.0,10.0,3.0,1604702198
Biraz soğumuştu ama lezzetli.,7.0,7.0,9.0,1604702198
Güzelde diyemem kötüde diyemem orta.,10.0,10.0,6.0,1604615798
Eski kalitesine dönüyor gibi.,9.0,9.0,9.0,1604529398
"Keşke düşük fiyatlı olsa da her gün söylesek, deprem dolayısıyla halimi hatırımı soran kuryeye teşekkür ederim..",10.0,10.0,10.0,1604529398
Hız olarak pek memnun kalamadım ama altınmaşa hla altınmaşa. Güzeldi.,5.0,10.0,8.0,1604529398
Bozdunuz iyiki düzelmiş dedik malzeme az 1 saatte gelio.,5.0,5.0,5.0,1604529398
Kavurma cok kotuydu birdaha asla bu firmadan bisey yemem.,7.0,7.0,1.0,1604529398
Kesinlikle tavsiye etmiyorum.,1.0,1.0,1.0,1604442998
"Sucuklu, kaşarlı ce cheddarlı tostta cheddar yoktu. Lezzeti fena değildi.",6.0,7.0,5.0,1604442998
En son söylediğimde kumpirimin içinde mısır yoktu lütfen dikkat edin ve geç geliyor.,5.0,1.0,9.0,1604442998
Bozmayın lütfen karışık efsane.,10.0,10.0,10.0,1604442998
Her zamanki gibi güzeldi.,10.0,9.0,9.0,1604356598
Öncelikle depremden dolayi gecmis olsun herzamanki gibi lezzet harika.,10.0,10.0,10.0,1604270198
Süper.,10.0,10.0,10.0,1604183798
Herzmanki gibi mükemmel.,10.0,10.0,10.0,1604059652
Kumpirdeki italyan salatası biraz garipti onun dışında herzaman ki gibi iyiysi.,10.0,10.0,9.0,1604059652
Cızbızko.,10.0,10.0,10.0,1604059652
Ekstra sucuklu ve kaşarlılar ekstra değildi normal karışığa koyduğunuz kadar malzeme vardı 1 saat gibi sürede geldi ve soğuk geldi. Sanırım indirimli günler olduğu için eksik malzeme ve yavaş geldi.,7.0,6.0,8.0,1604059652
Efsane! Mutlaka tavsiye ederim. Şu ana kadar yediklerim hamburger değilmiş bunu anladım. Bir hamburgerin peyniri bile güzel olablir mi efsaneydi gerçekten. Lacasadeburger(tavsiyem) yedikten sonra başka bir yerde hamburger yiyip de memnun kalacağımı düşünmüyorum. Paketlemesi özenli ve kurye nazikti.,10.0,10.0,10.0,1604059652
Güzel.,10.0,10.0,10.0,1604059652
1 saate geldi bravo.,7.0,8.0,9.0,1604059652
Güzel.,10.0,10.0,10.0,1604059652
Cız bız ko.,10.0,10.0,10.0,1604059652
Çok geç geliyor.,1.0,1.0,1.0,1604059653
Gayet başarılı.,10.0,10.0,9.0,1604059653
Hız yavaştı biraz geçikti patates ler gelene kadar kurumuştu pek beğenmedim ve eksik geldi yemeğim.,5.0,4.0,3.0,1604059653
Daha fazla ketçap mayonez gönderilmeli.,10.0,8.0,9.0,1604059653
Hamburger daha guzel paketlenebilirdi ama gecenin bir yarisi amerikada okuyan bana yemek getirip ac birakmadilari icin tesekkurler.,9.0,7.0,8.0,1604059653
Patatesler soğuk geliyor bı kaç seferdir. Ve mutlaka bi eksik oluyor.. Şimdi ulassanz tamamladık hemen diyeceksiniz. Ama zaten yoğunum bide eksik kola için mi uğraşıym? Dikkat edin kardeşim ben neden eksik için uğraşıyorum..,10.0,3.0,5.0,1604059653
"Eski lezzetine dönmüş, yoğunluktan dolayı 1saate gelmiş olmasına rağmen sıcakcıktı, kurye arkadaşa teşekkürler.",10.0,10.0,10.0,1604059653
Aşırı soğuk gelmeseydi çok iyiydi.,5.0,8.0,8.0,1604059653
Hız çok iyiydi fakat kumpir oldukça tuzluydu kör olduk tuzdan.,9.0,3.0,7.0,1604059653
Rus salatasıda sipariş vermiştim unuttular sanırım canları sağolsun lezzet yine mükemmel.,10.0,8.0,10.0,1604059653
Karışık efsane bol bol ve lezzetli patatesler bol ve lezzetli sucuk kasap sucuğu hiz süper lütfen bozmayın çok özlemişiz.,10.0,10.0,10.0,1604059653
Bardak rica etmiştik paketin içine eklemişti. Altınmaşa tadını zaten anlatmıyorum.,9.0,10.0,10.0,1604059653
Para üstü eksik verildi.,8.0,7.0,7.0,1604059653
8 dakikada gelen en hızlı yemek oldu tek kelime ile mükemmel.,10.0,10.0,10.0,1604059653
Yılların vazgeçilmezi. Ama eskiden daha iyiydi.,10.0,10.0,10.0,1604059653
Tadı çok güzel fakat fizandan geliyor.,1.0,7.0,10.0,1604059653
Çok güzeldi her zamanki gibi boldu.,10.0,10.0,10.0,1604059653
Bugün iki farklı yerden sandvic siparis verdim ama sizin ürünlerin üzerine tanımam.,10.0,10.0,10.0,1604059653
"Cok iyiydi, tesekkurler.",10.0,10.0,9.0,1604059653
Kurye çok saygılıydı.,10.0,10.0,10.0,1604059653
Doyurucu.,10.0,10.0,10.0,1604059653
Fena degil yenir.,9.0,9.0,9.0,1604059653
Karışık eski bol ve lezzetli zamanına dönmüş şükürler olsun.,10.0,10.0,10.0,1604059653
Ellerinize sağlık.,10.0,9.0,10.0,1604059653
Herzamanki gibi on numara ellerinize saglık.,10.0,10.0,10.0,1604059653
Karışık sandviçin iç malzemesinin bir kısmı yanıktı :(patates kızartması güzeldi.,9.0,9.0,7.0,1604059653
Cızbızko.,10.0,10.0,10.0,1604059653
Memnun kalmadım.,6.0,5.0,4.0,1604059653
Kargocu arkadaşa çok teşükkür ederiz :).,10.0,10.0,10.0,1604059653
Yiyecekler geldiğinde buz gibiydi patatesler unutulmuştu sonradan getirildiğinde patateslerde buz gibiydi!,1.0,1.0,1.0,1604059654
Çok güzel.,10.0,10.0,10.0,1604059654
Gelen her şey soğuktu tatsızdı güzel olan tek şey ayvalık tostunun ekmeğiydi onun dışında berbat.,8.0,8.0,1.0,1604059654
61 dakikada gelen soğuk kömürde sandviç ve soğuk patatesin tadını merak ediyorsanız iyi seçim.,1.0,1.0,1.0,1604059654
Nefis.,10.0,10.0,10.0,1604059654
Sipariş çok geç geldi. Filtre kahve söyledim olmadığını slöylediler ve tatlı getirmeyi teklif ettiler. Güzel bir tatlı olur diye kabul ettim. Fakat dondurma göndermişler ve dondurmanın dış plastiği de kırık geldi içinde parçaları vardı. Daha profesiyonel çalışan bir yer sanmıştım. Üzücü gerçekten.,1.0,1.0,1.0,1604059654
Gece çok canım isteyerek sipariş verdim ancak çok kötüydü. Tadı tuzu yoktu. Ketçap mayonez istememe rağmen yoktu içinde neredeyse sosis dışında ürünler yoktu. 19 lira tatsız tutsuz karışık sandviç için çok fazla. Üzgünüm ama eski altınmaşa lezzeti kalmamış.,10.0,9.0,1.0,1604059654
Harikaydııı.,10.0,10.0,10.0,1604059654
Guzel kumru.,9.0,9.0,9.0,1604059654
İyi.,10.0,10.0,10.0,1604059654
Sandviç her zamanki gibi güzeldi fakat patates soğan halkaları bayat ve pörsümüş geldi direk attım.,8.0,10.0,8.0,1604059654
"Siparilim eksik geldi hemen telafi ettiler. Filtre kahve söyledim, filtre kahveleri olmadığı için pablodan kahve alıp telafi ettiler. Çok hoş hareket teşekkürler. Tost da oldukça lezzetliydi.",10.0,10.0,10.0,1604059654
Notu dikkate aldığınız için teşekkür ederiz.,10.0,10.0,10.0,1604059654
İcecekleri her defasinda ayni torbaya koymaya devam edin caydan daha sicak geliyor icecekler...,8.0,10.0,9.0,1604059654
Güzel ve lezetli.,10.0,10.0,10.0,1604059654
Güzeldi.,8.0,8.0,8.0,1604059654
Süperrr.,10.0,10.0,10.0,1604059654
Gerçekten hayatımda yediğim en kötüsüydü sosisleriniz o kadar rezalettiki 2 kaşık alıp bıraktım.,4.0,4.0,1.0,1604059654
Teşekkürler gayet iyidi.,10.0,10.0,10.0,1604059654
Karışıkın sucukları yakmayın zaten lezzetaiz sucuk.,9.0,9.0,9.0,1604059654
Sadece cok pahalı.. Onun dısında güzel.,9.0,9.0,9.0,1604059654
Altinmasa için kötü birsey yazamam ama bundan böyle sadece sandviç icin tercihim olacaktır. Burger konusunu burgercilere bırakalım.,8.0,8.0,8.0,1604059654
Başarılı.,9.0,9.0,9.0,1604059654
Bu yediğim kumpir en harika kumpirdi... Ellerinize sağlık.,10.0,10.0,10.0,1604059654
Teşekkürler.,7.0,10.0,10.0,1604059654
Hız desen var lezzet desen var.,10.0,10.0,10.0,1604059654
"Her zaman ki gibi, gayet iyi.",10.0,10.0,10.0,1604059654
Kaliteli gerçekten.,8.0,10.0,9.0,1604059654
Cızbızko.,10.0,10.0,10.0,1604059654
Fena sayılmaz.,8.0,7.0,8.0,1604059654
En sevdiğim yemek olan kumpirden soğudum garnitürler ve sosisler çiğ agırlaşmış ve ayrıca ekstra kaşar en üste konulmaz patatese ekstra eklenir. Şaka gibisiniz.,1.0,1.0,1.0,1604059654
"Paketleme, hız ve servis bayağı iyiydi. Tebrik ederim valla.",10.0,10.0,10.0,1604059654
Bir iyi bir kotu. 3 gun oncekiyle bu farkli.,10.0,10.0,5.0,1604059654
Maalesef... Kumpir hiç iyi değildi. Adeta pürenin içine malzeme basmış üstüne kaşar rendesi atmıştınız ama erimemişti. Ortaköyde kumpir yemesem kumpirden nefret edebilirdim. Lütfen kırılmayın. Gelişmeniz için eleştiriyorum.,9.0,9.0,4.0,1604059654
Çok güzeldi kumpir sipariş ettik ve uzak olmasına rağmen ışık hızıyla geldi çok lezzetliydi ve sıcaktı joker olmasına rağmen teşekkürler.,10.0,10.0,10.0,1604059654
Güzel.,10.0,10.0,10.0,1604059654
Sebebini onlar biliyor zaten.,1.0,1.0,1.0,1604059654
İyiler.,9.0,9.0,9.0,1604059654
Harika.,10.0,10.0,10.0,1604059654
Kumrunun ekmeğini beğenmedim. Sandviç ekmeği gibiydi. Ama iç malzemeniz çok kaliteli.,10.0,10.0,9.0,1604059655
"Kumru muazzam buyu, dogurucu, ekmek lezzetli, bombastikti. Fakat kumpir konusunda kumru kadar iddiali degil. İcinin malzemesi yine cok boldu, ama secenekler biraz kisitliydi.",10.0,10.0,8.0,1604059655
Vasat.,8.0,6.0,6.0,1604059655
Kumpirin içine koyulan malzemeler taze değildi değişik bir koku vardı.,9.0,8.0,5.0,1604059655
Duble kaşarlı karışık sipariş ettim normal karışık geldi ketçap istemediğimi belirttim yinede ketçaplı sipariş geldi muhtemelen karıştı lütfen bir daha olmasın.,1.0,1.0,10.0,1604059655
Haftada bir iki yemek söylediğim bir mekan ayvalık menü 1 alıyorum ama minimum paket tutarı artmış bu sebeple artık söyleyemiyeceğim hoşçakal altınmaşa.,10.0,10.0,10.0,1604059655
Soğan halkaları yanık geldi onun dışında güzeldi.,10.0,8.0,9.0,1604059655
Ekmek bayat geldi lezzetide hiç yoktu ne yediğimi anlamadım.,1.0,2.0,1.0,1604059655
Ekmekler soğuk ve sucuk azdı.,1.0,1.0,1.0,1604059655
Herzamanki gibi doyurucu altinmasa top 10 listemde.,10.0,10.0,10.0,1604059655
Eksik urun geldi.,1.0,1.0,1.0,1604059655
İstediğimiz sosların tarihi geçmişti bu dikkatsizlik görmezden gelinemez ayrıca patates kızartması aşırı yağlı ve yumuşak soğuktu soğan halkalarınıda adeta kızartmayı unutmuşcasına yumuşaktı.,9.0,1.0,1.0,1604059655
Kumpir enfesti.,10.0,10.0,10.0,1604059655
Güzeldi yedik.,10.0,10.0,10.0,1604059655
"Düşünceli kurye gece zili çalmadan aradı, notlara dikkat edildi, çok teşekkür ediyorum lezzete diyecek bir şey yok zaten.",10.0,10.0,10.0,1604059655
Eksta mantar eklemiştim içinde yoktu notları okumuyorlar kumpirler 1 saat te ve soğuk geldi telafi edileceğini belirten firma dan bilgim yok geri dönüşünü aldım bir daha sipariş vereceğimi sanmıyorum.,1.0,1.0,1.0,1604059655
"Basit bir tost o fiyata olunca insan bir farklılık bekliyor, ekmeğe makina dahi basılmamış, içinde zaten peynir dahil 3 ürün var biri eksik koyulmuş. Kısacası olmamış.",5.0,3.0,2.0,1604059655
Eski kalitesi olmasa da yeterince doyurucu.,8.0,8.0,7.0,1604059655
Nice.,10.0,10.0,10.0,1604059655
Bir daha gece asla siparş vermeyeceğim gün içinde kalan tüm sosisleri koymuştunuz yağı bile çekilmiş yani sosisin çok kötüydü boğazımızdan geçmedi.,1.0,1.0,1.0,1604059655
Fena değil.,9.0,7.0,6.0,1604059655
Kumpir sahaneydi tavsiye ederim.,10.0,10.0,10.0,1604059655
Kumpir de kumru da superdi.,10.0,10.0,9.0,1604059655
Patatesi biraz az sadece içindeki.,10.0,10.0,10.0,1604059655
Süper.,10.0,10.0,10.0,1604059655
Gecenin bir saati kumpir getirdğiniz icin teşekkürler :).,10.0,10.0,10.0,1604059655
Hızlı.,8.0,8.0,8.0,1604059655
Beğenmedim.,1.0,1.0,1.0,1604059655
Kurye siparişleri getirirken maske taktığı için ayrıca teşekkür ederim önceki siparişimde maalesef kurye maske takmıyordu. Ayrıca sipariş ettiğim dondurmalar erimeden geldi önemli olan buydu. Teşekkür ederim.,8.0,9.0,10.0,1604059655
Süper.,9.0,9.0,9.0,1604059655
Herşey iyi ama tatlının yanına kaşık koysanızda yeme şansımız olsa.,10.0,8.0,9.0,1604059655
2 tane duble patates söylemişiz 1 tane ketçap ya da mayonez koymamışsınız.,9.0,3.0,8.0,1604059655
Servis hızı ve lezzet çok iyiydi.,10.0,10.0,10.0,1604059655
Ben kavurma istedim kumru geldi. Jokerden dolayı böyle bir durumla karşılaştığımı düşünüyorum. Onun dışında lezzet ve hız mükemmeldi. Kumru da mükemmeldi ama ben kavurma istedim.,10.0,7.0,10.0,1604059655
Temassız teslimat istediğim siparişi poşetsiz bir şekilde yere koyan bir kuryeniz var böyle bir zihniyet olamaz.,1.0,1.0,1.0,1604059655
Gayet güzel temiz ve lezzetli ayrıca teslimat çok hızlı.,10.0,10.0,10.0,1604059655
Lezzet harika özellikle kumpirine bayılıyorum.,10.0,10.0,10.0,1604059655
Lezzet olarak başarılı ve bi okadarda anlayışlı bir isletme benim mağduriyetini giderdiler tesekurler.,10.0,10.0,10.0,1601429909
53 dakika da geldi. Soğuk ve içindeki malzemeler kurmuştu. Bir karisikta olmasi gereken kaşar ve turşu ozenle tek parca olarak konulmuş olmasi da ayri bir güzellikti.,1.0,1.0,3.0,1601429909
Güzel.,10.0,10.0,10.0,1601429909
Güzel.,10.0,10.0,10.0,1601429909
"Hızlı teslimat, güler yüzlü personel.",10.0,10.0,10.0,1601429909
"Karışık sandiviç söyledim. Buz gibiydi, ekmek desen kurumuş, bayattı sıfır tat aldım verdiğim paraya üzüldüm...",5.0,5.0,1.0,1601429909
Çok hızlılar lezzeti de gayet güzeldi teşekkür ederim bide şu mayonezleri heinz yapsanızzz.,10.0,10.0,10.0,1601429909
Buz göndermişler.,1.0,1.0,1.0,1601429909
Her siparişte daha da yenilenen lezzet!,10.0,10.0,8.0,1601429909
"Kumpirin patatesindeki kaşar ve tereyağ daha belirgin olursa daha iyi olabilir ve mezeleri biraz daha fazla koyabilirsiniz, onun haricinde kumpiri beğendim mezeler tazeydi, elinize sağlık.",9.0,10.0,9.0,1601429909
10/10 harkasınız.,10.0,10.0,10.0,1601429909
Son zamanlarda verdiğim siparişlerin arasında en beğendiğim diyebilirimhiçbir eksik yoktu teşekkürler.,10.0,10.0,10.0,1601429909
Süper.,10.0,10.0,10.0,1601429909
Biraz soğuk geldi ve porsiyon küçülmüş galiba.,8.0,8.0,8.0,1601429910
Havuç taratorun tadı degisikti malesef çope gitti.. Mezeleri daha taze servis ederseniz sevinirim. Bazlama menu guzeldi.,9.0,9.0,8.0,1601429910
1 kerede şu notları okusanız çok güzel olacak turşu yazmayan menüde içine turşu koyuyosunuz. Not yazıyoruz onuda umursamıyorsunuz. Yazık...,6.0,1.0,10.0,1601429910
Hız falan iyide eski altınmaşa değil.,10.0,10.0,6.0,1601429910
Hata yok bulamadım.,10.0,10.0,10.0,1601429910
Ayvalık tostu lezzetliydi. Sadece biraz daha tosta basılıp dışının çıtır olması gerek bence genel olarak süperdi tabi.,10.0,10.0,10.0,1601429910
Fiyat azıcık düşürülse keşke.,10.0,10.0,10.0,1601429910
Kumpir lezzetliydi mantar bayat gibiydi diğer mezeler tazeydi hızli geldi.,8.0,8.0,8.0,1601429910
Güvenle ısmarladıgım sayılı yerlerden birtanesi.,10.0,10.0,10.0,1601429910
Notları dikkate almıyorlar.,8.0,5.0,5.0,1601429910
Lezzetli.,10.0,10.0,10.0,1601429910
Kumpir güzeldi.,10.0,10.0,10.0,1601429910
Standart ve güzel lezzet. 7 senedir aynı kaliteden ne aşağı indiler ne yukarı çıktılar. Sipariş verirken neyin geleceğini bilmek gayet güzel. Teşekkürler.,10.0,10.0,9.0,1601429910
"Sürekli tercih ediyorum, elinize sağlık.",10.0,10.0,10.0,1601429910
"Kurye çok beyefendi birisiydi, hızlı ve sıcak geldi.",10.0,10.0,10.0,1601429910
"Lezzet olarak kusursuzdu, hiz olarak gayet iyiydi karisik gayet dolu ve malzemeleri cok kaliteliydi, fiyat olarak sonuna kadar hak ediyordu bu lezzet icin tesekkur ederim mukemmeldi.",10.0,10.0,10.0,1601429910
Bu bölgede yediğim en güzel karışık sandviç. Malzemeler çok kaliteli. Kız arkadaşıma kumpir söyledim harikaydı. 6 dakikada sipariş mi gelir? Geldi valla. Altinmasadan şaşmaya hiç gerek yok. Özellikle sucuk beni benden aldı. Çok güzeldi.,10.0,10.0,10.0,1601429910
