comment_text,comment_speed,comment_service,comment_taste,comment_time
"Künefenin içinde şerbet yoktu, servis berbat künefeyi poşetten çıkarana kadar ellerim şerbet oldu.",8.0,3.0,3.0,1606343698
Tavuk şiş porsiyon söyledim hem çok lezzetliydi hemde tavuklar iri taneliydi beğendim. Acı biberleri çok acıydı tam istediğim gibi. Tek tavsiyem yanına ince lavaş yerine kalın pide koysanız çok daha güzel olur bence. İnce lavaş harici herşey 10 numaraydı teşekkürler.,10.0,10.0,10.0,1606084498
Lavaşlar çok kızartılıyor kebaplar tuzlu çok pişmiş ve yağlı ette bi acayip pul biber iyi gibi lütfeen dikkat edin eskiden daha iyiydiniz.,8.0,7.0,4.0,1605998098
Lezzeti düşmüş.,10.0,10.0,7.0,1605998098
Notları dikkate almalısınız bir de etiniz değişmiş sanki sürekli sipariş veririm bu defa hiç memnun kalamadım...,10.0,7.0,8.0,1605998098
Hersey guzel galiba zam gelmis bu uzdu.,10.0,10.0,10.0,1605825298
Adananın güzel yorumlarına kanıpta sipariş vermeyin et değil sucuk yedim sanki içinde yediğim en kötü adanaydı sadece siparişi getiren abinin güler yüzü samimiyeti çok güzeldi..,10.0,2.0,1.0,1605825298
Enfes.,10.0,10.0,10.0,1605738898
Çok iyi.,10.0,10.0,10.0,1605738898
Ciğerler fazla pişmiş ve çok büyük doğranmış.,8.0,8.0,7.0,1605738898
"Gece geç sipariş vermeme rağmen siparişin gelmesi uzun sürdü ve hayatımda ilk defa kıpkırmızı bir adana yedim, acı sevmeme rağmen içinde abartı acı vardı ve rengi tamamen kırmızıydı.",4.0,3.0,3.0,1605738898
"Hem adana hem ciğer dürüm söyledik eti çok az domatesi ve yeşilliği boldu, eti hiç koymasaydın daha iyiydi ustam bildiğin dürüm arası çoban salatası yedik..",8.0,4.0,2.0,1605652498
"Her şey çok güzeldi paket hızı, lezzeti sunumu piyasanın en iyilerinden..",10.0,10.0,10.0,1605566098
Kuru ekmek gondermek ayippppp.,10.0,1.0,5.0,1605479698
Teşekkürler memnun kaldım.,10.0,10.0,10.0,1605479698
Gerçekten hayatımda böyle güzel ciğer yemedim diyebilirim bu bölge de sizin gibi kaliteli bi işletme olduğu için şanslıyız hayırlı işler.,10.0,10.0,10.0,1605393298
Doyurucu olduğu için süperdi sağolun.,10.0,10.0,10.0,1605393298
"Fiyatına göre gayet lezzetli, kurye arkadaşda çok iyi kaç kez sipariş verdim bi kez olsun geç gelmedi, sedece bi taşıma çantası kullanılırsa daha iyi olur çünkü motorla gelirken yemek biraz soğuyabiliyor.",10.0,10.0,10.0,1605393298
Hayatım da böyle güzel bi adana yemedim çok teşekkür ederim bozmadan devam edersiniz inşallah hayırlı işler.,10.0,10.0,10.0,1605306898
Adana efsaneydi ustanın eline sağlık gerçekten çok güzeldi lezetliydi böyle devam.,10.0,10.0,10.0,1605306898
Bu devirde gerçekten hakkını vererek yapan bir işletme her kuruşunuz helal.,10.0,10.0,10.0,1605306898
İyiydi.,9.0,9.0,9.0,1605306898
Hayatımda yediğim en kötü tavuk kanadıydı bildiğin kokuyodu.,1.0,1.0,1.0,1605220498
Aldığınız parayı sonuna kadar hak ediyorsunuz helali hoş olsun yanında gönderdiğiniz meze için bile sipariş verilir teşekkür ederim tekrardan gündoğdu mh. 2463 sk.,10.0,10.0,10.0,1605220498
Adananiz müthiş gerçekten kim yapıyorsa hangi ustaysa kaybetmeyin bu adanayı herkesin denemesi lazim ya anlatılmaz yaşanır.,10.0,10.0,10.0,1605220498
Kaliteli bir işletme...,10.0,10.0,10.0,1605220498
Sipariş zamanında geldi fakat lezzet olarak pek beğenmedim.,10.0,1.0,1.0,1605220498
Harikalar yaratıyorsunuz cansınız arıkan apt.,10.0,10.0,10.0,1605134098
Memnun değilim.,1.0,1.0,1.0,1605134098
Teşekkürler.,8.0,8.0,8.0,1605134098
12de sipariş veriliyor ve malesef tavukla ilgili siparis veriorım dükkanımda kalmamış mantıklı cevap.,1.0,1.0,1.0,1604961298
Elinize sağlık guzel.,10.0,10.0,10.0,1604961298
Tek kelimeyle mükemmel.,10.0,10.0,10.0,1604961298
Yapıyorsunuz bu adanayi.,10.0,10.0,10.0,1604874898
Buz gibi gelmeseydi gercekten cok lezzetliydi.,3.0,3.0,7.0,1604874898
Tavuk dürümler muazzamdı. Tavsiye ederim.,10.0,10.0,10.0,1604874898
Her zaman favorim. Kurye arkadaş çok samimi güleryüzlü. Tavuk şiş efsane ama favorim adana.,10.0,10.0,10.0,1604788498
Tuzluydu.,9.0,9.0,6.0,1604788498
Rezalet et karnımı agrıtı aç kalsam daha iyiydi.,1.0,1.0,1.0,1604788498
Tadı çok güzeldi.,8.0,7.0,10.0,1604788498
Muhteşem bir lezzet.,10.0,10.0,10.0,1604788498
Güzel.,10.0,10.0,10.0,1604788498
Kaç defa soğansız sipariş etmeme rağmen ısrarla soğansız gönderildi.,5.0,8.0,3.0,1604702098
Lşü.,10.0,10.0,10.0,1604702098
Güzeldi.,9.0,8.0,8.0,1604615698
Lezzetinden.,10.0,10.0,10.0,1604615698
Hızlı servis.,10.0,10.0,10.0,1604615698
Herzaman on numara.,10.0,10.0,10.0,1604529298
Servis bir puan cunku bir adana durumun icinde yarim porsiyon kofte var :))) surekli siparis verdigim yer tesaduf icini acip baktim bu son siparisim oldu ne yazikki.,10.0,1.0,10.0,1604529298
Hızlı servis.,10.0,10.0,10.0,1604442898
Kanatlar yanık geldi ilk defa ama sunum fiyat iyi umarım bir daha olmaz.,10.0,10.0,8.0,1604442898
Her zaman süper lezzetler yapan bir restaurant tavuk şiş mükemmeldi tam kıvamında.,10.0,10.0,10.0,1604442898
Birdaha sipariş vermek mi. ? Asla ama asla.,1.0,1.0,1.0,1604356498
Muhteşem bir lezzet lavaş baharatlıyorlar ve ısıtıyorlar çıtır bir lezzet etin baharatlar ile uyumu muhteşem hızlı ve çabuk geliyor birde kendilerine ait sipariş siteleri olsa çok daha iyi olur.,10.0,10.0,10.0,1604356498
 kuzu ciğer harikaa.,10.0,10.0,10.0,1604270098
Kuzu şiş güzeldi elinize sağlık.,10.0,10.0,10.0,1604270098
Hız lezzet her şey mükemmel.,10.0,10.0,10.0,1604183698
"Dayicim isyerine soyledik, ikramlar cok guzeldi de catal yoktu, hicbirinden faydalanamadik.",10.0,1.0,10.0,1604097298
Mezeler mükemmel.,8.0,10.0,8.0,1604097298
Notun dikkate alınması ve lezzet on numara beş yıldız.,10.0,10.0,10.0,1604097298
Adana soyledim urfa gibi acı geldi yapmayin böyle.,10.0,10.0,7.0,1604097299
İki tane tavuk şiş söyledim galiba tavuğu koymayı unutmuşlar.,5.0,6.0,1.0,1604097299
Ekip olarak hepsi iyi ve güler yüzlü.,10.0,10.0,10.0,1603973153
Harikalar harikası tesekkurler arıkan apt.,10.0,10.0,10.0,1603973153
Yav kaçdır söylüyoruz çok iyidi bu sefer tavuk şişler soslanmamış gibiydi ve bütün gün miğdemizi ağrıttı anlamadım normalde çok iyi restoran ama bu gün bi sıkıntı vardı sanırım.,10.0,10.0,8.0,1603973153
Dana istedim urfa yemiş kadar oldum soğanlar çok acıydı domateslerde çok büyüktü gene tsk ederim ac karmiz doydu.,10.0,10.0,5.0,1603973153
Duble dürüm söyledim içinde hiçbir malzeme yoktu ve dürüm hiç iyi sarılmamış lezette yoktu.,9.0,1.0,1.0,1603973153
Bu seferi durumler çiğ geldi diyebilirim.. Durumlerdrn kus basi olanlar etlerin ickeri nerdeyse kirmiziya cok yakındı.,6.0,3.0,1.0,1603973153
Beğeniyorum ama notumu dikkate almamaniz üzdü beni.,9.0,9.0,9.0,1603973153
Adana dürümün cok abartılacak bir yanı yok. Aşırı lezzetli diyemeyeceğim ama kötü de değildi. Eti kokmuyordu. Fena değil.,7.0,5.0,5.0,1603973153
Sogan ve domatesler çok kalın doğranmış oluyor herzaman usta gözünü sevim az ince doğra şunları.,8.0,8.0,5.0,1603973153
"Adana yerine urfa geldi, urfa istesek urfa siparişi verirdik teşekkürler yine de remzi usta.",10.0,5.0,5.0,1603973153
Siparişimi vereli 2 hafta olmuştu ama hala unutmamışım adamlar efsane menünüzde birde kelebek olsa haftada 3 gün sizdeyim.,10.0,10.0,10.0,1603973153
Güzel.,9.0,8.0,9.0,1603973153
Çabuk geldi tazeydi bazen dışardan yemek söylerken çoğunlukla bu işletmeyi tercih ediyorum... Yalnız 30 tlye göre kanat biraz az geliyor ellerinize sağlık teşekkürler..,10.0,10.0,10.0,1603973153
Domatesler çok sulu olduğu için ekmekler ıslanıp yumuşuyor onun haricinde lezzeti harika.,10.0,10.0,10.0,1603973153
Her gece söylerim hızlı ve lezzetli.,10.0,10.0,10.0,1603973153
Her şeyin en iyisini hak ediyorsunuz kurye çok mütevazzi çok güleryüzlü.,10.0,10.0,10.0,1603973153
"Kola kalmadigi icin yerine yedigun getirmis kurye arkadas, sirf bu yuzden 10 verdim cunku bazi yerler alternatif getirmek yerine yemegi iceceksiz getiriyor ellerinde urun kalmayinca. Arkadas en azindan alternatif sundu. Sagolsun.",10.0,10.0,10.0,1603973153
Çok iyi.,10.0,10.0,10.0,1603973153
Her zamanki gibi hızlı lezzetli ve sıcak elinize sağlık.,10.0,10.0,10.0,1603973153
Hızlı ve lezzetli.,10.0,10.0,10.0,1603973153
"Elinize sağlık gayet hızlı ve lezzetliydi, adana kebap çok güzel.",10.0,10.0,10.0,1603973153
Etin lezzeti çok güzel fakat tek sıkıntı sogan ve domatesleri içine nerdeyse tüm tüm atmaları biraz daha ince doğranırsa çok güzel olur sadece et ve maydanoz yemekten bıktık.,8.0,8.0,7.0,1603973153
Yetersiz.,1.0,1.0,1.0,1603973153
Nicee.,10.0,10.0,10.0,1603973153
Resmen urfa dürüm bu kadar kötü yapılır kokuyor çiğ et yedim pişmeden yollamışlar.,7.0,2.0,1.0,1603973153
"Ciğeri muazzam, elinize sağlık.",9.0,10.0,10.0,1603973153
Guler yuzlu.,10.0,10.0,10.0,1603973153
Ekmek yanmisti tavuk izgara da biraz yanikti.,9.0,10.0,6.0,1603973153
Harika.,10.0,10.0,10.0,1603973154
Elinize sağlık çok çok iyiydi. Bayıldık.,10.0,10.0,10.0,1603973154
Her zamanki gibi on numara beş yıldız.,10.0,10.0,10.0,1603973154
Herkes adana kebab yapar ama bu adamlar baska bir sey yapıyor muazzam lezzeti ve gercek et tadı çok yerden siparis verdim ama bu kadar iyisini antalya da görmedim. Denemenizi tavsiye ederim pişman olmicagın��za eminim gönül rahatlığı ile yiyebilirsiniz.,10.0,10.0,10.0,1603973154
Künefede sorun var bence :d.,10.0,10.0,5.0,1603973154
Tavuk sis mükemmel herkeze tavsiye ederim.,10.0,10.0,10.0,1603973154
Adana dürüm ve tavuk dürüm söyledik içinde et namına bir şey yoktu daha çok dürüm ekmeğini yer gibiydik üzgünüm ama dürümleriniz güzel değil fiyat az diye resmen içine bir şey koymamışsınız keşke fiyatı fazla olaydı en azından verdiğimize değer diyecektik.,8.0,7.0,4.0,1603973154
Güzeldi.,8.0,8.0,8.0,1603973154
Yaprak kanat söyledim güzel olmuş elinize saglik.,9.0,10.0,10.0,1603973154
İlk siparisimdi bidaha olmaz.,1.0,1.0,1.0,1603973154
Pilav bozulmuş tadı ve kokusu çok kötüydü tavuklar biraz yanıktı ama o pek önemli degil pilavları günlük yaparsanız sizin için daha iyi olur yinede ellerinize saglık.,7.0,1.0,1.0,1603973154
Eski adresimi verdim yanlış adrese gitti yinede kurye arkadaş özür diledi görmesini istediğimiz esnaf yüzleri teşekkür ederim tekrardan özür dilerim.,10.0,10.0,10.0,1603973154
Ben böyle hizmet bole kalite gormedim paketci arkadas cok saolsun ustamizin elerine sağlık sevgisini katmis paketci arkadas ta gecenin bir yarısı olmasina ragme hızlı ve guleryuzlu sekilde tavırlar sergiledi favorimsiniz sidetle tavsiye ediyorum.,10.0,10.0,10.0,1603973154
Bayılıyom size.,10.0,10.0,10.0,1603973154
Etmi yedim baska bir seymi belli deil ekmegi kizarsin demistim bayat ekmek koymuslar saolsunlar.,5.0,6.0,3.0,1603973154
İdare ederdi.,7.0,7.0,7.0,1603973154
Harikasınız arıkan apt.,10.0,10.0,10.0,1603973154
Dürüm soğuktu.,10.0,8.0,4.0,1603973154
45 dakikada geldi soğuktu tadı yoktu.,1.0,1.0,3.0,1603973154
"Kurye arkadaş bir bayanla nasıl konuşması gerektiğini bilmiyor, aşırı samimi, bir daha asla.",1.0,1.0,10.0,1603973154
Güzeldi.,10.0,10.0,10.0,1603973154
Kuzu şiş dürüm 10 puan tavuk şiş dürüm 10 puanadana dürüm 8 puan tavsiye ederim.,10.0,10.0,10.0,1603973154
Bir buçuk adana söyledim ve gelen bu içine hiç koymasaydiniz keşke yazık size verilen para haram zaten zehir gibi tuzluydu yakışmadı size.,5.0,3.0,1.0,1603973154
Keşke alevde pismeseymis bildiğin is kokuyor sogansiz secmemize not yazmamiza rağmen sadece soğan vardı teşekkürler bir daha asla.,10.0,1.0,1.0,1603973154
Herşey güzeldi sadece kanat aldığınız tedarikçiyi değiştirmelisiniz.,10.0,10.0,10.0,1603973154
Nice.,9.0,9.0,9.0,1603973154
Efsane lezzet ustam eline koluna sağlık. Kesin ve net bir şekilde kepez de tek adam akıllı müşteriyi önemseyen yer diyebilirim gündoğdu mah. 2477. Sk çakır apt. K:4 d:8.,10.0,10.0,10.0,1603973154
Super tad super lezet.,8.0,9.0,10.0,1603973154
Harikaydı severek sipariş vericeğim.,10.0,10.0,10.0,1603973154
Haydari hariç diğer ikramalr baya çeşitli ve güzeldi hatta mükemmeldi. Hızlı geldi ve kurye arkadaş çok iyiydi. Kebap lezzetliydi ama lastik gibiydi ve küçüktü. Ama genel oalrak güzeldi tekrar sipariş edilebilir.,10.0,10.0,7.0,1603973154
Çok iyisiniz.,10.0,10.0,10.0,1603973154
Soguk geldi yaninda tursu falan yok.,8.0,6.0,7.0,1603973154
Nice.,9.0,9.0,10.0,1603973154
Porsiyonuz az.,10.0,10.0,10.0,1603973154
1 yıldız bile fazla! Hayatımda yediğim en kötü sey bu köfteydi bir adet yememe ragmen hala midem bulanıyor. Cok sert ne oldugu belli degil. Saşkınım nasıl satabiliyorsunuz bunu yazık günah. Bedava olsa yenmez. Denetlenmeli!,7.0,1.0,1.0,1603973154
Hayatım da ilk defa acı bir adana yedim teşekkürler.,10.0,10.0,10.0,1603973154
Elinize sağlık.,10.0,10.0,10.0,1603973154
Süpersiniz.,10.0,10.0,10.0,1603973154
Bi restaurant her seferinde aynı kalite de ayni güzellikte nasıl yemek yapıyor anlayamadım.,10.0,10.0,10.0,1603973154
Ellerinize sağlık.,10.0,10.0,10.0,1603973154
Gerçekten çok iyi.,10.0,10.0,10.0,1603973154
İyi.,10.0,10.0,10.0,1603973154
Harikasınız.,10.0,10.0,10.0,1603973154
Tavuk dürümün tadi damağımda kaldi ben hayatımda boyle lezzeti bi dürüm yemedim ustamin ellerine sağlık. Ama mutlaka ustayla yemek yemek isterim karşılıklı.,10.0,10.0,10.0,1603973154
Tavuk şiş porsiyon gayet güzel hazırlanmış ve lezzetli mezelerde çok güzel çok teşekkür ederim.,10.0,10.0,10.0,1603973154
İyi.,10.0,10.0,10.0,1603973154
Tavuk kanat şiparişim 26 dakikada geldi. Lezzeti tadı güzeldi. Kanatların tüyleri aşırı fazla geldi ustalarım buna fikkat ederseniz sevinirim.,9.0,8.0,8.0,1603973154
Elinize sağlık.,10.0,10.0,10.0,1603973154
Etler çok sert ve kesinlikle kuzu ciğeri değil hız ve servis fena değil ama lezzet olarak kesinlikle bir daha tercih yapmam.,10.0,8.0,5.0,1603973154
Lezzetli.,10.0,10.0,10.0,1603973154
Güzel.,8.0,10.0,10.0,1601343408
Tavuk kanat yanmıştı.,9.0,7.0,6.0,1601343408
Elinize sağlık ama garnitürü geliştirin artık.,10.0,10.0,10.0,1601343408
Mükemmeell.,10.0,10.0,10.0,1601343408
Lezzet. Servis. Hiz... Herşey mükemmel kurye arkadaşın güler yüzü mezelerin bollugu tazeligi essiz lezzeti... Ellerinize emeginize yüreğinize sağlık başarılarınızın devamını dilerim.,10.0,10.0,10.0,1601343408
Beğenmedim dürümler iyi değildi.,1.0,1.0,1.0,1601343408
"Kuzu ciğersipariş 26 dakikada teslim edildilezzeti, porsiyonu, mezeleri tek kişi için doyurucuelinize sağlık.",9.0,9.0,9.0,1601343408
Servis ve hız gayet iyiydi dürümü de gerçekten lezzetliydi favori mekanlarım arasında yerini aldı.,10.0,10.0,10.0,1601343408
Güzel.,10.0,10.0,10.0,1601343408
Kebap yiyecek olduğumda tek adresim burası yıllardır aynı lezzet aynı hizmet. Ellerine sağlık motor kurye arkadaşa da teşekkürler çok geçmeden bekletmeden getiriyor.,10.0,10.0,10.0,1601343408
Hızlı ve lezzetlı tesekkurler.,10.0,10.0,10.0,1601343409
Her zaman tavsiye edebileceğim bir mekan. A. Y.,10.0,10.0,10.0,1601343409
Herşey eksiksik ve mükemmel... Efsane lezzet emeğinize saglik kebabin tek adresi.,10.0,10.0,10.0,1601343409
Efsane gerçekten emeğinize sağlık böyle devam.,10.0,10.0,10.0,1601343409
Yine ve yine çok güzeldi herşey çok hızlı geldi ve lezzeti mükemmeldi.,10.0,10.0,10.0,1601343409
Beğendim.,9.0,9.0,9.0,1601343409
Hızlı ve güzeldi teşekkür ederim.,10.0,10.0,10.0,1601343409
Künefe hamur gibi olmuş.,8.0,7.0,7.0,1601343409
"Servis çok kötü, ne bir peçete ne bir ıslak mendil vardı. Yemeğin tadı gayet lezzetliydi fakat fiyatına göre porsiyon fazlasıyla küçük geldi bana.",8.0,1.0,8.0,1601343409
"Genele gore biraz gecti ancak lezzetli ve güzeldi, ellerinde istedigim icecek kalmayinca arayip bilgi de verdiler başkasıyla değiştirdik.",8.0,10.0,10.0,1601343409
Ustam hayatımda böyle lezzetli bi ciğer yemedim gerçekten çok iyi yapıyosunuz başarılarınızın devamını dilerim.,10.0,10.0,10.0,1601343409
Remzi usta günden güne daha iyiyiye gidiyor gelişen işletmeleri seviyorum.,10.0,10.0,10.0,1601343409
Tavuk yaprak kanat çok nefis.,10.0,10.0,10.0,1601343409
"Şalgam markanızı değiştirin derim, o şalgam yüzünden ciğerin tadını alamadım...",9.0,9.0,9.0,1601343409
Otuz kat dürümün içinde arayıp bulabileceğiniz minik kebap. Fiyatına göre mantıklı ama fiyat biraz yukarı çekilip et oranı artırılmalı. Çok geç geldi. Üzgünüm.,6.0,8.0,5.0,1601343409
Güzel ellerine sağlık.,10.0,10.0,10.0,1601343409
Bu sefer servisden puan kırıyorum rakip restaurantlar çok güzel garnitür koyuyor bence kaliteniz için önemli bu. Ama etin tadı efsane.,10.0,5.0,10.0,1601343409
Ustayı değiştirin lütfen simsiyah kanat geldi.,1.0,1.0,1.0,1601343409
Gayet iyi.,10.0,10.0,10.0,1601343409
Hızlı ve güzel teşekkür ederim.,10.0,10.0,10.0,1601343409
Hersey iyi hostuda zile basilmasi daha hos olurdu gecenin bi vakti verdigim icin siparişi de kusuruma bakmayin lutfen.,10.0,10.0,10.0,1601343409
Çok güzeldi ustanın ellerine sağlık.,10.0,10.0,10.0,1601343409
Her zamanki gibi harika. A. Y.,10.0,10.0,10.0,1601343409
Elinize sağlık.,10.0,10.0,10.0,1601343409
Mükemmel di.,10.0,10.0,10.0,1601343409
Domates ekmek yedim ha bide koca bi soğan başka bişey yoktu.,8.0,1.0,1.0,1601343409
Tat yok tuz lütfen biraz daha özen gösterin.,8.0,8.0,5.0,1601343409
Ciğer berbat.,8.0,8.0,2.0,1601343409
Lavaşın dışı yanmıştı. Her zaman tercih ettiğim bir yerdi ama bu siparişte hüsran yaşadım bir daha tercih etmeyeceğim.,10.0,8.0,3.0,1601343409
Servis ortalama süresi 20-30 dk yazıyodu. 1 saat sonra geldi. Gelen yemek buz gibiydi hiçbir keyif alamadık.,1.0,1.0,1.0,1601343409
Lavaş çok yanık geliyor.,10.0,10.0,10.0,1601343410
Ustamın eline sağlık tavuk şiş mükemmeldi tab yanındaki malzemelerde çok hızlı sıcak geldi.,10.0,10.0,10.0,1601343410
Teşekkürler.,8.0,8.0,8.0,1601343410
Çok iyi.,10.0,10.0,10.0,1601343410
Lezzet. Servis. Hiz... Herşey mükemmel kurye arkadaşın güler yüzü mezelerin bollugu tazeligi essiz lezzeti... Ellerinize emeginize yüreğinize sağlık başarılarınızın devamını dilerim.,10.0,10.0,10.0,1601343410
Elinize sağlık.,10.0,10.0,10.0,1601343410
Sipariş verip mekana gittik. Harikaydı. A. Y.,10.0,10.0,10.0,1601343410
İyiydi.,9.0,9.0,9.0,1601343410
"Şefim ellerine sağlık, kurye kardeş teşekkür ederim.",9.0,9.0,9.0,1601343410
Ben ciğer dürüm yedim gönül rahatlığıyla sipariş verebilirisniz gayet güzel ve sıcaktı geldiğinde.,10.0,10.0,10.0,1601343410
Daha iyi olabilirdi...,1.0,1.0,7.0,1601343410
Çok geç geldi sebebi paketçi arkadaş değildi ama restoranttan geç çıktı sagolsun paketci arkadas hizli getirdi.,4.0,9.0,10.0,1601343410
Kurye beyfendiydi. Erenköy siparişi.,10.0,10.0,10.0,1601343410
 tavuk yaprak kanat mükemmel bir lezzet.,10.0,10.0,10.0,1601343410
 kuzu şiş söylemiştik dana eti yedik ellerinize sağlık.,8.0,7.0,1.0,1601343410
Kuzu şiş istedik. Bildiğin dana kontrafile etini şişlemişler kuzu şiş diye satıolar.,1.0,2.0,1.0,1601343410
Mükemmeldi ellerinize sağlık...,9.0,9.0,9.0,1601343410
Elinize sağlık hızı mükemmeldi.,10.0,10.0,10.0,1601343410
O nasıl bir ciğerdi berbat.,9.0,5.0,1.0,1601343410
Adanası gayet güzel. Tavsiye ediyorum.,10.0,10.0,10.0,1601343410
Hızlı ve lezzetliydi adana kebap elinize sağlık.,10.0,10.0,10.0,1601343410
50 dk da geldi.,1.0,10.0,10.0,1601343410
İdare eder.,8.0,8.0,8.0,1601343410
Özel olarak çift lavaş istemiştik teşekkür ederiz ilginiz için :) ama ürün domates ve soğanın içinde biraz geri planda kalıyor ama karnımız güzel doydu başarılı.,7.0,9.0,8.0,1601343410
Tavuk kanat biraz çiğ kalmıştı. Yine de elinize sağlık.,8.0,8.0,6.0,1601343410
Gelirken sipariş verdim. Mekanında yedim. Harikaydı.,10.0,10.0,10.0,1601343410
Her zaman çok iyi. Asla sıkıntı yaşamadık bugüne kadar. Çok teşekkür ederiz. Keleş ailesi.,10.0,10.0,10.0,1601343410
Kaç yıldır bilindik işini severek ve lezzetli yapan bir yer herkese tavsiye ederim.,10.0,10.0,10.0,1601343410
Çok güzeldi ama biberler cehennem ateşinde harlanmış gibiydi ustam biberlere dikkat.,10.0,8.0,9.0,1601343410
Good.,9.0,9.0,9.0,1601343410
Her zamanki gibi lezzetliydi.,10.0,10.0,10.0,1601343410
Çok güzel adanası.,10.0,10.0,10.0,1601343410
Çok güzeldi elinize sağlık ahmet abiye selamlar..,10.0,10.0,10.0,1601343410
Güzel.,10.0,10.0,10.0,1601343410
Teşekkürler.,9.0,9.0,9.0,1601343410
İçinde çok aşırı salata var diğerinin tadını alıyor.,9.0,8.0,7.0,1601343410
"Etler pişmemiş içi çiğ kalmıştı, üstelik kuzu eti olmasına rağmen taş gibiydi.",7.0,1.0,1.0,1601343410
Basariliydi elinize saglik.,10.0,10.0,10.0,1601343410
Köfteler pişmemişti içi ona rağmen lastik gibiydi parcalanmiyordu bile.,7.0,7.0,1.0,1601343410
Güzel ve zamanında. Tebrikler.,10.0,10.0,10.0,1601343410
Her zaman ki gibi güzel.,10.0,10.0,10.0,1601343410
Yemekler çok güzel fakat 2 kere soğansız inatla bol soğanlı geldi.,9.0,9.0,8.0,1601343410
Etin tadı gelmiyo.,6.0,6.0,1.0,1598713664
Rezalet.,1.0,1.0,1.0,1598713664
Visne suyu istemistim baska geldi onlara dikag ederlerse daha iyi olur ve gelen kunefede serbet yoktu dencek kadar azdi ama yinede guzeldi elerine saglik tesekurler.,8.0,8.0,7.0,1598713664
Şipariş hızlı geldi ciger ve salata çok iyi ama kadayıf hiç iyi değil.,10.0,10.0,8.0,1598713664
Az puan verip nasibinizle oyanmak istemem ama soğan kalın doğranmış dürümün içinde ayran sıcak paket biraz dolaşıp gelmişti.,10.0,10.0,10.0,1598713664
Bana konumu uzak olsada 15 dk da geldi. Yan verilen ikramlar gayet güzel. Sadece ızgara biraz gözünüze az gelebilir ama zaten ülkede et fiyatlarına göre gelen ürün normal. Teşekkürler elinize sağlık.,10.0,10.0,10.0,1598713664
Çok kaliteli bir işletme.,10.0,10.0,10.0,1598713664
Her yediğimizde tadı farklı oluyo ve bu sefer soğanda sumak yoktu.,10.0,10.0,8.0,1598713664
Son istediğimiz dürümlerden memnun kalmadık.,8.0,8.0,3.0,1598713664
Herşey 10 numara abicim birde yazılan notları okusanız aşırı mutlu olcaz.,10.0,10.0,10.0,1598713664
Çok beğendiğim bir mekan bazen adanın eti lezzeti iyi olmuyor bunun farkına varıyoruz ustalar haberiniz olsun lezzeti bozmayın bir olur iki olur sonra bugün sipariş neden a kaldı diye sorarsınız.,10.0,10.0,5.0,1598713664
Yaprak kanat mükemmel.,10.0,10.0,10.0,1598713664
Soğanları hariç güzeldi tavuklar iyi pişmiş ancak soğanlar bozulmuştu hızlı gönderim için teşekkürler.,9.0,8.0,9.0,1598713664
Hiç karışık ızgara değildi.,1.0,1.0,1.0,1598713664
Sipariş verip mekanında yedik. Kesinlikle tavsiye ederim.,10.0,10.0,10.0,1598713664
Siparişi önceden verip mekana gittik. Adana dürümü mükemmel. Yanında nar ekşili salatası ile 10 numara olmuş.,10.0,10.0,10.0,1598713664
Çok iyi.,10.0,10.0,10.0,1598713664
10 numara 5 yıldız.,10.0,10.0,10.0,1598713664
Fena değil.,7.0,7.0,7.0,1598713665
Çok iyi hep aynı lezzet.,10.0,10.0,10.0,1598713665
İşi biliyorlar.,10.0,10.0,10.0,1598713665
"Elinize sağlık, hızlı ve lezzetli.",10.0,10.0,10.0,1598713665
Çok iyisiniz kalitelin tek adresi.,10.0,10.0,10.0,1598713665
Eline sağlık ustam.,10.0,10.0,10.0,1598713665
Çook hızlı ve çokk lezzetli.,10.0,10.0,10.0,1598713665
Siz n iyisini buln yapan qdr mnc n yaxşi si budur.,10.0,10.0,10.0,1598713665
Hiz ve servis iyiydi. Fakat tam pismemisti etler busefer. Herzaman soyledigim yer fakat en sonki sefer hayel kirikligina ugradim.,10.0,9.0,6.0,1598713665
İdare.,8.0,6.0,8.0,1598713665
Çok güzeldi paketçileri çok iyi :).,10.0,10.0,10.0,1598713665
Her şey güzel ama haydari inanılmaz cıvık.,10.0,6.0,8.0,1598713665
10 numara döner.,9.0,7.0,10.0,1598713665
Güzel.,10.0,10.0,10.0,1598713665
Boyle sacma bir sey yok konum atmama ragmen getiremediler yemeği. 20 25 dakika boyunca yolun ortasinda bekledim artik getirsinler diye. Sokağa kadar girip geri donduler kac defa.,1.0,5.0,5.0,1598713665
Et yumuşak değildi sertti.,3.0,3.0,3.0,1598713665
İyiydi.,10.0,7.0,8.0,1598713665
Berbat.,1.0,1.0,1.0,1598713665
Kolamızı unutmuşalar ama telafi ettiler harkika bi yer.,10.0,8.0,10.0,1598713665
Guzel.,9.0,9.0,9.0,1598713665
Güzeldi fakat ilk çıkan olması lazım bana gelene kadar biraz soğumuş çok deil ama sıcak olmasını isterdim.,8.0,8.0,5.0,1598713665
Tuzsuzdu ve dürüm içindeki soğanlar çok kalındı.,7.0,7.0,5.0,1598713665
Teşekkürler :) ellerinize sağlık :).,10.0,10.0,10.0,1598713665
Ustam her zamanki gibi mükemmel eline sağlık.,10.0,10.0,10.0,1598713665
Eski tat yok rezalet.,1.0,2.0,1.0,1598713665
"Her şeyiyle çok güzel bir tavuk şiş dürümdü. Tavuklar tam ayarında pişmiş, yumuşacık. Lavaşı da şahane.",10.0,10.0,10.0,1598713665
Elinize sağlık güzeldi paket getiren arkadaşa selamlar olsun.,8.0,8.0,8.0,1598713665
Urfa dürüm söylememize rağmen adana geldi çok acıydı çocuk yiyemedi ve çöp oldu. Herzman burda yememize rağmen çok lezzetli biryer olmasına rağmen bunu size yakıştıramadım. Yanlış sipariş olması kötüydü.,7.0,5.0,5.0,1598713665
"Haftanın 3 günü sizden sipariş veriyorum, dün verdiğim adana siparişinde et o kadar kokuyordu o kadar yan tadıyordu ki yiyemedim. Etin kokusunu ve tadını bastırması için koca koca biberler katmışsınız helal olsun size.",1.0,1.0,1.0,1598713665
Harika lezzetler.,10.0,10.0,10.0,1598713665
