comment_text,comment_speed,comment_service,comment_taste,comment_time
Hediye tatlı için teşekkür ederim.,10.0,10.0,10.0,1606017599
Ben tavuk ve köfte karışık sanmıştım oysakş tavuk köftesiymiş o.,7.0,7.0,7.0,1605931199
100 gram yazan sogan halkasini tattığımda 190 gram geldi bol bol koymuşlar tantuni dürümü de süperdi.,10.0,10.0,10.0,1605931199
Ketçap ekşimiş.,7.0,8.0,4.0,1604980799
Muazzam bir lezzet...,10.0,10.0,10.0,1604807999
Buz gibi geldi.,5.0,6.0,4.0,1604289599
"Bunca kötü yorum, çok ilginç. Galiba çok farklı şeyler yiyoruz aynı yerden. Üç yıldır sipariş veririm, iki kere olumsuz sipariş getirdiler o da ya sıcaktı ya da içecek dükkanda kalmıştı. İnsaf lan mis gibi yer.",10.0,10.0,10.0,1604203199
İnsan biraz emek verir hakkını verir bu kadar kötü iş yapılmaz.,1.0,1.0,1.0,1603992653
Enfeeesss.,10.0,10.0,10.0,1603992653
Ekmek sosu tam çekmemişti içi kuruydu buna dikkat ederseniz sevinirim onun dışında herşey güzel.,10.0,10.0,7.0,1603992653
"Baharatlı seçmiştim ama baharatsız geldi, olsun yine de güzeldi, teşekkür ederiz.",10.0,10.0,10.0,1601362907
Güzel ama köfte çok tuzluydu.,8.0,8.0,8.0,1601362907
Değişmeyen lezzet.,10.0,10.0,10.0,1601362907
"Hızlı, sıcak ve lezzetli elinize sağlık.",10.0,10.0,10.0,1601362907
"Sabaha karşı verilen sipariş olmasına rağmen lezzetli, sıcak geldi. Kurye arkadaş da gayet güleryüzlü idi... Teşekkürler...",10.0,10.0,9.0,1601362907
"Kibar kurye, vaat edilen zamanda teslimat, ortalamanın üstünde lezzet ve güzel servis.",10.0,10.0,10.0,1601362907
Berbat.,1.0,1.0,1.0,1601362907
"Ilık bile değildi. Soğanlı burger istedim, soğanlar iri ve halka değil yemeklik soğandı.",8.0,8.0,5.0,1601362907
"Her şey çok güzeldi ancak sanırım artık porsiyonlar küçülmüş, önceden her şey bol bol konuyordu ve o zaman 18 liraydı şimdi 25 lira ama patatesler azıcıktı... Soğan vs o da azdı... Üzdü bu durum.",10.0,10.0,10.0,1601362907
1 sipariste yanlışlık dediniz tekrar deneyin dediğin eyvallah dedim olmuştur youndr ama 2 sipariste yazmama rağmen nota aynı senin degisecegin yok sanırım patsolarin içine sayılı patates atıyorlar ekmeğin köşeyi neden aldığınızda anlamış değilim şiddetle tavsiye etmiyorum lezzet zaten iyi sayılmaz.,1.0,1.0,1.0,1601362907
Hamburger alt üst olmuştu poşet mayonez ketçap içinde kalmış hamburger dağılmış bi şekilde toplayıp yemeye çalıştım ama eti okadar çiğ kalmış ki çöpe atmak zorunda kaldım. Patatesler yağ içindeydi zaten hamburgerle birbirine karışmıştı. Verdiğim paraya yazık.,1.0,1.0,1.0,1601362907
Domates istemedim koyulmus ıslak mendil tuz yoktu porsiyonlar kucuk hız iyiydi hayirli isler.,10.0,2.0,5.0,1601362907
Bayat marul malesef.,1.0,1.0,1.0,1601362907
Sanırım sabah öok erken sipariş verdiğimiz için ıslak gamburger ekmekleri tam çmzülmemişti ve et pişmemişti ona rağmen o lezzzeti aldım daha uygun bir saatte tekrar sipariş edicem ellerinizr sağlık iyi çalışmalar.,10.0,10.0,10.0,1601362907
Güzeldi.,10.0,10.0,9.0,1598733161
Tavuk şiş tatsız tutsuz bir şeydi yeşillik olmadan gitmiyor.,9.0,7.0,6.0,1598733161
Olmasın dediğim hersek vardi ve ezik ve ıslak geldir içeceğimiz de mantolu söylemiştim şeftalili geldi.,2.0,1.0,2.0,1598733161
Güzel.,8.0,8.0,8.0,1598733161
Fiyat performans olarak gayet iyi. Ürünlerin kalitesi artsa tabi ki daha iyi olabilir yalnız bu durum ister istemez fiyatlara da yansır.,10.0,9.0,8.0,1598733161
Ellerinize sağlık.,10.0,10.0,10.0,1598733161
Beğenmedik.,1.0,1.0,1.0,1598733162
Her şey güzeldi lakin et biraz az pişmiş birde hamburger ekmeğini rica ediyorum değiştirin lezzet güzeldi lakin bu ikisi değişirse on numarayken beş yıldız olursunuz.,10.0,10.0,10.0,1598733162
Gelen urun sicak degildi belirtilen suresi asti patsonun içi bomboş sadece ekmek yedim resmen tavsiye asla etmem.,1.0,1.0,1.0,1598733162
Geç saatte vermemize rağmen siparişi sıcak ve lezzetli idi... Kurye arkadaş d gayet kibardı...,10.0,9.0,10.0,1598733162
Fiyatı uygun lezzeti süper.,10.0,10.0,10.0,1598733162
"Ya herşeyi geçtim, paket servisi getiren çok sevimli bir insan kendisine burdan teşekkür eder hayatında başarılar dilerim.",10.0,10.0,10.0,1598733162
Neden cuma bu akşam kapalısınız?,10.0,10.0,10.0,1598733162
Gayet hızlı ve lezzetliydi. Double cheeseburger söyledim tek sıkıntısı ekmek çok dağıldı. Belki farklı bir ekmek kullanılabilir. Onun dışında her şey mükemmeldi.,10.0,9.0,10.0,1598733162
Harikasınız.,10.0,10.0,10.0,1598733162
Kuryede çalışan abi güler yüzlü ve anlayaşlıydı servis güzeldi lezzet çok güzeldi.,10.0,10.0,10.0,1598733162
Tek kelimeyle mükemmel.,10.0,10.0,10.0,1598733162
İnanılmaz güleryüzlü ve kibar bir esnaf herşey çok lezzetliydi çok teşekkür ederiz.,10.0,10.0,10.0,1598733162
Aleyna burgere konulan eti çözemedim tavuk ete benziyordu ama sosundan pek tavuk tadı alamadım. Ayrıca çok sıcaktı ilk defa sıcaktan şikayet ediyorum genelde hep soğuk gelen yemeklerden şikayet ederdim onun dışında bir sıkıntı yok.,9.0,8.0,8.0,1598733162
Bim in burger ekmegini kullamazsaniz biraz puan verilebilir.,7.0,2.0,1.0,1598733162
"Yemekler sıcak geldi, şiş dürüm güzeldi önem arz eden arkadaşlar için kurye bey gayet güler yüzlü ve kibardı teşekkürler.",10.0,10.0,10.0,1598733162
Elize emegine saglik hem ucuz hemde cok lezzetliydi kesinlikle tercih edilmesi gereken bir isletme islak tavuk burgerden beklentimi dusuk tutmama ragmen mukemmel birsey geldi.,10.0,10.0,10.0,1598733162
Hamburgerlerin köfteleri çiğ olmasaydi daha iyi olabilirdi.,10.0,7.0,3.0,1596103416
Körili tavuk sipariş verdim. Dürüm olarak geleceği menü de belirtilmemişti ve buna rağmen dürüm geldi. Bir porsiyon pilav bir avuç kadar. Tavuklar çiğdi. Dürüm yaptıkları lavaşin tadı çok kötüydü. Kısacası pilav hariç hepsi çöpe gitti.,1.0,1.0,1.0,1596103416
Güzel lezzetli ve çokkk sıcak geldi soğumasını bekledim valla.,10.0,10.0,10.0,1596103416
Lezzetli ve hızlı. Kötü yorumlara aldanmayın.,10.0,10.0,10.0,1596103416
 gerçekten başarılı çok teşekkürler ellerinize sağlık.,10.0,10.0,10.0,1596103416
Zincir restoranlara tur bindirir yerli milli burger.,10.0,10.0,10.0,1596103416
Hamburger ekmeğinin altları biraz yanmıştı. Daha önceki siparişlerde bu yoktu. Patatesin yanında ketçap ekşiydi bozuktu. Lezzet iyiydi. Fakat piknik önceki siparişimde minimum tutarın tam olarak 3 tl üzerinde siparişim olmasına rağmen evim uzak olduğu için gelmek istememişti. Bunu da yazayım!,10.0,7.0,6.0,1596103416
İyiydi gayet.,8.0,9.0,9.0,1596103416
Güzeldi.,10.0,10.0,10.0,1593473670
Köfteyi kesinlikle deneyin..,10.0,10.0,10.0,1593473670
Ekmeği galiba yeşillikle beraber mikrodalgada 5dk tutuyorsunuz marul yemin ederim dilime yapıştı sıcaklığından erimişti.,8.0,6.0,3.0,1593473670
Başarılı.,10.0,10.0,10.0,1593473670
İşin gücün rast gitsin üstadım.,10.0,10.0,10.0,1593473670
Ekonomik doyurucu.,10.0,10.0,10.0,1593473670
Cok guzeldi.,9.0,10.0,10.0,1593473670
"Genelde daha lezzetli olurdu hamburgerleri bu siparişimde de eski tatlari aradim açıkçası, ekmek bayat gibiydi biraz dikkat edersiniz umarım.",8.0,7.0,6.0,1593473670
Islak hamburgeri tost makinası na basmışlar hadi tamam ama aynı zamanda yakmışlar emeğimize sağlık ama beğenmedim.,10.0,7.0,3.0,1593473670
Güzel hızlı.,10.0,10.0,10.0,1593473670
Kötü.,5.0,5.0,5.0,1593473670
Islak hamburger tam bi hayal kırıklığı.,10.0,10.0,7.0,1593473670
Sabah 10 da işletmeden yarım ekmek köfte söyledim üşenmeden getirdi ve getiren beyefendi çok güler yüzlü ve kibar. Lezzette çok iyi. Kesinlikle tavsiye ediyorum.,10.0,10.0,10.0,1593473670
Ekmekleri değiştirmenizi tavsiye ederim.,9.0,8.0,8.0,1593473670
"Kelimelerle anlatamadığım bir lezzet edirne için çok çok büyük bir şans piknik sıcak, lezzetli, taze, fiyat olarak uygun daha ne olsun?",10.0,10.0,10.0,1593473670
Hamburgerlere küçük diyenlere aldırmayın gayette yeterli büyüklükte. Tadı desen doyum olmuyor. Seneler öncesinde severek yediğim ürünler seneler sonrasında da yine aynı lezzette. Kazancınız bol olsun.,10.0,10.0,10.0,1593473670
"San sebastianın içinden 2cmlik bir yumurta kabuğu çıkmasaydı her şey daha güzel olabilirdi, o kabuğun gözden kaçmış olması imkansız.",8.0,8.0,1.0,1593473670
Gayet güzel.,8.0,10.0,9.0,1590843924
