comment_text,comment_speed,comment_service,comment_taste,comment_time
Hızlı bir şekilde teslimat gerçekleşti. Kalitesi de çok güzel çok memnun kaldım.,8.0,8.0,8.0,1606641029
Çok lezzetliydi yemekler.,10.0,10.0,10.0,1606641029
Yanık sorununu acil düzeltmeniz lazım.,10.0,8.0,8.0,1606554629
Yanık sorununu acil düzeltmeniz lazım.,10.0,9.0,7.0,1606554629
İdare eder.,5.0,8.0,10.0,1606554629
Tavuk dürüm aldık çok lezzetliydi ama sosu daha yoğun olmalı bence biraz içi kuru kalıyor.,9.0,10.0,10.0,1606554629
Soğuktu 1 vede yok turşu koymuşsunuz hızı hiç söylemiyim :).,1.0,1.0,1.0,1606295429
Buz gibiydi içinde malzeme eksikti.,1.0,1.0,1.0,1606295429
Birader ekmek buz gibi et dessen içine yicek tavuk bile koymamışsınız ekmek darmadagın gelmiş sürekli söylüyorum ama iyice bozdunuz.,1.0,1.0,1.0,1606209029
Buzzzzz gibi bir durum yedim sabah saat 11 buçukta yoğunluk olmadığı halde bir saatte geldi.,1.0,1.0,1.0,1606209029
Gelen patatesi ve dürümü mikrodalgayada ısıtıp yemek ve yazdığım notu okumayıp gecenin bi yarısı personeli bilgilendirmeden yollayıp zile bastırmak gibi hiç beklemediğim şeylerle karşılaşmam her zaman sipariş verdiğim yer adına üzdü beni. Lütfen yazdığımız notları okuyun. Geç gelmesine de razıyız yani.,2.0,2.0,2.0,1606209029
Çok kuru biraz daha sos koyulmalı.,7.0,7.0,7.0,1606122629
Iyı.,8.0,8.0,8.0,1606122629
Teşekkkürler.,10.0,10.0,10.0,1606036229
Aso.,10.0,10.0,10.0,1605949829
Dönerler biraz çiğdi. Sanırım gece olduğu için fazla özenmediniz.,6.0,8.0,4.0,1605949829
Süper.,10.0,10.0,10.0,1605863429
İskenderi asla almanızı tavsiye etmem.,8.0,3.0,1.0,1605863429
Malzeme eksikliği.,1.0,1.0,1.0,1605863429
Döner dürüm istemiştim ne olduğu belli olmayan birşey değil.,1.0,1.0,1.0,1605863429
Hiç getirmeseydiniz ben yemeği beklerken doydum zaten.,1.0,10.0,7.0,1605863429
Tşkler.,10.0,10.0,10.0,1605863429
Mükemmel.,10.0,10.0,10.0,1605863429
İdare eder.,7.0,7.0,7.0,1605777029
Iyı.,8.0,8.0,8.0,1605690629
Kurye yemegimi tam bir saatte getirdi evime yakın olan bir restoranda yola çıkıpta 1 saat sonra yemegin gelmesi şaşırtıcı. Ben burdan kuryenizin dışarda gezip sonra yemegi getirdigini düşünüyorum zaten dürümde soguktü rezalet.,1.0,1.0,1.0,1605690629
Beğenmedik.,1.0,1.0,1.0,1605690629
Öncü dönerden vazgeçemiyorum. Yok böyle bir lezzet. Her geçen gün servisde hızlanmalar oluyor artı olaraktan.,7.0,8.0,9.0,1605690629
"İstemediğim şeyleri içine koymazsanız çok güzel olur, tavuk sos ve patates yeterli.",6.0,10.0,5.0,1605604229
Berbat.,1.0,1.0,1.0,1605604229
Berbat.,1.0,1.0,1.0,1605604230
Eskisi gibi degil soguk ve lezzetsiz. Bir daha alacağımı sanmıyorum.,3.0,5.0,2.0,1605604230
Teşekkürler :).,10.0,10.0,10.0,1605604230
Son zamanlarda yapılan işe ilgi yok kalite düşüyor demekki artık öncü den yemiycez.,1.0,1.0,1.0,1605517830
"Hızınıza hayran kaldım, bi durum 1 saat 15 dakika da geldi. Ayrıca bir teşekkür de yazlık bir dürüm yapmışsınız yalnız yanlış mevsimde geldi, o kadar soğuk geldi ki içim üşüdü yerken, bir teşekkür de o paketi öylece müşterisine yollayan işletme sahibine mükemmelsiniz...",1.0,1.0,1.0,1605517830
İyice kalite düşüyor.,5.0,1.0,1.0,1605517830
Yavaş.,1.0,1.0,10.0,1605517830
Çok güzeldi ancak çok geç geldi ve çok soğuktu.,5.0,6.0,10.0,1605431430
Tavuk besleyip büyütüp kesip pişirseydim bu siparişimden daha hızlı olurdu.,1.0,1.0,3.0,1605431430
Et döner harika şiddetle tavsiye ederim.,8.0,8.0,8.0,1605431430
Dürümleri lütfen biraz soslu yapın.,1.0,1.0,1.0,1605345030
Adı gibi öncü bi döner.,8.0,8.0,8.0,1605258630
Servis güzeldi fakat eski lezzet kalmamış lavaş erimiş yapışmış tavuk tadı yok eski sos bolluğu yok hız deseniz rezalet ayıp ettiniz öncü döner.,4.0,9.0,6.0,1605172230
Sosu bol olsaydı çok daha iyi olurdu elinize sağlık.,9.0,9.0,8.0,1605172230
Kötü baya kötü.,1.0,1.0,1.0,1605172230
Lezzet on numara hız da gayet iyi.,7.0,10.0,10.0,1605085830
Çok geç geldi 2 saatte teslim etti.,1.0,3.0,7.0,1605085830
Combo diyerek insanları kandirmayin.,1.0,1.0,1.0,1604999430
Good.,8.0,8.0,8.0,1604999430
Yemek soguk kokuyor.,1.0,1.0,1.0,1604999430
Malzeme eksikliği var hala.,1.0,1.0,1.0,1604999430
"Kurye çok saygılıydı, teşekkürler.",8.0,10.0,10.0,1604913030
"Gayet hızlı geldi. Diğer yerlere göre daha uygun. Dürüm gayet büyük ve doyurucu. Sosu da gayet lezzetli. İçinde turşu, kürdan, tuz, ıslak mendil, peçete hepsi vardı. Çok beğendim.",10.0,10.0,10.0,1604913030
Geç.,1.0,1.0,1.0,1604913030
"Servis 1. 5 km 1 saat sonra geldi zaten soğumuştu, içinde turşu ve sos istememe rağmen hiçbirşey yoktu. Biraz siparişler detayina dikkat edin soğuk ve sossuz yedikten sonra hiçbir anlami yok boş yani dikkat lütfen.",4.0,3.0,4.0,1604826630
1 saati geçiyo gelmesi vede geldiğinde soğuk oluyor daha ilgili olabilirler bu konuda.,3.0,3.0,4.0,1604826630
Geç geliyor.,1.0,1.0,1.0,1604826630
Dükkandaki döner ile alakası yok ve sipariş bir buçuk saat sonra geldi.,1.0,1.0,1.0,1604826630
Çok yavaş berbat.,1.0,5.0,8.0,1604826630
Çok yavaş 60 dk sürmemeli 300 metre var arada.,1.0,1.0,6.0,1604826630
Kuryeniz iyi ve güler yüzlü böyle kurye görmeyeli uzun zaman oldu böyle arkadaşlarla çalışmanız güzel bir şey ismi hasandı galiba ellerinize sağlık.,10.0,10.0,10.0,1604826631
Gerçekten harika dönerler ellerinize sağlık.,10.0,10.0,10.0,1604826631
"Rica ediyorum her defasında aranmiyim, evin adresi var ne zaman sipariş versem abi ev nerdeydi diye aranıyorum.",7.0,1.0,10.0,1604740231
İçerisindeki malzemeler eksik geliyor gün geçtikçe lezzeti kaçıyor.,1.0,1.0,1.0,1604740231
Döner cok kuruydu. Hiç beğenmedim.,3.0,3.0,1.0,1604740231
Efsane lezzet süper hız. Siyah motoru olan orta yaşlı abi ne zaman gelse hızlı geliyo. Benim paketlerimi abi getirsin rica ediyorum.,10.0,10.0,10.0,1604567431
Seviyoruz öncü döneri ama biraz daha güzel yapabilirler isteseler.,7.0,8.0,7.0,1604481031
Öncü tavuk döner lezzeti tam gaz devam ediyor. Çok seviyorum soslu döner yemeği. Ellerinize sağlık. Hızlı geldi ayrıca. Çok doyurucu ve lezzetli.,8.0,10.0,10.0,1604481031
Sosu az ve soğuk geldi.,6.0,7.0,6.0,1604394631
Dürümler çok kuru biraz fazla sos koyarsanız iyim olur.,7.0,7.0,2.0,1604394631
Eski soslu dürümleri özlüyoruz.,1.0,1.0,1.0,1604394631
Lavaş ful yanıktı 2 ısırık alıp çöpe attım. Normalde restorantınıza geldiğimde güzel yapıyorsunuz paket servisler neden böyle anlamış değilim.,8.0,8.0,1.0,1604394631
Super.,10.0,10.0,10.0,1604308231
Elinize sağlık.,9.0,9.0,10.0,1604308231
Günün tatlısı gelmedi ve dürüm soğuktu.,7.0,1.0,5.0,1604221831
Verilen süreden çok sonra geldi servis güzel sayılır farklı poşetlerle geldi kola ve dürüm sosu lezzetliydi.,1.0,9.0,9.0,1604221831
Acı biber hic koymamişsiniz.,9.0,6.0,9.0,1604221831
Her siparişimde tavuk biraz daha azalıyor resmen patatesli soslu dürüm yedik tavuk nerdeydi.,10.0,10.0,7.0,1604221831
"Daimi müşteriniz olarak belirtiyorum. Açıkçası bugünkü siparişten memnun kalmadım. Hayal kırıklığına uğradım. Dürümün içinde bir kaç patatesten başka pek birşey yoktu. Nerdeyse hiçbir şey yoktu. Sarılmış, içi boş dürüm yemiş oldum.",6.0,5.0,2.0,1604135431
1 tane dürümü getirmek bu kadar zor olmamalı ya 1 saatte 1 dürüm gelmez mi.,1.0,1.0,1.0,1604135431
Çok yavaş.,2.0,7.0,9.0,1604135431
"Hızlı teslimat, lezzetli.",9.0,9.0,9.0,1604135431
Gayet guzeldi.,10.0,10.0,10.0,1604097685
Arkadaşlar çok kötü yemeyin çok soğuk geldi bir de hiç tat yok yani yani yani tavuk tavuk yoktu yani ya.,1.0,1.0,1.0,1604097685
Patatesleri çok az gönderiyorsunuz vetaze değil onun haricinde güzeldi.,9.0,7.0,8.0,1604097685
Kuruye çok hızlı geldi dönerin lezzetide gayet iyiydi.,10.0,10.0,9.0,1604097685
Eski lezzeti kalmamış soğuk geldi.,6.0,7.0,7.0,1604097685
Efsane.,10.0,10.0,10.0,1604097685
Çok hızlı geldi ve çok lezzetliydi.,10.0,10.0,10.0,1604097685
Bildiğimiz lezzet hoştu. Islak mendilde olsaydı iyiydi.,8.0,7.0,9.0,1604097685
Öncü benim için bitmiştir...,1.0,1.0,1.0,1604097685
Tavuk dönerden 5/6 tane küçük kemikler çıktı idare ederdi çok güzel değildi.,8.0,7.0,5.0,1604097685
Döner her zman aldığımızdan daha kuru soslanmamış ve soğuk geldi yoğunluktan da olsa bu şekilde olmaması gerekirdi.,5.0,4.0,2.0,1604097685
Bugün gelen motor cunuz genelde hep getirdiği zaman erken geliyor diğerleri hep geç geliyor tebrik ederim siyah tişörtlü arkadaşa çok tskr ederim.,10.0,10.0,10.0,1604097685
Orta halli bir siparişti. Yiyecekler ılıktı. Düz döner işte övülcek birşeyi yok.,7.0,7.0,7.0,1604097685
"Hız çok yavaş belirttikleri gibi bana 10 dk yürüme mesafesinde olan yerden 40 dk da teslimat, servis te hicbir sorun yok gayet iyi, lezzet döner tavuk dönerdi benim tavuk tadı ağzıma. Hic gelmedi içi bol soslu ve ıslak, lslak salçalı gibi bı lavaş cook lezzetli değildi bence begeneni vardır belki.",5.0,10.0,5.0,1604097685
Pidenin içi menemen gibiydi..,4.0,4.0,3.0,1604097685
Güzeldi geçti yendi bitti.,8.0,7.0,10.0,1604097685
Kuryeniz oktay bey çok nazikti ve kibardi durumleriniz efsaneydi emeği geçen herkese çok teşekkür ederim.,10.0,10.0,10.0,1604097685
Öncü döneri değerlendirmeye gerek olmadığını düşünüyorum bizzat kendim gelerek ve arayarak sipaaris veriyorum ve memnunum yalnız sizi çok güzel temsil edenide gördüm bir kuryeniz var güler yüzlü hızlı mı hızlı hasancan kadar speedy ve iyi kurye görmedim böyle boyle işletmeye böyle işlem helal olsun.,10.0,10.0,9.0,1604097685
Özellikle ismini sordum gelen kurye arkadaşın hasancan imiş güler yüzlü ve çok saygılı bi arkadaş.,10.0,10.0,10.0,1604097685
Güzel.,9.0,9.0,9.0,1604097685
Yani 3 yi de yanınızda taşıyamazsanız paket servisi bırakın o zaman.,1.0,1.0,1.0,1604097685
Abi çok güzel dürüm leriniz tüm utalarımın eline sağlık.,10.0,10.0,10.0,1604097685
2 dürüm 1 saatte nasıl geliyor? Max 1 bucuk kilometre yere yahu insaf kardeşim insaf buz gibi soguk birde. 10 dkda yola çıktı gözüküyor ama bir türlü ulaşmıyor. Sırf sosu için vaz geçemiyoruz belki düzelir belki düzelir diyoruz sizin düzeleceğiniz flan yok. Dahada almıyorum. Alırsam namerdim.,1.0,1.0,1.0,1604097685
Gayet basarili.,10.0,10.0,10.0,1604097685
Kurye hasan can artik favori kuryem ahahah cok tatli ve guleryuzlu masallah diyorum.,10.0,7.0,10.0,1604097685
Hızlı geldi lezzetliydi.,10.0,10.0,10.0,1604097685
Super.,10.0,10.0,10.0,1604097685
"Servis 1, 5 saatte geldi. Gelesiye dürüm soğumus kola ılımış.",1.0,1.0,1.0,1604097685
Kuryeniz hasancan çok nazik ve canayakın birisiydi servise ve lezzete onun sayesinde bu puanı veriyorum.,10.0,10.0,10.0,1604097685
Hayatımda yediğim en berbat dürümdü. Aldigim menü eksik olarak bana ulaştı. Normalde hiç bir şekilde yorum yapmıyorum ama siz bunu hakettiniz. Dürüm yanmıştı yenmiyordu bile. Buz gibiydi hepsi. Servis desen 1 saatte geldi desem yeridir.,1.0,1.0,1.0,1604097685
Soguktu ve bekletilmistik.,1.0,1.0,1.0,1604097685
Hasan can kardeşime teşekkür ederim ama inatla dürümlere konulmasin dediklerimi koymuşsunuz bidaha soylemiycem sanirim ama kurye adamdir.,10.0,7.0,5.0,1604097685
Sipariş getiren kişi hakan bey çok kibar ve ilgiliydi bu tarz kişilerin çalıştırlması çok faha güzel ileyişim önemli.,8.0,8.0,8.0,1604097685
Öncü kalitesi.,10.0,10.0,10.0,1604097685
Sarımsak soslu döner mi olur ya berbat.,7.0,8.0,1.0,1604097685
Sadece bir dürümde turşu istemediğimi söylememe rağmen ikisine de konmamış ve kuryenizin bozuk parası yoktu 2 tl eksik para üstü verdi benim için 2tl çok önemli değildir lafını yapmam ama yapanlar olabilir kuryenin bozuk parasız dolaşması garip bir durum. Lezzeti ve hızı iyiydi her zamanki gibi.,7.0,5.0,8.0,1604097685
Çok hızlı geldi. Sosu çok lezzetli. Doyuruyor.,10.0,10.0,10.0,1604097685
55 dakikada geldi sıcak değildi ve döneri kuruydu servis süresi kısalırsa hepsi normale döner diye düşünüyorum.,7.0,7.0,7.0,1604097685
Iyı.,8.0,8.0,8.0,1604097686
Tadı yok ekmek sert.,4.0,4.0,4.0,1604097686
Good.,10.0,10.0,7.0,1604097686
Değişmez lezzet öncü farkı gerçekten orjinal kaliteli dürüm.,10.0,10.0,10.0,1604097686
Nerdeyse her gün söylüyorum ama bu sefer özenilmemişti bekletilmişdi sanırım ve geç geldi :(.,6.0,6.0,5.0,1604097686
Döner içine bence soğan domates maydanoz girmeli ama genede güzel.,10.0,10.0,8.0,1604097686
Lavaşı biraz kuruydu.,6.0,6.0,7.0,1604097686
Güzeldi kurye skntisi vardı yazdığım nota çok dikkat edilmemiş gerisi iyidi.,7.0,10.0,10.0,1604097686
Her zaman öncüden yerim fakat 2 seferdir tavuklar hep yanık geliyor.,10.0,10.0,4.0,1604097686
Fena değil.,8.0,8.0,8.0,1604097686
"Baba böyle bi lezzet olamaz, hız desen dışardaydım benden önce gelmiş. Hijyen mükemmel. Nazar değmesinn :).",10.0,10.0,10.0,1604097686
Tam 1 saatte getirdiler önceki siparişim 20dk içinde gelmişti.,1.0,8.0,8.0,1604097686
Jdkdk.,10.0,9.0,9.0,1604097686
Enson 10 gün önce verdim daha lezetliydi ama bugün yediğime pişman oldum patates çiğ falan di yane iyi değil.,6.0,10.0,2.0,1604097686
Tadıda çalışanlarıda muazzam bir işletme. Özellikle kuryeleri sipariş hiç geciktirmiyor.,10.0,10.0,10.0,1604097686
Soğuk geç geldi kötü.,1.0,1.0,1.0,1604097686
13. 28de yola çıkan paketim 14. 52de elime ulaştı kuryenin değişmesi lazim kargoyla yollasaniz daha hızlı gelirdi tabiki yemekte buz olmuş bu süre zarfında.,1.0,5.0,2.0,1604097686
Çok lezetli biraz çabuk çıkılsa 10 numara.,5.0,8.0,10.0,1604097686
Bütün gece miğde yansami geçirdik ayıp ya biraz insan özenir de yapar döneri kapatın öncü döneri.,1.0,1.0,1.0,1604097686
Muy bueno.,10.0,10.0,10.0,1604097686
Hızlı ve lezzetli.,10.0,10.0,10.0,1604097686
"Etler pişmemişti, yenilcek durumda değildi. Sepsertti. Direk çöpe gitti.. Sağolun.",1.0,1.0,1.0,1604097686
Lezzetli ve sıcak geldi.,10.0,10.0,10.0,1604097686
Lezzetli.,10.0,10.0,10.0,1604097686
Normal geldi servis iyidi ama tavuk dürümü ne kadar kötü yapabilirseniz o kadar kötü yapmışsınız. Tavuk bu dürüm için kesildiğini görseydi kahrından ölürdü. Bi tavuk dürüm yapmak bu kadar zor olmamalı malzemeleri bana yollasaydınız kendim yapar yerdim be.,7.0,9.0,3.0,1604097686
Öncü dönerden çok memnun kaldım herkese tavsiye ederim.,10.0,10.0,10.0,1604097686
Başarılı.,10.0,10.0,10.0,1604097686
Çok yavaş getiriyolar.,1.0,8.0,7.0,1604097686
Hızlı ve lezzetli. Gerçekten de lezzette öncü :).,10.0,10.0,10.0,1604097686
3 puani hiz icin verdim. Lezzet hic yok. Yedigün istedim pepsi ginderdiler. Yemek karti ile oducem diye belirttim gelen kurye bende pos makinesi yok dediler. Menunun yaninda tatli var fakat kasik yok neyle yicez. Kardeşim madem hizmet veriyorsunuz lezzeti servisi gectim az ozenin ya.,3.0,1.0,1.0,1604097686
Ne zaman sipariş versem hep soğuk geliyor siparişler birikme den siparişe çıkmıyorlar.,1.0,1.0,1.0,1604097687
Hızı çok iyiydi 15dk ya geldi. Lezzet olarak da güzeldi.,10.0,8.0,10.0,1604097687
Tamam o halde ben bu kadar mı zor bir şey yok ki benim için çok teşekkür ederim canım benim ya da meslek yüksekokullarının ilgili programlarına devam edebilirler veya bu alana en yakın programların uygulandığı meslek yüksekokuluna ek puanları ile yerleşebileceklerdir merhaba ben sizden haber bekliyo.,1.0,1.0,1.0,1604097687
Kuryenin 50 kuruşu yokmuş.,7.0,5.0,8.0,1604097687
Sıcak geldi fakat qr kod ile ödeme yapacağımı söylememe rağmen yapamadım.,7.0,7.0,7.0,1604097687
Cok yavaşlar.,1.0,10.0,8.0,1604097687
"Çok geç geldi, buz gibiydi.",1.0,1.0,1.0,1604097687
Güzel.,5.0,9.0,9.0,1604097687
Dürüm hayatımda yediğim en kötu dürüm olabilir soğuktu yaninda gelen patatesler sogumustu ha bide gunun tatlisi diye 50krlik puding yolluyorlar şaka gibi almayin aldırmayın.,1.0,1.0,1.0,1604097687
20 tl zam gelmiş 1 tl fazla aldılar. Bir daha da vermem sipariş.,1.0,1.0,7.0,1604097687
Güzeldi teşekkürler.,10.0,10.0,10.0,1604097687
Turşu daha çok olabilir.,8.0,8.0,8.0,1604097687
Çok hızlı ve lezzetli.,10.0,10.0,10.0,1604097687
Yemin ederim sırf o yakışıklı kuryeniz için sipariş veriyorum kaç gündür o gelmiyor gerçekten yaptığınız ayıp.,1.0,1.0,1.0,1604097687
Yavaş.,1.0,1.0,1.0,1604097687
Tat neden bu sefer kötüydü anlamadım.,10.0,5.0,1.0,1604097687
Domates koymayin dememe ragmen doldurmuslar notlar okunmuyor.,10.0,10.0,5.0,1604097687
Dürümün biri sırf kıkırdaklardan oluşmuş gibiydi.,10.0,10.0,8.0,1604097687
"Bi gününüz birini tutmuyor o neydi öyle, nimettir sonuçta.",1.0,4.0,4.0,1604097687
Perfecto.,10.0,10.0,10.0,1601467941
Çok soğuk geliyor.,1.0,9.0,4.0,1601467941
Çok soğuk geliyor.,1.0,8.0,7.0,1601467941
Soguk ve ilgisiz geldi içine deri ve kemik tarzı şeyler koymayın dediğim halde koydunuz yazıklar olsun.,1.0,1.0,1.0,1601467941
Sony sincap.,10.0,10.0,10.0,1601467941
Acıkınca kafam öncüye gidiyo.,10.0,10.0,10.0,1601467941
Tadını bu sefer güzel değildi sanırım zam da gelmiş.,10.0,1.0,1.0,1601467941
Ccok gec geldii zaman zaman hız degisiyor.,7.0,8.0,8.0,1601467941
Bu gün gelen kurye arkadaşın ismi neydi bilmiyorum ama cidden güler yüzlü sizin yaptığınız hatayı kendi yapmış gibi özür diliyo.,10.0,10.0,10.0,1601467941
Good.,8.0,8.0,8.0,1601467941
Good.,8.0,8.0,8.0,1601467941
Efsane ama hız yavaş.,4.0,9.0,10.0,1601467942
Çok güzel soslu ve harika lezettliydi ama biraz geç geldi. Geç gelmesi dışında başka bir olumsuz tarafi yoktu gayet güzel.,9.0,10.0,10.0,1601467942
Lezzetli.,10.0,10.0,10.0,1601467942
Yemek saatte geldi buz kuranıma.,1.0,1.0,1.0,1601467942
Son siparişimde çok memnun kaldım. Sırf sosu için her gün yiyebileceğim bir döner.,9.0,9.0,10.0,1601467942
Her seferinde 1 saati geçkin gonderiyorlar ve aradığımda konuşmamı ağzıma tıkayıp teli kapiyorlar. Kelime bile edemiyorum. Bu çalışanlar öncü döner e leke sürüyor.,1.0,1.0,4.0,1601467942
Et ve lavaş yanmıştı hep burayı tercih ederim ama bu siparişi beğenmedim.,4.0,9.0,4.0,1601467942
Ticket pos u yok diye insanlardan nakit istiyorsunuz.. Pos cihazı yoksa siparişi iptal edin o halde bizde başka yerden sipariş verelim..,9.0,1.0,10.0,1601467942
Çok geç geliyor.,1.0,1.0,1.0,1601467942
Güzeldi.,10.0,10.0,10.0,1601467942
"Güzeldi ve hızlıydı, teşekkürler.",10.0,10.0,10.0,1601467942
Gerçekten harikaydı ellerinize sağlık.,10.0,5.0,10.0,1601467942
Muhteşem tat burda hazırlanıyor olarak gözükse de 10-15 dakika içinde geldi siparişim. Ama keşke poşeti acamayacagim şekilde baglamasaydiniz :(.,10.0,7.0,10.0,1601467942
Hızı bu sefer çok iyiydi 20 dkda geldi her zaman geç gelen sipariş. 1 saat 20 dakka civarı beklediğimi bilirim. Servis neden 5 özellikle belirttim turşu koyun içine diye malesef salatalık turşusu yoktu içinde.,10.0,5.0,10.0,1601467942
Aşırı geç geldi en az 1 30 saat 5 6 defa sipariş verdim hep aynı ve içerisinde mayonez başkada bişey yok basmışlar mayonezi.,1.0,1.0,3.0,1601467942
"Et iskender aşırı derecede çok yağlıydı, etler çok kalın kesilmişti. Dürümde bile etler kalın olduğu için ısırılmıyordu.",9.0,1.0,1.0,1601467942
Çok lezetlii.,8.0,10.0,10.0,1601467942
Mükemmel.,6.0,10.0,10.0,1601467942
Good.,8.0,8.0,8.0,1601467942
Good.,8.0,8.0,8.0,1601467942
Sos aşiri çok olmuş ikinci siparişim aynı sos aynı tat ama bıraz sosu azaltırsanız iyi olcak galiba ama tat olarak güzel. Teşekkürler pasaport pizzadan.,10.0,10.0,9.0,1601467942
Iyı.,8.0,8.0,8.0,1601467942
Hep erken getiriyorlardı bu kez getirdiler. Neyse ki kola soğuk ve dürüm hala sıcaktı. Gelen kurye de yoğunlun durumu izah ederek telafi edeceklerini söyledi. Aksiliklere rağmen lezzeti yerindeydi.,5.0,9.0,9.0,1601467942
Hersey muhteşemdi tskler.,10.0,10.0,10.0,1601467942
Gönderdiğiniz yemek çok soğuktu zaten bir saatte geldi.,1.0,1.0,1.0,1601467942
İskender yedim. Fiyatına göre gayet güzeldi. Teşekkür ederim.,9.0,9.0,9.0,1601467942
Pişman oldum.,1.0,1.0,1.0,1601467942
Hızdan malum soğuktu döner bir de rica ediyorum biraz daha fazla biberiye.,6.0,7.0,7.0,1601467942
Her şey çok iyiydi. Devamlı sipariş vereceğim.,10.0,10.0,10.0,1601467942
Lavaşın bir kısmı yanmıştı onun dışında problem yok.,8.0,8.0,6.0,1601467942
Dürüm soğuk ve eksik geldi.,6.0,1.0,1.0,1601467942
Yavaş ve soğuk.,1.0,2.0,1.0,1601467942
Hayatımda yediğim en güzel döner.,10.0,10.0,10.0,1601467942
"Lezzet olarak iyiydi, ancak 1 saat 25 dakikada geldi. Bir daha sipariş edersem belki lezzeti için yoksa o kadar beklemeye de değmez.",1.0,9.0,9.0,1601467942
Mutlukente 50 dk de geldi buna ragmen yemekler guzel ve sicakti.,8.0,10.0,10.0,1601467942
Tam tamına verdiğim sipariş saatinden 1 saat sonra getirdiler soğumuştu.,1.0,5.0,7.0,1601467942
Gelmesi bir saat sürdü onun dışında gerek servis gerekse lezzet 10/10.,6.0,10.0,10.0,1601467942
"Döner soğuktu, kredi kartı ile ödeme seçtiğim halde pos cihazı getirilmemişti, ilk siparişimde böyle değildi, kalite düşmüş.",8.0,5.0,6.0,1601467942
Bol sos bol mayonez dedim ama çok kuruydu döner. Notları dikkate alın lütfen.,8.0,9.0,5.0,1601467942
1. 5 saate geldi 10 dk lık yere.,1.0,1.0,1.0,1601467942
 favorim.,10.0,10.0,10.0,1601467942
"Gebzenin tavuk döner konusunda en iyisi diyebilirim, bozmayın böyle devam :).",10.0,10.0,10.0,1601467942
Gayet hızlı ve doyurucuydu. Tesekkurler.,9.0,9.0,9.0,1601467942
Bir buçuk saat sonra geldi sipariş buz gibi ve tadı kötüydü sipariş vermeyin verdirmeyin.,1.0,1.0,1.0,1601467942
Good.,8.0,8.0,8.0,1601467942
İçinde döner diye bisey yok adeta döneri koklatmışlar ekmeğe. Ekmek hamur olmuştu. Siparişler o kadar geç geliyor ki bi gün önceden sipariş verirseniz açlıktan ölmemiş olursunuz.,1.0,1.0,1.0,1601467942
Keşke tavuk döner koysaydınız biraz full patates geldi içi. Patates dürüm yedik.,1.0,1.0,1.0,1601467942
 super.,10.0,10.0,10.0,1601467942
Et döner diye kavurma atmışsınız içine döner dediğin ince kesim olur kuşbaşı olmaz.,8.0,6.0,1.0,1601467942
Ekmeği çok sert.,7.0,6.0,6.0,1601467942
Valla gebzede öncünün üstüne dönerci tanımıyorum.,10.0,10.0,10.0,1601467942
Notuda dikkate almışlar gayette hızlı geldi gerçekten müthişdi.,10.0,10.0,10.0,1601467942
Gerçekten ellerinize emeğinize sağlık hızlı ve lezeet liydi.,10.0,10.0,10.0,1601467942
10 numara.,10.0,10.0,10.0,1601467942
"Gerçekten eski lezzeti yok, sos yoktu resmen sımsıkı sarılmış lavaş yedik resmen, hızlarının hakkını yiyeöem.",10.0,5.0,3.0,1601467942
Lezzet güzel ancak yoğunluktan ötürü hız yavaş.,5.0,5.0,9.0,1601467942
Lezzete diyecek bir şeyim yok ama servise 4 verdim cünkü kurye arkadas su sürecte maskesiz bana teslim yapması gözüme battı bu kurye gibi duyarsız dikkatsiz insanlar.,8.0,4.0,9.0,1601467942
Ehh.,8.0,6.0,6.0,1601467942
Asansörümüz bozuk olduğu için getiren arkadaş 5 kat çıkmak zorunda kaldı. Lezzet ortaydı ama çok hızlı geldi. Getiren arkadaş hakkını helal etsin...,10.0,10.0,8.0,1601467943
Güzeldi.,10.0,10.0,10.0,1601467943
"Kurye arkadaş çok kibardı teşekkür ediyorum, iyi çalışmalar.",10.0,10.0,10.0,1601467943
"Yürüyerek çarsıya kadar gelseydim, paket şipariş olarak alıp yine yürüyerek eve dönseydim daha hızlı olurdu.",1.0,10.0,10.0,1601467943
Güzeldi.,7.0,8.0,9.0,1601467943
Çok lezzetli.,10.0,10.0,10.0,1601467943
Geç gelen sipariş 1 saatte geldi üstüne kıkırdak çıkması :) almayın aldırmayın.,1.0,1.0,1.0,1601467943
İlk defa hızlı geldi hayret ettim. Lezzeti zaten güzel bu yüzden vaz geçemiyoruz zaten.,10.0,10.0,10.0,1601467943
Hızlı teslimat. Lezzetli ve eksiksiz geldi. Teşekkürler.,9.0,9.0,9.0,1601467943
Ellerinize sağlık çok güzel olmuş ve sıcak geldi böyle devam etmeniz dileğiyle telefonla sipariş alan arkadaşlar anlayışlı ve kibarlar tskr ederim gerçekten.,10.0,10.0,10.0,1601467943
Neredeyse 1 saat bekledim gelmesi çok uzun sürdü. Kola yerine ayran getirdiler. Lezzeti aynıydı güzeldi.,5.0,3.0,9.0,1601467943
Çok lezetli ve hızlı teşekürler.,10.0,10.0,10.0,1601467943
Klasik öncü lezzeti tek kelimeyle harika. Elinize sağlık.,9.0,9.0,10.0,1601467943
Et dürüm yerine tavuk döner getirdiler. İlettiğim gibi et döner ve de tatlı yolladılar gerçekten çok lezzetli ve iyi bir müessese patronunu gerçekten çok takdir ettim ve de kuryesi çok içten ve cana yakın biri her konuda helal olsun.,10.0,10.0,10.0,1601467943
Guzel.,10.0,10.0,10.0,1601467943
Gayet lezzetli.,10.0,10.0,10.0,1601467943
Ellerinize sağlık öncü gebze şubesi hızlı ve sıcak geldi.,10.0,10.0,10.0,1601467943
Kuruydu döner beğenmedim.,7.0,4.0,1.0,1601467943
Güzeldi.,10.0,10.0,10.0,1601467943
Çok geç geldi soğumuştu ve sosu sadece anlatmışlar. İçine koymamışlar.,3.0,5.0,5.0,1601467943
Good.,8.0,8.0,8.0,1601467943
Good.,8.0,8.0,8.0,1601467943
Mükemmel bir lezzet tavsiye ederim herkese.,10.0,10.0,10.0,1601467943
Kesinlikle şiddetle öneriyorum hem anlayışları için hemde hatay usulü soslu vazgeçilmez lezzetim olan döneri olsun rica etmiştim kardeşime puding gönderir misiniz diye onlarda bizi kirmayip iki tane göndermişler allah razı olsun.,10.0,10.0,10.0,1601467943
1 saat yemek. Mi beklenir.,1.0,1.0,1.0,1601467943
On numara beş yıldız.,10.0,10.0,10.0,1601467943
İçine döner koysaydınız iyiydi.,10.0,5.0,1.0,1601467943
Çok geç geldi 1 saatten fazla sürdü ama tadı fena değildi sıcak olsa daha güzel olurdu.,1.0,8.0,8.0,1601467943
On numara.,10.0,10.0,10.0,1601467943
