comment_text,comment_speed,comment_service,comment_taste,comment_time
Afiyet olsun.,10.0,10.0,10.0,1606678397
Her şey mükemmeldi.,10.0,10.0,10.0,1606419197
"Gayet güzel ve lezzetliydi, iyi pişmişti. Tavsiye ediyorum.",10.0,10.0,10.0,1606332797
Ayran patlamış her yer ayran içindeydi ayrıca yediğim en kötü tavuk olmuş. Bidaha yenmez ilk yorumumun böylesi beter bişey için olacağını hayal etmezdim.,7.0,1.0,1.0,1605900797
Restoranın dekoruna bayıldım işletme hakkını vermiş abi hayırlı işler olsun kolay gelsin.,10.0,10.0,10.0,1605900797
Mükemmel ötesi herşey çok taze ve lezzet çok iyi yenisiniz sepette korkarak siparis verdim ama bundan sonra sizdeyiz elinize sağlık kolay gelsin.,10.0,10.0,10.0,1605900797
"Usta biz her yerden pilav yedik ama bu kadar iyisini görmedik. Hız lezzet den ziyade o nasıl bir servis tabağı, nasıl bir hijyen.. Valla helali hoş olsun çok sevindi böyle güzel bir firmanın faliyete geçmesine. Artık gönlümüz rahat. Fevkaladenin fevkinde:).",10.0,10.0,10.0,1605814397
