comment_text,comment_speed,comment_service,comment_taste,comment_time
Çorba ve tavuk şiş dürüm enfes tam bir fiyat performans restoranı.. Açıkça söyleyeyim bu fiyata bu kadar güzel yemek beklemiyordum hem hızlı hem sıcak geldi porsiyonlar gayet yeterli ve çok lezzetli ellerinize sağlık umarım kalitesini hiç bozmaz bundan sonra favorim burasıdır nett.,10.0,10.0,10.0,1603896741
Tam 2 saat sonra geldi.,1.0,5.0,5.0,1603896741
Adana süperdi. Teşekkür ederim.,7.0,9.0,10.0,1603896741
Adam sınız süper elinize sağlık indirimli olsa da hepsi ful eksik yok teşekkürler elinize sağlık.,10.0,10.0,10.0,1603896741
Helal olsun güler yüzlü kurye. Lezzetli ürün. Ucuz hesap.,10.0,10.0,10.0,1603896741
"Gayet güzel bir işletme, teşekkürler.",9.0,10.0,10.0,1603896741
Güzel.,10.0,10.0,10.0,1603896741
Tavuk adana dürüm söyledim maalesef yiyeyemedim lavaş sırılsıklamdı.,10.0,8.0,2.0,1603896741
Hızlı geldi ancak kuzuşiş tamamiyle yağşiş idi. Joker indirimi geldi diye sevinip güzel bişeyler yiyelim dedik binpişman olduk.,7.0,2.0,2.0,1603896741
"Fiyata oranla tavuk miktarını yeterli bulmadım, domatesli ekmek yiyor gibi hissettim fazla sulu geldi bana.",9.0,9.0,7.0,1603896741
Teşekkürler.,10.0,9.0,10.0,1603896741
Fiyat lezzet çok iyi. 100100 tavsiye.,10.0,10.0,10.0,1603896741
Çok lezzetli.. Elinize sağlık.,10.0,10.0,10.0,1603896741
Servis güzeldi hızlı geldi ama lezzet konusunda çok iyi değildi ama yine de acken yenilebilir.,10.0,10.0,5.0,1603896741
Ef sa ne! Adana dürümler rüyama giriyor..,10.0,10.0,10.0,1603896741
Kuryenin maskesi yoktu!,10.0,1.0,9.0,1603896741
Çift lavaş istemiştim ama tek lavaş geldi içinde malzemeleri çok az.,10.0,10.0,7.0,1603896741
Öğle arasında sipariş verdim. Öğle aram bittikten sonra geldi. Buz gibi olmuştu sipariş. Siz üzgün müsünüz bilmiyorum ama ben üzgünüm.,2.0,3.0,5.0,1603896741
Daha doyurucu olabilir.,9.0,8.0,8.0,1603896741
Lavaşı yumuşamış ve hamur olmuştu ama onun dışında tadı çok güzel.,10.0,10.0,8.0,1603896741
Fiyat performans efsane ayrıca çok hızlı geldi.,10.0,10.0,10.0,1603896741
