comment_text,comment_speed,comment_service,comment_taste,comment_time
Efsane olmuş. Çok teşekkür ederim.,10.0,10.0,10.0,1606526482
On nımara.,10.0,10.0,10.0,1606526482
Etlikti evimde de burdaki evimde de vazgeçilmecim tüm çalışanlara teşekkür ederim.,10.0,10.0,10.0,1606440082
Köftesi ve yaprak kanadı çok çok güzeldi. Ama tavuk adana dürümü beğenmedim birde midye dolma çok soğuktu dondurucudan çıkarıp getirmiş gibiydi. Kabuğunun üstü pek iyi temizlenmemişti lezzeti fena sayılmazdı.,10.0,10.0,8.0,1606440082
Çiğ gönderilen yemekler filan filan.,1.0,1.0,1.0,1606353682
Soğuktu genel olarak ve arkadaş beğenmedi adanayı. Tavuk dürüm iyiydi.,8.0,7.0,6.0,1606353682
"Başka bir yerden sipariş verdim, 1 saat 15 dakika geçti gelmedi. İptal ettim buradan söyledim. 10 dakika olmadan getirdiler. 11 puan olsaydı hızına 11 verirdim. Paketleme gayet iyi tüm ürünler sıcak geldi. Lezzeti de ortalamanın üzerindeydi. Teşekkürler etlik dürüm.",10.0,10.0,9.0,1606353682
Kofte ekmekte cok ama cok az kofte vardı.,10.0,2.0,7.0,1606267282
"Sipariş içerisinde domatesli ve domatessiz adana dürüm vardı ancak dürümler domatesli geldi. Domatese alerjisi olan arkadaşım aç kaldı, bilgilerinize.",7.0,3.0,8.0,1606267282
Kötü.,1.0,1.0,1.0,1606267282
Üç dürüm de lezzetliydi ellerinize sağlık aylar önceden bir tane patlamış ayran gelmişti dün de ne hikmetse ikram ayran geldi helaliniz var hayırlı işler bol kazançlar.,10.0,10.0,10.0,1606267282
Fiyatı uygun mükemmel bir yer çok teşekkürler.,10.0,10.0,10.0,1606267282
Soguk gönderım dısında olumsuz birşey yoktu lezizdi.,10.0,10.0,8.0,1606180882
1 saat sonra geldi.,1.0,1.0,1.0,1606180882
Fiyatına göre oldukça iyi.,10.0,10.0,10.0,1606180882
Maalesef bu sefer çok beğenemedim. Dürümü andırıyor ama dürüm diyemem.,10.0,9.0,7.0,1606180882
Köfte ekmek siparişi vermiştim çok beğendim. Köftelerin aşırı tuzlu olmaması soğan ve yeşillikle ekmeğin içindeki harmanı harikaydı. Tavsiye ederim.,8.0,10.0,10.0,1606094482
Berbat önceden pişirilip kenarda bekletiyorsunuz gelince hemen ısıtıp gönderiyorsunuz kuru gekiyor ve soğuk eti belli yani bu bir çözüm deil böyle musteri kaybedersiniz hiç begenemddim.,9.0,1.0,1.0,1606094482
Midyeleri kucuktu.,8.0,7.0,6.0,1606094482
"1 saat de geldi, ama corba sicakti ve güzeldi.",7.0,9.0,9.0,1606094482
Gelen çorbalar içilmeyecek durumdaydı. Dürümler de buz gibiydi.,1.0,1.0,1.0,1606094482
Parasına değiyor.,10.0,10.0,10.0,1606094482
Hep kikirdakli geliyor bana.,10.0,8.0,7.0,1606094482
Cok gec geldigi icin sogumaya yakın ve lezzetsizdi. Ayrıca yedigim en kücük porsiyon dürümdü. Kısacası ilk ve son siparisim oldu.,1.0,3.0,3.0,1606008082
Hızlıydı. Hızlı olmasına rağmen biraz soğuktu. Lezzeti gayet yerinde.,9.0,9.0,9.0,1606008082
"Pişmemiş köfte, içinde tavuk olmayan tavuk dürüm ve taştan kumdan yenmeyen bayat midye. Kısacası olumlu tek yanı belirtilen sürede getirmeleri. Not: turşu ve hazır ayran gayet tüketilebilir lezzetler.",10.0,1.0,1.0,1606008082
Öğlen sipariş verdim akşam dükkana gelip paket aldım efe beyle sohbetim oldu kendisi çok efendi tam bir beyfendi kaybetmeyin o çocuğu sırf o var diye dükkana gelip bişeyler aldığım olmuştur.,10.0,10.0,10.0,1606008082
"Dürümü çok beğenmedim, kebap kuru geldi bana ama 10dk da hemen yetişti.",10.0,9.0,7.0,1606008082
Çok hızlı gelmesine rağmen siparişim soğuktu baya ve sertti.,10.0,9.0,7.0,1606008082
Teşekürler bu tat için.,10.0,10.0,10.0,1606008082
Mercimek çorbası harika.,10.0,10.0,10.0,1606008083
Tertemiz hakkıyla yapıyorsunuz elinize sağlık.,10.0,10.0,10.0,1606008083
"Tavuk şiş ve sütlaç gaaayet iyiydi. Direkt fiyat performans lokantası, 7 tl ye yiyebileceğiniz en iyi sütlaç diyebilirim.",10.0,10.0,10.0,1606008083
Acayip hızlılar ve adanaları leziz.,10.0,10.0,10.0,1605921683
Sadece midye siparişi verdim gelmesi uzun sürmedi ama midyesi güzel değildi.,10.0,8.0,3.0,1605921683
Güzel.,10.0,10.0,10.0,1605921683
"Sicacik geliyor, hizli, fiyatida iyi daha istenir.",10.0,10.0,10.0,1605921683
Soğuk geldi dürümler.,7.0,6.0,3.0,1605921683
Tavuktan adana güzel ama biraz daha fazla olabilir.,10.0,9.0,10.0,1605921683
Kötü.,1.0,1.0,1.0,1605921683
Lezzetliydi.,10.0,10.0,10.0,1605835283
Lezzetli ancak ilk kez soğuk geldi.,9.0,5.0,9.0,1605835283
"Çok geç geldi, soğumuştu. Üzüldüm.",3.0,8.0,6.0,1605835283
"1. 5 porsiyon deyince tek dürüm, et miktarı artıyor diye düşünmüştüm. Gerçekten 1. 5 sarma dürüm gönderiyolar.",10.0,10.0,9.0,1605835283
İyi.,10.0,10.0,10.0,1605748883
"Hız, servis, lezzet 10/10.",10.0,10.0,10.0,1605748883
Her zamanki gibi harikaydı.,10.0,10.0,10.0,1605748883
Çoğu zaman orda da yerim efe bey çok ilgiliydi kendisine teşekkür ederim.,10.0,10.0,10.0,1605748883
İç malzemesi azdı ve soğuk geldi onun dışında güzeldi.,7.0,9.0,7.0,1605748883
Adana dürüm karnımı çok ağrıttı.,9.0,9.0,8.0,1605662483
Çiğ gönderdiler kendilerine whatsappdan attım fotgrafı dönmediler.,7.0,7.0,1.0,1605662483
Adana bir miktar çiğ ve lezzetsizdi onun dışında tavuk şiş gayet güzeldi.,9.0,9.0,8.0,1605662483
"Kuzu şiş dürüm çok iyi, biber turşularınız bombastik. Fazladan istedim getirmişsiniz, yaptığım yemeğe atmayı düşünüyorum... Sadece şunu ekleyebilirim, lavaşlarınızı daha kaliteli alabilirsiniz. 2 siparişimde de orta kısmında bükülme hissettim. İlkinde kırılmıştı bunda kırılmadı ama gidiciydi...",10.0,10.0,9.0,1605662483
5 gündür burdan yiyorum adamlar yapıyor.,10.0,10.0,10.0,1605662483
Porsiyonlar küçük içinde az malzeme var.,10.0,10.0,7.0,1605662483
"Kurye maske takmıyordu, pos cihazında temassız özellik yoktu. Onun haricinde tavuk şiş lezzetliydi ama bir tanesi doyurmadı.",8.0,2.0,8.0,1605662483
Lezzet güzel ancak porsiyonlar çocuk menü.,6.0,3.0,7.0,1605662483
Hepsi harikaydı ama servis istemediğim halde sürekli servis yolluyorsunuz. Biber istemeden biber yollamayın lütfen. Onun için kırıyorum puan.,10.0,8.0,10.0,1605576083
"Dürümün kutuda gelmesi güzel işinize olan saygıyı gösteriyor. Lavaşlar çok ince çift söylememe rağmen pek etkili olmadı, biberler bence değişmeli, tavuk adana denemek istedim içeriği çok zayıftı tad almadım fiyatı artırıp içinin kalitesini artırabilirsiniz. Elinize sağlık.",8.0,8.0,8.0,1605576083
Köfte benim tarzım değilmiş. Benim tarzım şaşmazdaki bizim köfte tarzı. Sizinkiler ev köftesi gibi değil. Lastik gibi. Tabi ki puan kırmıcam bunu da seven vardır. Önceki yağlı dürümler için 10 10 10.,10.0,10.0,10.0,1605576083
"Tam 2 saatte geldi, 1, 5 saat boyunca yolda gozukuyordu. Haliyle butun durumler buz gibiydi.",1.0,5.0,4.0,1605576083
İyi.,10.0,9.0,10.0,1605576083
"Joker de söyledik fiyatına göre güzel. 2 tanesi 25 tl biraz yeşilliği boldu ama normal. Lavaşı gerçekten beğendim, kendi lavaşları.",8.0,8.0,8.0,1605576083
Fiyat performans gayet iyi lezzetli.,10.0,10.0,10.0,1605576083
Abi şu dürmleri kağıt a biraz az satın yaa kağıt ı çıkarana kadar sinirden söylüyorum hem iştah olmaz hemde doğaya zarar vermeyiz kağıt in yarısını kullanın elinize sağlık yemekler lezzetli.,10.0,7.0,9.0,1605576083
Fiyat lezzet hız on numara.,10.0,10.0,10.0,1605576083
Tavuk şişleri mükemmel aynı zamanda fiyat performans ürünü.,10.0,10.0,9.0,1605576083
Çorbayı poşetten içtik.,9.0,1.0,8.0,1605576083
Yaklaşık olarak 80 dakikada ulaştı elimize. Yemekler dolaptan çıkmış gibiydi. Çorba akmıştı. Her seferinde mutlu ederken bu sefer üzdü...,1.0,7.0,3.0,1605576083
Dedikleri süreden baya önce geldi tad konusunda on numara.,8.0,8.0,8.0,1605489683
"Hız iyi, servis iyi ama tavuk şişteki tavuğun tadı bir garipti. Adananın tadı iyiydi. İkisinin de miktarı azdı. Tamam fiyatına göre eyvallah ama bu kadar küçük de gelmez diye tahmin etmiştim.",10.0,8.0,6.0,1605489683
İi.,10.0,10.0,10.0,1605489683
"Porsiyon biraz küçüktü, lezzet ve teslimat hızı mükemmel.",10.0,10.0,9.0,1605489683
Teşekkürler.,10.0,10.0,10.0,1605489683
Lezzet konusunda kesinlikle tercih edilebilir fakat siparişimin eksik gelmesi çok üzücü yemeğim bittiğinde anca geldi...,5.0,5.0,8.0,1605489683
Dana önce de sipariş verdim geç geldi ama kurye çok güler yüzlüydü. Dün gece verdiğim sipariş yine geç geldi ve kurye önceki kurye değildi. Hiç güler yüzlü değildi sanki zorla getiriyormuş gibi. Köfteler ve adanalar soğuktu.,1.0,4.0,5.0,1605489683
"Tklayıp siparişi verdim kapı çaldı neredeyse, en hızlı servis deneyimimdi. Öylesine sipariş vermiştim ama bundan sonra yazdım burayı, fiyat-lezzet performans olarak da iyi.",10.0,9.0,9.0,1605489683
Gayet lezzetli.,10.0,10.0,10.0,1605489683
Fiyatı uygun ve güzeldi ancak çok küçüktü. Doyamadım.,10.0,8.0,8.0,1605489683
"Hız ve servis konusunda gayet istenilen düzeydeydiler. Dürümlerin yanında gelen biber turşusu bence acı değildi hem de dürümle beraber rahat yenebilecek biber türü değillerdi. Cin biberi daha uygun oluyor. Ciğerin ve kıyma kebabın yumuşak olması gayet güzel, fakat yine de içinde acı hiç yoktu.",9.0,9.0,8.0,1605489683
Hem lezzet olarak hem fiyat olarak iyi.,9.0,9.0,9.0,1605403283
Çok hızlı geldi ve köfteler gerçekten lezzetliydi. Teşekkürler :).,10.0,10.0,10.0,1605403283
Bahçelinin 1 numaralı kuryesi burda.,10.0,10.0,10.0,1605403283
10 dakika olmadı söyleyeli hemen getirdiler gayet lezzetliydi ve pişmişti ellerinize sağlık teşekkürler.,10.0,10.0,10.0,1605403283
Tavuktan adana istedim ilk defa çok güzeldi. Hatta sanırım küçük ayran kalmamış büyük ayran koymuşlar çok teşekkürler.,10.0,10.0,10.0,1605403283
İndirime rağmen içi boldu.,10.0,10.0,10.0,1605403283
Midyenin tadi sanki icinde mazot var gibiydi...,8.0,7.0,5.0,1605316883
Gayet güzeldi... Ayran da getirmişlerdi... Emeklerine sağlık.,10.0,10.0,10.0,1605316883
Hızlı ve lezzetli köfteler. Denemeyen pişman olur.,10.0,10.0,10.0,1605316883
Normalde yorum yazmıyorum ama gerçekten memnun kaldım ilk defa sipariş verdim hız lezzet her şey gayet güzel aman bozulmasın.,10.0,10.0,10.0,1605316883
Şiş ve midye olması gerektiği gibi.,10.0,9.0,7.0,1605316884
Dürümler zaten güzel de sütlaç da güzel.,10.0,10.0,10.0,1605316884
Onnnnnnn.,10.0,10.0,10.0,1605230484
Basarili.,10.0,10.0,10.0,1605230484
Kötü.,1.0,3.0,1.0,1605230484
En mukemmel yemeği yiyebileceginiz tek adres..,10.0,10.0,10.0,1605230484
Hayatımda daha kötü bir dürüm yemedim.,10.0,1.0,1.0,1605144084
Yaprak kanat daha güzel pişilebilirdi. Adananızmçok güzel çünkü.,10.0,10.0,10.0,1605144084
"Siparişim çok hızlı geldi, çok lezzetli ve sıcaktı. Çok memnun kaldım. Emeğinize sağlık.",10.0,10.0,10.0,1605144084
Fiyat performans olarak iyi.,9.0,9.0,9.0,1605144084
Tavuk dürüm güzeldi.,10.0,7.0,8.0,1605144084
Çok iyi teşekkürler.,10.0,10.0,10.0,1605144084
Herşey güzel geldi elinize sağlık.,10.0,10.0,10.0,1605144084
Fena değil.,10.0,10.0,8.0,1605144084
Çok beğendik tapu kadastro genel m.,10.0,10.0,10.0,1605057684
Midyeler çok büyük ve lezzetliydi. Fiyatına oranla yiyebileceğiniz en iyi ve büyük midyelerden. Servis daha özenli olsa kusursuzdu.,9.0,8.0,9.0,1605057684
Hayatımda yediğim en kötü nudgettı diyebilirim hatta bi tanesini yedikten sonra çöpe atmak zorunda kaldığım..,8.0,8.0,3.0,1605057684
Gecelerin iyisi.,9.0,8.0,8.0,1605057684
Dürüm küçük biraz büyütürseniz efsane olur mevcut fiyata göre.,10.0,10.0,10.0,1605057684
Valla çok açtım lezzetli mi degil mi bilmiyorum.,8.0,10.0,10.0,1605057684
"Müptela oldum adanaya, hele 7, 5 tl ye güveçte sütlaç bence show.",10.0,10.0,10.0,1605057684
Adana dürüm güzeldi fakat çorba berbattı...,10.0,10.0,8.0,1605057684
İlk kez böyle tatsız bir adana dürüm yedim. Önermiyorum.,5.0,5.0,1.0,1605057684
Bir soyleyen bi daha soylemesin diye acilmis bir isletme sanirim.,7.0,1.0,2.0,1605057684
Çok güzeldi.,10.0,8.0,10.0,1605057684
21 yaşındayım doğma büyüme adanalıyım adanada yediğim adanadan hiçbir farkı olmayan tek yersiniz eline sağlık usta.,10.0,10.0,10.0,1605057684
Tavuk sis çok güzeldi.,10.0,10.0,10.0,1605057684
Tavuğunda koku vardı daha önceki siparişlerimde böyle bi problem yaşamamıştım umarım bi daha olmaz.,10.0,10.0,1.0,1604971284
Süper hizli geldi. Lezzeti de gayet iyiydi.,10.0,10.0,10.0,1604971284
İkinci siparişim. Hızlı geliyor. Özellikle benim gibi çorba severler için bu çok önemli. Ayrıca yorumlar dikkate alınıyor. Ellerinize sağlık. Bol kazançlar dilerim.,10.0,10.0,10.0,1604971285
Teşekkürler.,9.0,9.0,9.0,1604971285
Oldukça kaliteli.,10.0,10.0,10.0,1604971285
Çok güzeldi.,10.0,10.0,10.0,1604971285
Çok soğuktu.,1.0,1.0,1.0,1604884885
Hem lavaşı hem dürümü başarılıydı. Denenmeli diyorum.,10.0,10.0,10.0,1604884885
Midye biraz kurumuştu onun dışında herşey güzel.,10.0,10.0,7.0,1604884885
Çift lavaş parası ödememe rağmen tek geldi ama lezzetli olduğu için puan kırmadım.,10.0,10.0,10.0,1604884885
"Fiyat performans restoranı. Tavuk şişi doyuyur, adanası lezzetlidir. Sadece gece 3-4 sonrası sipariş verirken iki kere düşünün.",10.0,10.0,9.0,1604884885
Orta.,1.0,1.0,1.0,1604884885
Hem uygun fiyatlı hemde lezzetli ve çok geç saatlere kadarda açık bir restoranda aradığım herşey sizde var teşekkürler.,10.0,10.0,10.0,1604884885
Fiyat performans olarak tavuk suyuna çorba lezzetli tavsiye ederim özellikle öğrencilere.,9.0,9.0,9.0,1604798485
"Hayatımda yediğim en kötü dürümdü. İnanılmaz kötüydü. Kesinlikle tavsiye etmiyorum. Lezzetini geçtim, hassas bir mideniz varsa sakın sipariş vermeyin.",5.0,1.0,1.0,1604798485
"Yedikten sonra merakla sayfayı yeniledim ve 22. Dakikada bitirmiştim o kadar hızlı geldi inanamadım. 25 indirim döneminde de fiyatlarına zam yapıp aynı kapıya getirmeyen nadir yerlerden. Lezzetine de bitiyorum. Dürüm, ekmek arası yemek için hayal mekanlardan. Ellerinize sağlık çok teşekkürler :)))).",10.0,10.0,10.0,1604712085
Öğrenci işi..,8.0,8.0,8.0,1604712085
Cok hizliydi ama soguktu.,10.0,8.0,8.0,1604712085
Çok güzeldi ellerinize sağlık.,10.0,10.0,10.0,1604712085
Tuzsuz ve baharatsız.,10.0,10.0,8.0,1604625685
Orta seviye.,5.0,5.0,5.0,1604625685
I ya.,8.0,10.0,6.0,1604625685
Baya iyi.,10.0,10.0,10.0,1604625685
"Kurye abi 8 dakikada getirdi, vallaha helal olsun ) elinize sağlık.",10.0,10.0,10.0,1604625685
Yemek adana sis ama dometisli sis geldi yazık be. Kardeşim allah hesabını soracak insan göndermeye utanır ya servis getiren arkadaş teşekkür ediyorum ama lokanta berbat evinize o parayı helal diye mi gotiruyir sunuz acaba.,10.0,1.0,1.0,1604539285
Daha önce de sipariş vermiştik. Güzeldi. 1. 5 saatte minnet rica ile getirdiniz yemeğimizi.. Elinize sağlık ama kurye problemini çözmeniz gerekli.,1.0,6.0,8.0,1604539285
Murat bey tessekurler.,10.0,10.0,10.0,1604539285
Öncelikle siparişi getiren murat beye ilgisinden dolayı teşekkür ediyorum yağmurda o kadar ıslanmadan rağmen sipariş gayet sıcaktı.,10.0,10.0,10.0,1604539285
Fiyat performans.,10.0,10.0,10.0,1604539285
Oldukça geç ve soğuk geldi.,1.0,1.0,1.0,1604452885
Çok soğuktu lavaşı patlamıştı notum göz önünde bulundurulmamıştı. Kısaca vasattı son kez söyledim.,7.0,5.0,4.0,1604452885
Ekmekler yanmış lezzeti kötü.,8.0,8.0,4.0,1604452885
Hızlı servis gerçekten güzeldi elinize sağlık gönül rahatlığıyla alabilirsiniz.,10.0,10.0,10.0,1604452885
Güzel.,10.0,9.0,9.0,1604452885
O kadar para vermeye değmez. Beğenmedim çok geç geldi yemek.,3.0,7.0,3.0,1604452885
Serviste puan kırmamın tek sebebi çorbanın çok fazla dökülmesi ve yanına peçete konması ama gönlümden geçen 10 da 10 öyle bir hızla geldiki yemek ben bilgisayarı açıp oyuna girene kadar kapı çaldı ve bu 9 dk içinde oluyor siz düşünün.,10.0,9.0,10.0,1604452885
Biraz daha kısa sürede gelebilirdi 1saat bekledim siparisi.,2.0,10.0,10.0,1604452885
Lezzetli ve kaliteli ürünler sunan mükemmel ötesi diyebiliriz.. Tskler.,8.0,9.0,10.0,1604452885
"Siparişimiz 1 saat 20 dkda geldi, her şey çok soğuktu. Isıtıp yedik. Dürümlerini ve çorbalarını geliştirmeliler sütlaçları görece daha iyiydi.",2.0,6.0,5.0,1604452885
Lezzetliydi dürümler teşekkürler.,7.0,7.0,7.0,1604452885
Hız puan olarak 0 olsa verirdim çünkü 1 saati buldu servis normal ama lezzet olarak hiç tavsiye edilmez tavuk sanırım beklemiş bozulmuş gibi tadı değişikti tavuktan başka her şeye benziyordu zaten yemedik attık ve o gün aç kaldık o yediğimiz kısmı inşallah tavuktur.,1.0,1.0,1.0,1604452885
Kuzu şiş dürüm çok lezzetliydi bayıldım.,10.0,10.0,10.0,1604366485
"75 dkda geldi, yağı bile donmaya yaklaşmış bir adana dürüm yedim. İlk ve son siparişimdi.",2.0,6.0,1.0,1604366485
Midye dolma kötüydü.,8.0,7.0,5.0,1604366485
"Güzeldi ama çok soğuk geldi kurye dükkandan çıktıktan 35 dakika sonra teslim etti, hızı arttırmanızı tavsiye ederim, zaten sipariş verdikten sonra 1 saatte de getirmek çok yanlış, lezzet olarak öneririm puanları dikkate almanız için düşük verdim.",1.0,1.0,9.0,1604366485
Her şeyiyle 10 numara fakat ciğer şiş biraz yağsız ve kuru düzeltirseniz hergün sizdeyim.,10.0,10.0,10.0,1604366485
Teşekkürler.,10.0,10.0,9.0,1604280085
Herşey çok güzel fakat dürümlerin içindeki etler çok çok çok az. Bence artırmalısınız. Etler gerçekten incecikti.,10.0,10.0,10.0,1604280085
Midyelere el atmak da fayda var.,10.0,9.0,8.0,1604280085
Güzeldi.,8.0,8.0,8.0,1604280085
İki tane durum söylemiştim soğuk geldi. İcecegimide unutmuşlar bu yüzden geç geldi.,5.0,2.0,3.0,1604280085
Havadan daha soğuk dürüm...,1.0,1.0,1.0,1604280085
Teşekkürler.,10.0,10.0,10.0,1604280085
"Kuryeniz dünyalar iyisi bir insan. Paramı verdiğimde iki kağıt para arasında başka bir para kalmıştı ve tekrardan dönüp bana geri verdi. Sizin gibi insanlar hep varolsun. Dipnot, keşke param olsaydı ve size çok çok bahşiş verebilseydim kurye bey ama öğrenciyim..",10.0,10.0,8.0,1604280085
Severek yiyoruz.,10.0,10.0,10.0,1604280085
Böyle lezzetlerden uzak kalıyoruz mekan beşevler de ama adı niye etlik? Algılar diyor ki mekan etlikte6gelmex.,10.0,10.0,10.0,1604280085
Not okunmuyor.,1.0,1.0,1.0,1604280085
Adana kebabin a ve d si var anasi kayıp küçücük resmini cektim yok bulamadım. Ucuza verirken çalmak size zarar verir. Ustun kaliteli olmaya bilir ama belli bir seviyede olmalı ucuz yapalim derken seviyesiz olmaya gerek yok. Resmini yükledim gelenin.,3.0,1.0,1.0,1604280085
"Soğuk geldi, paketleme harikaydı fakat tadından da cok memnun kalmadık, daha iyi olabilir.",9.0,10.0,8.0,1604193685
Notları okuyun gerisi güzel!,8.0,10.0,10.0,1604193685
Çorba ve ekmek arası köfte aldık. Nota sıcak olmasını istediğimi söylemiştim ve sıcak geldi. Tadları da gayet güzeldi.,7.0,9.0,9.0,1604193685
Yorumlarda beğenmedim ve doymadım diyor çoğu insan fiyat olarak porsiyon güzel doymuyorsan bir buçuk söyle lezzete diyeceğim bir şey yok gerçekten çok lezzetli bir adana dürüm yedim ve ilk defa notlarıma bu kadar dikkat edildiğini gördüm güzeldi genel olarak...,10.0,9.0,10.0,1604193686
Porsiyon küçük hele tek lavaş hiç doyurmaz. Ama gayet lezzetli elinize sağlık.,10.0,9.0,10.0,1604193686
Tadı çok iyiydi keşke cin biberden biraz falz koysalarmış.,9.0,8.0,10.0,1604193686
Mükemmel. 11 olsa 11 verirdim.. Servis de hız da tadı da mükemmeldi.,10.0,10.0,10.0,1604107286
Soğuk olması haricinde bir sorun yoktu.,7.0,10.0,8.0,1604107286
Porsiyonlar küçük ancak fiyat performans olarak kötü değil.,10.0,9.0,7.0,1604107286
Fiyatına göre lezzet.,8.0,8.0,7.0,1604107286
Çorbalar sıcak ve lezzetliydi.,10.0,10.0,10.0,1604107286
"Adana biraz az pismisti.. Ama genel olarak tavuk sis de o da cok lezzetli, tesekkurler.",10.0,10.0,9.0,1604107286
Her açıdan muazzam!,10.0,10.0,10.0,1604020886
Lezzetli.. Elinize sağlık.,10.0,10.0,10.0,1604020886
Porsiyonlar düşük ve ince dürümler. Lavaş dağılıyordu.,8.0,4.0,4.0,1604020886
Tam bur f\p ürünü tavsiye ederim.,8.0,10.0,8.0,1604020886
Adana dürüm ve ciğer dürüm bayattı. Midye de pilavdı. Yemedik.. Asla tavsiye etmiyorum.,3.0,3.0,2.0,1604020886
Sipariş 1. 5 saat sonra ve buz gibi geldi. Hayatımızda yediğimiz en berbat dürümdü. Bir insanın yaptığı işe saygısı olur.,1.0,1.0,1.0,1604020886
"Oldukça beğendim. Sumaklı soğan dürümlerde adeta gereklilik, bunun farkında olmaları güzel. Adana dürüm gayet başarılı. Porsiyonlar konusundaki şikayetler tamamen yanlış değil ama çok az da değiller. Fiyatı düşününce her türlü diğer yerlerden daha iyi oluyor sadece porsiyon olarak bakarsak.",10.0,9.0,10.0,1604020886
Ömer beye hız için teşekkür ederim.,9.0,9.0,8.0,1604020886
Guzel.,10.0,10.0,10.0,1603934486
Dürümlerin içi biraz boş gibiydi ama çok lezzetliydi.. Teşekkürler.,9.0,9.0,10.0,1603934486
Arkadaslar gece yemek söylemeyin. Tavuk şiş ve adana söyledik. Bayat ve kalanları göndermişler. Hiç mi dürüst esnaf yok. Gece aç kaldık. Çöpe attık.. Tavsiye etmiyorum.,3.0,3.0,2.0,1603934486
Gerçekten çok güzel ve lezzetli teşekkürler elinize sağlık.,10.0,10.0,10.0,1603934486
Lezzet cok kötü.,1.0,1.0,1.0,1603934486
Genelde herşey için 10 puam verdim ancak en son gelen siparişim resmen buz gibiydi yinede lezzet olarak gerçekten güzel bir dürümcüsünüz sumaklı soğanı dürümün içinde herkez bilmez çok özel bir lezzet katar bunun için de teşekkür ediyorum.,10.0,10.0,10.0,1603896740
Adana çok küçük eğer kuş mideli değilseniz 5 tane yeseniz de doymazsınız.,7.0,7.0,7.0,1603896740
3kisi yedik üçümüz de mide krampları geçiriyoruz saatlerdir bize uymadı.,8.0,2.0,1.0,1603896740
"Yüzde 25 indirimle aldım ve fiyatına göre çok iyiydi, fiyattan bağımsız da güzeldi. Sütlaç 10 numara.",8.0,9.0,10.0,1603896740
Adana durumu cok begendim fakat tavuk sis durumu de bir o kadar begenmedim. Hatta yarisini yiyebildim sadece. Cok agir olmus.,10.0,10.0,7.0,1603896740
Başarılı...,10.0,10.0,10.0,1603896740
Elinize sağlık.,10.0,10.0,10.0,1603896740
Mükemmel bir adana dürüm..,10.0,10.0,10.0,1603896741
"İlk defa sipariş verdik ama çorba, dürümler ve sütlaç muhteşemdi.. Kesinlikle tekrar sipariş vereceğiz. Teşekkür ederiz.",8.0,10.0,9.0,1603896741
Birazcık soğuktu ama verdiğim fiyata değerdi. Bu akşam yine isteyeceğiim. Kolay gelsin.,10.0,10.0,9.0,1603896741
Çok lezetli ve güzeldi.,10.0,10.0,10.0,1603896741
Yağlı dürüm harikaydı. Çocukluğumdan beri yememiştim. Reesmen anılarım canlandı. Ustacum ellerine sağlık.,10.0,10.0,10.0,1603896741
Güzeldi sıcaktı.,8.0,8.0,8.0,1603896741
Soğuktu ama lezzetli.,5.0,8.0,8.0,1603896741
Guzeldi.,10.0,10.0,10.0,1603896741
Gayet güzel.,10.0,10.0,10.0,1603896741
"Geç geldi, tavuk gerçekten az ama adanası güzel ama adananın da eti çok değil.",4.0,10.0,9.0,1603896741
Hocam ellerinize sağlık gecenin 4ün de bile özenli ve lezzetli hazırlanmış ve göndermişsiniz..,10.0,10.0,10.0,1603896741
Olmadi.,1.0,1.0,1.0,1603896741
Malesef ürünler soğuk ve cok yavas geldi.,5.0,5.0,5.0,1603896741
Servis inanılmaz hızlı fiyata göre gelen yemeğe şok oldum. Çok güzel paketlenmiş ürün.,10.0,10.0,10.0,1603896741
"Yemekler biraz geç gelsede efsane yemekleriyle (adana dürüm, tavuk şiş, sütlaç) bize geç kalma sorununu felan unutturdu. Bol kazançlar.",10.0,10.0,10.0,1603896741
Gecenin köründe kurtarıcı gibi yetiştiler.,10.0,10.0,10.0,1603896741
Çok yağlıydı 1. 5 porsiyon demişler içine serpiştirmişler dalga geçer gibi ilk ve sondu ben beğenmedim yağlıydı gerçekten 3 puanı içten verdim kötülemek amacım yok kurtarmıyosa önce kaliteyi sonra fiyatı arttırın.,7.0,5.0,3.0,1603896741
Gayet basarili.,10.0,10.0,10.0,1603896741
Adam adammmmmm. 25 indirime göre gerçekten kaliteli.,10.0,10.0,10.0,1603896741
Çoh hojdur. Lakin durumun içine koydugunuz domatesler lavasi fena yumuşatıyor abi bilginiz olsun. Dost acı soylermiş. Bana bı acılı dürüm.,10.0,10.0,10.0,1603896741
Adana aldık teşekkürler.,10.0,10.0,10.0,1603896741
"Şu ana kadar gelen en sıcak siparişti, herşey çok iyiydi.",9.0,10.0,10.0,1603896741
"Adana tavuk dürüm aldık, tadı çok güzel ama tavuğu yok gibiydi ve doyurucu olduğunu düşünmüyorum.",6.0,9.0,8.0,1603896741
Yemek siparişi verildikten 10 dakika sonra yolda çıktığı gösterildi. Ancak sipariş 70 dakika sonra geldi. Yemek yola çıkmadan yola çıkmış gibi yapmışlar. Lezzet berbattı. 70 dakikayı abartmıyorum.,1.0,3.0,1.0,1603896741
Porsiyonlar inanılmaz küçük fiyat performans berbat.,7.0,6.0,4.0,1603896741
Cok iyi.,10.0,10.0,10.0,1603896741
Fiyat hizmet lezzet hepsinden çok memnun kaldık. Teşekkürler.,10.0,10.0,10.0,1603896741
Hep indirim olsun.,10.0,10.0,10.0,1603896741
Çok hızlı geldi ama kuzu şiş biraz daha pişseydi keşke 10 dk daha beklerdik yinede iyiydi...,10.0,9.0,9.0,1603896741
Kral ya işyerinde beklettim biraz ama hala güler yüzlü.,10.0,10.0,10.0,1603896741
"Lavaşın yumuşak olması sıkıntısı çözülürsr çok daha iyi olur, yine de lezzetli.",10.0,10.0,10.0,1603896741
İyiydi her şey.,10.0,10.0,10.0,1603896741
Buz gibiydi.,7.0,2.0,2.0,1603896741
Siparisim tam olarak 1 saat 50 dakikada geldi. Kuryenin gerekcesi cok uzak olmasiydi. Yemek sepetinden siparis verirken restoran adresine bakmiyorum. Uzaksa arayip iptal edebilirsiniz. Hepsi buz gibi olmustu. Ayrica durumlerin uzerine hicbirsey yazilmamis icinde ne var diye parcalamak zorunda kaldik.,1.0,3.0,4.0,1603896741
