comment_text,comment_speed,comment_service,comment_taste,comment_time
Pizzalar çok lezzetli mmmmm nefisss.,10.0,10.0,10.0,1606513104
Çok iyiydi.,10.0,10.0,10.0,1606513104
Lezzet ve hızda sıkıntı yok ancak yanında sos göndermemiştiniz onu da geçtim en azından şu pandemi zamanında içeceğin yanına pipet koymayı keşke ihmal etmeseniz.,8.0,1.0,8.0,1606426704
Çok iyi..,10.0,10.0,10.0,1606340304
Herzamanki gibi kaliteli ve lezzetli.,9.0,9.0,9.0,1606253904
Çok güzeldi ellerinize sağlık.,10.0,10.0,10.0,1606253904
Begenmedik.,1.0,1.0,1.0,1606167504
Pizzadan nefret eden bana pizzayı sevdirdiniz.,10.0,10.0,10.0,1606167504
Teşekkürler.,8.0,8.0,8.0,1606167504
Pizza konusunda en iyisi..,9.0,10.0,10.0,1606167504
Tavukjalapeno ikilisi harika.,10.0,10.0,10.0,1606081104
Çok tatlu bir kuryeniz var. Sıcak ve hızlı geldi teşekkürler.,9.0,9.0,8.0,1606081104
Çok hızlı geldi kurye arkadaşa teşekkürler.,10.0,10.0,10.0,1606081104
Hızlı gelmesine rağmen buzz gibiydi pizza açıkçası bu kadar yüksek bi fiyat ödeyince insan kaliteli bir şey yemeyi bekliyor.,9.0,9.0,6.0,1606081104
İyiydi...,10.0,10.0,10.0,1605994704
"Ufak bir kusur aradım, bulamadım. Dilimlerin kesimi bile güzeldi.",10.0,10.0,10.0,1605994704
Hızlı servis lezzetli yemek daha ne olsun. Tebrikler.,10.0,10.0,10.0,1605908304
"Eskiden cokomania daha dolu dolu cikolatali olurdu, simdi kenarlari tamamen bos. Yine sahanesiniz, ama cikolataya eskisi gibi doymak isterim :).",10.0,10.0,9.0,1605821904
Diğerlerine kıyasla daha lezzetli.,10.0,10.0,10.0,1605389904
"Herzaman aynı lezzet, hızlı servis.",10.0,10.0,10.0,1605303504
"Hem hizli hem sicakti. Ama puanimin çogunu, siparisimi getiren bey için veriyorum. Inanilmaz guleryuzlu ve nazikti :).",10.0,10.0,10.0,1605217104
Başarılı.,10.0,10.0,10.0,1605217104
İstediğim saatte geldi. Pizzaya bayıldım. Kurye güler yüzlü ve kibardı ilk denememdi gerçekten beğendim teşekkürler :).,10.0,10.0,10.0,1605217104
Hızlı geldi sıcaktı.,10.0,10.0,10.0,1605130704
Cok iyi hizmet ve servis. Guler yuzlu teslimci ve sicak pizzaaa:).,10.0,10.0,10.0,1605130704
Servis lezzet mukemmel. Keyifle yedik...,10.0,10.0,10.0,1605130704
Mükemmel bir lezzete sahipti çok teşekkür ederim.,10.0,10.0,10.0,1605130704
Pizza hut yildiz subesiyle ikinci defa aynisi basima geliyor. Pizzayi paketlemeden once yenilebilir durumda mi diye kontrol edin.,10.0,6.0,5.0,1605044304
Lezzet hizmet çok iyiydi.,10.0,10.0,10.0,1605044304
Lezzet hizmet çok iyiydi.,10.0,10.0,10.0,1604957904
Hız ve servis güzel pizzası güzel.,10.0,10.0,10.0,1604957904
Lazanya bu sefer kötü geldi üzgünüm.,7.0,7.0,6.0,1604957904
Hala pizzaya peynir koymuyorsunuz. Reklamlariniz aldatici.,10.0,10.0,6.0,1604957904
Temassiz teslimat istemistik. Ama kapi hic calinmadi. Siparisin geldigini cok gec fark ettik.,7.0,6.0,8.0,1604957904
Servis elemanı çok kibardı. Servis de çok güzeldi.,10.0,10.0,10.0,1604871504
Lezzetini seviyorum.,10.0,10.0,10.0,1604785104
Çok başarılı.,10.0,10.0,10.0,1604785104
Ketcap mayonez islak mendik pecete yokdu.,9.0,6.0,9.0,1604785104
"Büyük boy pizza düşündüğüm gibi büyük değildi, sanırım siz de piyasa şartlarına uydunuz ve porsiyonda küçültmeye gittiniz.",10.0,8.0,8.0,1604612304
Ucuza yapacağız diye malzeme kullanmıyorlar.,9.0,8.0,5.0,1604612304
Fakir dostu pizza hut da olmasa şu ekonomide napacaz belli değil.,10.0,10.0,9.0,1604525904
Kuryeniz çok kibardı. Fakat pizza donmuş olarak geldi.,7.0,9.0,1.0,1604525904
Her zamanki gibi çok memnun kaldım. Zincir pizzacılar arasında gerçekten en iyisi olabilir.,10.0,10.0,10.0,1604439504
Eskisinden çok daha iyi.,10.0,10.0,10.0,1604439504
Malzeme koymayacakmış galiba sonradan bir kaç parça atalım demişler.. Pizzanın üstünde sadece pizza sosu vardı ve 4-5 adet sosis hamur yedim teşekkürler..,8.0,1.0,1.0,1604439504
Büyük boytr end pizza teslimat min 45dk ve doğal olarak ılık soğuk arası geldi keyif alamadık pizza konusunda hızlı teslimat çok ama çok önemlidir eskiden yarım saatte gelmezse bedava furyası vardı keşke tekrar geri gelse.,4.0,7.0,6.0,1604353104
Lazanyada sadece hamur ve sos yedim. Bence pizzadan devam edin.,9.0,8.0,5.0,1604353104
Emniyet bantı açık geldi pizza kutusunun.,10.0,1.0,10.0,1604353104
Mü-kem-mel! Çocukluğumuzda atakule pizza hutda yediğimiz pizzalar gibiydi. Ayrıca bir önceki siparişimizde yaşadığımız problemle ilgilendiği için muhittin beye de teşekkür ederiz.,10.0,10.0,10.0,1604266704
11 olsa 11 puanı hakediyor.,10.0,10.0,10.0,1604266704
Pizzada mahallenin en iyisi.,10.0,10.0,10.0,1604180304
Pizza çok güzeldi. Teşekkürler.,10.0,10.0,10.0,1604180304
Pizza hut üstüne tanımıyorum.,10.0,8.0,10.0,1604180304
Çok geç geldi soğuktu.,1.0,8.0,7.0,1604180304
22. 06 da sipariş verdim 23. 40 da elime ulaştı. İstanbuldan geldi heralde. Çünkü 23. 00 da restoranı aradığımda kuryeye veriyorum şimdi geliyor dedi 40 dakika sobra geldi. Siparişinizi alamadık şimdi hazırlıyoruz deseydi doğrusunu söylemiş olurlardı.,1.0,6.0,8.0,1604093905
Çok beğendim teşekkür ediyorum.,10.0,10.0,10.0,1604093905
Ketçap mayonez baharat koymalısınız. Bi peçete ıslak mendil bile yoktu.,10.0,5.0,10.0,1604093905
Çok iyi.,10.0,10.0,10.0,1604007505
"Pizza gayet lezzetliydi, sıcak gelmişti ve sanırım çokomania hastasıyıım teşekkürler.",10.0,10.0,10.0,1604007505
"Siparişim gayet sıcak, hızlı ve lezzetli geldi. Tekrar sipariş verilebilecek bir restoran.",10.0,10.0,9.0,1603921105
"20 dkda sıcacık geldi, zincir pizzacılar arasında son zamanlarda yediğim en iyisi, pizanın sosu da biraz daha lezzetlenirse 10 numara olur.",10.0,9.0,9.0,1603921105
Her şey mükkemmeldi hız ve lezzet hepsi muazzam servis zaten ayrı güzel.,10.0,10.0,10.0,1603921105
Hızlıydı ve güzeldi. Teşekkürler.,10.0,10.0,10.0,1603921105
"Siparişin zamanında gelmesi, pizzanın lezzeti ve çalışanların güler yüzü 10 üzerinden 10 puanı hak ediyor. Ellerinize sağlık.",10.0,10.0,10.0,1603883359
"Çok hızlı bir şekilde sıcak geldi, lezzeti de çok güzeldi.",10.0,10.0,10.0,1603883359
Bir önceki siparişim çok başarılıydı. Bu sefer gelen pizzada yanmış yağ kokusu ve tadı vardı.,8.0,8.0,2.0,1603883359
Başarılı.,10.0,10.0,10.0,1603883359
"Sıcak ve çok güzeldi, her zamanki gibi.",10.0,10.0,10.0,1603883359
"45 dkda geldi ve menüde yer alan çikolatalı dondurma yerine maraş dondurması vardı, onun dışında dürüm ve patatesler lezzetliydi.",7.0,7.0,8.0,1603883359
"Çok memnun kaldık. Sıcak, lezzetli ve bol malzemeliydi.",10.0,10.0,10.0,1603883359
Elinize sağlık..,10.0,10.0,10.0,1603883359
Mini cokomaniada cikolata hic yoktu nerdeyse.,9.0,5.0,7.0,1603883359
Malzemesi yine azdı pizzaya o kadar para veriyoruz bari malzeme koyun böyle devam ederse burdan söylemeyi keseceğim.,6.0,6.0,1.0,1603883359
Güzel ve fiyatlar çok uygun.,10.0,9.0,9.0,1603883359
Kurye çok iyiydi.,10.0,10.0,10.0,1603883359
Paket servislerde yediğimiz en güzel ve en sıcak pizzaydı. Pizzayı getiren kişi de çok nazik ve kibardı.,10.0,10.0,10.0,1603883359
Tadı çok lezzetli.,10.0,10.0,10.0,1603883359
Ellerinize sağlık..,10.0,10.0,10.0,1603883359
Kuryeniz çok iyi biriydi teşekkürler :).,10.0,10.0,10.0,1603883359
Yemeksepetini sirf pizza hut icin kullaniyorum. Her seferinde yemek sicacik geliyor ve ilgi alakalari kusursuz. Pizzalarin lezzeti de zaten muthis. Cok tesekkur ederim.,10.0,10.0,10.0,1603883360
Çok iyi..,10.0,10.0,10.0,1603883360
Sufle lezzetli olabilirdi ama yumurta kalıntıları üstündeydi bu da tadını değiştirmiş.,10.0,10.0,6.0,1603883360
Ben son derece memnunum. Hızlı geliyor ürünler iyi hazırlıyorlar. Paketçileri güleryüzlü.,10.0,10.0,10.0,1603883360
"Paket serviste bu kadar sıcak pizza yediğimi hatırlamıyorum, çok keyifliydi, teşekkür ederim. 1 tl farkla susam kenar lezzetini çok seviyorum.",10.0,10.0,10.0,1603883360
"Çok memnun kaldım. Sıcak, hızlı ve lezzetliydi. Uzun zamandır yediğim en iyi fast food pizzaydı gerçekten.",10.0,10.0,10.0,1603883360
Tam bu şekilde devam ederse en iyi şubelerden biri olabilir.,10.0,10.0,10.0,1603883360
Herzaman oldugu gibi.,10.0,10.0,10.0,1603883360
Hizmet çok iyi. Emeği geçen herkese teşekkür ederim.,10.0,10.0,10.0,1603883360
"Servise 10 verdim, pizzalar sımsıcaktı. Lezzetliydi ama belki tuz ve baharat daha güzel kullanılabilir. Hız da fena değildi. Kesinlikle uğraşılmış bir siparişti, teşekkür ederim.",9.0,10.0,9.0,1603883360
Ellerinize sağlık çok güzeldi.,10.0,10.0,10.0,1603883360
Servis süresi 20-30 dk yazmasına rağmen siparişim 1 saatte ve soğuk geldi. Soğuk olduğu için pizzanin lezzeti de etkilendi.,1.0,10.0,7.0,1603883360
Lezzetli ve fiyat uygundu tavsiye ederim..,10.0,10.0,10.0,1603883360
Kaşar peyniri donmuş olarak geldi. Bu konuda daha özverili olabilirler.,10.0,10.0,6.0,1603883360
Goodinho.,10.0,10.0,10.0,1603883360
Eski pizza hut lezzetine yakın bir noktada hızı süppper 15- 20 dk. Geldi.,10.0,9.0,9.0,1603883360
10 numara..,9.0,10.0,9.0,1603883360
Festival postasını aldım çok beğendim.,10.0,10.0,10.0,1603883360
Salçasi aşırı fazlaydi salça ekmek yermiş gibi hissettim.,10.0,5.0,4.0,1603883360
Pizzalar hariç bu aralar lazanyasını da severek yiyoruz.,10.0,9.0,10.0,1603883360
"Hizmet kalitesi yönünden özel bir gayret gösterdiklerini hemen her siparişimde farkediyorum, çok iyi bir yöneticisi olmalı, tebrik ediyorum. Susam kenar lezzetinin rakiplerine oranla oldukça hesaplı bir fiyatla sunulması ise bence çok akıllıca bir strateji.",10.0,10.0,10.0,1603883360
Her zaman mı iyi olur maşallah :)).,10.0,10.0,10.0,1603883360
Harika.,10.0,10.0,10.0,1603883360
Hamurun üzerine çok fazla sos kullaniyorsunuz. Yerken resmen soslu pizza yiyoruz ve hiç hoş değil.,9.0,9.0,5.0,1603883360
Lezzetliydi ve temassız teslimata dikkat edildi.,10.0,10.0,10.0,1603883360
Eski pizza hut nerde? Cok kotuydu uzgunum.,8.0,5.0,2.0,1603883360
"Margherita pizza favorimiz oldu, yan ürünler de kaliteli.",10.0,10.0,10.0,1603883360
Seviyoruz.,10.0,10.0,10.0,1603883360
Kurye cok düzgün biriydi.,10.0,10.0,8.0,1603883361
Paketçileri çok güleryüzlü. Kutuya dokunmamak için size aldırıyorlar gayet memnun kaldım.,10.0,10.0,10.0,1603883361
Baba o ne ya.,10.0,10.0,10.0,1603883361
Pizzayı getiren arkadaş çok kibar ve hızlıydı. Ellerinize sağlık.,10.0,10.0,10.0,1603883361
Hızlı geldi. Pizza çok lezzetliydi. Kurye de çok kibardı. Kaliteli işletmeniz için teşekkür ederiz.,10.0,10.0,10.0,1603883361
Efsane.,10.0,10.0,10.0,1603883361
Çok begendim.,10.0,10.0,10.0,1603883361
Elinize sağlık.,10.0,10.0,10.0,1603883361
Herşey çok güzeldi. Tatlı için ayrıca teşekkürler.,10.0,10.0,10.0,1603883361
"Kargocu arkadaş çok kibardı, ilgisi için teşekkürler.",10.0,9.0,9.0,1603883361
Kutu biraz bükülmüştü ancak pizza lezzetliydi ve hızlı geldi.,10.0,9.0,10.0,1603883361
Zamanında geldi ve çok lezzetli idi tavsiye ederim.,10.0,10.0,10.0,1603883361
Akdeniz daha güzeldi sankibu kez çok beğenmedim. Sucuklu ve ekstra pastırma söyledim o da tuzluydu. Midemize de dokundu.,10.0,10.0,7.0,1603883361
Pizzalar paketin icerisinde takla atmış gibi geldi tamam lezzetli ama bu şeklide pek hoş olmadı.,9.0,4.0,8.0,1603883361
Tsk.,8.0,9.0,9.0,1603883361
"Kuryeniz çok güler yüzlüydü, pizza da çok lezzetliydi. Çok memnun kaldık teşekkürler.",10.0,10.0,10.0,1603883361
Sarımsaklı ekmek ve peynirlim aldım ancak malzeme çok çok az kullanılmış sanki 2 küçük ekmeğe 20 vermiş gibiyim.,10.0,10.0,1.0,1603883361
"Her şey harikaydı. Cok hızlı geldi pizzalar, gayet de guzeldi.",10.0,10.0,10.0,1603883361
Hersdy mukemmeldi notumh dikkate alan e siparisimi bizzat teslim eden u e müdürü beyefendiye teşekkür ediyorum.,10.0,10.0,10.0,1603883361
Fiyatlarınızın çok artması dışında herşey güzel.,8.0,9.0,9.0,1603883361
Emniyet bandı açık geldi.,10.0,7.0,10.0,1603883361
Tavsiye.,10.0,10.0,10.0,1603883361
Her zamanki gibi çok lezzetliydi. Paketleme ve servis konusunda da hijyen kurallarını dikkate alıyorlar. Çok başarılı.,10.0,10.0,10.0,1603883361
Çok güzeldi.,10.0,10.0,10.0,1603883361
"Lazanya gayet guzeldi, sarimsakli ekmek zaten efsane :) getiren kurye arkadas da cok cok nazik ve guleryuzluydu. Cok tesekkurler.",10.0,10.0,10.0,1603883361
Fast food pizza için güzel.,9.0,9.0,9.0,1603883361
"Çok hızlı, sıcak ve lezzetli. Ellerinize sağlık.",10.0,10.0,10.0,1603883361
Harikaydı.,10.0,9.0,10.0,1603883361
"Hız, servis, lezzet, doyuruculuk her şey 10 numara.",10.0,10.0,10.0,1603883361
"Doritoslu pizza favorimiz, diğer pizzalarda çok lezzetli kesinlikle tavsiye ediyoruz. Ayrıca kuryenizin samimiyeti için teşekkürler.",10.0,10.0,10.0,1603883361
Her şey çok güzeldi.,10.0,10.0,10.0,1603883362
"Süper hızlı, süper lezzetli. Teşekkürler arkadaşlar...",10.0,10.0,10.0,1603883362
15 dakikada falan geldi sıcak ve aşırı lezzetliydi.,10.0,10.0,10.0,1603883362
Gayet iyi.,10.0,10.0,9.0,1603883362
"Kurye cok nazikti, pizza da gayet lezzetliydi cok tesekkurler!",10.0,10.0,10.0,1603883362
Çok lezzetliydi ve teslimat güzeldi.,10.0,10.0,10.0,1603883362
"Nerde o eski pizzalar. Peyniri yanmıştı, adeta mozerella değil de kaşar.",6.0,5.0,4.0,1603883362
"Acıkarın sucuğu da margarita da sarınsaklı ekmek de başarılıydı. Pizza siparişlerinde kuryeler genelde temassız teslimatı ciddiye almıyor ama bu sefer öyle olmadı. Kapıya bırakıldı bu benim için önemli bir kıstas, teşekkürler.",9.0,10.0,9.0,1603883362
Adamsınız adammmmm.,10.0,10.0,10.0,1603883362
Çok lezzetli 3.,10.0,10.0,10.0,1603883362
Pizza güzeldi ama sosu biraz fazlaydı sanki.,8.0,8.0,8.0,1603883362
Pahalı ama verdiğim paranın hakkını 10 üzerinden 7 karşılıyor.,10.0,10.0,10.0,1603883362
En iyi iki pizzacidan biri burasi. Bir cok gurme pizzacidan kat kat iyi.,10.0,9.0,9.0,1603883362
"Güzel, mideye inişi çok hızlı :).",9.0,8.0,8.0,1603883362
"Kurye arkadaş işini hakkiyla yapiyor. Güler yüz, tatlı dil. Süper.",10.0,10.0,10.0,1603883362
Sadece tek dilimde sosta bi yığılma olmuştu çok önemsenecek bişey değil 10 puandan kırsanız 9. 8 olur gayet güzeldi teşekkürler.,9.0,10.0,10.0,1603883362
Sıcacık geldi notlara dikkat ediliyor tartışmasız en iyi pizza hut şubesi.,10.0,10.0,10.0,1603883362
Gayet iyiydi ve hizliydi.,10.0,10.0,10.0,1603883362
"Pizza hut kalitesi tabii ki, teşekkür ederim, üstelik seçtiğim tek kişilik menüdeki pizza için incecik hamur seçeneği olmuyormuş bu yüzden menüde olan küçük boy pizza yerine orta boy gönderdiler.",10.0,10.0,10.0,1603883362
Ellerinize sağlık..,10.0,10.0,10.0,1603883362
Her şey güzel de tat yok be.,10.0,10.0,1.0,1603883362
Hem cok hizli hem cok lezzetli tebrikler. İki sipariste de ayni kalitede geldi.,10.0,10.0,10.0,1603883362
Sıcaktı lezzetli ve doyurucu idi.,10.0,10.0,10.0,1603883362
"Her şey mükemmeldi eksik tek bir noktaları yoktu, teşekkür ediyorum.",10.0,10.0,10.0,1603883362
Süper süper süper.,10.0,10.0,10.0,1603883362
Tavsiye ederim herkese. Daha önce farklı bir yerden alıyordum artık hep sizden alacağım çok beğendim.,10.0,10.0,10.0,1603883362
Kuryeniz on numara.,10.0,8.0,8.0,1603883362
"Gerçekten hızlı. Getiren arkadaş çok iyi, güler yüzlü, kibar. Paketleme güzel. Tad harika. Daha ne olsun. Teşekkürler. Bundan sonra sizinleyim.",10.0,10.0,10.0,1603883362
"Elim artık hiç başka bir pizzacıya gitmiyor, kurye abilerde çok iyi :).",10.0,10.0,10.0,1603883362
"Lütfen bu kalite ve lezzeti bozmayın. İlgili, samimi ve sipariş takibi yapan ender işletmelerdensiniz. Pizza hut ı eski günlerine döndürmüşsünüz. Teşekkürler.",10.0,10.0,10.0,1603883362
Orta boya göre son derece bol malzemeli ve doyurucuydu. Yanında tuz da gönderseydiniz harika olurdu.,9.0,10.0,9.0,1603883362
"Hızlı, lezzetli ve sıcak. Diğer şubelerin sizden öğrenecekleri çok şey var. Teşekkürler...",10.0,10.0,10.0,1603883362
Gayet güzeldi. Arkadaşlara teşekkür ediyorum.,9.0,9.0,9.0,1603883362
Pan hamurun eşi benzeri yok.,10.0,10.0,10.0,1603883362
Hızlı ve sıcacık ve çok lezzetli geldi. Kurye çok kibar ve güleryüzlüydü.,10.0,10.0,10.0,1603883362
Nice.,10.0,10.0,10.0,1603883362
Hızlı ve güzeldi. Kurye arkadas cok kibardı.,10.0,10.0,10.0,1603883362
Zamaninda geldi gayet lezzetliydi :).,10.0,10.0,10.0,1603883362
Öncelikle pizzam çok düzgün paketlenmiş şekilde geldi. Açtığımda yeni fırından çıkmış gibi sıcacıktı. Kurye arkadaş ise saygılı ve güleryüzlüydü. Her şey için teşekkür ederim.,10.0,10.0,10.0,1603883362
Teşekkürler.,7.0,7.0,7.0,1603883362
Siparişimiz hızlı ve sıcak geldi. Lezzeti harikaydı.,10.0,10.0,10.0,1601253616
Her şey güzeldi. Pizzalar sıcakcıktı. Teşekkürler.,10.0,10.0,10.0,1601253616
Güzeldi.,10.0,10.0,10.0,1601253616
Hızlı ve sıcak geldi.,10.0,10.0,9.0,1601253616
Gayet iyidi.,9.0,9.0,9.0,1601253616
"Harikaydı, çok teşekkürler.",10.0,10.0,10.0,1601253616
Pizza lezzetliydi ve hızlı geldi. Ayrıca teslimat temassız olsun seçeneğine dikkat edildi.,10.0,10.0,10.0,1601253616
Siparişim çok hızlı ve sıcak şekilde teslim edildi. Ayrıca pizzanın içindeki malzeler çok boldu.,10.0,10.0,10.0,1601253616
Çok lezzetliydi elinize sağlık.,10.0,10.0,10.0,1601253616
Bol malzeme hızlı teslimat teşekkürler.,10.0,10.0,8.0,1601253616
Herşey muhteşem fakat fiyatlar biraz artmış.,10.0,10.0,10.0,1601253616
Pizzalar harikaydı :)).,10.0,10.0,10.0,1601253616
Hız lezzet süper çok teşekkürler.,10.0,10.0,10.0,1601253616
"Pizzanın lezzeti sıcaklığı, kuryenin güler yüzü ve mekanın tekrar arayıp memnuniyeti sorması ilgilenmesi kısacası herşey mükemmeldi. Ellerinize emeğinize sağlık.",10.0,10.0,10.0,1601253616
"Hızlı, sıcak ve lezzetliydi.",10.0,10.0,10.0,1601253617
Her zamanki gibi süperdi.,10.0,10.0,10.0,1601253617
Herşey çok güzeldi teşekkürler.,10.0,10.0,10.0,1601253617
Gayet leziz.,10.0,10.0,10.0,1601253617
"Hızlı ve sıcak geldi, lezzet zaten çok iyi.",10.0,10.0,10.0,1601253617
Saat geç bile olsa sıcak ve lezzetli pizza getirmeniz.,10.0,10.0,10.0,1601253617
"Mukemmel hizmet, mukemmel lezzet.",10.0,10.0,10.0,1601253617
Servis çok hızlıydı.,10.0,10.0,10.0,1601253617
Sipariş tahminimiz sen hızlı geldi. Lezzet gayet iyi. Servis de iyiydi. Teekkurler.,10.0,10.0,9.0,1601253617
"Ankara da yediğim en güzel pizzalardan biri, servis de hızlı, her şey mükemmel, daha ne olsun.",10.0,10.0,10.0,1601253617
Eskiden süpersuprem yediğin de futbol topu kazanıyorduk.,10.0,10.0,10.0,1601253617
İyiydi güzeldi hoşdu.,10.0,9.0,10.0,1601253617
Çok teşekkür ederim çok beğendim.,10.0,10.0,10.0,1601253617
Cok gec geldi.,5.0,8.0,8.0,1601253617
13dk de geldi harikaydı.,10.0,10.0,10.0,1601253617
Kaliteli yemekler güler yüzlü kurye hızlı teslimat teşekkürler.,10.0,10.0,10.0,1601253617
Gayet başarılı.,10.0,10.0,10.0,1601253617
"Pizzalar süper, servis çok hızlı. Özellikle kurye arkadaşa teşekkürler.",10.0,10.0,10.0,1601253617
Her zamanki gibi mükemmel.,10.0,10.0,10.0,1601253617
Pizza sıcacık gelmişti teşekkürler.,10.0,10.0,10.0,1601253617
"Her şey çok güzeldi, teşekkürler muammer bey...",10.0,10.0,10.0,1601253617
Küçük pizza çok küçük.,10.0,10.0,8.0,1601253617
Kurye arkadas yeteri kadar hızlı geldiğini düşünüyorum eskisine nazaran pizza once ki siparislerimde peyniri kuru bir şekilde geliyordu ama bu sefer gayet istenilen kivamdaydi şubenin arayıp memnun kalıp kalmadığımı sorması cabası umarım bu şekilde devam ederler.,10.0,10.0,10.0,1601253617
Kuryeleri çok iyi bir o kadar da ürünleri müthiş.,10.0,10.0,10.0,1601253617
Çokomania harika.,10.0,10.0,10.0,1601253617
"Hersey cok guzeldi, pizzalari mukemmel.",10.0,10.0,10.0,1601253617
Maalesef pizzanın içindeki cips bayattı. Taze olsa gerçektek lezettli olabirdi. Diğer ürünler lezeetliydi ama bayat malzeme kabul edilemez.,9.0,8.0,5.0,1601253617
"Kelimeler kifayetsiz kalır. Hem sosu, hem hamuru, hem de kenarları efsaneydi. Çok teşekkürler.",10.0,10.0,10.0,1601253617
"Hızlı, sıcak ve lezzetliydi.",10.0,10.0,10.0,1601253617
Hızlı ve sıcak geldi. Kurye gayet nazikti. Her şey olması gerektiği gibi :).,10.0,9.0,10.0,1601253617
Hizli guvenilir ve lezzetli. Tek ricam pizzaya konulan ürünleri biraz daha fazla koymaniz.. İnanin size geri dönüsü daha iyi olacaktir. Tesekkurler.,10.0,10.0,9.0,1601253618
Pizzalarınız çok lezzetli ve sıcacık geldi özeniniz için teşekkür ederiz.,9.0,10.0,10.0,1601253618
"Hızlı, lezzetli ve sıcaktı.",10.0,10.0,10.0,1601253618
Cok cabuk geldi ve sicakti. Kuryeye guleryuzu icin ayrica tesekkurler.,10.0,10.0,10.0,1601253618
Hızlı sıcak eksiksiz ve lezzetli geldi paketleme de bi sorun yoktu ellerinize sadece pizza ve bi sürü ekstra söyledik yanında keşke biraz sos gönderseydiniz.,10.0,8.0,10.0,1601253618
Kurye işini iyi yapıyordu belli unutulan ürün önemli değil dememe rağmen tamamlayıp hatayı gidermek için çalıştı çok teşekkür ederim :).,10.0,10.0,8.0,1601253618
Gayet başarılı teşekkürler.,10.0,10.0,10.0,1601253618
Pizzalarınızı beğeniyorum umarım böyle devam edersiniz.,10.0,10.0,9.0,1601253618
Aşırı hızlı ve lezzetli.,10.0,10.0,10.0,1601253618
Paçanga böreğinin içinde pastırma göremedim. Tadı hiç güzel değildi.,6.0,6.0,1.0,1601253618
Mamamiaa...,10.0,10.0,10.0,1601253618
Is yerine getirilen lazanyanin yaninda ne bir catal ne de pecete vardi. Yemegin ortasinda kiymanin icerisinden kemik cikti ve midemin bulanmasiyla her seyi kaldirip cope attim.,10.0,1.0,1.0,1601253618
Güzeldi.,10.0,10.0,9.0,1601253618
Hamuru değiştirmişler süper olmuş...,10.0,10.0,10.0,1601253618
Teşekkürler.,10.0,10.0,10.0,1601253618
"Yazılan notlara çok dikkat ediyorlar, ellerinize sağlık çok teşekkürler.",10.0,10.0,10.0,1601253618
Güzeldi bu sefer nota da dikkat edilmişti.,9.0,10.0,9.0,1601253618
"Margarita o kdr pişmişki, üzerindeki peynir gelene kdr sertlesmiş taş gibi olmuş. Biraz az pişirin. Pizzanın peyniri yanana kadar pişirmeyin.",9.0,9.0,5.0,1601253618
"Hızlı geldi, servis iyiydi. Pizza sıcak ve çok lezzetliydi. Kesinlikle tavsiye ederim.",10.0,10.0,10.0,1601253618
Seviyoruz.,10.0,10.0,10.0,1601253618
Çokomania aşırı başarılı! Sufle eh.,9.0,9.0,7.0,1601253618
Elinize sağlık.,10.0,10.0,10.0,1601253618
Sadece sucuk ve mısırlı istememize rağmen başka şeylerde vardı sucuğu da azdı biber ve mantardan dolayı yenmedi.,1.0,1.0,1.0,1601253618
Yine kalite düşmeye başladı pizza üzeri ekstra malzeme koyulmamıştı normalde olan mısır bile yoktu beklemiş taze olmayan malzemeler de cabası.,9.0,6.0,3.0,1601253618
Sıcacık geldi teşekkürler.,10.0,10.0,9.0,1601253618
Seviyoruz.,10.0,10.0,10.0,1601253618
Çok iyi...,10.0,10.0,10.0,1601253618
Çok lezzetli.,9.0,10.0,10.0,1601253618
Güler yüzlü kurye hızlı teslimat güzel yemekler.,10.0,10.0,10.0,1601253618
Doritos sucuk efsane.,10.0,10.0,10.0,1601253618
