comment_text,comment_speed,comment_service,comment_taste,comment_time
Güler yüzlü servis çalışanına sahip olmanız çok güzel. Nazik insanlara hasret kalmıştık.,10.0,10.0,10.0,1606613931
Bol malzemos!,10.0,10.0,10.0,1606441131
İçinde turşu gönderiliyordu önceden artık sanırım getirilmiyor.,9.0,7.0,9.0,1606441131
"Sevgili muhittin usta çalışanları, pandeminin şu raddesinde kuryenizi maskesiz gönderemezsiniz. Değil teslimatta caddede gelirken bile hem kendi iyiliği hem çevredekilerin iyiliği için maske takması gerekiyor, resmi hale getirilmiş bir kural bu. Lütfen dikkatli olun.",9.0,1.0,9.0,1606268331
Gene efsaneydi gene çok güzeldi beğenmeyen arkadaşlar ağzının tadını bilmiyor.,10.0,10.0,10.0,1606268331
Sipariş geç gelmişti ve soğuktu. Lezzetli değildi. Kurye kibardı.,5.0,10.0,5.0,1606268331
Harikaydi.,10.0,10.0,10.0,1606268331
Harika harika.,10.0,10.0,10.0,1606095531
Iyı.,8.0,8.0,8.0,1606009131
"Her zaman bol malzemos )) mukemmelsiniz servisci arkadaşlar hem güleryuzlu hem mutevazi harika değerler, oradada yediğimde cok guzel derecede ilgi alaka.",10.0,10.0,10.0,1606009131
Notlara fazlasıyla dikkat edilmişti ve gece olmasına rağmen sıcacık taze gelmişti. Ellerinize sağlık.,10.0,10.0,10.0,1605922731
Turşu suyu poşete dökülmüştü peçeteler ıslak iyi paket olmayan sandviçler ucundan biraz ıslanmıştı fakat lezlet ve hız gayet iyiydi.,10.0,5.0,10.0,1605836331
Harikasınız sadece biraz pahalı.,10.0,10.0,10.0,1605836331
Yine mukemmeldi.,10.0,10.0,10.0,1605749931
Yemek çok iyiydi bayıldım hemde mert getirince süper hızlı geldi teşekkür ederim.,10.0,10.0,10.0,1605749931
Gayet doyurucu lezzetli notlar dikkate alınıyor.,10.0,10.0,10.0,1605749931
"Çok soğuktu, sucuğun yağları donmuştu o yüzden. Gidip yerinde yemek en güzeli.",1.0,7.0,7.0,1605663531
Ayvalıkta bile bu kadar içi dolu bir tost yemedim. Çok lezzetliydi ve malzemesi boldu. Sadece ekmeği biraz sert geldi bana.,10.0,10.0,10.0,1605577131
Sandviç ekmeği demiştim. Ama karışmış olabilir tabiki yinede iyiydi.,10.0,10.0,10.0,1605577131
Her zaman türkiyenin en iyisi. Her konuda kusursuz..,10.0,10.0,10.0,1605577131
Antalyada üstüne yok.,10.0,10.0,10.0,1605404331
İzmir çok iyii.,10.0,10.0,10.0,1605317931
Güzel degil.,1.0,1.0,1.0,1605231531
Eski tadını alamadım açıkcası...,8.0,8.0,5.0,1605231531
Tek kelimeyle mükemmel anlatmaya gerek yok.,10.0,10.0,10.0,1605231531
Tahminimden daha az sürede ve sıcacık geldi siparişim... Hizmet kalite lezzet ilk günkü gibi tek geçerim..,10.0,10.0,10.0,1605145131
Çeşme kumrusu çeşmeden yapılandan bile iyi.,7.0,7.0,10.0,1605058731
Antalyanın en iyisi. Ellerinize sağlık.,10.0,10.0,10.0,1605058731
Süper!,10.0,10.0,10.0,1605058731
Uzun suredir boyle lezzetli kumru yememistim. Ustanin eline saglik. Izmir eritme eritme ve gorali bir o kadar lezzetli ve malzemeler kaliteliydi (pembe renkli degildi :). Umari bu kaliteyi korurlar.,10.0,10.0,10.0,1605058731
İzmir eritme sipariş ettim sosisli sandviç geldi.,8.0,5.0,8.0,1604885931
Yolda gözükürken arayıp pastırmam kalmamış demek böyle bir şey varken de ayran yerine kola göndermek. İzmir çoooook iyiydi ama yapan ustanın emeğine yazık böyle hatalar :(.,1.0,1.0,10.0,1604799531
Ekmek yanık ve bulunduğu ortama yanık kokusu bırakacak kadar yoğundu. Gönderdiğiniz sandviç bu kokudan yenemiyordu. Çöpe attım. Tekrar tercih edeceğimi zannetmiyorum.,8.0,6.0,6.0,1604713131
Harikaydı.,10.0,10.0,10.0,1604713131
Malzemeleri bol.,8.0,9.0,8.0,1604626731
Paketin yanında karışık turşu olmalı.,10.0,10.0,10.0,1604540331
Çeşme kumru müthiş.,7.0,8.0,10.0,1604540331
İzmirde böyle güzel yapmıyorlar.,9.0,10.0,10.0,1604367531
"Yumurta az gibiydi, lezzet iyi, servis yapan arkadaş güler yüzlü.",8.0,8.0,8.0,1604367531
"Çok hızlı geldi, sıcak ve lezzetliydi. Yumurtalı çember ile karışık tost söyledik. Elinize emeğinize sağlık.",10.0,10.0,10.0,1604194731
"Paketçi arkadaş çok kibardi teşekkür ederim, eritme müko.",10.0,10.0,10.0,1604194731
Paketçi çok nazikti kibar davrandı evime kadar bıraktı ocaktaki arkadaş şor gibi olsada paketçiye teşekkürler.,10.0,10.0,10.0,1604194731
Baya güzel.,10.0,10.0,10.0,1603984185
Kumru muhteşem otesiydi ama fiyatı bir tık düşük olsa daha iyi olurdu o zaman her gün yiyebilirdim.,10.0,10.0,10.0,1603984185
Herşey çok güzeldi elinize emeğinize sağlık.,10.0,10.0,10.0,1603984185
Güzeldi.,10.0,10.0,9.0,1603984185
Şehrin en iyisi.,10.0,10.0,10.0,1603984185
Herzaman 10.,10.0,10.0,10.0,1603984185
Uzun zamandır müşterisi olduğum restorandan yediğim en kötü üründü. Daha önce hiç mor renkli sosis görmemiştim. Fiyatların artması ancak kalitenin düşmesi üzüyor.,10.0,9.0,1.0,1603984185
Hayatımda gördüğüm en iyi restoran mükemmel.,10.0,10.0,10.0,1603984185
Güzel lezzetli tavsiye ederim.,10.0,10.0,10.0,1603984185
Süperrr.,10.0,10.0,10.0,1603984185
Üstüne tanımam.,10.0,10.0,10.0,1603984185
Nice.,10.0,10.0,10.0,1603984185
İyi.,10.0,10.0,10.0,1603984185
Gecenin bir yarısı geldiğinde bile lezzetli geliyor. Eritme sparişlerinizde kağıdın peynire yapışmaması adına peyniri alt tarafa koymalarını rica edebilirsiniz.,9.0,10.0,10.0,1603984185
"Lezzeti gayet yerindeydi, oldukça hızlı geldi.",10.0,10.0,10.0,1603984185
"Yumurtalı çember sandviç ve karışık tost söyledim. Tost normal tost ama yumurtalı çember sandviç çok güzeldi kesinlikle tavsiye ediyorum. Ayrıca notlara dikkat ediyorlar. Elinize sağlık. (bazıları peynir kağıda yapışıyor demiş, yahu erimiş peynir nereye yapışacak, gülü seviyorsanız dikenine katlanın).",10.0,10.0,10.0,1603984185
İzmir eritmeniz çok güzel ve zaten artık imza ürününüz gibi bir şey ama paket serviste peynirin neredeyse tamamının kağıtta kalması tek kelimeyle hayal kırıklığı. Lütfen buna bir çözüm bulun çünkü 26 liranın 10 lirasını dişlerimle kağıttan kazımak zorunda kaldım.,7.0,1.0,9.0,1603984185
Notlarımı dikkate aldılar. En güzel lezzet. Uzun mesafe ve yanlışlıkla yanlış adres seçtiğimiz için diğer adresimize de getirdiler ve halen sıcaktı. Teşekkürler.,10.0,10.0,10.0,1603984186
Hızlı geldi ve sıcaktı. Tadı güzeldi kötü bir tad almadım. Joker olduğu için fiyat olarak da iyiydi.,9.0,9.0,8.0,1603984186
Mükemmel.,10.0,10.0,10.0,1603984186
Kaşarlı tostu muhteşemdi.,10.0,10.0,10.0,1603984186
Güzel ama izmirin içinde soslar biraz daha fazla olmalı.,9.0,10.0,10.0,1603984186
Yemeğinizi 1 saat sonra yemek isterseniz sipariş verebilirsiniz.,1.0,8.0,8.0,1603984186
Knbu.,10.0,10.0,10.0,1601354440
Çok leziz ve güzeldi.,10.0,10.0,10.0,1601354440
Turşu dedik ama olmadı bu sefer.,10.0,2.0,10.0,1601354440
Siparişim hızlı ve sıcak geldi gayet lezzetliydi.,9.0,9.0,9.0,1601354440
Enfes.,10.0,10.0,10.0,1601354440
Tavsiye ediyorum pişman olmazsınız.,10.0,10.0,10.0,1601354440
Baharat az.,10.0,8.0,7.0,1601354440
Dün gece sipariş verdim çok hizlidilar gelen kurye arkadaş güler yüzlü iyi biriydi allah hepinizden razı olsun.,10.0,10.0,10.0,1601354440
Huge! Very tasty. Great value.,10.0,10.0,10.0,1601354440
Tost gayet doyurucuydu.,10.0,9.0,8.0,1601354440
Çember sipariş verdim. Bana pastırmalı baska bir sey geldi. Paketleri kontrol edip göndermelisiniz.,10.0,10.0,1.0,1601354440
Teşekkürler.,10.0,10.0,9.0,1601354440
Kesinlikle antalyada daha iyisi yok...,10.0,10.0,10.0,1601354440
Birazcık daha sıcak gelebilir sanki :/.,10.0,10.0,10.0,1601354440
"Kaliteli malzeme, muazzam lezzet. Elinize sağlık.",10.0,10.0,10.0,1601354440
Beşıktaş.,10.0,10.0,10.0,1601354440
Elinize sağlık o kadar yoldan bile sıcak geliyor.,10.0,10.0,10.0,1601354440
O eski bol döküm eritme yok. Ekmek eskiden kapanmazdı şimdi doyurmuyor bile.,10.0,10.0,10.0,1601354440
"Antalyanin en iyi eritmesi burda yillardir heryerde yedim burdan iyisi yok, ama mekana giderseniz daha memnun kalirsiniz paket mekanin tadini vermiyor :d.",9.0,8.0,10.0,1601354440
Yazılan notları okuyun.,7.0,6.0,3.0,1601354440
Antalyadaki en iyi eritmeleri siz yapıyorsunuz hem de yıllardır. Kimse kusura bakmasın :) böyle devam edin elinize emeğinize sağlık.,10.0,10.0,10.0,1601354440
Çok beğendim.,10.0,10.0,10.0,1601354440
Turşu olmasin dediğim halde nota özellikle belirttim turşulu geldi onun dışında herşey güzel.,10.0,8.0,10.0,1601354440
Mükemmeldi. Hızları gerçekten iyi bu 3. Siparisimdi. Her seferinde yazdığım notlar da yapılmıştı gerçekten tebrikler.,10.0,10.0,10.0,1601354441
Çok yavaş ve buz gibi gelen yemekler.,1.0,1.0,1.0,1601354441
Kaşar eritme kumru çok güzeldi. Çok kaliteli işletmesiniz :).,10.0,10.0,10.0,1601354441
Dünyanın en iyisi.,10.0,10.0,10.0,1601354441
"Sayas peyniri yerine labne fikri de fena degilmis :) ekmek biraz daha kumru ekmegi olmaliydi ama, yine de tesekkurler, lezzetliydi.",10.0,10.0,10.0,1601354441
On numaraa.,10.0,10.0,10.0,1601354441
Puanı kırmadım ama bu sefer olmadı. Ekmeğin her yeri yanık halde geldi peynir bile yanıktı... :(.,10.0,10.0,10.0,1601354441
Çeşme kumrusu efsane güzel.,10.0,10.0,10.0,1601354441
Lokontada bir sıkıntı yok sıkıntı sende yemek sepeti 45 dk boyunca bir soru sorucak kimseyi bulamadım canlı bağlatıymış ne canlısı ya bi şey diyin ya ayıp lan dalga geciyosunuz insanla bir daha sipariş yok telefon acar isterim bu kadar kolay siz bi işe yaramıyorsunuz orda.,10.0,10.0,10.0,1601354441
Çeşme ekmeğindeki eritme çok lezzetli ve doyurucu.,9.0,9.0,10.0,1601354441
F/p 10. Teşekkürler.,10.0,10.0,10.0,1601354441
Herkese tavsiye ederim muhteşem lezzet.,10.0,10.0,10.0,1601354441
Süpersiniz.,10.0,10.0,10.0,1598724695
Çıkarmak istediğiniz ürünler diye bi seçenek koymuşsunuz. Buna rağmen neden çıkardığım ürünü yine de koyuyorsunuz? Biraz daha dikkat edin lütfen.,10.0,3.0,10.0,1598724695
Fenaaaa fenaaaa.,10.0,10.0,10.0,1598724695
Gayet başarılıydı.,9.0,9.0,9.0,1598724695
Ekmek dağılmış vaziyette geldi sucukların bazıları tam pişmemiş.,10.0,10.0,6.0,1598724695
Vazgeçilmezim...,10.0,10.0,10.0,1598724695
Çok hızlı geldi. Malzeme o kadar boldu ki bir süre sonra sandviçi tutmaktan kolum ağrıdı.,10.0,9.0,9.0,1598724695
Kaşarlı köftenin içinde bir gram kaşar yoktu ve bir ekmek daha bayat olamaz yakışmadı.,1.0,1.0,1.0,1598724695
King.,10.0,10.0,10.0,1598724695
"Turşu biberler daha acı olmalı, eritme harika.",10.0,10.0,9.0,1598724695
Lezzeti gayet iyi ve cok hızlı geldi paketcide cok güler yüzlü.,10.0,10.0,9.0,1598724695
İyiydi.,10.0,10.0,10.0,1598724695
Eritme ambalaja yapıştığı için kaşarı pek yiyemedik sucuk eritme ise normal eritmeye göre lezzetsiz tavsiye etmem..,10.0,7.0,5.0,1598724695
Baharat çok fazla ek olarak vermeniz daha iyi olur.,10.0,10.0,1.0,1598724695
Hızlı ve çabuk gelmesinden çok memnun kaldım.,10.0,10.0,7.0,1598724695
40dkda geldi siparişim sıcak ve lezzetliydi.,8.0,9.0,9.0,1596094949
Serviste ve lezzette tartışılmaz güzel mekanın güzelliği ıslak mendil den belli iyi çalışmalar.,10.0,10.0,10.0,1596094949
Ekmek biraz bayattı dağılıylrdu onun dışında sorun yok.,10.0,10.0,7.0,1596094949
Özel ekmeğinde gelmedi ve ekmek yanıktı.,5.0,1.0,1.0,1596094949
Doyurucu.,9.0,9.0,9.0,1596094949
O eski halinden eser yok şimdi. 55 dakikada kaşar komple kağıda yapışmış olarak geldi.,1.0,2.0,3.0,1596094949
Her şey mükemmeldi. Sadece izmir eritme de özel çeşme kumru ekmeği yazıyordu. O ekmekle değil başka bit ekmekle gönderildi.,10.0,10.0,10.0,1596094949
Oldukça lezzetli ve doyurucuydu. Tek sıkıntı ekmeğin yanık olması... Bir de eskiden biberiye gönderiyordunuz artık gelmiyor.,10.0,7.0,10.0,1596094949
Bi dene.,9.0,9.0,9.0,1596094949
Ekmek bayatti iç malzeme soğuk kaşar donmus çeşme ilk defa böle kötüydü aradım söyledim.,7.0,5.0,1.0,1596094949
Çok iyiydi.,10.0,10.0,10.0,1596094949
Siparişi getiren arkadaş çok kibardıürünün hem lezzeti iyi değildi hemde 26 liraya ufacık bir ekmek geldi eskiden daha bol ve lezzetli geliyordu.,8.0,3.0,7.0,1596094949
Eski zamanlarından lezzet konusunda eser yok :(.,5.0,5.0,1.0,1596094949
Taste.,9.0,10.0,10.0,1596094949
Normalde cok severım eritmeyi ve cesme gayet güzeldi dün bi sipariş verdim böyle kötü hazırlanmış olamaz lezzet zaten hıc yoktu 2 gundur kendıme gelemedim sizden hıc beklemezdim çeşme kumrucusu.,6.0,5.0,1.0,1596094949
İlk zamanlarin çeşme kumru lezzetinden eser yok.,8.0,8.0,7.0,1596094949
Lezzet olarak çok güzel ama 26 lirayı hak etmiyor bence. Ben bu gece aldım ve doymadım. Müşteri memnuniyeti olarak isodan çok daha iyi ama eski çeşme değil bence ve bu durum üzdü. Yine de tam puan veriyorum.,10.0,10.0,10.0,1596094949
"Aksama olmasına rağmen ilgiyle karşıladılar, sagolsunlar.",10.0,10.0,10.0,1596094949
Neydi o eski izmir eritme şuan hali yengen gibi.,9.0,9.0,2.0,1596094949
Bu kadar kötü olabilirdi.,1.0,1.0,1.0,1596094949
Yumurta pek benlik değilmiş ama genel olarak lezzet güzel.,8.0,9.0,9.0,1596094949
Teşekkür ederim.,9.0,9.0,9.0,1593465203
İyiydi.,10.0,10.0,10.0,1593465203
"Geçen sefer 30 dkda gelmişti, bu sefer 50 dk sürdü. Hadi bunu geçtim, motorcu arkadaş maske takmamıştı. Neden takmadın diyorum, astımım var diyor, daha kötü ya ölürsün diyorum, sizde de yok diyor. Bir daha siteye giremezsin maske takmazsan dedim. Lezzet iyi ama sunumdan sınıfta kaldılar.",3.0,3.0,8.0,1593465203
Lezzeti çok güzeldi hızı gayet iyiydi pastırmaliyi tavsiye ederim.,9.0,9.0,9.0,1593465203
Tadin bi.,10.0,10.0,10.0,1593465203
10 numara.,10.0,10.0,10.0,1593465203
Yumurtalı çemberi tavsiye ederim kesinlikle :).,10.0,10.0,10.0,1593465203
Ekmekler daha kucuk geliyor artik.,8.0,7.0,6.0,1593465203
1 saatten fazla surede geldi. Ama bi problem olmus sanirim yine de sicak geldi.,6.0,10.0,10.0,1593465205
Lezzetliydi.,9.0,9.0,9.0,1593465205
Teşekkürler.,10.0,9.0,10.0,1593465205
Ekmek boyutu küçük olmasa lezzet 10 numara.,7.0,7.0,10.0,1593465205
Yıllardır çok lezzetli ve iyi hizmet.,9.0,9.0,9.0,1593465205
Bol malzeme çok hızlı servis 14 dk da geldi.,10.0,10.0,10.0,1593465205
Paketçi arkadaş çok kibar ve güleryüzlüydü. Yemekse her zamanki gibi kusursuz. Teşekkürler.,10.0,10.0,10.0,1590835459
