comment_text,comment_speed,comment_service,comment_taste,comment_time
Tek kelimeyle muhteşem.,10.0,10.0,10.0,1606258691
Elinize sağlık. Her şey güzeldi.,10.0,10.0,10.0,1606172291
Cok iyidi.,10.0,10.0,10.0,1606172291
Notumu dikkate almıslardı midyeler de gayet basarılıydı ancak kokoreçleri bana cok lastik gibi geldi bu benim damak tadımdan dolayı sanırım yoksa bu sekilde kokoreçi daha cok begenenleri de gördüm.,10.0,9.0,8.0,1605999491
1. 5 porsiyon söylemek şart ama adam da haklı kıyma olmuş 45 lira.,10.0,10.0,10.0,1605999491
Kokorecleri begendik elinize saglik.,10.0,9.0,10.0,1605999491
Daha önce de sipariş vermiştim. O zaman her şey gayet iyiydi. Ancak bu sefer siparişim 1 saatte geldi. Kokoreç soğumuş ve çok kuruydu. Köfte de soğuk ve lezzetsizdi maalesef.,3.0,9.0,2.0,1605653891
Köfte küçücüktü.,8.0,10.0,8.0,1605653891
"Yine sıcak, leziz ve doyurucuydu. Hızlı geldi, getiren personel efendi, kibar. Esas menünün yanındaki çiğ köfte de çok lezzetliydi. Elinize sağlık ustam, lütfen çizginizi bozmayın.",10.0,10.0,10.0,1605567491
Çok hızlı geldi kokoreç oldukça da lezzetliydi teşekkürler.,10.0,10.0,10.0,1605394691
"Kokoreç gayet lezzetliydi, sipariş çabuk geldi fakat ben hemen yiyemedim bekledi bir süre ona rağmen soğuk hali bile güzeldi. Midyelerin yanında küçük yazıyordu harbiden küçükmüş. Midye lezzetsiz ve biraz kumluydu sanki.",10.0,9.0,8.0,1605394691
Bu semtte yiyebilceğim en güzel kokoreçti ustamızın ellerine sağlık midye ikramıda ayrı güzeldi.,10.0,10.0,10.0,1605221891
"Kuzu yürek ve böbrek dürüm söyledim. Süresinden önce geldi ve sıcaktı. Servis, tat, hijyen ve doyuruculuk güzeldi. Bu ürünlerde bence fiyatını hak ediyor. Böyle devam edin. İkram için de teşekkürler.",10.0,10.0,10.0,1605221891
Hızlı ve lezzetli teşekkürler.,10.0,10.0,10.0,1605135491
Midyeler gayet güzeldi ama keşke daha düzgün bir paketleme olsa..,10.0,7.0,9.0,1605049091
Bence ankaranın en iyi midye teşekkürler dayı.,10.0,10.0,10.0,1604962691
Ekmek arası istemiştim dürüm geldi.,8.0,8.0,6.0,1604789891
Ankaranin en kötü kokoreçi ve midyesi.,5.0,5.0,5.0,1604789891
Ayran olaydı iyiydi.,8.0,4.0,8.0,1604617091
Başarılı..,10.0,10.0,10.0,1604530691
Çiğ köfte dürüm çiğ köfteciler kadar güzel :).,10.0,10.0,10.0,1604530691
"Söylediğim bütün midyeleri çöpe attım insanların sağlığıyla oynamayın.. Köfteyi ekmek arası istedim servis yolladınız, ayrana kadar vasat bir tat lütfen kendinizi geliştirmeye calısın..",5.0,1.0,1.0,1604185091
Midye tek kelimeyle harika elinize sağlık allah işinizi gücünüzü rast getirsin.,10.0,10.0,10.0,1604098691
1 numarasiniz.,10.0,10.0,10.0,1603925891
Midye dolmalar lezzetliydi ama tuzluydu yine de teşekkürler.,10.0,10.0,8.0,1603888145
Kral.,10.0,10.0,10.0,1603888145
Daha iyi bi et olabilirdi.,7.0,7.0,7.0,1603888145
Tadı çok kötüydü.,6.0,9.0,1.0,1603888145
Böbrek sote harbi çok iyiydi.,10.0,10.0,10.0,1603888145
Buyuk midye dolmalarınız harika ama küçükler de gerçekten düğme kadar.,10.0,10.0,10.0,1603888145
Köfte harikaydı. Teşekkür ederim.,10.0,10.0,10.0,1603888145
Arnavut ciğeri çok başarılıydı.,10.0,10.0,10.0,1603888145
Jokerli siparis on uzerinden on. Tesekkurler.,10.0,10.0,10.0,1603888145
Mükemmel ötesi süppersiniz.,10.0,10.0,10.0,1603888145
Kokericiniz harika ancak sipariz ettigim ayran gelmedi. Extra 5 lirayi bosuna vermis oldum. Paketlemeyi daha dikkatli yaparsiniz umarim. 5 lira icin firmanizi alcaltmayin.,10.0,1.0,5.0,1603888145
Harika.,10.0,10.0,10.0,1603888145
Hem hızlı servis hemde lezzetli midyeler.,10.0,10.0,10.0,1603888145
Kokareçin miktarı azalmış elinize sağlık teşekkür ederiz.,10.0,8.0,8.0,1603888145
Köfte çok lezzetliydi teşekkürler.,10.0,10.0,10.0,1603888145
Lezzetli ve iyi pişmişti.,8.0,8.0,9.0,1603888145
Kokoreçi güzel tavsiye ederim.,10.0,10.0,10.0,1603888145
Hayatimda yediğim en kötü kokorecti. Teşekkürler.,10.0,1.0,1.0,1603888145
"Kokoreç aldığınız yeri değiştirin mutlaka, detaya girmeyeceğim. İkram midye için teşekkürler.",10.0,10.0,5.0,1603888145
"Geldiği gibi bir lokmadan snr iki ekmek arası kokoreçte çope gitti gerçek kokoreç sevenler sakın, lastik gibi kokoreçi baharatla kamufle etmeye çalışmışlar pişman olduk.",1.0,1.0,1.0,1603888145
Mükemmel bi yemek keyfi gerçekten ellerinize sağlık.,10.0,10.0,10.0,1603888145
Köfte ve sucuk ekmek söyledik çok güzeldi.,10.0,10.0,10.0,1601258399
"Kokoreç, midye güzeldi. Notları dikkate alıyorlar. Hızlı geldi. Çok teşekkürler.",10.0,10.0,10.0,1601258399
Muhtesem.,10.0,10.0,10.0,1601258399
Her zamanki gibi harikaaaaa.,10.0,10.0,10.0,1601258399
Enfes böylesi yok.,10.0,10.0,10.0,1601258399
Yeni kokoreccimi buldum. Tesekkurler aynen devam.,10.0,10.0,10.0,1601258399
Teşekkürler köfte ve midye siparişi verdik herşey çok güzeldi.,10.0,10.0,10.0,1601258399
"Köfte lezzeti güzel ama çok kurutmuştunuz yanık tadı vardı, dikkat edilmeli.",10.0,8.0,8.0,1601258399
"Jokerde görüp deneyelim dedik ne kadar iyi etmişsiz. Köfte ekmek tek kelimeyle şahaneydi. Favoriler arasına eklendi. Ellerinize, emeğinize sağlık.",10.0,10.0,10.0,1601258399
Muhteseem.,10.0,10.0,10.0,1601258399
Hız ve servis güzeldi ancak adanalı olmama rağmen köftenin baharatları bana bile fazla geldionun haricinde güzeldi.,10.0,10.0,6.0,1601258399
Gayet hızlı geldi temassız teslimata da özen gösterdiler tavuk bifteğin lezzeti gayet güzel yalnız lavas biraz kuruydu haricinde ikram midye içinde teşekkür ederiz.,10.0,10.0,10.0,1601258399
Hızlı ve doyurucu.,9.0,9.0,9.0,1601258399
Kokoreç biraz çok pişmişti ama lezzeti yerindeydi.,7.0,9.0,8.0,1601258399
Köfte söyledim gayet guzeldi hizli geldi 2 adet midye göndermisler gece gece güzel gitti :) hayirli işler.,10.0,10.0,10.0,1601258399
Yediğim en kötü kokoreç. Sirkeyi öyle koymuşsunuz ki turşuya her yere sinmiş. Kırmızı listedesin.,10.0,1.0,1.0,1601258400
Çok hızlı çok sıcak ve kokoreç lezzetli.,10.0,10.0,10.0,1601258400
Elinize sağlık ikram için teşekkürler.,10.0,10.0,10.0,1601258400
On numara köfte harika lezzetli ellerinize saglik.,10.0,10.0,10.0,1601258400
"Lezzetli kokoreç, hızlı ve sıcak.",10.0,10.0,10.0,1601258400
Kötüydü...,1.0,1.0,1.0,1601258400
Notlari dikkate alan sıcacık ekmek ve köfte her zamanki gibi muazzamdi.,10.0,10.0,10.0,1598628654
Üstad yemekler on numaraydı eline sağlık. Tavuklar pek taze değildi gibi. O yüzden puan kırdım. Ellerine sağlık.,10.0,10.0,9.0,1598628654
Notu dikkate almadığınız için lezzetten puan kırdık onun dışında güzeldi sıcak geldi.,8.0,10.0,7.0,1598628654
Deneyin ve görün diyorum.,7.0,7.0,7.0,1598628654
Ekmek arası kaşarlı köfte çok güzeldi. Özellikle acı sevenler için. Gayet hızlı geldi ve servis de başarılıydı. Teşekkürler...,10.0,10.0,10.0,1598628654
Mantarlı tavuk ve böbrek sote yedik efsane olmuş. Tavuğun içindeki kekik biraz daha az olabilirmiş sadece. Porsiyonların dolgunluğu da gayet başarılı. Hız konusunda hiç bir lafım yok. Kuryenin altında jet var çünkü. Ellerine sağlık benden kocaman bir alkış.,10.0,10.0,10.0,1598628654
Nefis mükemmel çok hızlı centrumdan selamlar.,10.0,10.0,10.0,1598628654
Kurye arkadaş çok efendi idi tsk.,10.0,10.0,10.0,1598628654
Tavuklu mantarlı kaşarlı efsane tavsiye ederim.,10.0,10.0,10.0,1598628654
Şimdi kokoreçine laf yok güzeldi ve sıcaktı ama o midyeler nedir? Pilavı lapa baharatı az. Yorumlara bakan güzel kardeşim sen en iyisi sadece kokoreç söyle.,9.0,9.0,6.0,1598628654
Tam kokoreç ve 20 midye siparişi vermiştim. Kokoreç gayet lezzetli ve sıcaktı. Midyelerde iri etli ve doluydu. Memnun kaldım sadece bazı midyeler iyi temizlenmemiş ara ara ağzıma kum geldi. Genel itibariyle güzel :).,10.0,10.0,10.0,1598628654
Hızlı ve sıcak geldi.,10.0,10.0,10.0,1598628654
"Ne kokereç iyiydi ne de midyeler midye. Midyeler kabuktan ibaretti. Kokoreçler bayağı iri kıyım ve çiğdi, baharat ise sadece koklatılmıştı. Ne yazık ki beğenemedik.",5.0,1.0,1.0,1598628654
Muhteşemdi ellerinize sağlık.. İkramınız içinde teşekkür ederiz...,10.0,10.0,10.0,1598628654
"İzmir usulü kokoreç iri kıyım olur. Ekmeğin içindeki dilim kokoreç, bıçakla az kıyılır. Sizinki satırda ince çekilmiş gibiydi. İzmirliyim. Yaptığınız izmir usulünün doğru olmadığını söyleyeyim. Ürün sıcak geldi, özenle paketlenmiş, yanında verilen ikramlar için de çok teşekkürler. Kolay gelsin.",10.0,10.0,8.0,1598628654
Fiyatlar ilk başta iyiydi ama tanındıkça ilerler bu keşke tanınmayla orantılı değilde hakkı bu diyerek fiyat biçseniz. Fiyat perfonmans olarak fiyat biraz fazla.,9.0,9.0,9.0,1598628654
Kokoreç yanık ve kuruydu. Baharatı da anormal düzeydeydi. Ara ara sipariş verdiğim bir işletmedir. Eski lezzeti ve kalitesi yoktu maalesef.,8.0,8.0,2.0,1598628654
"Son zamanlarda yediğüm en güzel kokoreçti, ellerinize sağlık.",10.0,10.0,10.0,1598628654
İkram midye için tesekkürler. Ancak midye sevmiyorum. Rus salatası ve kısır ekşiydi.,10.0,10.0,6.0,1598628654
En iyi köfteci! Harikasınız.,10.0,10.0,10.0,1598628654
Ankarada yediğim en güzel ve en büyük midye. Hakkını veriyorsunuz. Teşekkürler...,10.0,10.0,10.0,1598628654
"Çok hızlı geldi ve ikramlar güzeldi. Kokoreç çok iyi, midyeleri pek beğenmedim.",10.0,10.0,10.0,1598628654
Teşekkürler.,8.0,7.0,10.0,1598628654
İyi bir fiyat performans.,10.0,10.0,10.0,1598628654
Midye ve kokoreci efsane.,10.0,10.0,10.0,1595998909
Sade kokoreç efsane.,9.0,9.0,10.0,1595998909
Köftenin lezzeti çok güzel ve fiyata göre fazlasıyla doyurucuydu çok begendim elinize saglık.,10.0,10.0,10.0,1595998909
Köfte fıyata gore doyurucu ve bu fiyatlardakilere göre lezzetli. Fakat turşu başarısız. Sanırım sirke ile yapılmış çok ağır kokuyordu. Onun dışında sevkiyatcı arkadasta hızlı ve guler yuzluydu. Tesekkurler.,10.0,9.0,9.0,1595998909
Çok kötü kokuyordu daha öncede söylemiştik ama bu şekilde gelmemişti yiyemedik resmen sipariş verirken 2 kere düşünün derim.,6.0,6.0,2.0,1595998909
Kokoreçe diyecek lafım yok ama midyeleri çöpe attık içi kurumuş bu kadar kötü midye görmedim.,10.0,10.0,5.0,1595998909
Bu sefer beğenmedim. Kokoreç iyi doğranmamıştı.,5.0,5.0,3.0,1595998909
İnanılmaz hızlı. Jokerle kokoreç aldık. Yemeğe doyamadık. Çiğ köfte ikramı içinde teşekkür ederim.,10.0,10.0,9.0,1595998909
Kokorec yedim tadi pek hosuma gitmedi.,9.0,9.0,6.0,1595998909
Sucuk dışındaki zarıyla beraber konmuştu ekmeğin arasına gerisi güzeldi.,10.0,10.0,9.0,1593369163
Nihat dayı bitirdin bizi :).,10.0,10.0,10.0,1593369163
Her zaman ki gibi enfes güzel di elinize sağlık hayırlı işler bol kazançlar.,10.0,10.0,10.0,1593369163
İnanılmaz.,10.0,10.0,10.0,1593369163
Biraz serttiama lezzetli).,10.0,10.0,10.0,1593369163
Harika gerçekten her zaman köfteler muhte.,10.0,10.0,10.0,1593369163
Herseyiyle dört dörtlük. Teşekkürler.,10.0,10.0,10.0,1593369163
Herşey gayet güzeldi. Fiyata göre beklentiyi karşıladı diyebilirim..,10.0,10.0,10.0,1593369163
Kömür yedik!,9.0,9.0,1.0,1593369163
Kokoreç ve köftesi güzel.,5.0,5.0,5.0,1593369163
Kokoreç :çok bir beklentiniz olmasın büyük midye: sakın söylemeyin küçük midye: iyi değil kötü değil not: servisi iyi... Hızı iyi... Ama lezzet olarak beklentiyi kesinlikle karşılamıyor.,9.0,9.0,1.0,1593369163
Migdem bozuldu ama kokorec ten değildi galiba emin olamadım onun disinda lezzeti ve servisi efsaneydi.,10.0,10.0,10.0,1593369163
Koftenin icinden kemik cikti tebriker servis berbatti ikram yoktu...,1.0,1.0,1.0,1593369163
Çok güzeldi. Yanında çiğ köfte ve midye de getirmişler. Çok teşekkürler.,10.0,10.0,10.0,1593369163
Kokoreçi çok guzeldi.,9.0,10.0,10.0,1593369163
Sıcacık ve çok lezzetliydi.,9.0,7.0,10.0,1593369163
"Hızı çok iyiydi. Ama lezzeti ve kalitesi için aynı şeyi diyemeyeceğim. Kokoreç genel olarak iyi değildi, midye zaten çok kötüydü, kabuğu bile temiz değildi.",10.0,1.0,1.0,1593369163
Hız güzel ama kokoreç çok küçük.,9.0,8.0,9.0,1593369163
Cok hizli ve lezzetli. Koftelerinde gercek mangal tadi var. İkramlar icin de cok tesekkur ederiz:).,10.0,10.0,10.0,1593369163
Tavuk biftek çok iyiydi hızlı ve sıcak geldi.,10.0,10.0,10.0,1593369163
Çok iyiymiş cidden.,10.0,10.0,10.0,1593369163
Nihat dayı her defasında show yapıyor kuzu böbrek yemediyseniz tam adresi müdürler için teşekkür ederiz ustam.,10.0,10.0,10.0,1593369163
Elinize sağlık çok güzeldi.,10.0,10.0,10.0,1593369163
Tek kelimeyle harikaydı. Yanında gönderdikleri çiğ köfte ve midye dolma için minnettarım.,10.0,10.0,10.0,1593369163
Sevdim.,10.0,10.0,10.0,1590739417
Ayranım gelmedi. (.,9.0,7.0,9.0,1590739417
Köfte tam pişmemiş idi diğer ürünleri iyiydi...,10.0,10.0,7.0,1590739417
Ben çoğu zaman yemek sepetini kullanıyorum çünkü yemek yapmaktansa rahata kaçmak bana daha rahat geliyor... Daha önce çok fazla adana dürüm siparişi verdim bir çok yerden. Fakat hiçbiri bu lezzette ve doyuruculukta değildi... Kesinlikle tavsiye ederim. Emeklerine sağlık.,10.0,10.0,10.0,1590739417
Sebzeli kokoreç farklı bir lezzetti elinize sağlık.,10.0,10.0,10.0,1590739417
"Kokoreçler çok lezzetliydi. Yaninda gönderilen çiğ köfte de yediklerimin en iyisinden olabilir. Şahane bir yemek yedik, biz joker indirimiyle söylemistik ama jokersiz de parasını hak ediyor kesinlikle.",10.0,10.0,10.0,1590739417
Midye lezzetliydi ama aralarında diri kalan pirinç taneleri vardı çiğ köfte güzeldi teşekkürler.,9.0,9.0,6.0,1590739417
"İstenmeyen malzemeleri seçme şansımız varsa, onlar koyulmasın diye, içecek de yanlış gelmişti. Onun dışında elinize sağlık:).",10.0,7.0,10.0,1590739417
