comment_text,comment_speed,comment_service,comment_taste,comment_time
Güzeldi.,10.0,10.0,10.0,1606676849
Mutlaka yememeniz gereken bir zurna tavuk döner dürüm soğuk lezzetsiz ve kötü 1 kere bile deniyim diyip paranıza yazık etmeyin.,8.0,1.0,1.0,1606590449
So delicious.,10.0,10.0,10.0,1606590449
Güzel neticede.,10.0,10.0,10.0,1606590449
"Servis ve lezzet için 1 den daha az veremediğim için 1 i uygun gördüm, lütfen düzelin..",6.0,1.0,1.0,1606504049
Jokerde çıktı ve birçok olumsuz yoruma rağmen şinitzel menü sipariş ettim. Gayet hızlı geldi ve fiyatına göre tadı iyiydi. Kötü yorum yapanlar sanırım beklentiyi yüksek tutmuşlar. Onun dışında evinizde ekmek yoksa bu menüde fazladan yufka istemenizi tavsiye ederim.,10.0,10.0,10.0,1606504049
Turşu istedim sanki bana inat yapmışlar hiç göndermediler.,1.0,1.0,1.0,1606417649
Gerçekten çok iyiydi. Teşekkürler.,10.0,10.0,10.0,1606417649
Berbat.,7.0,7.0,2.0,1606417649
Ekspertiz 216 mi ne var allah aşkına istemeyin.,10.0,1.0,1.0,1606331249
Soğuktu ve siparişim eksik geldi.,1.0,1.0,1.0,1606244849
Porsiyonlar küçük.,10.0,10.0,1.0,1606244849
Et döner dürüm fiyatı yüksek diye aldanmayın küçük ve hiç doyurucu değil.,10.0,6.0,3.0,1606158449
"Porsiyonlar biraz daha büyük olursa çok daha güzel olurmuş, jokere rağmen lezzetli ve hızlıydı.",8.0,8.0,9.0,1606072049
Kesinlikle hamburgerlerini almayın et hamburger söyledim iki tane 50tl para verdim bimin hamburgerini göndermişler verdiğim para kuruşuna kadar haram olsun iyi pişirememişlee bile.,1.0,1.0,1.0,1605985649
Süper.,10.0,10.0,10.0,1605899249
Aç olduğum için yedim.,1.0,1.0,1.0,1605899249
" yediğim en kötü ayvalık tostu, tost demeye bin şahit lazım, özellikle aradıklarımda orijinal ayvalık tostu u diye sorduğumda evet dediler, sıcak dedim soguk geldi malzeme desen içinde iki parça birşey var, ekmek birbirine yapışmamış kaşar denen birşey yok. Rezillik. Bir daha asla.",7.0,1.0,1.0,1605899249
26 liraya bu kadar dürüm cok küçük.,1.0,1.0,1.0,1605812849
Gayet basaeili.,10.0,10.0,10.0,1605812849
Yemin ederim şaka olmalısınız. Köftenin yanında ekmek lavaş vs hiçbirşey yoktu. Tavuk dürümler de 5 cmdi birdaha sizden sipariş vermekmi? Asla tövbe valla günah!,1.0,1.0,1.0,1605640049
"Patso güzel, döner epey kötü, midye dolma 2tl için epey küçük ve lezzetsizdi.",9.0,6.0,4.0,1605640049
Güzeldi. Soğuk gelmese çok daha güzel olurdu.,8.0,10.0,8.0,1605640049
Lütfen bu yolladığınız sandwici kumru adı altında satmayın bu kumru değil çünkü.,7.0,1.0,1.0,1605640049
Sakın sipariş vermeyin berbat.,6.0,6.0,1.0,1605640049
Tek kelime ile berbat.,8.0,1.0,1.0,1605553649
Beğendim.,10.0,10.0,10.0,1605553649
Güzeldi.,9.0,9.0,9.0,1605467249
Elinize sağlık herşey çok güzeldi.,10.0,10.0,10.0,1605467249
İyiydi gibi.,8.0,7.0,7.0,1605467250
Berbat.,1.0,1.0,1.0,1604430450
İndirimli olduğu için malzeme azdı galiba.,1.0,1.0,1.0,1604133504
Kurye çok güzel yüzlü ve samimi bir insandı gerçekten yediğim dönerden dahada zevk aldım böyle bir insanın elinden yediğim için adamsın kurye reyiz.,10.0,10.0,10.0,1604133504
Amerikanlı patso istemiştim sosisli geldi ve patatesi azdı. Bıraktığım bahşişi hak etmediler.,10.0,7.0,7.0,1604133504
Tek kelimeyle harika.,10.0,10.0,10.0,1604133504
Fiyatına göre çok hizmet kalitesi çok iyidi.,10.0,10.0,10.0,1604133504
"Sosisli patsoda sosis yoktu. Sosis kalmadıysa bunu kapıda belirtmeniz ve fiyatı ona göre almanız gerekmez mi? Patates miktarı fena değildi, porsiyon bence yeterli.",7.0,5.0,5.0,1604133504
Güzel iki tane söyleseydim dedim tadı damağımda kaldı.,9.0,9.0,9.0,1604133504
Gayet hızlı geldi. Güler yüzü ve nazik tavrı için getiren kurye arkadaşa teşekkürler.,10.0,10.0,7.0,1604133504
Güzeldi.,10.0,10.0,10.0,1604133504
İnanılmaz lezzetli bir tost sevdalısı olarak yediğim en iyi yengen di harikasınız.,10.0,10.0,10.0,1604133504
Güzel.,10.0,6.0,6.0,1604133504
Bu kadar kötüsünü gerçekten yemedim malzeme çok kalitesizdi ekmek bayattı ve ürünler buz gibiyken içeçek ne hikmetse sıcacıktı!,1.0,1.0,1.0,1604133504
Guzell.,10.0,10.0,10.0,1604133504
Gayet mütaviza bir mekan.,10.0,10.0,10.0,1604133504
Hızlı güzel kaliteli.,10.0,10.0,10.0,1604133504
Döner ekmeklerin içinde yine azıcık döner vardı ama onun dışında her şey güzeldi.,9.0,9.0,9.0,1604133504
"Goralı, ıslak hamburger, tavuk döner ve kumru sipariş etmiştim kumru hariç diğer ürünler vasatın altındaydı.. Goralının içindeki amerikan salatasıda ekşimişti..",9.0,7.0,2.0,1601503758
Güzeldi ve hızlı geldi bravyo.,10.0,10.0,10.0,1601503758
Bugün verdiğim siparişte ıslak hamburger gelmedi. Bilginiz olsun.,9.0,4.0,8.0,1601503758
Servis elemanını tebrik ediyorum.. Her zamankı gibi nezih ve kıbar bir arkadaş.,9.0,8.0,8.0,1601503758
Elinize sağlık herşey o numara.,10.0,10.0,10.0,1601503758
"Hiç tavsiye etmiyorum, joker ile söyledim, dürüm dönerin içi boş denecek kadar azdı, patso eh idare eder diyebilirim ancak dürüm tavuk döner diye sipariş ettiğim ürün tam bir fiyaskoydu ki onun fotoğrafını da ekledim. Yanmış döner parçası. Umarım joker çıktı diye sipariş verme hatasına düşmezsiniz.",5.0,1.0,1.0,1601503758
Notu dikkate almışlar lezzetliydi.,9.0,9.0,9.0,1601503758
Rezalettttttyt.,1.0,1.0,1.0,1601503758
Çok lezzetli.,10.0,10.0,10.0,1601503758
Yediğim tost lezzet olarak çok iyidi. Hız ve kuryenin güler yüzlülüğüde tatmin ediciydi.,10.0,10.0,10.0,1601503758
Her zamanki gibi lezzet harikaydı.,10.0,10.0,10.0,1601503758
Lezzet ve hızı beğendim. Güzel hizmet.,10.0,10.0,10.0,1601503758
Köfte çok kötüydü.,5.0,5.0,5.0,1601503759
14 verince sosisli patsodaki patatesin ekmeğe sığamayacağını sosislisininde gerçekten kaliteli olduğunu düşünmüştüm üşenmedim saydım 32 adet patates koyulmuş yani daha az ücrete daha kaliteli ve doyurucu dükkan varken piyasada başarılar.,8.0,1.0,5.0,1598874013
Bi onceki siparisimde cok iyiydi bu sipariste doner sandvic filan yoktu ekmek ve icinde 3 4 tane bakin tane doner vardi tum sandviclerin hepsinde.,5.0,1.0,1.0,1598874013
"Çok lezzetliydi, ayrıca ikramınız için teşekkür ederiz.",10.0,10.0,10.0,1598874013
"Hıza 10 veriyorum çünkü siparişim 1 saatte geldi fakat maalesef bir kaza olmuş ancak yine de getirdiler, kurye iyiyimiş ben sordum merak etmeyin. İkram içim teşekkürler.",10.0,10.0,8.0,1598874013
"Çok hızlı geldi, getiren kişi gayet kibar ve güler yüzlüydü. Söylediğim ıslak hamburgerler de lezzetliydi.",10.0,10.0,9.0,1598874013
Ketçap mayonezsiz patsomu olur.,8.0,2.0,2.0,1598874013
Süper servis hızı falan süperdi sıcacık geldi lezzet de ayrı güzel.,10.0,10.0,10.0,1598874013
"Islak hamburger biraz acıydı. Çocuk için pek uygun değil. Dürüm döner porsiyonu azdı. Joker etkisi olabilir. Midye dolma, sıcak ve fevkaladeydi.",10.0,9.0,9.0,1598874013
1 saate yakın bir sürede geldi. Kumru kağıtlarla iç içe geçmiş ve soğuktu. Ayran ılıktı içilecek gibi değildi. Islak hamburgerin ekmeğini kaldırıp et aradım içinde. 10 gram bile et koymamışlar. Et dediğime bakmayın. Et kokusu işlenmiş soyalı bir madde. Kumrunun sucukları yanmıştı fazla pişirilmiş.,1.0,1.0,1.0,1598874013
Çok küçüktü 2 hafta önce 8 liraya büyük bir ıslak hamburger yemiştim ama bu ıslak hamburger çok küçüktü ama tadı gayet iyiydi...,9.0,9.0,9.0,1598874013
Servis personelinin yaklaşımı ve nezaketi bizi çok mutlu etti ancak patateslerin kızardığı yağ için ve patatesler için daha iyi olabilirdi diyorum.,8.0,9.0,8.0,1596244267
Kokoreçin malzemesi çok azdı. Midye iyiydi.,10.0,9.0,8.0,1596244267
İyi.,9.0,9.0,8.0,1596244267
Güzeldi.,10.0,10.0,9.0,1596244267
Tam büfe stili işte. Beni memnun etti.,9.0,9.0,9.0,1596244267
Guzeldi.,10.0,10.0,10.0,1596244267
Gayet hızlı ve güzel bir şekilde geldi siparişimiz. Ekstradan gönderdiğiniz ürün için de çok teşekkür ederiz.,10.0,10.0,9.0,1596244267
Hizli geldi lezzet fiyat dengesi gayet iyi.,10.0,8.0,9.0,1596244267
"Ellerine sağlık, ıslak hamburger böyle olmalı, çok lezzetliydi, çok çabuk ta geldi doğrusu.",10.0,10.0,10.0,1596244267
Daha önce telefon ile sipariş vererek ıslak hamburgeri ve ayvalık tostunu denemiştim çok lezzetli ve doyurucu idi. Bugün verdiğim siparişle de bir kez daha kalite ve lezzet testinden geçmiş oldu. Gönül rahatlığı ile herkese tavsiye ederim. Ellerinize sağlık.,10.0,10.0,10.0,1596244267
2yıllık sarıoğlu büfe çalışanı olarak herşeyi beğendim gayet lezzetli ve güzeldi ama sade patsonun patatesiaz ve patatesi kalitesiz patatesi geliştirilmeli her şey için teşekkürler kolay gelsin.,10.0,10.0,10.0,1596244267
Midyesi kokoreçi çok güzel ama hamburgerler snitzel pek olmamış gibi ama yinede puan veriyorum kapıya getiren arkadaş çok nazikti.,10.0,10.0,7.0,1596244267
Harikaydı. Ellerinize sağlık.,10.0,10.0,10.0,1596244267
"90 gr. Diye satılan hamburgerde 20 gr. Bile köfte yoktu, ayıp yaptığınız. 8 tl ye satılan ıslak hamburgerde de durum aynı, 6 tl. Ye başka biryerden dün yedim 2 katı büyük köfte vardı, umarım yediğim şeyler ettir.",5.0,1.0,1.0,1596244267
"Servisin hızı, menünün doyuruculuğu çok iyiydi umarım böyle devam edersiniz. İyi çalışmalar dilerim.",10.0,10.0,10.0,1596244267
"Gayet güzel ve lezzetli, ayrıca mahzemeler taze.",10.0,10.0,10.0,1596244267
İnş bozmazlar ben sosisli söyledim gerçekten güzeldi..,10.0,10.0,10.0,1596244267
"Kumru guzeldi ama buyuk hamburgeri çöpe attim. Koftesi cok basarisizdi, ayrica icindeki yesillikte koku vardi. Kolay kolay puan kirmam ama hakkaten yiyemedim.",10.0,8.0,1.0,1596244267
"Jokerle almama rağmen gayet başarılıydı, emre bey de gayet kibar. Hayırlı işler dilerim.",10.0,10.0,10.0,1596244268
"Herşey çok lezzetliydi... Hızlı geldi, ellerinize sağlık..",10.0,10.0,10.0,1596244268
Süper ürünler çok iyiydi teşekkür ederimm.,10.0,10.0,10.0,1596244268
"Lezzet efsane, hız süper yeni açılmasına rağmen gayet başarılıydı ellerinize sağlık.",10.0,10.0,10.0,1596244268
