comment_text,comment_speed,comment_service,comment_taste,comment_time
Akşam 9da sipariş verdim gece 11de geldi. Sipariş verken bunu göz önünde bulundurun.,1.0,6.0,8.0,1593614919
Dondurmaları her zaman çok iyi.,8.0,10.0,10.0,1593614919
"1 kg luk tatlinin yarisinin lezzeti farkli yarisinin lezzeti farkli. İcinden fistik kabuklari cikti, yarisi bayatlamis acimisti tatlinin.",1.0,1.0,1.0,1593614919
Getiren arkadaş maşallah hem hızlı hem iletişimi kuvvetli hemde prezantabl.,10.0,7.0,9.0,1593614919
"Sipariş 125 dakikada geldi ve tek istediğimiz dondurmaydı, o da erimiş olarak geldi.",1.0,1.0,1.0,1593614919
Siparişim tam 1 saat 25 dakikada geldi.,1.0,1.0,8.0,1593614919
Tam puan.,10.0,10.0,10.0,1593614919
Özellikle portakallı dondurmasını tavsiye ederim.,10.0,10.0,10.0,1593614919
"Hayatimda ilk defa kotu bir kazandibi yedim. Herkes basaramaz, bravo.",8.0,6.0,1.0,1593614919
