comment_text,comment_speed,comment_service,comment_taste,comment_time
Ali naziğin eti okadar kötü kokuyordu ki yiyemedim bile. Yanına ne bir çatal koymuşlar ne bir peçete. Lahmacun fena değil ama o et kokusunun mide bulantısı yetti.,8.0,1.0,1.0,1606672163
Adana dürümün içine keşke adanada koysaydınız cımbızla koyulmuş kadar küçük ve çiğdi. Pişmemişti. Pahalıyada satın razıyız ama düzgün satın...,7.0,3.0,5.0,1606499363
Lahmacunlar her zaman ki gibi çok iyi. Çok yumuşak ve tam kıvamında. Ustanın eline saglik.,10.0,10.0,10.0,1606499363
Lahmacun çok lezzetliydi ayrıca kurye çok güler yüzlüydü.,10.0,10.0,10.0,1606412963
Mükemmel tazelikte salata ve yanında gönderilen ikramlar servis çok güzel belirtilen sürede de geldi lezzet konusuna gelirsek lahmacun sıcaktı ama lezzeti biraz tatmin edici deildi dağa iyi olabilirdi.,9.0,10.0,8.0,1606412963
Elimize sağlık. İzmirler daha kalın olursa daha iyi olur.,9.0,9.0,8.0,1606412963
Cok başarılı.,10.0,10.0,10.0,1606326563
Sıcak olması gereken lahmacun soğuk geldi ve hızlı gelebilirdi.,1.0,1.0,7.0,1606326563
Gayet iyi.,7.0,8.0,8.0,1606326563
Dürumun yaninda dahi meze gelmesi super ayrica patlican ezmeleri harika durumleri yedigim en lezzetli adana durumlerden biri hiz cok iyi fiyat cok iyi kesinlikle tavsiye ediyorum umarim boyle yerler kapanmaz iyi calismalar..,10.0,10.0,10.0,1606326563
"Hasib the delivery man is very good and respectful and the most important thing that he speaks english, thank you for everything :).",10.0,10.0,10.0,1606240163
Berbaaat 2 günlük bulgur fındık kadar kanat göndermişler tavsiye etmiyorum.,1.0,1.0,1.0,1606240163
Eti pişmemişti kaçası hamurdu hala mide bulantim geçmedi dürümü birdaha tercih etmem.,6.0,1.0,1.0,1606240163
Güzeldi ama ayranın birisi unutulmuş. Dikkat edilmesi gerekiyor. Ayran bile dünya para olmuş çünkü.,8.0,8.0,8.0,1606067363
2 saatte getirdiler.,1.0,1.0,1.0,1605980963
2 defa şipariş verdim müşteri memnuniyeti yok galiba 2 sin dede lahmacun lar acı olsun 2 ayrı 3 ayrı olsun dedim ama sipariş detayları na bakılmıyor kola istedim ayran geldi tek rar vericem ama aynı şekilde kağle alınmaz yada yanlış siperiş gelirse son siparişim olacak iyi günler.,8.0,1.0,7.0,1605980963
Gelen kurye arkadas gercekten güler yüzlüydü. Lahmacunlar harika. Tesekkürler. Her zaman aynı kalite ile inşallah.,9.0,9.0,9.0,1605894563
Anlatılmaz yaşanır tat ve hizmet.,10.0,10.0,10.0,1605808163
Güzel.,10.0,10.0,7.0,1605721763
Lezzet kalite hizmet herşey mevcutbaşarılar hayırlı işler.,10.0,10.0,10.0,1605721763
Lahmacunlari gayet sıcak geldi ve lezzetliydi. Mezelerde iyiydi. Arnavutkoydeki düşünmeden sipariş vereceğiniz bir müessese.,10.0,10.0,10.0,1605721763
Sütlacin üzeri kapkara yanikti hemde tadi sütlaca sinmisti beğenmedik.,1.0,1.0,1.0,1605635363
Lezzetliydi hızlı servis iyi bir puanı hak eden bir isletme.,10.0,10.0,10.0,1605635363
"10/10 her şey harika, lezzetten kurye arkadasa kadar, bravo.",10.0,10.0,10.0,1605635363
Güzeldi.,4.0,8.0,8.0,1605635363
Sutlac su gibiydi.,1.0,1.0,1.0,1605548963
Son zamanlarda aldığımız en iyi siparişti. Lezzeti fazlasıyla tatmin ediciydi. Sipariş sırasında bulunduğumuz her talep karşılanmıştı. Teşekkür ederiz elinize sağlık.,9.0,10.0,10.0,1605548963
Arnavutköyde kendi dalında en başarılı olan restaurantı emir sultan kebabdır çok net şekilde bunu söyleyebilirim.,10.0,10.0,10.0,1605462563
Artık tercihlerimiz buradan yana diyebilirim. Yemekler çok lezzetli. Çorbalar sıcacık geldi. Kurye kibar saygılı ve güler yüzlüydü.,10.0,10.0,10.0,1605462563
Çatal vb malzemeler yoktu.,10.0,5.0,10.0,1605376164
Siparişleriniz hemen gelmedi yarim saatten fazla bekledim.,1.0,5.0,8.0,1605376164
Çok basarılı.,10.0,10.0,10.0,1605289764
Mezelere bayıldık. Etli ekmek daha çıtır olabilirdi onun dışında lezzetliydi.,10.0,9.0,7.0,1605289764
Sadece plastik çatal kaşık yoktu herşey harika.,9.0,9.0,9.0,1605203364
Güzeldi ama kavurmali pide diyince açık pide sandım kapalı kir pidesi gibiydi eti böldü.,6.0,6.0,8.0,1605203364
Tavsiye ediyorum çorbası ve lahmacunu şahane. Adanasi da güzel. Ilgili bir işletme allah bol kazanc versin.,10.0,10.0,10.0,1605203364
Sıcak ve oldukça lezzetliydi yanında garnitürler tazeydi kurye çok ilgili ve güler yüzlüydü teşekkürler.,10.0,10.0,10.0,1605116964
Değişmeyen tat değişmiyen lezet harikasınız elinize emeğinize sağlık.,10.0,10.0,10.0,1605116964
Lahmacunlar çok güzeldi hızlı bir şekilde elimde geldi teşekkür ederim ellerine sağlık.,10.0,10.0,10.0,1605116964
Gayet güzel.,10.0,10.0,10.0,1605116964
Et ve patlıcan hiç pişmemişti.,1.0,1.0,1.0,1605116964
Bu benim 4 cı siparişimdır her seferinde ayni lezzet aynı tat ayınıkez de yaninda gönderdiği ikramlarda öyle di ve sıcak hızlı geldi hepsi için teşekkür ederim ellerinize kollarınıza sağlık.,10.0,10.0,10.0,1605030564
Sipariş yanlış gelmiş sanırım ven beyti kebabı istemiştim adana porsiyon gelmiş yinede geri gondermedim sağlık olsun.,10.0,6.0,5.0,1605030564
Lahmacun efsaneydi sıcaktı ve ikramları da gayet güzeldi ellerinize sağlık.,10.0,10.0,10.0,1604944164
Bu defa ic malzemesi az geldi bana.,10.0,10.0,5.0,1604944164
On numara yer tavsiye ederim yanında mezhesi herşeyi fazla fazla geliyo ve getiren abi iletişimi çok iyi güler yüzlü işletmeyi tebrik ediyorum.,10.0,10.0,10.0,1604857764
Hız olarak gerçekten iyiydi lezzet olarakta iyiler teşekkür ediyorum ellerinize emeginize saglık alinazige özellikle bayıldık.,10.0,10.0,9.0,1604771364
"Gerçekten çok lezzetli, sıcak teslim ediliyor. Her siparişte ikram oluyor çok teşekkürler.",10.0,10.0,10.0,1604771364
Lezet tat on numara ikramlar şahane çiğköftenize hayran kaldım lahmacun hamurunuz ince olmuş tam kıvamında süpersiniz.,10.0,10.0,10.0,1604771364
Lahmacunlar iyiydi ama kuzu şiş çok kötüydü.,6.0,5.0,5.0,1604684964
Lavaşı hamurdu biraz lezzeti güzel çok yerde yerim adanayı beğendim ben yanına yolladıkları mezeler hoş olmuş beklediğimin üstündeydi.,8.0,8.0,8.0,1604684964
Bir buçuk porsiyon istedik yaprak kanat hem 1 porsiyon geldi hemde but var içinde he parayı 1 buçuk porsiyon olarak ödedim... Sonradan aradım yarım porsiyon daha gönderdiler. Bir daha da söylemem.,1.0,1.0,1.0,1604684964
Yemek lezzetli fakat 51 dakika da gelmesi beni üzdü daha hızlı olması gerekir fakat müşteri memnuniyeti adına restoran iyiydi.,2.0,2.0,8.0,1604684964
Teslimat servis hızı lezzet harikaydı yanında gönderilen ikramlar içinde teşekkürler.,10.0,10.0,10.0,1604598564
İkinci siparişim aynı lezzet aynı tat tşkler. Hayırlı işler.,10.0,10.0,10.0,1604598564
Lahmacun söyledik ikinci sparişim elinize sağlık mükemeldi ailece mekanda yemek yedik işletmecisi kibar işinin ehli bi beyfendi başarılarınızın devamını dilerim.,10.0,10.0,10.0,1604512164
İkramlarınız için teşekkür ederim. Bu sefer çiğ köfte koymayı unutmuştunuz ama:).,8.0,8.0,8.0,1604512164
Adana dürüm efsaneydi elinize sağlık sipariş ve yanında gelen garnitürler de çok güzeldi.,10.0,10.0,10.0,1604512164
Köfte yerne sanki sucuk yedim. Çok baharatlıydı ve sertti. Bir daha sipariş edeceğimi sanmıyorum. Yanına gelen ikramlardan patlıcanlı yoğurt bayatlamıştı.,10.0,10.0,7.0,1604512164
"Lahmacun kötü, kıyması az. Fiyat ucuz olduğu için olabilir. Üzgünüm beğenmedim.",8.0,6.0,3.0,1604425765
Yanında getirdikleri ekstra mezeleri çiğköftesi falan çok iyiydi ellerini bol tutmuşlar bu çok hoşuma gitti diğer restaurantlar sadece yemeği getiriyo kuru kuru bu konuda sizi tebrik ediyorum.,9.0,10.0,10.0,1604425765
Yemek dağınık geldi ama lezzet ve hızı güzeldi ) ellerinize sağlık.,9.0,7.0,9.0,1604425765
Biraz gecikti ama ikramlar süper:).,8.0,10.0,10.0,1604425765
İlk kez sipariş verdim pide yedim sadece çok hoşuma gitti pidenin yanında gelen malzemeler çok güzeldi teşekkürler emir sultan kebap 10 numara lezzet ve servis.,10.0,10.0,10.0,1604425765
Lahmacun sicakti acili soyledim lakin icindeki isot cok tuzlu ve hafif ekşi gibiydi.,6.0,6.0,5.0,1604339365
Yaaaan8ii.,9.0,9.0,8.0,1604339365
"İlk defa söyleyip bu kadar memnun kalmak güzel bir duygu, çorbası orijinal mercimek çorbası, servis gayet sıcak geldi, gavurdagı salatası gayet taze sebzelerle yapılmış ve cevizi bol olmuş, lahmacun ortalama lezzette ama malzeme kaliteli ve bol olmuş.",9.0,10.0,9.0,1604252965
Herşey mükemmeldi teşekkür eder hayırlı işler bol kazançlar dilerim.,10.0,10.0,10.0,1604252965
Lahmacunda nerdeyse hic et yoktu..,4.0,6.0,2.0,1604252965
Kıvırcık daha fazla olsa.,8.0,10.0,10.0,1604252965
Hızlı lezettli yalnız lahmacun bir tık ufak sanki onun haricinde mukemmel.,10.0,10.0,10.0,1604166565
"Harika gercekten keyifle yedik ilk siparisimdi bu kadarini beklemiyordum lahmacunu ve adanasi şahaneydi ikramlari da keza öyle, elinize saglik.",10.0,10.0,10.0,1604128819
"Lahmacunlar sıcak ve çok lezzetliydi kesinlikle tavsiye ederim, ayrıca kurye baya güler yüzlü samimi bir insandı, basarilarinizin devamını dilerim.",10.0,10.0,10.0,1604128819
Hızlı ve lezzetli geldi teşekkür ediyorum.,10.0,10.0,10.0,1604128819
Hızlı geldi lezzetliydi teşekkürler.,10.0,10.0,10.0,1604128819
Çorba ve lahmacun gayet güzel di elinize sağlık.,10.0,10.0,10.0,1604128819
"Arkadaşlar elinize emeğinize sağlık lezzetin ve servisin bozulmamasını temmenni ediyorum, hayırlı işler bol kazançlar.",10.0,10.0,10.0,1604128819
"Menü doyurucu, mezeler çok başarılı.",10.0,10.0,10.0,1604128819
Lahmacun sipariş verdim. Harcı azdı lakin lezzeti çok iyidi.,10.0,10.0,10.0,1604128819
Teşekkürler çorba güzeldi.,10.0,10.0,10.0,1604128819
Servis eksik yemek fena değil porsiyon az.,7.0,7.0,7.0,1604128819
Ev olduğu için mi koymadiniz bilmiyorum ama çatal bıçak peçete vs yoktu. Biz de yeni taşındık evde hiçbir şey yoktu doğru düzgün yiyemedim o nedenle. Ama fena değil lezzetliydi.,10.0,7.0,9.0,1604128819
Lezzet güzeldi. Daha sıcak olabilir. Bize ılık geldi. Islak mendil peçete kürdan tuz vs hiçbiri yoktu. 5 adet lahmacuna 3 dilim limon konulmuştu. En azından 5 dilim koyulabilir. Yeni açılmış bir isletmeymiş onun için puan kırmadım. Bunları dikkate alırlarsa daha iyi olabilir. Beğenerek yedim.,1.0,10.0,10.0,1604128819
"Çok hızlı ve sıcak geldi ve meze olarak gönderilenler de çok iyi, inşallah bozulmaz, yeni favori restorantım.",10.0,10.0,10.0,1604128819
Gayet güzel yemek eren kardeşimde güler yüzlü hoş sohbet bir paketçi.,8.0,10.0,9.0,1604128819
Tadı çok güzel ikramları da güzel ama lavaşı çok dağılıyorbi de çok yavaş geliyor ama yoğunluktan dolayı olduğunu düşünüyorum.,5.0,10.0,10.0,1604128819
"30 dakikada geldi, servis iyiydi ama lezzeti asiri kotuydu bir daha asla tercih etmem.",8.0,7.0,1.0,1604128819
Lezeti çok güzeldi herkese tavsiye ederim özellikle servis çok hızlı ve getiren arkadaş çok güler yüzlü tşk ederim.,7.0,10.0,8.0,1604128819
Lahmacunlariniz boyut olarak kucuk fakat yanında göndermiş oldugunuz mezeleriniz harikaydı bence sadece meze bile sipariş edilebilir acılı ezmenizin benim gibi acı yiyemeyen biri için tam lezzetinde acılığıyla nefisti ve diğer patlıcan salatanızda. Tavsiye ederim.,10.0,10.0,10.0,1604128819
Servis güzel lezzet güzel daha ne olsun ellerinize sağlık.,10.0,10.0,10.0,1604128824
Servisi getiren emir kardeşimize teşekkür ederim kaliteli servis super lezet.,10.0,10.0,9.0,1604128824
Birşey diyimmi servisleri mükemmel özenle koymuşlar ve tadını beğendim yediğim şeylerin. Hızı da gayet iyiydi. Tavsiye ederim.,10.0,10.0,10.0,1604128824
Kurye arkadaş çok güler yüzlüydü teşekkürler kendisine.,10.0,10.0,8.0,1604128824
Bu zamana kadar yediğim en güzel dürüm o eski kebap tadını aldım diyebilirim tek kelimeyle harikaydı lahmacun da söylemiştim bambaşka bir tat mezeleri çeşit çeşit neyi tatsam ayrı bı lezzet kesinlikle bu tatları denemenizi tavsiye ederim.,10.0,10.0,10.0,1604128824
Maalesef hayatımın en soğuk lahmacununu yedim. Tabak daha sıcaktı. Bu arada özel lahmacun istemiştim. Hiç bir şekilde tavsiye etmiyorum. Hayal kırıklığına uğradım.,6.0,8.0,3.0,1604128824
Merkez mahallesine sipariş 1 saatte geldi tam olarak. Künefe sıcaktı fakat lezzet açısından pek iyi değildi.,1.0,8.0,6.0,1604128824
İkramlar için teşekkür ederiz. Belirtilen saatler aralığında geldi fakat çiğköfte işini biraz daha geliştirmeniz lazım ama dürümünüzü beğendik ellerinize sağlık.,9.0,10.0,9.0,1604128824
Başarılı biraz daha iyi olabilir.,10.0,9.0,8.0,1604128824
"Tek kusur sipariş biraz geç geldi. Servis, yemeğin sıcak gelmesi ve mezeler güzeldi. Inşallah zamanla bozulmaz.",8.0,10.0,10.0,1604128824
1 sipariş tam 58 dakikada geldi 2 coco cola yaziyor 8 tl pepsi geliyor tercih etmediğim marka lahmacunlar çok soğan sarımsaklı sunumu iyi mezeler iyi.,1.0,8.0,1.0,1604128824
Yoğunluktan dolayı geç kalmış ama ikrami ve lezzetine diyecek lafım yok lezzetiyle herseyi unutturdu elinize sağlık hoşgörünüz için teşekkür ederim başarılarınızın devamını dilerim.,7.0,10.0,10.0,1604128824
Künefe bu zamana kadar arnavutköyde yediğim en iyi künefeydi.,10.0,10.0,10.0,1604128824
Lahmacun ve yanında gönderdiğiniz mezeler çok güzeldi.,10.0,10.0,10.0,1604128824
Kuzu şiş söyledik dürüm fazlasıyla ıslaktı içerisine atılan domatesin suyundan diye tahmin ediyoruz dikkate alırsanız sevinirim dükkan hayırlı olsun kardeş.,10.0,10.0,8.0,1604128824
Çıtır beyti ali nazik mükemmeldi yanındaki mezelere bayıldım canim çiğ köftede istiyordu ikrama koymuşlar benzeriniz yok teşekürler.,10.0,10.0,10.0,1604128824
İlk defa söyledim çok güzeldi inşallah bozmazlar zamanla.,10.0,10.0,10.0,1604128824
Hem ideal fiyat hem tatlı (::bu arada mezelerinize bayıldım.,10.0,10.0,10.0,1604128824
Güzeldi hersey ayrı ayrı paketlenmıstı sıcak geldı tavsiye edıyorum.,10.0,10.0,10.0,1604128824
"Dürümler biraz dagildi yerken ama lezzet iyiydi. Bol salata meze yollamışlar teşekkür ederim, çorba ve diğerleri gayet sıcaktı. Servis elemanı kibardi. Firinda sütlacı beğendim.",9.0,9.0,8.0,1604128824
