comment_text,comment_speed,comment_service,comment_taste,comment_time
Lavaşda değişiklik olmuş galiba eskisi gibi çıtır ve lezzetli değildi sos yüzünden yumuşasa bile dışının etkileneceğini pek sanmıyorum yine de elinize sağlık.,10.0,9.0,9.0,1606404233
Biraz daha bol sos koyabilirsiniz :).,10.0,10.0,9.0,1606404233
Turşusu az gönderilmese efsaneeee.,10.0,10.0,8.0,1606317833
Tadı eskisi gibi değildi soğuktu yiyemedim.,2.0,1.0,1.0,1606317833
Teşekkürler.,10.0,10.0,8.0,1606317833
Öğrenci dostu :).,8.0,6.0,7.0,1606231433
Kuryelerinize söyleyin biz aşağıya inmek zorunda değiliz. Mahalle sokak bina numarası vermişim. Beni aşağıya inmek zorunda bırakıyor kuryeniz. Yapacağı şey haritalara girip sokak ve bina numarasını yazmakken beni soğukta dışarıya çıkarıyor. Üstüne telefonda da nerede bu ya diyor. Başka sorun yok.,7.0,8.0,8.0,1606231433
Lezzeti guzel.,7.0,8.0,10.0,1606145033
Her şey için teşekkürler.,10.0,10.0,10.0,1606058633
Her zaman sipariş verdiğimiz yer ama bu son siparisimizden memnun kalmadım içinin döneri aşırı azdı patatesi boldu içinde nedense doner yoktu.,10.0,10.0,5.0,1606058633
Hatay usulü dürüm güzel ama onun dışında biseyden memnun kalmadim patatesler kupkuru ve cok az. Menüde büyük gosterilen ayran küçük getirildi. Alacaksaniz sadece dürüm alın.,8.0,1.0,8.0,1605972233
Cok kotu et döner boyle olamaz.,1.0,1.0,1.0,1605885833
Lezzetliydi.,4.0,7.0,8.0,1605885833
Tek kelimeyle mükemmel.,10.0,10.0,10.0,1605885833
Gayet iyi.,9.0,9.0,9.0,1605799433
Her zamanki gibi mükemmel.,10.0,10.0,10.0,1605713033
Çok hızlı ve lezzetli.,10.0,10.0,10.0,1605713033
"Harbi harbi geçen yedim, böyle bir lezzet yok, getirme hızı zaten mükemmeldi. Elinize sağlık.",10.0,10.0,10.0,1605626633
Güzel.,10.0,10.0,10.0,1605626633
Çok beklemedik lezzetliydi.,8.0,9.0,8.0,1605453833
Tatlı çikolatalı olsaydı daha iyi olurdu ama yinede harikaa.,10.0,10.0,10.0,1605453833
Gelen dürüm buz gibiydi soğuktu.,5.0,5.0,3.0,1605453833
Teşekkür ederim gayet lezzetliydi 10 numara 5 yıldız.,10.0,10.0,10.0,1605367433
Etler geldiğinde donmuştu.,6.0,6.0,4.0,1605367433
Çorum şubedeki sarımsaklı sos daha güzel bir tat vermişti aynı sosu kullanmanızı tavsiye ederim.,10.0,8.0,7.0,1605367433
"Dürümlerin ikisininde sozsuz gelmesi, etlerin büyük ve bütün olması, soğuk olması, ve geç gelmesi haricinde bir problem yok.",1.0,1.0,1.0,1605367433
Güzel.,10.0,10.0,10.0,1605281033
Tatları güzeldi fakat. Soğuk geldi.,7.0,8.0,8.0,1605281033
Cok guzeldi klasik best of..,7.0,9.0,10.0,1605194633
Güzel.,10.0,10.0,10.0,1605108235
Porsiyonlar küçük.,10.0,10.0,6.0,1605108235
Guzeldi.,7.0,7.0,9.0,1605021835
Güzel gayet bence.,10.0,9.0,9.0,1604935435
"Burhan ustanın ellerine sağlık, yapıyor bu işi.",9.0,9.0,10.0,1604849035
Amasyada yiyebileceğiniz en güzel ve lezzetli dürüm döner.. Hızlı ve sıcak teşekkürler.,10.0,10.0,10.0,1604676235
Gelisi 40 dkdan fazla suruyor. Ama cidden cok lezzetli. Bir de tuz konusu hala sikintili.,7.0,8.0,9.0,1604676235
Lavaş yanıktı ve içinde çok çok az döner vardı.,9.0,8.0,6.0,1604676235
Vazgeçilmez.,10.0,10.0,10.0,1604589835
Her şey güzeldi ama patatesler aşırı yumuşaktı ve buz gibiydi.,10.0,9.0,7.0,1604589835
Siparişten 1 saat sonra geldi. Genelde daha hizlidirlar diye düşünmüştüm. Çarşıda işyerine istedik çünkü. Geldiğinde durum çok soğuktu. Keşke bu durumu bildirip hiç getirmeseydiniz. Başka yiyecek durumu olmayanlar için üzücü ve hayal kırıklığı oluyor. Bi daha istemem sanırım.,1.0,6.0,6.0,1604503435
Güzel lezzet uygun fiyat.,8.0,8.0,8.0,1604417035
Güzeldi.,10.0,10.0,10.0,1604244235
Dürümün sosunu eskisi gibi koymuyorsunuz ve kuru dürüm yiyoruz gibi oluyor lütfen duzeltin artik.,8.0,1.0,1.0,1604244235
Cok lezzetli.,7.0,8.0,10.0,1604244235
Sipariş yavaş geldi.,1.0,3.0,8.0,1604157835
İyi.,10.0,10.0,10.0,1604071435
Çok erken geldi ve sıcacıktı. Tadına zaten söyleyecek bişey yok her zamnki gibi mükemmel...,10.0,10.0,10.0,1603860889
Gerçekten mükemmel.,10.0,10.0,10.0,1603860889
Guzel.,10.0,10.0,10.0,1603860889
Lavasınız biraz yumuşak olsa herşey 10 numara bide kürdan:).,10.0,10.0,10.0,1603860889
Ekonomik menü asla ekonomik değil.,10.0,1.0,7.0,1603860889
Su kuryeleriniz amasya gibi kucuk bi yerde adresi okumak yerine her seferinde telefon acacaksa siparis vermiyorum daha.,6.0,6.0,8.0,1603860889
Gayet güzel.,9.0,9.0,9.0,1603860889
İyiydi.,9.0,9.0,9.0,1603860889
Kurye baya hızlı getirdi teşekkür ederim.,10.0,8.0,8.0,1603860889
Ellerine sağlık çok güzel olmuş.,10.0,10.0,10.0,1603860889
Görünen ortada dayı güzel olmasa her seferinde burdan söylemekten bıkmaz usanmaz aynı şeyi yemekten sıkılırdık ama güzel ki sıkılmıyok dayı.,10.0,10.0,10.0,1603860889
Lezzetli ve hızlı.,10.0,10.0,10.0,1603860891
Güzell.,9.0,9.0,9.0,1603860891
"Gelmesi 1 saat 10 dakika sürdü. 1 saat 10 dakika, 1 saat 10 dakika, 1 saat 10 dakika, 1 saat 10 dakika. Sos çok tuzlu, tavuk eti az ve kalın kesilmiş. Dürümünüzü genel olarak beğeniyorum ancak düzeltilmesi gereken şeyler var.",1.0,7.0,7.0,1603860891
Güzel.,10.0,10.0,10.0,1603860891
Yapıyorsunuz bu sporu.,10.0,10.0,10.0,1603860891
Çok güzeldi tadı özel sosu malzemeleri ama önceki siparişlerimde çok pişmiş veya çiğ et geldi eğer bu konuları düzeltirseler en iyi döner restourantı bile olabilirler :d öneririm.,8.0,6.0,9.0,1603860891
Sadece ekmek yedik icinde gram sos yoktu yavan ekmekti hic memnun kalmadik.,6.0,4.0,1.0,1603860891
Kurye patatesi getirmeyi unuttuğu için tekrar gelmesinde patatesin yanında iki tanede tatlı getirmiş saolsun ).,9.0,10.0,9.0,1603860891
Ellerinize sağlık çok güzel ve hızlı geldi teşekkürler emeğiniz için.,10.0,10.0,10.0,1603860891
Gayet memnunum.,9.0,8.0,9.0,1603860891
Sürekli sipariş verdiğim yer sipariş notuna ne yazdiysam onu dikkate alıp göndermişler saolsunlar.,10.0,10.0,10.0,1603860891
Eti patatesi ve sosu iyiydi yine söylicem ama o biber ne kadar acı ya acısızından yok mu.,10.0,10.0,9.0,1603860891
Sipariş notuna bol soslu olsun yazmama ramen öncekinden bile kuru geldi ve çok yavas geldi halbuki evimizden dukkana 10dakika motorla 5dakika ve onceki siparisimde tursu vardi ve bu siparişde yoktu giderek eksiliyor etler yanmıştı lutfen yorumları dikkate alin.,6.0,8.0,5.0,1603860891
Güzell.,10.0,10.0,10.0,1603860891
Biraz kücuk yani 2 tane kesiyo.,10.0,9.0,8.0,1603860891
"Getirdikleri et döner donmuştu çok kötüydü, tavuk dönerleri iyiydi.",5.0,2.0,1.0,1603860891
Dürümünüz bir rakam olsa 7 olurdu. 7 den başka bir rakam düşünülemez.,7.0,7.0,7.0,1603860891
Güzeldi.,9.0,9.0,8.0,1603860891
"Gercekten cok lezzetli bir dürümdü, yeni favori mekanim olabilir ama sosu inanilmaz derecede tuzluydu. Yiyenlerden biri tansiyon hastasiydi tetikte bekledim bisi oldu olacak diye. Umarim hep boyle yapilmiyordur. Lutfen biraz daha dikkat.",9.0,9.0,7.0,1603860891
Patatesler soğuk gelmişti. Notlar düzgün okunmamış. Mayoneze alerjisi vardı arkadaşımın belirttik yinede koyulmuş.,6.0,1.0,4.0,1603860891
İyiydi.,10.0,10.0,10.0,1603860891
Güzel.,10.0,10.0,10.0,1603860891
Dürümden başka her şeye benziyordu ve tavuklar yürüyordu çiğ tavuk durum yapan amasyada tek yersiniz gurur verici bir durum:).,1.0,1.0,1.0,1603860891
Bi çok adı nam salmış marka yapmış yerden daha lezzetli ve daha insan daha gerçekci hanitr ük filmi reklamcıları olurya halkın içinden gibi gösterip piyasa yapan hah bu adamlar orjinali işte lezzet insanlık hoşgörü saygı sevgi her açıdan bu yazdıklarımı okuyan kim umrumda deil içimden gelen bu okada.,10.0,10.0,10.0,1603860891
Dürüm küçüktü lavaş da kuruydu biraz ama ıslak hamburger mükemmel tek geçerim.,9.0,6.0,7.0,1603860891
Beklediğimden çok daha küçüktü sosu iyiydi ama gerçekten çift lavaş olmasına rağmen doyurmadı porsiyonlar çok küçük.,8.0,2.0,6.0,1603860891
Cok guzeldi keske. Hep boyle gelse.,10.0,10.0,10.0,1603860891
Güzel.,10.0,10.0,10.0,1603860891
Donerleri lezzetli ama israrla her siparisimde bol bol soslu istememe ragmen kuru geliyor umarim birdahakine gelmez iyi gunler.,9.0,4.0,5.0,1603860891
İlk defa siparişim geç geldi biraz dikkat etmeniz gerekiyo onun dışında herşey mükemmel elinize sağlık.,10.0,10.0,10.0,1603860892
Gayet güzeldi. Artık dürümcüm diyerek hava atabilecegim bir yer.,8.0,10.0,10.0,1603860892
Eski tadı kalmamış üzgünüm.,10.0,8.0,3.0,1603860892
Porsiyonlar küçülmüş bi önceki siparişim daha büyük gelmişti.,6.0,6.0,9.0,1603860892
Efsane aga.,8.0,8.0,9.0,1603860892
Güzel.,10.0,10.0,10.0,1603860892
Sosu baydı.,5.0,6.0,1.0,1603860892
İyiydi.,8.0,8.0,8.0,1603860892
Güzel daha bol soslu yapsalar daha güzel olur.,10.0,10.0,10.0,1603860892
Deneyin.,10.0,10.0,10.0,1603860892
Daha önce bu kadar harika bir dürüm yememiştim elinize saglık.,10.0,10.0,10.0,1603860892
Yemek güzeldi elinize sağlık hızıda güzeldi herkese tavsiye ederim:).,10.0,9.0,9.0,1603860892
İyiydi.,10.0,10.0,10.0,1603860892
Harika çok lezzzetliydi hızlı geldi.,10.0,10.0,10.0,1603860892
Sos mayonez tavuk tursu baharat bukadar mı yakışır bi dürüm çe ve bu insanlar cok iyi adamlar vesselam.,10.0,10.0,10.0,1603860892
Afiyet olsun.,10.0,10.0,10.0,1603860892
Servis hızlı lezzet desen mükemmel tek kelime ile süperr.,10.0,10.0,10.0,1603860892
Çok iyiy.,9.0,9.0,9.0,1603860892
Efsane.,10.0,10.0,10.0,1601231146
Hızı cidden iyi 15 dakikada geldi. Lezzet de fena değil güzel ama yazılan notlara bakmıyorlar heraldeçünkü ben birine sadece patates koyun yazmıştım ama domates ve marul da vardı.,10.0,5.0,7.0,1601231146
Lavaş biraz kuru sert gibiydi onun dışında tadı gayet güzeldi çabuk geldi.,10.0,10.0,8.0,1601231146
İyi.,3.0,2.0,2.0,1601231146
Güzel.,10.0,10.0,10.0,1601231146
Patatessiz ama soslu ve turşulu olsun dedim tam aksine patatesli sossuz ve turşusuz geldi. Artı soğuk geldi.. Hiç memnun kalmadim.,1.0,1.0,1.0,1601231146
"Ya bir patates göndermişler bu kadar mı kötü olur. Böyle donmus, sertleşmiş, yenmeyecek düzeyi çoktan geçmiş bir patatesi nasıl gönderebiliyorsunuz, hepsini döktüm gerçekten üzücü. Sondu bu siparişim.",7.0,3.0,1.0,1601231146
Herşey çok güzeldi ellerinize sağlık ama yanindaki ikramlık biber tursularin miktari biraz az.,10.0,10.0,10.0,1601231146
Güzeldi ama patatesler bayattı.,10.0,9.0,8.0,1601231146
Cok iyii.,10.0,10.0,10.0,1601231146
Salçalı sostan fazla konuluyor biraz azaltılması lazım.,5.0,5.0,5.0,1601231147
İnanilmaz bir tuz oranı vardı yenecek gibi değildi.,9.0,8.0,7.0,1601231147
Neredeyse sos yoktu bu seferkini begenmedik.,7.0,5.0,5.0,1601231149
Sipariş notuna ekledigim herşeyi yerine getirip göndermişler sağolsunlar lezzet on numara teşekkürler.,9.0,10.0,10.0,1601231149
Çok guzeldiii.,10.0,10.0,10.0,1601231149
Bu adamlar işinin hakkını harbiden veriyor bence ve eklemek isterimki herkes esnaf olamaz ama siz esnafsınız dayı anlayışınız içinde ayrıca teşekkürler.,10.0,10.0,10.0,1601231149
Güzel.,10.0,10.0,10.0,1601231149
Biraz daha pişmiş olsa çok güzel olurdu.,7.0,10.0,8.0,1601231149
Çok beğendim.,10.0,10.0,10.0,1601231149
Sarımsaklı soslu deneyin çok lezzetli.,10.0,10.0,10.0,1601231149
"Kurye arkadaş biraz daha güleryüzlü olabilirdi, sipariş verdiğim için özür dileyecektim az kalsın...",7.0,3.0,9.0,1601231149
Her siparişimiz böyle gelse soslu şekilde asla 10 aşağısı vermem çok lezzetliydi.,10.0,10.0,10.0,1601231149
Iyi.,8.0,8.0,8.0,1601231149
Iyi.,8.0,8.0,8.0,1601231149
"Gayet güzel, gayet hızlı, gayet lezzetli. Kesinlikle tavsiye ederim.",10.0,10.0,10.0,1601231149
İdare eder.,9.0,7.0,7.0,1601231149
Eski tadı yok.,6.0,6.0,6.0,1601231149
Siparis verdim ve anında hızlı geldi ve sıcacaktı. Teşekkürler.,10.0,10.0,10.0,1601231149
Çok lezzetliydi.,7.0,8.0,10.0,1601231149
Çok lezzetli ve çok doyurucu elinize sağlık.,10.0,10.0,10.0,1598601403
Nerde yanmış ve kuru patates varsa hepsini özenle dürümün içine koymanız çok güzel az daha dişimi kıracaktım birde lavaşınız herzmanki gibi yumuşak değil çok sertti ama lezzeti çok iyiydi.,10.0,8.0,5.0,1598601403
Yanlış sipariş.,1.0,1.0,1.0,1598601403
Çok güzel her zaman ki gibi.,10.0,10.0,10.0,1598601403
Dürümün içinde sarımsak vardı en nefret ettiğim şey yani hiç te hoş değildi sarımsak olmasaydı güzel olabilirdi.,8.0,5.0,3.0,1598601403
Teşekkürler.,10.0,10.0,10.0,1598601403
Şu poşeti bir daha hiç açılmayacak mis gibi 88 kere bağlamazsanız ıyi olur çözene kadar dürüm buz gibi oluyor.,10.0,1.0,10.0,1598601403
Daha iyi olabilir ama kesinlikle yenmeyecek bi dürüm değil lezzetli.,7.0,7.0,7.0,1598601403
İskender çok tuzlu.,9.0,9.0,6.0,1598601403
Çok güzel olmuş ellerine sağlık kolay gelsin.,10.0,10.0,10.0,1598601403
Ara dönerlerde bozulma oluyor. 2-3 sipariştir etler yumuşaktı bu sefer çok sert etler vardı içinde yiyemedim.,7.0,7.0,5.0,1598601403
Güzeldi elinize sağlık.,10.0,9.0,9.0,1598601403
Güzel lavaşları biraz kuru ama yinede iyi.,9.0,9.0,9.0,1598601403
Sos güzel değildi gerisi güzel.,10.0,10.0,6.0,1598601405
"Hatay usulü dürüm istedim. Çok çok iyi olmasa da normal standartlarda lezzet, hız ve servis.",9.0,9.0,8.0,1598601405
Her şey için teşekkürler.,10.0,10.0,10.0,1598601405
Hiz bekledigimden çok çok daha iyiydi. Lezzet olarak biraz daha iyi olmasini beklerdim ama yine de doyurucuydu güzeldi.,10.0,10.0,7.0,1598601405
İçinde veya sosta sarımsak vardı sanırım -önceden tadını almıyordum veya bu kadar yoğun değildi varsa da- ve bu seni cidden rahatsız etti. Sarımsak haricinde her şey çok iyiydi bir de biraz geç geldi.,7.0,10.0,8.0,1598601405
Hız 1 inde altında ama 0 olamadığı için puanlıyamadım.,1.0,1.0,1.0,1598601405
 dürümler buz gibi geldi yanlış adrese götürüp aynı dürümleri tekrar bize getirdiler.,1.0,1.0,1.0,1598601405
Kuryenin tavırları hoş değildi.,7.0,8.0,8.0,1598601405
Tavuk döner ve patatesler dürümün icinde sos olduğu halde kuruydu ama genede yenilebilirdi.,10.0,10.0,8.0,1598601405
Tavuğunuz pişmemiş geliyor hocam. Öyle damak tadı az pişmiş çok pişmiş olayı değil hakikaten pişmemiş sakız gibi.,9.0,9.0,5.0,1598601405
Eski best of u mumla arıyorum tavuk yanmış ağzıma deri geliyor dürümdeki patates cipsiniz kaç günlük.,7.0,7.0,7.0,1598601405
"Bayat, kurumuş ekmeği de göndermezsiniz be.",6.0,1.0,1.0,1598601405
Güzeldi elinize sağlık.,8.0,8.0,9.0,1598601405
Tavuğun bazı parçalarının tadı garipti ve lezzetsizleştriyordu hız yeterliydi serviste sıkıntısızdı.,8.0,8.0,6.0,1598601405
Amasyanin bir ucundan diger ucu yurume 1 sata suruyo. Doner 1 saatte gelemiyo.,1.0,2.0,1.0,1598601405
Geçen söylediğime göre lezzet iyi değildi pişmemiş gibiydi porsiyon söylemiştim içindekiler gelene kadar hep karışmıştı.,8.0,8.0,5.0,1598601405
Yanmış patates koymuşsunuz hepsini.,7.0,1.0,1.0,1598601405
Süper hız... 12 dakikada teslim.,10.0,10.0,10.0,1598601405
Sosunuz bir harika servis hızıda gayet başarılı.,10.0,10.0,10.0,1598601405
Döneride kuryesi kadar iyi olsaydı keşke.,10.0,5.0,5.0,1598601405
Dürümler güzeldi. Ama ıslak hamburgerlerin tadı pek beklediğim gibi değildi.,10.0,10.0,7.0,1598601405
Güzeldi.,10.0,10.0,9.0,1598601405
Tam 1. 5 satte geldi.,4.0,7.0,9.0,1598601405
Ne yazık ki puan verme bölümünde 0 yok servis ve lezzette 1 puan bile çok.,5.0,1.0,1.0,1598601405
Bol soğanlı istedim içinde ince doğranmış 3-5 parça soğanla geldi. Bol acılı pul biberdende eser yoktu. Gittikçe kalite ve lezzetten ödün veriyorsunuz.,10.0,6.0,6.0,1598601405
Hataysosu çok azdı soğanlı istemıştim ama soğansız gelmışti.,8.0,9.0,8.0,1598601405
Et dönerinizin tarzını çözemesem de tadı çok güzel :)).,10.0,10.0,10.0,1598601405
Çok güzeldi hız servis lezzet 10 numara.,10.0,10.0,10.0,1598601405
En son ki yediğimden gerçekten güzeldi. İnsanoğlu hata yapabilir. Böyle güzel yapmaya devam edin lütfen bozmayın.,9.0,9.0,9.0,1598601405
Kötü.,2.0,1.0,2.0,1595971659
Güzel.,5.0,5.0,5.0,1595971660
Hiz her zaman ki gibi efsane yavaş.,1.0,5.0,5.0,1595971660
Eh.,7.0,6.0,5.0,1595971660
Etler kurumuştu kuru et koymazsanız iyi olur.,8.0,1.0,1.0,1595971660
İyi.,5.0,5.0,5.0,1595971660
Best of ailesine teşekkür ediyorum. Ekmeği çok çıtır ve lezzetli sağolsunlar o kadar ozenmisler ki yedikçe keyif aldım tavuğun lezzeti zaten harika bahsetmeye gerek yok kendilerine has soslari mükemmel gerçekten keyif alarak yedim ellerinize saglik.,10.0,10.0,10.0,1595971660
Kurye arkadaş vize kartının şifresini sorup kendi girmek istiyor bence hiç hoş değil.,7.0,9.0,9.0,1595971660
Siparişş 1 saatte geldi rezaletti.,1.0,1.0,2.0,1595971660
Dürümün içine domates ve marul da koymuşlar onları da içerikten çıkarma hakkında göstermeleri gerek.,8.0,3.0,9.0,1595971660
Hayatımda yediğim en berbat dönerdi. Sert sert etleri koymuşlar içine bir de 2 tane aldım. Aç kaldım. İnsan dönerin içindeki etleri çıkarıp yemeye çalışır mı? Ben çalıştım. Hayatımda ilk defa başıma geliyor. Objektif davranıcağım kısım ise hızlı geldi. Belki nedeni hızlı gelmesiydi.,8.0,1.0,1.0,1595971660
Aşırı kuruydu tavuklar patatesler lavas rezaletti bozmussunuz iyice.,1.0,1.0,1.0,1595971660
Et dönerleri çok kötü 3 günlük et döner yemek isteyen sipariş edebilir.,1.0,1.0,1.0,1595971660
Sosu biraz az olmuştu.,8.0,8.0,7.0,1595971660
Cok yazık tam ekmek arası tavuk dürüm aldım geldiğinde paketten dokulmuş ve içinde sadece tavuk tavuk vardı ne sos ne de diğer içinde bulundugunu yazan seçenekler kupkuruydu tavuklar bayattı.,7.0,5.0,2.0,1595971660
Guzel.,10.0,10.0,10.0,1595971660
Güzel.,8.0,8.0,8.0,1595971660
Harika.,10.0,10.0,10.0,1595971660
Çok güzel lezzetli.,10.0,10.0,10.0,1595971660
Çok güzel ve lezzetli.,10.0,10.0,10.0,1595971660
İdare eder.,6.0,6.0,6.0,1595971660
"Hatay usulü tavuk dürümün tadı tuzu sosu güzel ama içine tavuğu az, patatesi çok koymuşlar.",8.0,8.0,3.0,1595971660
10 dakikada geldi. Gerçekten hızlı geldi servis güzeldi. Lezzete 9 vermenin sebebi sosu bana göre değildi ama yenmicek gibi de değil gayet güzeldi.,10.0,10.0,9.0,1595971660
Hızlı sıparış mükemmel :).,10.0,10.0,10.0,1595971660
Para üstü yanlis verildi... Bi daha siparis vermem.,1.0,1.0,1.0,1595971660
Siparişimde kola eksik geldi ve beklemek zorunda kaldım.,8.0,7.0,9.0,1595971660
Eldivensiz dağıtım. Kuru dürüm.,7.0,4.0,1.0,1595971660
Dürumun içinde kemik parçalarının olması dışında her şey iyi sıcak ve hızlı.,10.0,10.0,5.0,1595971660
Güzel.,10.0,10.0,10.0,1595971660
Efsane.,10.0,10.0,10.0,1595971660
Evde olsa peçete koyması gerek ve kavutları sertti.,9.0,4.0,7.0,1595971660
Çok hızlı bir şekilde geldi. Dönerde gayet güzeldi.,10.0,10.0,9.0,1593341917
Her zamanki lezzet güzeldi.,10.0,10.0,10.0,1593341917
İdare eder ama yavaştı.,4.0,7.0,7.0,1593341917
Et döner bu kadar kötü yapılabilirdi.,5.0,5.0,1.0,1593341917
Üçüncü defa aynı sorunu yaşıyorum. Dürümlerin içindeki patates çok az pişmiş oluyor her seferinde. Dürüm genel olarak çok kuru ve tavuk eti de aynı şekilde kupkuru. Dürümü yedikten sonra akşama kadar yanma kaynaklı mideyi perişan etmeye hakkınız olmadığını düşünüyorum.,8.0,2.0,1.0,1593341917
Notlar okunmuyor dürümde sos namına bişey yok ve soğuk geliyo. Bi ayar çekin artık şu işe..,10.0,10.0,1.0,1593341917
Et dürüm söyledim arkadaşım uyarmasına rağmen ordan et yeme dediği halde söyledim ve inanın bana en kötü et dönerdi ve ilk defa bir yere 10 dann aşşağı puan veriyorum direk -1.,1.0,1.0,1.0,1593341917
Hayatımda yediğim en kötü et dürümdü beceremiyorsanız yapmayın.,1.0,1.0,1.0,1593341917
Etler çiğydi ve karnımı ağrıttı. Fiyatı düzenli aralıklarla arttırıyorsunuz ama aynı hassassiyeti lezzete yansıtmıyorsunuz. Ayransız 10 lira olan bir dürümden daha iyi bir şey bekliyor insan tabi.,10.0,7.0,3.0,1593341917
Domatessiz istedim domatesli geldi3tavuk cok kuru ve lezzetsiz diekmek bayattisoyledigime pisman oldumsadece cabuk geldi.,9.0,1.0,1.0,1593341917
Onur yıldız a saygılar...,10.0,10.0,10.0,1593341917
İyi.,10.0,10.0,10.0,1593341917
Süper.,10.0,10.0,10.0,1593341917
Tavuk biraz kuruydu.,8.0,8.0,7.0,1593341917
İyi.,10.0,10.0,10.0,1593341917
Yine süper herzaman olduğu gibi.,10.0,10.0,10.0,1593341917
Mükkemmellll.,10.0,10.0,10.0,1593341917
Harika.,10.0,10.0,10.0,1593341917
Etler biraz kuru gibiydi ama yinede süper.,10.0,10.0,9.0,1593341917
Çok hızlıydı istediğim gibi geldi.,10.0,10.0,10.0,1593341917
Beklediğimden hızlı ve güzel paket halinde geldi fakat tat konusuna gelirsem tavuğu yakmışsınız.,9.0,10.0,5.0,1593341917
Onur hızlı getiriyor.. Onur olmasa gerçekten iptal ederdim diğer kurye hep yavaş canım sıkıldı son 4 paketi onur getirdi harika hızlı ve sıcaktı.,10.0,10.0,5.0,1593341917
Galiba hayatımdaki en hızlı siparişti 5 dakika da geldi çok şaşırdım :) herhalde restoranda olsam bu kadar hızlı servis edilemezdi :)).,10.0,9.0,9.0,1593341917
Çok hızlı servis ve güzel lezzet tavsiye ederim.,10.0,10.0,10.0,1593341917
Siparişi verdim 5 dakika sonra kapı çaldı hala bu nasıl oldu şaşkınım :) ayrıca çok lezzetli ve çok sıcaktı teşekkürler.,10.0,10.0,10.0,1593341917
999.,9.0,9.0,9.0,1593341917
Adanalıyım. Ama bu adamlar bana amasya da adanaya hissettirir sanki adana daymışım keyfıni hissıni yaşattırır bra.,10.0,10.0,10.0,1593341917
İyi.,10.0,10.0,10.0,1593341917
Turşu istemedim ama getirdiler:(.,10.0,9.0,10.0,1593341919
Hamburgere çorbamı döktünüz kardeşim öyle hamburger olmaz.,5.0,1.0,1.0,1593341919
Her şey mükemmeldi her şey için teşekkürler.,10.0,10.0,10.0,1593341919
İskender fransız kalmis.,1.0,1.0,1.0,1593341919
Şöyle sos güzel olunca tavuk iskender harika oluyor.,10.0,10.0,10.0,1593341919
Lezzet guzel ama gec geldi.,7.0,9.0,9.0,1593341919
Selime selam olsun.,10.0,10.0,10.0,1593341919
Her şey için sağolunn hediye icinde.,10.0,10.0,10.0,1593341919
Güzel.,10.0,10.0,10.0,1593341919
Daha iyi olabilir.,3.0,4.0,7.0,1593341919
Kuryeniz çok iyi ismi onur galiba... Harika birisi.,10.0,10.0,6.0,1593341919
50-60 dakikada gelecek dendi fakat 1 saat 20 dakika sonra geldi.,1.0,4.0,6.0,1593341919
Kuryeler çok kibar sıcak hızlı geldi lezettide harika siz amasyaya fazlasınız bence driftci çocuklar.,10.0,10.0,10.0,1590712173
Patates porsiyonu çok küçük.,10.0,8.0,10.0,1590712173
"Tavuk döner siparişi vermiştim. Sipariş köpük kutuda dönerin, ekmeğin ve sebzenin bulamaç halini almıştı. Ekmek normal pide ekmeğiydi lavaş değil. Dönerin üzerinde herhangi bir sos yoktu kupkuruydu. Marul ve domatesten ıslanan taze olmayan ekmek parçaları ıslanmış ve hamurlaşmıştı. Dehşetli kötüydü.",4.0,1.0,3.0,1590712173
Turşu konulmamasını istemiştim fakat dikkate alınmamış.,10.0,5.0,8.0,1590712173
Unutulan böyle bilmediğiniz işi yapmayın.,1.0,1.0,1.0,1590712173
5 dakikalık mesafe yakında olmama 2 saatte sonra gelen sipariş ve buz gibi olması tam bir rezillik..,1.0,1.0,1.0,1590712173
Baya geç geldi ayrıca kola sıcacıktı dikkat edilmesi gerek.,7.0,8.0,8.0,1590712173
Tadı iyi ancak döner hep kuru ve kalın kesilmişti.,7.0,7.0,8.0,1590712173
"1, saatte anca geldi lezzet on numara ama.",1.0,1.0,10.0,1590712173
Siparişimiz 3 saatte geldi sürekli aradık yoğunluk olduğunu ve birazdan gönderceklerini söylediler ama 3 saat bekledik dürümler soğumuş kendinden geçmişti tekrar tercih etmeyeceğiz.,1.0,1.0,1.0,1590712173
"Şuana kadar hiçbir restorana kötü yorum yapmadım ama bu sipariş tam 1 saat 57 dakikada geldi. Dürüm küçüktü, içecekler yanlış gelmişti. Bir daha asla sipariş vermem.",1.0,1.0,1.0,1590712173
