comment_text,comment_speed,comment_service,comment_taste,comment_time
Gayet güzeldi ve 10 dakika içerisinde geldi çabuk geldi.,10.0,10.0,10.0,1606476803
Pideler enfes sadece hız konusunda pek iyi değildi teşekkürler.,8.0,10.0,10.0,1606476803
Tek kelimeyle muazzam.,10.0,10.0,10.0,1606131203
Çok hızlı.,10.0,9.0,7.0,1606131203
"İlk defa size düşük not veriyorum. Aç olmasam hayatta yemezdim. Kıyma bildiğiniz kokuyordu. Hamur da çiğ idi. Sucuğa sucuk demeye bin şahit lazım. Midem hala tuhaf. Çok lezzetliydi pideniz, ilk defa bu kadar kötü yedim. Kendinizi bozmamışsınızdır inşallah.",8.0,10.0,3.0,1605958403
Herşey iyiydi fiyat makul lezzet fiyata göre çok iyi.,10.0,10.0,10.0,1605958403
Tuzluydu.,6.0,3.0,4.0,1605699203
"Pideleri gayet güzel ama corba beni sok etti. Resmen su kivamindaydi. Hayatimda gördüğüm en sivi mercimek corbasi olarak tarihe gecti. Adi mercimek zaten, bu kadar sulu bir seyde mercimek tadi degil kokusu bile yoktu. Onun disinda hiz da gayet iyiydi.",8.0,8.0,6.0,1605699203
Kuşbaşılının etleri daha çok pişmiş olmalı diye düşünüyorum ama yine çok güzeldi.,10.0,10.0,9.0,1605267203
Bağçeşmeye kır pidesi siparişi vermiştik çok hızlı geldi ve çok sıcaktı. Lezzet zaten tartışılmaz.,10.0,10.0,10.0,1605094403
26 tl tuttu bozuk verdim. Servis elemanı böyle şeymi olur allah aşkına dedi. Para paradır bulamayan var. Cimmere yaz tedavülden kaldırsınlar paraları o zaman. Üründe yanlış geldi soğuktu. Ama sağlık olsun emeğiniz için teşekkür ederim. Sadece olanı yazdım. Keşke kağıt para verebilseydim durumumyoktu.,6.0,3.0,3.0,1605094403
"Lezzetiyle, servisiyle 10 numara bir mekan. Herkese tavsiye ederim.",10.0,10.0,10.0,1605008003
"Mantarlı kaşarlı güveç pide ve patatesli kır pidesi söyledim. İkisi de fazla yağlıydı ve patatesli pidenin gerçekten herhangi bir lezzeti yoktu, mantarlı pide ise fazla tuzluydu ve de pidenin kenarları dışında kalan kısım çok inceydi.",7.0,6.0,3.0,1604921603
Hızlı geldi ama pideler kır olsa da çok yavandı.,7.0,6.0,6.0,1604835203
Her şeyi güzeldi. Yalnız pideye biraz fazla kekik atmışlar. Lezzetten 1 puanı bu sebeple kırdım. Hızı ise bayağı hızlı.,10.0,10.0,8.0,1604576003
Ispanaklı kır pidesini bir elden geçirseniz iyi olur. Çok yavan çünkü. Onun dışında her ürün fiyatıyla orantılı kaliteli.,9.0,9.0,8.0,1604403203
Bayıldıkkkkk.,10.0,10.0,10.0,1604316803
O kadar pide aldık hepsi çok aşırı tuzluydu yiyemedik.,9.0,8.0,2.0,1604230403
Herzamanki gibi gayet basarili...,10.0,10.0,10.0,1604106257
"Güzel, beğendim.",10.0,10.0,10.0,1604106257
Harika herkeze tavsiye ederim çok hızlı akıp gidiyor.,10.0,10.0,10.0,1604106257
Hızlı ve lezzetli.,10.0,10.0,10.0,1604106257
Çok da begenmedik.,9.0,8.0,7.0,1604106257
Harikaydı.,10.0,10.0,10.0,1604106257
Gönüllerin ve lezzetlerin birincisi...,10.0,10.0,10.0,1604106257
Elinize sağlık.,10.0,10.0,10.0,1604106257
Kurye arkadaş temel eğitimini tamamlayamamış gibi hareketlerde.,2.0,6.0,6.0,1601476511
Her zaman şampiyon...,10.0,10.0,10.0,1601476511
Özellikle notta sıcak gelsin beklerim diye belirttim ama soğuk geldi.,1.0,1.0,1.0,1601476511
Tek kelime ile harikasınız.,10.0,10.0,10.0,1601476511
Yine nefis lezzetli.,10.0,10.0,10.0,1601476512
En iyi karadeniz pide.,10.0,10.0,10.0,1601476512
Çok hızlıydı ve harika pidesi vardı kocaman resmen arttı bayıldık.,10.0,10.0,10.0,1601476512
Siparişim tam 4 dakika sonra geldi ve sıcaktı. Gerçekten müthiş.,10.0,10.0,10.0,1601476512
Harikulade.,10.0,10.0,10.0,1601476512
Guzeldi.,10.0,10.0,10.0,1601476512
2 kişi söylemiştik 4 tane pide kahvaltıya da kalır diye düşünmüştük ama o kadar lezzetli ve sıcaktı ki 10 dakika içerisinde bitirdik. Kaşarlı mantarlı olan favorimiz oldu.,10.0,10.0,10.0,1598846766
Usta değişti heralde kıymalı pide soledik domatesler ve biberleri butun koysaydınız.,10.0,10.0,6.0,1598846766
Kuşbaşılı pide soyledim içinde peynir olmasın dememe rağmen peynir koymuşlardı yemeden çöpe attım.,1.0,1.0,1.0,1598846766
İzmit in göbeğinden otogara seri ve sıcak getirmesi çok şahane ayrıca lezzeti zaten muazzam..,10.0,10.0,10.0,1598846766
"Hızlı, uygun, pratik.",10.0,10.0,10.0,1598846766
Güzeldi.,10.0,10.0,10.0,1598846766
Kır pidesi hariç hepsi sıcaktı.,10.0,10.0,10.0,1598846766
10 10 10 güzel.,10.0,10.0,10.0,1598846766
İdare eder.,8.0,6.0,8.0,1598846766
Gayet hızlıydı ve güzeldi.,9.0,9.0,9.0,1598846766
Kurye arkadaş resmen hareketleri ile söyleme lan sen bir daha sipariş felan dedi resmen msj alındı kurye kardeş (.,1.0,6.0,8.0,1598846766
Güzeldi.,10.0,10.0,10.0,1598846766
Güzel.,8.0,8.0,8.0,1596217020
İzmit ten otogara çok seri ve sıcak getirmeleri harikulade bişey.. Seviyoruz.,10.0,10.0,10.0,1596217020
Bu kadar sıcak nasıl getirdiniz çok merak ediyorum. Çok güzeldi her şey.,10.0,10.0,10.0,1596217020
Biraz daha lezzetli olması gerekir.,8.0,5.0,3.0,1596217020
Yıllardan beri tadında ufacık bi değişiklik olmaz mı ya? Hala güzel hala leziz.. İyi ki varsınız..,10.0,10.0,10.0,1596217020
Ya boyle bişey yok daa. Rizeliyim rizede yemedum boylesini.,10.0,10.0,10.0,1593587274
Mantarlı yediğim pide çok kötüydü.,1.0,1.0,1.0,1593587274
"İlk kez denedim, gayet iyiydi. Bayağı hızlı geldi.",10.0,10.0,10.0,1593587274
Cok hızli geldi ve lezzetliydi teşekkürler.,10.0,10.0,10.0,1593587274
Pideler çok hızlı ve sıcak geldi. Lezzetide güzel ama çok tuzlu.,10.0,9.0,9.0,1593587274
Efsane...,10.0,10.0,10.0,1593587274
Siparişimiz çok hızlı geldi ve sıcaktı. Pidelerin lezzeti güzel ama fazla tuzluydu.,10.0,8.0,9.0,1593587275
Şu sipariş alt sınırını 15 e çekin. Ev değiştirdim 25 tl ağır geliyor her sipariş başı.,10.0,10.0,10.0,1593587275
Lezzetini tartışmicam gerçekten çok güzel fakat online kartla parasını ödediğim ve eksik getirdikleri iki sipariş var ayıp olmasin dükkana gidip gelmekle uğraşmasın diye kuryeye söylemedim ama parasını ödediğim şeyide almak istiyorum dikkatli olun artık.,3.0,1.0,8.0,1593587275
Taze değildi ısıtılmış gönderilmiş çok beğenemedik yerinde yemek daha güzel tereyağ ile servisi başka oluyor.,8.0,6.0,6.0,1593587275
"Hızlı, sıcak, lezzetli.",8.0,8.0,8.0,1593587275
Böyle karadeniz olmaz beyler.. Sallamayalım.,8.0,8.0,8.0,1593587275
Kocaman porsiyon ve gayet lezzetliydi cok begendiktek sorun fazla tuzlu olmasiydi. Tuz oraniniza dikkat edebilirseniz -hem damak tadi hem saglik acisindan zararli ve gereksiz- seviniriz. Tesekkurler.,9.0,9.0,9.0,1593587275
"Kuşbaşılı kaşarlı karadeniz pidesikarışık karadeniz pidesibunları sipariş edin, bir daha başka pideciden yemeyeceksiniz!",10.0,10.0,10.0,1593587275
Afiyet olsun.,10.0,10.0,10.0,1590957529
Çok geç geldi ama sıcak ve lezzetliydi. Pidelerin arasına şeffaf ambalaj koymaya tekrar başlamışsınız böyle devam lütfen.,5.0,10.0,10.0,1590957529
