comment_text,comment_speed,comment_service,comment_taste,comment_time
Lütfen müşreri notlarına dikkat edin.,1.0,1.0,1.0,1606572539
Başarılı.,10.0,10.0,10.0,1606572539
Önceden kıyması daha lezzetliydi biraz bozdular ama yine de güzel.,6.0,4.0,7.0,1606486139
Gerçekten porsiyonlar inanılmaz büyük ya bir de kıymalı kaşarlı pide enfes kullandıgınız tereyağı çok güzel.,8.0,8.0,10.0,1606486139
Katmer i tavsiye etmiyorum.,10.0,10.0,10.0,1606313339
Mercimek çorbasından mutlaka icmelisiniz. 5 dakika sonra yemeğim önündeydi.,10.0,10.0,10.0,1606313339
Güzel.,10.0,10.0,10.0,1606226939
Güzeldi.,10.0,9.0,9.0,1606226939
Bekledigimizden cok hizli geldi ve cok alakali kurye idi.,9.0,9.0,10.0,1606226939
Güzeldi.,9.0,9.0,9.0,1606226939
Lezzetine ve hıza lafım yok uzun süredir başka yeri tercih etmiyorum fakat çorbam her seferinde dökülmüş olarak geliyor paketlemede problem var.,8.0,3.0,10.0,1606140539
Bu fiyata bu olur elinize sağlık.,8.0,8.0,8.0,1606054139
Süper herzamanki gibi.,10.0,10.0,10.0,1606054139
Ellerinize sağlık.,10.0,10.0,10.0,1605967739
Müşteri notları hiçbir şekilde dikkatle alınmıyor ve normalden çok geç geliyor.,3.0,1.0,1.0,1605967739
Çorbalari saatte kaçta soylerseniz söyleyin sıcak geliyor.,10.0,10.0,10.0,1605967739
İlk ve son siparişimdi kalan bütün pideleri bana göndermişsiniz sıcak dursun diye altı ısıtmalı tezgahta altları odun gibi olmuş dura dura üstlerini yiyip geri kalanını attım çok ayıp yakıştıramadım.,1.0,1.0,1.0,1605881339
Müthiş.,10.0,10.0,10.0,1605881339
Kullandığınız un en kalitesiz un sanırım lastik gibi. Oluyor soğuduğunda donan bi yağ var kıymalı ürünlerde oluyor genelde.,7.0,7.0,7.0,1605881339
Mercimek çorbası harika.,10.0,10.0,10.0,1605881339
Not yazmışsın sunu iştemişsin istememişsin umrundabile deyiller ama onlar okuyup yapmıyorlar bizde geri göndermememizden iyi niyet i kötüye kullanıyorlar.,10.0,7.0,10.0,1605881339
Çorbada kaşık yoktu pideler fazlasıyla yağlıydı.,5.0,1.0,5.0,1605881339
50 dakikada anca geldi.,3.0,7.0,9.0,1605794939
Yedigimiz pide ve pizza super ötesi kesinlikle tavsiye ediyorum. Bir yiyen bir daha birakamaz. Hep olsa hep yersiniz. Bize tavsiye ettiler bizde tavsiye ediyoruz.,8.0,10.0,10.0,1605708539
Kaşık ve ketçap koymayı unutsanız da güzel.,10.0,10.0,10.0,1605708539
Harika.,10.0,10.0,10.0,1605708539
"Kurye çok nazikti, tavuk tantuni her zamanki gibi 10/10.",10.0,10.0,10.0,1605708539
Güzeldi.,7.0,8.0,10.0,1605622139
Lezzetllii güzel ama boyut olarak küçük doyamadık maalesef.,10.0,10.0,10.0,1605622139
Kurye abıye sevgiler post bozuldu ama.,10.0,10.0,10.0,1605622139
Özellikle yazmamıza ramen pizzanın sadece 1inde sos vardı ve çok geç geldi soğuktu.,1.0,1.0,1.0,1605535741
Notlara bakmıyorsunuz!,10.0,10.0,6.0,1605535741
Pideler güzel sadece. Kır pideler berbat lastik gibi parçalar var büyük büyük.,9.0,8.0,7.0,1605535741
2 saate anca geldi buzz gibiydi 2 pide 7 su soyledim pideler bogazimda kaldi.,1.0,3.0,1.0,1605535741
Güzel lezzet.,10.0,10.0,10.0,1605449341
Tek kelimeyle efsana elerinize sağlık.,10.0,10.0,10.0,1605449341
Sipariş verdikten hemen sonra çok geçmeden kapıdaydı pideler sıcacıktı emeğinize sağlık.,10.0,10.0,10.0,1605449341
Herşey süperdi sadece yoğurtlu tantuni biraz daha fazla yoğurt istiyoruz aynen devam.,10.0,10.0,10.0,1605362941
Pide istemiştim pizza geldi malesef tadı güzeldi ama yanlış yolladınız.,9.0,9.0,8.0,1605362941
"Kuryeci ürünü sipariş ettikten 8 dakika sonra geldi, gerçekten hızlıydı. Çorba önceden içtiğimde sanki daha lezzetliydi ama buda ortalamanın baya üstündeydi...",10.0,10.0,10.0,1605362941
Herşey mükemmeldi. Geç gelen ve soğuk olan yemek ılımış kola. Hele teslim edilmeden siteye teslim yazmak harikulade..,3.0,8.0,7.0,1605362941
Hersey soguk ve corbada yanık tadı vardı pideler soguktu.,3.0,2.0,3.0,1605362941
İnsan bi salata bişey koyar.,8.0,4.0,7.0,1605276541
Soğuk geldi ve çok uzun sürdü.,5.0,10.0,8.0,1605190141
İlk defa bi restorana düşük puan veriyorum cunki geldiginde cok soguktu sanki bayat gibiydi.,3.0,3.0,3.0,1605103741
Gerçekten çok beğendim...,10.0,10.0,10.0,1605103741
İi.,9.0,9.0,9.0,1605103741
Pideler hem gec geldi hemde cok yagliydi. Bu sefer begenemedim uzgunum.,5.0,9.0,4.0,1605103741
Çok iyi.,10.0,10.0,10.0,1605017341
50 dk ve soğuk geldi.,1.0,1.0,1.0,1605017341
Güzel lezzet.,10.0,10.0,10.0,1605017341
"Babalar, sizden sürekli sipariş veren biri olarak rica ediyorum lütfen tadınızı bozmayın. Bi gün çok güzel çok taze geliyor başka bi gün kavgada adamın kafasına atsan yaracak şekilde. Ama pizzalar efso.",9.0,9.0,9.0,1605017341
Çorba gayet sıcak geldi ekmekler de öyle. Turşusunu da bol koymuşlardı.,7.0,10.0,10.0,1605017341
Kaşarlı mantarlı pide efsane.,10.0,10.0,10.0,1604930941
Kralsınız başka açıklaması yok ıspanaklı kıymalı favorim deneyin abi.,10.0,10.0,10.0,1604930941
Eski lezzeti yoktu.,1.0,1.0,1.0,1604930941
Tereyağı fazlasıyla baskındı. Azaltılabilir.,8.0,8.0,6.0,1604930941
"Harika. 18 dakikada hazırlandı yola çıktı. Sıcacık, bol malzemeli geldi. Elinize sağlık, öğrenci olarak 20 tlye doyulan nadir yerlerden.",10.0,10.0,10.0,1604930941
Çok güzeldi.,9.0,9.0,9.0,1604930941
Her zaman sıcak ve hızlı getiriyorlar.,10.0,10.0,10.0,1604930941
Notumu dikkate aldığınız için teşekkür ederim. İçecek unutulmutu fakat her tat her zaman çok iyi olduğu için önemli değil. Kuryenizin gecikmeye ilişkin cevap veriş tavrını olumsuz bulduğum için 1 puan:(.,1.0,10.0,10.0,1604844542
Güzel lezzet.,10.0,10.0,10.0,1604758142
Tavuk sote bildiğin tavuklu pide içiydi. Beğenmedim.,1.0,6.0,4.0,1604758142
Guzeldi. Turşu yerine biber turşusu yazmanızı öneririm.,9.0,9.0,9.0,1604671742
Ekmek hamurundan pide pek lezzetli olmuyor. Pide hamurundan yaparsanız daha güzel olur. Teşekkür.,8.0,7.0,7.0,1604671742
"1. 5 saat beklemek, aradığınız da tutarsız bahaneler duymak ve soğuk yemek istiyorsanız adresiniz.",1.0,1.0,1.0,1604671742
Tursu koy icine.,8.0,6.0,10.0,1604671742
Peynirli pide isteyip kıymalı getirmeleri dışında sorun yok.,10.0,1.0,10.0,1604671742
Maskesiz.,1.0,1.0,1.0,1604671742
Gayet güzel ve lezzetli.,9.0,9.0,9.0,1604585342
"Lezzeti çok iyi sıcacık geldi. Servise 9 vermemin sebebi, pideyi çok kötü kesmişler, hatta kesememişler. Ayırmak için uğraş verdim. Bunun haricinde hbir sıkıntı yok. Biraz daha hızlanmaları tam puan getirir.",8.0,9.0,10.0,1604585342
Corbalar ilk defa dökülmüş olarak gelmişti çorbada eski tat yoktu eski lezzetine dönmesi ümidiyle iyi çalışmalar.,10.0,1.0,5.0,1604585342
Kır pidesi muazzamdı ama normal pide leş 7 puanı kır pidesine verdim.,8.0,3.0,7.0,1604585342
İyi.,8.0,8.0,8.0,1604498942
Nice.,8.0,8.0,8.0,1604498942
Tezgahta kalmış soğumuş pide gönderiyorsunuz pideyi yerken dişimiz kırılacaktı nerdeyse...,8.0,6.0,3.0,1604326142
Cansınız.,10.0,10.0,10.0,1604326142
Gece 2 de verdim çorba dahil her şey sıcaktı ve hıphızlı geldi.,10.0,10.0,10.0,1604326142
"Gayet hızlıydı, sıcaktı, zaten çok lezzetli. Ispanaklı pide porsiyonu da çok iyidi. Sadece hala patatesli kir pidesinin harcı biraz az, onu artıtrabilseniz harika olacak.",10.0,9.0,10.0,1604326142
Başarılı bir sunum yapılmıştı. Teşekkürler.,9.0,9.0,9.0,1604239742
Her zaman güzel..,9.0,9.0,9.0,1604153342
Baya iyiydi sıcakta geldi elinize sağlık.,10.0,10.0,10.0,1604115596
Çok iyi.,10.0,10.0,10.0,1604115596
Yıllardır yediğim yer kalite her zaman üst düzey.,10.0,10.0,10.0,1604115596
İyi.,10.0,10.0,10.0,1604115596
Cok tuzlu bide yeşilik yok.,10.0,1.0,1.0,1604115596
Güzel lezzet.,10.0,10.0,10.0,1604115596
Yani sabahtan kalan pideleri ısıtıp dayatmışlar bana kek gibi pide yedim tadı bile yoktu yakışmadı yani patatesler zaten kuru geldi yazık günah.,7.0,4.0,1.0,1604115596
Son dönemlerde verdiğim en kötü siparişlerden bilgilerinize. Elimizede çok gel ulaştı.,4.0,5.0,3.0,1604115596
Pideye koyduğunuz et sinirli kayış gibi.,8.0,7.0,7.0,1604115596
Cadde katık.,10.0,10.0,10.0,1604115596
Tadı çok değişmiş. Kıymalı pideye basmışlar soğanı.,6.0,6.0,7.0,1604115596
Geç saat siparişleri bile çok özenli.,10.0,10.0,10.0,1604115596
Kavurmalı pide istedim ancak içinde kavurmayı zor sezebildim. Yok denecek kadar azdı.,4.0,7.0,1.0,1604115596
Önceden roka geliyordu artık gelmiyor -.,1.0,10.0,10.0,1604115596
Tavuklu pide de çok fazla biber tadı var. Biraz azaltılırsa harika olur.,10.0,10.0,8.0,1604115596
Keşke notlar kısmını da dikkate alsanız biraz.,8.0,8.0,8.0,1604115596
Yıllardır değişmeyen lezzet.,10.0,10.0,10.0,1604115596
Harika.,10.0,10.0,10.0,1604115596
Güzel lezzet.,10.0,10.0,10.0,1604115596
Kurye abiden allah razı olsun. Hız mükemmeldi. Ellerinize sağlık.,10.0,10.0,10.0,1604115596
Siparişler 1 saat sonrasında geldi.,1.0,1.0,1.0,1604115596
Müthiş. Mercimek efsane. Notlara dikkat ediliyor.,10.0,10.0,10.0,1604115596
Pide denince akla gelen ilk ve tek yer.,10.0,10.0,10.0,1604115596
"Üff ne çorba, hem sıcak hem lezzetli, pideyi anlatmıyorum bile... Valla helal olsun.",10.0,10.0,10.0,1604115596
Gğzle.,10.0,10.0,10.0,1604115596
Berbat.,1.0,1.0,1.0,1604115596
"Plastik çatal, peçete vs. İstememiştim ama gönderilmiş, lütfen dikkat edin. Patatesli kaşarlı pidenin tadı güzeldi. Hız da iyi.",10.0,8.0,8.0,1604115596
Hızlı geldi ve sıcacıktı. Kuşbaşılı kaşarlı pidelerden birini yumurtasız istemiştik. O da yumurtalı yapılmış. Kaşarı da az bulduk. Yok gibiydi. Haricinde lezzetliydi. Bu yüzden 1 puan kırdım.,10.0,9.0,9.0,1604115596
İlk defa pizza söyledik. Çok iyiydi. Diğer ürünler zaten 10 numara. Sağolsunlar.,10.0,10.0,10.0,1604115596
Wuhhw.,10.0,10.0,10.0,1604115596
Başarılı.,8.0,8.0,8.0,1604115596
On numara beş yıldız.,9.0,9.0,9.0,1604115596
Harika.,10.0,10.0,10.0,1604115596
Kır pidesinin tadı biraz vasat.,9.0,7.0,7.0,1604115596
15 dk da gelmeniz yerine notları okuyup 1 saatte gelmenizi tercih ederdim. Ne yazsak okumuyorsunuz ve pideler hiç bir şekilde sıcak gelmiyor. Ayrıca bu sefer patates harcını yapan abi acıyı fazla kaçırmış sanırım ben hayatımda böyle acı patatesli pide yemedim. Sanırım bu son şans verişimdi. Üzgünüm.,10.0,2.0,2.0,1604115596
Her daim 10 numara.,10.0,10.0,10.0,1604115596
Pizza tek çeşit ama çok iyi tavsiye ederim.,10.0,10.0,10.0,1604115596
Lezzetli.,10.0,10.0,10.0,1604115596
"Sofram pide artık bizim de soframız, ailecek akşam yemeklerimizi mis gibi tereyağlı sofram pide ile süslüyoruz, çocuklarımız artık ne yediğini biliyor..",10.0,10.0,10.0,1604115596
Pideler soğuktu ama tadı güzel.,8.0,6.0,9.0,1604115597
Kıymalı kır pidesi dışında güzel her ürün.,9.0,9.0,8.0,1604115597
Soğuk geldi. Daha önce çok gez gelinen adres ama biraz dolaşmış sanırım kurye.,8.0,5.0,6.0,1604115597
Çok güzel yoğurtlu tantuni tavsiye ederim.,8.0,8.0,10.0,1604115597
İlgisixlik hatsafada telefonla aradığımda brbinlemi başkasıylamı konuştuğu belli değil hız desen oda yok 1. 30 saate geldi sioarişler tşk aç kaldık.,1.0,1.0,1.0,1604115597
Telefonla arasakta ilgilenen yok 25-30 dakikaya gelecek şey 1 saat 15 dakikaya geliyor. Sıfır ilgi müşteri memnuniyeti.,1.0,1.0,1.0,1604115597
Gerçekten berbatsınız. Bu işi bırakın.,10.0,1.0,1.0,1604115597
Hem eksik siparis getiriyosunuz hem telefonu açmiyorsunuz. Nasil bir müesisese bu?,1.0,1.0,1.0,1604115597
Hem doyurucu hem lezzetli hem ekonomik... En sevdigim restoran!,10.0,10.0,10.0,1604115597
Pizza aşşırı iyi.,10.0,10.0,10.0,1604115597
Her zaman ki çorba değildi umarım bir günlük dinir durumdur.,8.0,7.0,2.0,1604115597
Hızlı servis.,10.0,10.0,10.0,1604115597
Gayet güzeldi.,10.0,10.0,10.0,1604115597
Güzel.,10.0,10.0,10.0,1604115597
Elleriniz dert görmesin güzel lezzet.,10.0,10.0,10.0,1604115597
Cok guzeldi simdi yine sipariş verdim sabırsızlıkla bekliyorum.,10.0,10.0,10.0,1604115597
Servis olarak kaşık peçete tuz herhangi birsey konulmamış.,8.0,3.0,8.0,1604115597
Eksik sipariş geldi.,8.0,1.0,8.0,1604115597
Abicim yıllardır varsınız yemeksepetinde ama yıllardır ısrarla şu notları okumuyorusuz. Artık tövbe ettim sizden bir daha sipariş vermek yok!,7.0,7.0,3.0,1604115597
Bir buçuk saatte geldi. Aç kaldık teşekkürler.,1.0,1.0,1.0,1604115597
Başarılı.,8.0,8.0,8.0,1604115597
Yazan sürenin 2 katında getirdiler. Ayrıca sipariş elime ulaşmadan 30 dk önce ulaştı diye işaretlemişler. Yalan söylüyorlar kısaca. Soğuk ve 1 saatte gelen pide yemek istiyorsanız doğru adres ama.,1.0,1.0,1.0,1604115597
3 senedir tavuklu kaşarlı pide yerim kalite iyice düşmüş. İçine koyduğunuz tavuk miktarı çok azalmış. Yanına gönderdiğiniz 9 tllik patates hele? Tavuk döner söylesem daha fazla patates kızartması yerdim! 1 saatte zor evime geldi ve soğuk. Kıymal pide kıymalı değil soğan ve soyalı pide. Yazıklar olsun.,1.0,1.0,1.0,1604115597
Ucuz ve lezzetli.,10.0,10.0,10.0,1604115597
Baya iyi.,10.0,10.0,10.0,1604115597
Ayranımıda getireydi iyidi.,9.0,9.0,9.0,1604115597
Sık sipariş verdiğim bir yer. Fakat son siparişimde çorbalar tamamen dökülmüş haldeydi. İlk kez böyle bi sorun olduğu için yine de çok düşük puan vermek istemedim. Umarım düzeltirsiniz.,8.0,3.0,6.0,1604115597
Soğansız dediğim halde soğanlı geldi. Lütfen notlara dikkat edin. Tantuniniz çok lezzetli ama soğanlı olduğu için yemekte zorlandım.,10.0,1.0,10.0,1604115597
Verdiğimiz siparişin gelişi bir saatten uzun sürdü.,1.0,8.0,8.0,1604115597
Güzel.,10.0,10.0,10.0,1604115597
Güzeldi hersey ellerinize sağlık.,10.0,10.0,10.0,1604115598
Değsmeyen lezzet mercimek çorbası olmak üzere senelerdir tercih ettiğim adres.,10.0,10.0,10.0,1604115598
30dk mesafeye 1s10dkda gelmek iş midir? Bir detr afik var yalanı motorlu kurye için geçerli sebep mi.,1.0,1.0,9.0,1601485852
Güzeldi.,10.0,10.0,10.0,1601485852
Yani menüye tek bir lavaş koymak nedir ya 2-3 tane koysanız dükkanınız mı batacaktı ayrıca tavukta soğuktu ve çok sertti.. Hiç memnun kalmadım ilk ve son oldu galiba siparişim.,4.0,1.0,2.0,1601485852
Ellerinize sağlık hicbir eksik yok.,10.0,9.0,8.0,1601485852
Diger subeniz daha güzel kaliteli bunu begenmedim.,2.0,3.0,2.0,1601485852
Normalde çok güzeldi çorbanız ama bugun tuzsuz ve tadsızdı tutmamış birde fazla limon istiyoruz yetmiyor göndermemişsiniz eğer ücrettense koyun ekstra limon 1 tl diye paramızla alalım.,10.0,1.0,1.0,1601485852
Güzel lezzet.,10.0,10.0,10.0,1601485852
"Lütfen notları okuyun, yok yere plastik kaşık, ıslak mendil vb. Göndermeyin.",8.0,9.0,9.0,1601485852
Elinize sağlık :).,10.0,10.0,10.0,1601485852
"Her zaman sıcak çorba getiren, tüm ürünleriyle kalitede zirve yapmış bir restoran. Elinize emeğinize sağlık.",10.0,10.0,10.0,1601485852
Tantuni pide ve katmerinizi denedim. Açık konuşayım kıymalı kır pidesinde sadece domates tadı vardı kıyma tadı alamadım bile. Tabi ekonomik sebeplerden dolayı kıymalıdan malzeme olarak pek birşey beklemiyorum ama beklediğimden de az geldi. Sadece 1 puan düşük verdim çünkü hamuru gayet iyi ve tazeydi.,9.0,10.0,9.0,1601485852
Çorba dökülmüştü bayağı. İlk kez böyle bir sıkıntı yaşadık yoksa normalde 10/10.,10.0,7.0,10.0,1601485852
Adaaaaammm.,10.0,10.0,10.0,1601485852
Güzel lezzet teşekkürler.,10.0,10.0,10.0,1601485852
Lezzetli ama fiyatina göre cok kücük.,10.0,10.0,10.0,1601485852
Gönderim süresi 30dk yazıyorsunuz sipariş bana 1 saat 10 dakika sonra buz gibi geliyor önceki siparişlerimde de aynı sorunu yaşadım sizle bir daha asla sipariş vermeyeceğim bu restoranttan.,1.0,1.0,1.0,1601485852
Temiz ve güzel sadece kıymalının yağı biraz fazla.,10.0,10.0,10.0,1601485852
Günün her saati sıcak ve taze ürün kalitesi. Elinize emeğinize sağlık.,10.0,10.0,10.0,1601485852
9 liralık gelen patates kızartması gülünçtü bir daha patates söylemem.,7.0,6.0,3.0,1601485852
Geç geldi ve lezzetsizdi.,1.0,1.0,1.0,1601485852
Hamurlu ürünleriniz çok yağlı.,4.0,4.0,4.0,1601485852
Turşu istedik turşuyu geçtim bi tane limon bile yoktu.,9.0,6.0,9.0,1601485852
Güzel lezzet.,10.0,10.0,10.0,1601485852
Her zaman yediğim yer zaten 1 kere memnun kalmadığım olmadı tantuniden anlıyorlar gerçekten aliminyum folyoya sarılı olarak geldi gayet sıcaktı geldiğinde zaten kısa süre içerisinde kapımda oldu.,9.0,9.0,10.0,1601485852
Soğuk.,1.0,1.0,1.0,1601485852
Gecenin 2sinde sıcak gelir mi diye tereddüt ettim açıkçası ama öyle bir sıcak geldi ki ağzım yandı resmen soğumasını bekledim. Yerinde yesem bu kadar sıcak gelmezdi. Kuryeci reise de ayrı bir parantez açmak gerekir. Uslubu ve hızı alkışı hak ediyor bence.,10.0,10.0,10.0,1601485852
O çorba değildi suydu resmen.,10.0,8.0,1.0,1601485852
Mükemmeldi.,10.0,10.0,10.0,1601485853
Çorbalarının üstüne tanımam efsane çorbaları var yanındaki pidelerde mükemmel tavsiye ediyorum.,10.0,10.0,10.0,1601485853
Turşu biberi göndermediğiniz sürece servis 1.,8.0,1.0,8.0,1601485853
Çorba efsane tebrikler.,8.0,10.0,10.0,1601485853
Hızlı ve leziz.,10.0,10.0,10.0,1601485853
Çok lezzetli.,10.0,10.0,10.0,1601485853
Güzel lezzet.,10.0,10.0,10.0,1601485853
Karadeniz pide dedik kıymalı uzun poğaça geldi ehuehe.,8.0,8.0,6.0,1601485853
Sevgilim hiç sevmedi pideler kurumuştu ve soğuktu.,1.0,1.0,1.0,1601485853
İdare.,5.0,5.0,5.0,1601485853
Sipariş notu kısmına üzerine basa basa tantuninin içinde hiçbir şey olmasın dememe rağmen koymuşsunuz.,7.0,7.0,7.0,1601485853
Mercimek çorbası tartışmasız izmitin en iyisi.,10.0,10.0,10.0,1601485853
Mükemmel di.,10.0,10.0,10.0,1601485853
Kıymalı istedim patatesli ve peynirli geldi 45 dk sonra geldi buz gibiydi ne biliyim söylemem söylemmez yani.,1.0,1.0,1.0,1601485853
Gercekten çok hızlı geldi pizza beklediğimden biraz küçüktü lezzet konusunda pideler biraz baharatsızdı sanırım damak zevkime biraz baharatsız geldi ama lezizdi. Kolay gelsin iyi çalışmalar.,10.0,10.0,9.0,1601485853
Sıcak ve hızlı geldi gayet lezzetliydi teşekkürler.,10.0,10.0,10.0,1601485853
1 saati geçti öyle geldi ve tadı hiç iyi değildi lütfen böyle pide gönderilmez yazık günah o kadar para veriyoruz sonra çöpe gidiyor.,1.0,1.0,1.0,1601485853
Sucuklu kaşarlı bir harika ellerinize sağlık kurye kardeşim seninde ayağına sağlık :).,10.0,10.0,10.0,1601485853
Patatestl istedim kıymalı geldi.,7.0,7.0,7.0,1601485853
55 dakika sürdü.,1.0,1.0,1.0,1601485853
Kuşbaşılı kaşarlı pideye kasar koymayı unutmuşlar sanırım. Kuşbaşı da çok azdı. Diğer yerlerle kıyaslandığımda ortalamanın çok altında. Siz mercimek çorbasına devam edin o konuda iyisiniz.,8.0,9.0,5.0,1601485853
Fena değil.,8.0,8.0,8.0,1601485853
1 saatte geldi ve soğuktu.,1.0,2.0,2.0,1601485853
Arkadaşlar tavuklu kaşarlı pideden şaşmayın derim. Tavuklu kaşarlıyı efsane yapıyorlar ama kıymalı kaşarlı beni hayal kırıklığına uğrattı.,10.0,10.0,1.0,1601485853
Keşke pidenin üzerine domates olduğunu söyleseydiniz alerjisi olan var olmayan var lütfen dikkat edin.,3.0,3.0,1.0,1601485853
Hızlı geldi güzeldi kır pidesi.,10.0,10.0,10.0,1601485853
Güzel ve hızlı.,8.0,8.0,8.0,1601485853
İyi.,10.0,10.0,10.0,1601485853
Güzel.,9.0,9.0,9.0,1601485853
Çok lezzetli.,10.0,10.0,10.0,1601485853
Memnun kaldım lezzet özellikle çok iyi.,9.0,9.0,9.0,1601485854
Notları okusanız keşke.,9.0,5.0,4.0,1601485854
Lütfen soğuk içeceği yemek ile aynı yere koymayın sıcak soğuk çok kötü hal alıyor. Ne içecek soğuk kalıyor ne de yiyecek sıcak.,10.0,8.0,10.0,1601485854
Üç senedir sürekli yemek yediğim bir yer. Bir kere bile kötü bir yemeğine denk gelmedim. Tantunisi de pidesi de müthiş. Hayranınızım!,10.0,10.0,10.0,1601485854
1 saat sonra ve buz gibi geldi arayıp söylediğimde de üzerine yoğurt döktüğümüz için soğuyor dendi sanki ilk defa yiyormuşuz gibi üstelik içine malzeme koymayı unuttular galiba yoğurtlu yufka göndermişler.,1.0,1.0,1.0,1601485854
Hızlı ve lezzetli.,10.0,10.0,10.0,1601485854
"Gec sipariş olduğu icin ekmekler somun emekti, kesme hep tantuni ekmegi olsa.",10.0,3.0,5.0,1601485854
Tek kelime ile rezalet 49 dakikada geldi soğuk tatsız şerbetsiz mide bulantısından 2 çatal yiyip çöpe attım.,1.0,1.0,1.0,1601485854
Siparişimin ışık hızında gelmesine pizza dayanamamış anlaşılan. İçinde koyduğunuz kavurmayı nizami bir şekilde pizzanın 3 tarafına eser miktarda koymuşsunuz. Ararken arkadaş kayboldu hala onu arıyoruz. Sormadan koyduğunuz mantar ve mısırları ayıklamak çok eğlenceliydi. Ne diyelim elimize sağlık.,10.0,1.0,1.0,1601485854
"1 saatte getirmenin çeşitli özürleri olabilir belki ama 9 liralık ücrete karşılık, 1 avuç plastik gibi patates gelmesinin özrü olamaz. Rutubet kokan, soğuk, sert, tatsız bir şey geldi. 5 liraya daha lezzetli ve daha fazlasını yollayanlar var. Ayıptır.",3.0,1.0,1.0,1601485854
1. Eleman maskesiz getirdi. 2. Sabah olduğu için heralde. Dünden kalanları bana getirmişler. Ve kıyma ekşimiş. Yada bizede öyle gelmiş olabilir ama kesinlikle soğuk ve bayattı.. 3. Yemeden direk attık. Teşekkürler.,1.0,1.0,1.0,1601485854
Her zaman yediğim o iyi pizza değildi bu seferki soğuk ve malzemesi zayıftı.,5.0,5.0,5.0,1601485854
Yoğurtlu tantuni hastasıyım beeee.,10.0,10.0,10.0,1601485854
Yemekler süper. Ama gönderim süreleriniz cok uzun.,1.0,10.0,10.0,1601485854
Keşke kaşarlı pideye biber ve dometes koyudugunu belirtseydiniz ama güzeldi.,10.0,8.0,8.0,1601485854
Eski lezzeti son iki sipariştir alamıyorum biraz daha dikkat lütfen.,10.0,10.0,7.0,1601485854
Çorba komple posetteydi yiyemedik ne pideyi ne çorbayı çorbanın kasesi alttan patlamış diyeceklerim bu kadar.,10.0,1.0,1.0,1601485854
Fena değildi.,9.0,7.0,7.0,1601485854
Güzel ve sıcaktı beğendik teşekkürler.,9.0,10.0,10.0,1601485854
"Hastaydım, sıcak sıcak getirdiler her şeyi sağ olun. Çorbada bulyon veya tavuksuyu mu vardı anlayamadım ama, keşke tüm ürünlere içeriklerini yazsanız alerji vs için de önemli.",10.0,9.0,9.0,1601485854
Adamsınız.,10.0,10.0,10.0,1601485854
Güzeldi.,10.0,10.0,10.0,1598856108
Her zamanki gibi mükemmel.,10.0,10.0,10.0,1598856108
"Süper ötesi tek geçerim çorbayı bugün b, raz değişik geldi ama ona nazaran bir yorum yapamam herzman iyi çünkü.",10.0,10.0,10.0,1598856108
Hizmet lezzet teslimat siparisin sicak teslimi herseyiyle 10 numara dilerim ayni cizgi ve kalitede hic bozmadan aksine uzerine katarak ilerlemeniz dilegi temennesiyle tesekkurler iyi calismalar.,10.0,10.0,10.0,1598856108
12 dk getirdiler sıcak geldi fiyat performans olarak çok iyi elinize sağlık.,10.0,8.0,10.0,1598856108
Sürekli sipariş verdiğim bir yer fakat zamanla çok bozdunuz ben bu kadar özensiz bişey görmedim tantuni lapa pilav gibi olmuş tavuklu pide zaten her gün daha kötü bir tada bürünüyor... Ben şahsen bir daha sipariş verirsem... Ne diyim.,8.0,8.0,1.0,1598856108
Berbatın ötesi etten kıkırdak çıktı.,3.0,1.0,1.0,1598856108
Bayat pide yolladiniz o yüzden 1.,1.0,1.0,1.0,1598856108
Pide yani... Çok ta şey yapmayın.,10.0,10.0,10.0,1598856108
Tavuk sotesi güzel de yanında ufak bir salata vs bekliyor insan. Yine de güzel.,9.0,9.0,9.0,1598856108
Patatesler daha kaliteli olabilirdi. Keççap mayonez acı sos istemiştim özensiz bi şekilde sadace keççap atmışlar poşetin içene.,8.0,8.0,5.0,1598856108
Bu hız bu lezzet... Pideleri yerken ağzımız yandı.,10.0,10.0,10.0,1598856108
Başarılı.,10.0,10.0,10.0,1598856108
Sıcacık ve lezzetli.,10.0,10.0,10.0,1598856108
"Pideleri yiyemedim, çok kötü kokuyordu tatları da aynı şekilde.",10.0,8.0,2.0,1598856108
Herşey güzeldi pideler hafif yağlı olmuş gerisi iyi.,10.0,10.0,10.0,1598856109
Çokkk iyiiii.,10.0,10.0,10.0,1598856109
Hadi pide çok küçükde malzemede bu kadar az olanını ilk defa görüyorum. Dilimlenmiş pidenin içlerinde kiminde 1 adet sucuk kiminde sadece domates vardı yani pidenin içine konulan miktar 50 gr yoktur domates ve biberi çıkardığınızda bu son sipariş.,5.0,10.0,1.0,1598856109
Normalde başka bir restoranttan alıcaktım ama deneyeyim dedim memnun kaldım kararsız kalan arkadaşlar gönül rahatlığıyla sipariş edebilirler.,8.0,8.0,9.0,1598856109
"Çorbanın yanında tuz yok, pidenin içindekiyse peynir değil.",9.0,7.0,4.0,1598856109
Güzeldi vallahi.,10.0,10.0,10.0,1598856109
Patatesli pide çok güzel ama kıymalı pidenin içinde sadece domatesli baharatlı harç var kıyma tadı hiç gelmiyor fiyatı yükseltilip içine kıyma kullanılabilir bidaha tercih etmem kıymalısını hızlı ve sıcak geldi.,10.0,9.0,5.0,1598856109
Güzel lezzet..,10.0,10.0,10.0,1598856109
Çok hızlı.,10.0,10.0,10.0,1598856109
Geç bir saatte sipariş vermiş olmama rağmen kuryeniz çok güleryüzlüydü. Teşekkür ederim.,10.0,10.0,10.0,1598856109
Ellerinize sağlık teşekkürler.,10.0,10.0,10.0,1598856109
Kötüü.,2.0,1.0,1.0,1598856109
Hızlı ve lezzetli.,10.0,10.0,10.0,1598856109
Elinize sağlık.,10.0,10.0,10.0,1598856109
Süper.,10.0,10.0,10.0,1598856109
Memnun edici.,8.0,8.0,8.0,1598856109
Siparişi vermemle gelmesi bir oldu.,10.0,10.0,10.0,1598856109
Hizmet ve kalitenin yanında kır pidesi mükemmel.,10.0,10.0,10.0,1598856109
Şok güzel.,10.0,10.0,10.0,1598856109
Plastik çatal-bıçak istemediğimi belirtmiştim. Lütfen notları daha dikkatli okuyun. Fiyat-kalite dengesi açısından ürünler genel olarak lezzetliydi.,9.0,8.0,8.0,1598856109
Pidesinden tantunisine muazzam siparisler hizli teslim ediliyor ve sicak geliyor.,9.0,9.0,9.0,1598856109
