comment_text,comment_speed,comment_service,comment_taste,comment_time
2. Defa söyleyişimiz ilkinde hızlıydı ancak 2. Siparişin gelmesi 1 saat olmasına rağmen sıcak ve lezzeti yerindeydi dürümün bile yanında salatalık ve biber turşusu olması güzel detay. Sürey azaltırsanız limana getirirkem memnun kalırız.,4.0,10.0,7.0,1606412471
Liman personeli olarak memnun kaldık.,10.0,10.0,10.0,1605980471
Hep bu kalite ve lezzet de devam etmeniz dileğiyle teşekkür ederim.,10.0,10.0,10.0,1604425271
Bmw m420 lux arabayla paket teslim aldım ve şok oldum! Her şey için teşekkür ederim.,10.0,10.0,10.0,1604128325
Liman dürümün yemek sepetine girişi aynı bölgedeki diğer işletmeler için öncü olur dilerim. Bu açıdan tebrik ediyorum. İlk kez hizmet aldım ve memnun kaldım.,9.0,10.0,9.0,1601498579
Yemeksepeti aracılığıyla ilkez istedim değişik geldi sanırım doğu yöresi yapıyorlar çok beğendim elliinize sağlık tavsiye ettim.,10.0,10.0,10.0,1601498579
