comment_text,comment_speed,comment_service,comment_taste,comment_time
Müdür beye sevgilerle.,10.0,10.0,10.0,1606212452
Gerçekten çok lezzetli bir künefesi var kesinlikle tavsiye ederim ellerine sağlık.,10.0,10.0,10.0,1605780452
"Çok başarılı, doyurucu.",10.0,10.0,10.0,1605434852
Çok kötüydü peynirin tadı değişikti. Bir daha almam.,1.0,1.0,1.0,1605348452
Siz efsanesiniz şu çikolatali fıstıklı pastayı sizin gibi kimse yapamaz her seferinde tazecek her gelişinde daha da lezzetli.,10.0,10.0,10.0,1605348452
Teşekkür ederim elinize sağlık.,10.0,9.0,9.0,1605002852
Ekmekler sahane.,9.0,10.0,9.0,1604916452
Hızlıca özenli şekilde geldi. Teşekkürler.,10.0,10.0,10.0,1604398052
Gerçekten hiz servis lezzet hepsinde on numara tatlıları çok başarılı mutlaka denenmesi lazım.,10.0,10.0,10.0,1604311652
Sipariş notunu dikkate almaları ve 15 dkda gelmesinin yanında pasta gayet taze ve lezzetliydi. Kesinlikle yeni favorim.,10.0,10.0,10.0,1604311652
"Hız kezzet ve fiyat her şeyiyle mükemmel, tüm tatlılar sıcacık geldi kurye de çok kibardı elinize sağlık hep böyle devam edersiniz umarım.",10.0,10.0,10.0,1603966052
Elinize sağlık.,10.0,10.0,10.0,1603841906
Gayet iyi.,10.0,10.0,10.0,1603841906
"Adanada mutlaka denenmesi gereken bir lezzet öncelikle siparişimizi 44 lük hazırlayıp, titiz bir şekilde servis yapılmasını sağlayan personele ve mekana her gittiğimizde bizi güler yüzle karşılayan çetin beye çok çok teşekkür ediyorum petek inci farketmez çetin bey varsa biz hep varız.",10.0,10.0,10.0,1603841906
Tşk.,10.0,10.0,10.0,1603841906
Muhtesem fistikli dondurmada tek gecerim.,10.0,10.0,10.0,1603841906
Fırın sütlaç bozuk geldi...,1.0,1.0,1.0,1603841906
Başarılı.,10.0,10.0,10.0,1603841906
Lezzeti mukemmel ama biraz daha erken gelmeli.. Gec kalindi.,5.0,8.0,10.0,1603841906
"Sütlacın pirinçleri pişmemişti, tadı kötüydü. Dondurma taş gibiydi.",10.0,5.0,1.0,1603841906
Yamuk yumuk geldi. 20 tl verip pasta alıyorsun ve böyle geliyor. Ne diyim. Çilekler hariç tadı da güzel değildi aşırı sekerliydi. Çayı şekerli içerim tatlıyı severim ama bu ciddi sekerliydi midem bulandı. Çilekler güzeldi diye üç puan verdim. Berbat düğün pastaları bile bundan iyi bir daha asla.,9.0,1.0,3.0,1603841906
"Hızlı gönderim için teşekkür, ancak haziran ayında 3 tepsi aldığım normal baklavanın tadını şimdi bulamadım. Tadı çok hoşuma gitmedi, verdiğim paranın karşılığını alamadığımız düşünüyorum, tat iyileşecek ise kg fiyatını 90 dan 120 ye çıkartabilirsiniz. Şeker fazla idi.",10.0,10.0,3.0,1603841906
Başarılı.,10.0,10.0,10.0,1603841906
Özellikle istediğim halde mum ve maytap yollamamışlar.,10.0,6.0,8.0,1603841906
Kunefede kasar tadi vardi asiri yogundu cok sevemedim.,10.0,10.0,7.0,1603841906
Adamlar bu işi yapıyor.,10.0,10.0,10.0,1603841906
Hızlı ve lezzetliydi.,9.0,9.0,9.0,1603841906
Lezzetinden yillardir memnun oldugum yerdir. Tavsiye ederim calisanlarda cok ilgili ve guler yuzlu.,10.0,10.0,10.0,1601212160
"Herşey çok kaliteliydi, zamanında geldi teşekkürler.",10.0,10.0,10.0,1601212162
Mükemmel kalite on numara harika.,10.0,10.0,10.0,1601212162
Cok taze ve lezzetli bir pastaydı.,10.0,10.0,10.0,1601212162
Mükemmel lezzetteydi tatlılar ustaların ellerine sağlık ayrıca sağlıklı cam kasede teslimat çok etkikeyiciydi teşekkür ederiz.,10.0,10.0,10.0,1601212162
Fena değildi.,9.0,10.0,8.0,1601212162
Hızlılardı ama pasta berbat camur gibi geldi begenmedim su adanada yenecek tek güzel yer kalmadi.,8.0,5.0,5.0,1601212162
Künefe hamur gibiydi ve şerbeti nerdeyse yoktu.,1.0,1.0,1.0,1601212162
Pastalar biraz yamulmuş ama lezzet 10 numara.,10.0,7.0,10.0,1601212162
Adanada online olarak hizmet veren en taze pastaları bulabilirsiniz tazeliğinden şüphe etmiştim gerçekten güzeldi tebrikler.,9.0,8.0,10.0,1601212162
Kesinlikle siparişlerimden memnun kalmadım.,1.0,1.0,1.0,1601212162
Tek kelime ile mukemmel bir lezzet.,10.0,10.0,10.0,1601212162
Sutlac çok kötüydü içi katı.,4.0,8.0,1.0,1601212162
Biraz küçük bir pasta fıstıklı çikolatalı olan. İçi baya yoğun çok çabuk kesiyor. Lezzetli ve taze idi.,9.0,10.0,8.0,1601212162
Yaklaşık 5 dk da geldi. Lezzetide gayet yeterli ve güzeldi.,10.0,9.0,10.0,1601212162
"Künefe sıcak geldi, lezzeti de normaldi.",7.0,8.0,8.0,1598582416
Hemen hepsi lezzetli olmasına rağmen kadayıf bize göre çok fazla tereyağlıydı. Ancak geneli güzel elinize sağlık.,10.0,10.0,9.0,1598582416
Çikolatası biraz fazlaydı fakat taze ve lezzetliydi ellerinize sağlık.,9.0,9.0,9.0,1598582416
Sipariş çok gecikti. Ama lezzetliydi.,3.0,8.0,10.0,1598582416
5dakika uzaklıktaki evime bir saatte getirdiniz onun dışında lezzetliydi beğendim.,1.0,9.0,9.0,1598582416
Çok hızlı geldi ve çok lezzetliydi.,10.0,10.0,10.0,1598582416
"Eve siparis verdiğim ancak daha önce tatmadigim ve damak tadima hiç uygun olmayan ürünü, farklı bir ürünle ikiletmeden değiştirdiğiniz için teşekkür ederim... Müşteri memnuniyeti tam olarak budur.",10.0,10.0,10.0,1598582416
Biraz daha hızlanırsanız iyi olur lezzet standart kötü değil.,9.0,9.0,9.0,1598582416
Çikolatalı fıstıklı pastanız efsana tazecik geldi çikolata kıvamına bayıldım.,10.0,10.0,10.0,1598582416
"Lezzet konusundaki düşüncemin sizden künefe sipariş etmiş olmamla hiç alakası yok. Künefe yanında istediğim profiterol deki iç krema, dışındaki sos lezzeti ve porsiyonun mevcut hali. Eve servis istenmiş bir künefe yorumlanması anlamsız bir sipariştir. Künefe mekanda yenir sıcacık ve taze iken...",10.0,9.0,7.0,1598582416
"Gerçekten tam istediğim gibiydi, ellerinize sağlık teşekkürler.",10.0,10.0,10.0,1598582416
Tatlı kutusunda hamurlaşmış noodle geldi ne çatal ne peçete hiç bir şey yoktu.,8.0,1.0,5.0,1598582416
