comment_text,comment_speed,comment_service,comment_taste,comment_time
Çok hızlı servis. Kurye hızlıca teslim ediyor.,10.0,9.0,9.0,1606296256
Fevkalade.,10.0,10.0,10.0,1606296256
Hızlı ve lezzetli servis. Güler yüzlü bir kurye teşekkürler sos.,10.0,10.0,10.0,1606037056
Efsane.,10.0,10.0,10.0,1606037056
5 senedir yemeksepeti kullanıyorum daha iyi kurye görmedim patso da ayrıca iyidi.,10.0,10.0,8.0,1605950656
Merhabalar kolay gelsin kurye çabucak geldi çok hızlıyıdı kuryedeki kişi güler yüzlü samimi çok iyi birisiydi kendisi kendisine çok teşşekkür ederiz samimiyettinden dolayı hayırlı işler.,10.0,10.0,10.0,1605950656
Kuryenin hızı dilere destan anlatılmaz yaşanır.,10.0,10.0,10.0,1605950656
Hep aynı kalite de hiç bozmayan daha da iyiye giden muhteşem restoran. Kusursuz hizmet anlayışına sahip güler yüzlü çalışan emeklerinden dolayı büyük övgü haketmekte.,10.0,10.0,10.0,1605864256
Güzel notunuz için teşekkürler hem hızlı hem lezzetli hem doyurucu tavsiye ederim.,10.0,10.0,10.0,1605864256
"Müşteri ile iletişim kurulması önemli bir davranıştı, teşekkür ederim.",10.0,10.0,9.0,1605777856
Yerken cok güzel sonra mide bulantısı çekiyorsunuz.,9.0,9.0,5.0,1605777856
"Tavuk dürüm konusunda kendini cidden çok geliştirdi, notlara dikkat ediliyor ve çok hızlı.",10.0,10.0,10.0,1605777856
"Siparişi verdim 7-8 dk da kapımdaydı hemde tam notta istedigim gibi, bir değişim var dürümün lavaşı dahil daha kaliteli olmuş ellerinize sağlık, özellikle içine bir sos bulsanız daha da güzel olacak.",10.0,10.0,10.0,1605691456
Lezzet aramayıp karın doyurmak için 1 numara. Karbonhidrat patlaması yaşatıyor :).,10.0,6.0,5.0,1605605056
Hızlı ve lezzetli.,10.0,10.0,8.0,1605432256
Harika bir kuryeniz var.,10.0,10.0,10.0,1605432256
Herşey harika! Sosisli patsonun her gün daha dolu geliyor. S. O. S çalışanlarının ilgisi mükemmel. Favori restoranım burası.,10.0,10.0,10.0,1605345856
Her zamanki gibi çok iyi.,10.0,10.0,10.0,1605259456
Kibar kuryeniz furkan beye ve size çok teşekkürler.,10.0,10.0,9.0,1605259456
15 dakikada geldi lezzet çok iyi ayrıca kurye arkadaşa teşekkür ederim.,10.0,10.0,10.0,1605259456
"3 çeyrek tantuni siparişim yarım ekmek tantuni şeklinde geldi, muadili midir sanmam ama pek önemli değil, lezzet gayet iyi.",10.0,10.0,10.0,1605173056
Harika.,10.0,10.0,10.0,1605086656
Çalışanınız furkan gerçekten çok iyiydi. Güler yüzlü ve ilgiliydi. Siparişimde 15 dakika içerisinde geldi. Lezzeti de güzeldi.,10.0,10.0,10.0,1605000256
Servis 10 mumara ve lezzetli sicak.,10.0,10.0,10.0,1605000256
İşlerini güzel yapan bir ekip oldukları belli.,10.0,10.0,10.0,1605000256
Güzell.,9.0,9.0,9.0,1604827456
Kurye gayet hızlı getirdi ve yemek de güzeldi.,10.0,10.0,10.0,1604741056
Kilolu arkadaş yine çok güler yüzlüydü.,10.0,10.0,10.0,1604654656
Kurye on numara beş yıldız bir insan.,10.0,10.0,10.0,1604654656
Kurye çok iyiydi ve hızlı bir şekilde getirdi.,10.0,10.0,10.0,1604481856
Lezzeti güzel. Hızlı geldiği için gayet sıcak ve taze. Kuryede gayet güler yüzlü ve temiz. Örnek alınması gereken bir yer gözünüz kapalı sipariş verin pişman olmayacaksınız.,10.0,10.0,10.0,1604481857
Kurye gibi kurye be.,10.0,10.0,10.0,1604395457
Severek her zaman siparis verdigim restoran çalışanlarına sonsuz teşekkürler.,10.0,10.0,10.0,1604395457
Kurye 5 yıllık yemeksepeti tecrübemdeki en iyi kurye daha iyisini görmedim patso harikaydı elinize sağlık.,7.0,10.0,9.0,1604309057
Hızlı ve güler yüzlü kurye. Teşekkür ediyorum.,10.0,10.0,10.0,1604309057
Her anlamda en iyisi kurye on numara.,10.0,10.0,10.0,1604222657
"Aralıksız 2 senedir çok severek sipariş verdiğim restoran. Siparişin hızı, yiyeceklerin lezzeti, kurye arkadaşın kibarlığı, sıcakkanlığı ve diğer her şeyi ile gönüllere taht kurmuştur :) umarım hep böyle devam eder. Saygı ve sevgiler.",10.0,10.0,10.0,1604136257
Çok güzeldi ellerinize sağlık çok beğendim kurye çok kibar ve nazikti çok teşekür ederim.,10.0,10.0,10.0,1604098511
Kuryeci abi çok tatlı ve cana yakındı.,10.0,10.0,10.0,1604098511
Yemekler çok iyiydi ayrıca kurye arkadaşa güler yüzlülüğü için ve siparişi 10 dakika içinde getirdiği için ayriyeten teşekkür ederim.,10.0,10.0,10.0,1604098511
Herşey çok güzeldi..,10.0,10.0,10.0,1604098511
"Restoran hizmet kalitesi üst düzey, restoran calışanı hızı ve iletisim kabiliyeti taktire şayan ileri düzey de hizmet ve lezzet. Her zaman harikularde menü lezzetini kapınıza kadar eksiksiz getiriyorlar ve bunu güler bir yüz ve yüksek bir enerji ile yapan personelleri var. Sos büfe forever.",10.0,10.0,10.0,1604098511
Lezzet ve hız güzeldi. Serviste furkan kardesimiz güleryüzüyle ilgi alakasıyla yine memnun etti herkese iyi çalısmalar.,10.0,10.0,10.0,1604098511
Kaşarlı tavuğu herkese tavsiye ederim. Ellerinize sağlık.,9.0,9.0,9.0,1604098511
Hamburger menü bol malzemeli lezzetli sıcak patatesler güzel hız harika kuryeniz güler yüzlü ve saygılı teşekkür ederim.,10.0,10.0,10.0,1604098511
Fazla söze gerek yok. Güler yüzlü ve kaliteli bir restoran.,9.0,9.0,10.0,1604098511
Kilolu arkadaş çok iyiydi.,10.0,10.0,10.0,1604098511
Güzel.,8.0,9.0,9.0,1604098511
Kurye abi çok iyi güleryüzlüydü ama 1 saatte geldi ve tavuk hamburgerler kötüydü sadece sadece patso güzeldi.,4.0,10.0,4.0,1604098511
"Tostlar vasat. Ekmek arası tavuk çok başarılı. Karar verdim zaten buradan ekmek arası tavuk alacağım, sadece.",8.0,9.0,7.0,1604098511
İlk kez burada sorun yaşadım. Umarım ilk ve son olur.,1.0,1.0,1.0,1604098511
Hızlı ve gayet lezzetli.,9.0,9.0,9.0,1604098511
Islak mendil koyulmalı.,8.0,7.0,9.0,1604098511
Kaşarlı tavuk dönerin içinden kemik çıkması vetavuk döner diye satılan döner olmayan ürününüz güzel değildi daha dikkatli ve biraz daha malzeme eklerseniz güzel olur.,2.0,1.0,1.0,1604098511
Lezzet guzel ama kurye arkadasin nezaketi ve kibarligi hatta hal hatir sormasi daha da guzel.,10.0,10.0,10.0,1604098511
Gayet güzel ve başarılı.,9.0,9.0,9.0,1604098511
Servis yapan arkadasin kibarligi ve nezaketi takdir edilesi.,10.0,10.0,10.0,1604098511
İyi.,8.0,10.0,8.0,1604098511
Yemekler cidden mükemmeldi hem hızlı hem temiz müthiş bir yer.,9.0,10.0,10.0,1604098511
Kesinlikle çok doyurucu menüler lezzeti de gayet yerinde öeze tarzı yiyecekler biraz daha fazla olursa çok iyi olut.,9.0,9.0,9.0,1604098511
Gayet başarılı uzun süredir yediğim en iyi kavurmalı kaşarlı tost...,10.0,10.0,10.0,1604098512
Temiz hızlı lezzetli kibar kurye.,10.0,10.0,10.0,1604098512
Tavuk tantuni hem lezzetli hem doyurucu kuryeniz güler yüzlü ve saygılı teşekkür ederim.,10.0,10.0,10.0,1604098512
Yine çok güzeldi.,10.0,10.0,10.0,1604098512
Goralı sandiviç istediğimde bütün sosisli olacağını düşünmüştüm ama basit bir şekilde sosisler doğranıp kızartılmış içine konulmuş. Amerikan salatası neredeyse hiç yoktu. Ekmek çok taze değildi. Karın doyurmak için yenilebilir ama lezzet yok.,8.0,5.0,4.0,1604098512
Patso her zamanki gibi mükemmel ama hamburger için aynı şeyleri söylemek mümkün değil içindeki et biraz daha büyütülmeli (fiyatına göre çok küçük) ayrıca 2 dir hamburgerler dağılmış şekilde geliyor lütfen bunu düzeltin.,9.0,2.0,7.0,1604098512
Yemek cidden değişik bir şekilde mükemmeldi.,10.0,10.0,10.0,1604098512
Ekmek arası sinitzel menu istedim bana gelen yanmış bir sinitzel ve cok az patates. Bari 2/dilim ekmek ataydınız onu gectim ketcap mayonezde yok ac olmasam ve iste olmasam kesinlikle geri yollardım.,1.0,1.0,1.0,1604098512
Öküz doyurana porsiyonu azaltıp başka malzemede eklenebilir biraz ev işi olmuş.,10.0,10.0,6.0,1604098512
"Artık eskisi kadar çabuk gelmiyor. Bir de dürüm paketin içindeyken mi ısıtıldı ne olduysa lavaş dışındaki kağıtla bütünleşmişti, o kısmı kesmek zorunda kaldım.",7.0,7.0,8.0,1604098512
Servisde ketçap mayonez beklerdim onun dışında hızlı ve güzeldi.,10.0,3.0,8.0,1604098512
"Tavuk dürümün lavaşını o kadar kızartmazssanız daha iyi olabilir, bazen çok iyi geliyor bazen yanık geliyor..",8.0,5.0,7.0,1604098512
Cok iyi hizli bir siparis ama donerin icinede ketcap mayonez filan koysaniz cok iyi olur.,10.0,9.0,10.0,1601468766
Güzel beğendim.,9.0,9.0,9.0,1601468766
Hizli.,10.0,10.0,10.0,1601468766
"Önceki siparişlere göre biraz geç gelmişti ve ayrandan dolayı dürüm soğumuştu ama olsun, arada olur böyle.",8.0,8.0,9.0,1601468766
Güzel.,10.0,10.0,10.0,1601468766
Hizli ve lezzetli.,10.0,10.0,10.0,1601468766
Calisanlar cok sicakkanli.,10.0,10.0,10.0,1601468766
Kuryeniz çok güler yüzlü.,10.0,10.0,10.0,1601468766
Tavuk döner dürüm yerine yarım ekmek daha iyi.,10.0,10.0,7.0,1601468766
Bu seferki fazla iyi değildi sanki.,6.0,9.0,8.0,1601468766
Yemek çok hızlı geldi ve sıcacıktı saraylı mahallesi muhtarı olarak çok memnun kaldım iyi çalışmalar dilerim.,10.0,10.0,10.0,1601468766
Ürünler gayet güzel bu çevredeki en iyi restoran benim açımdan kesinlikle burası. Kuryenin de gayet hızlı ve güler yüzlü olması gerçekten güzel bir durum.,10.0,10.0,10.0,1601468766
Hızlı güvenilir lezzetli aparatifler burada.,9.0,9.0,9.0,1601468766
Menü olarak seçtiğim siparişte patates unutuldu. Verilen sipariş tam gelmediği için puan kırdım. Hem içecek değişimi için aradınız (içecek var demek menü seçmişim) hem de eksik getirdiniz. Daha çok dikkatli olmanızı rica ederim. Lezzet standarttı bu arada.,8.0,4.0,6.0,1601468766
Öksüz doyuran ve sosisli patso mükemmel paketçiniz hızlı ve seri böyle devam 10 numaraaaa.,10.0,10.0,10.0,1601468766
Hamburgerler fazla sarsılmış.,10.0,10.0,8.0,1601468766
Kurye arkadaş ışık hızında geldi sağolsun :).,10.0,9.0,10.0,1601468766
Güzel.,9.0,9.0,9.0,1601468766
10 numara gayet samimi gayet hızlı.,10.0,10.0,10.0,1601468767
Çok hızlı çok lezzetli çok malzemeli çok güleryüz teşekkür ederim.,10.0,10.0,10.0,1601468767
Çok lezzetli hamburgerler sıcak ekmeği taze kuryeniz güler yüzlü saygılı teşekkür ederim.,10.0,10.0,10.0,1601468767
Oğlum ve ben begeniyoruz.,10.0,10.0,10.0,1601468767
Harika nefiss leziz mmmm bayıldım.,10.0,10.0,10.0,1601468767
Efsaneydi bee.,10.0,10.0,10.0,1601468767
Hizz ve servis çok iyi lezzet sanki eskisi gibi değildi.,8.0,8.0,7.0,1601468767
Kurye arkadasa cok tesekkurler.,10.0,10.0,10.0,1601468767
Harika lezzetler ve güleryüzlü personel. İyi ki varsın sos büfe.,10.0,10.0,10.0,1601468767
Yemek efsaneydi elllerinize sağlık.,10.0,10.0,10.0,1601468767
Kurye efffsane.,10.0,10.0,10.0,1601468767
Siparişi tamamlaya bastıktan 10 dk sonra kapımdaydı. Kurye çok güleryüzlü ve nazikti. Ustamında ellerine sağlık tadı müthişti.,10.0,10.0,10.0,1601468767
Elinize sağlık kokoreç çok güzeldi çok acıkmıştım geldiği gibi yedim ama tek sıkıntı ben tantuni söylemiştim :d.,9.0,10.0,10.0,1601468767
Midem bana dava açsa yeridir.,1.0,1.0,1.0,1601468767
Hızlı servis ve lezzet için çok teşekkürler.,10.0,10.0,10.0,1601468767
"Sıcaklık, hız, tat, her şey gayet yerinde. Elinize sağlık.",10.0,10.0,10.0,1601468767
Siz adamsınız 3.,10.0,10.0,10.0,1601468767
Tavsiye ederim.,8.0,8.0,9.0,1601468767
Harikaydı.,10.0,10.0,10.0,1601468767
Kumru siparişi verdim içindeki sosisleri yanikti ve ekmek dağılmış ve kuru bir şekilde geldi.,6.0,1.0,2.0,1601468767
Bu nasıl hızdır arkadaş.,10.0,10.0,10.0,1601468767
Öksüz doyuranla doymadım ekmek küçülmüş ve patatesler bayat gibiydi.,7.0,10.0,9.0,1601468767
Mükemmel.,10.0,10.0,10.0,1601468767
Yine yeni yeniden mükemmeldi.,10.0,10.0,10.0,1598839021
"Ekstra ikram için teşekkürler, kurye arkadaş oldukça güleryüzlü, tavsiye ederim.",10.0,10.0,10.0,1598839021
Apo abiye can feda.,10.0,8.0,10.0,1598839021
Mükemmel.,10.0,10.0,10.0,1598839021
Efsaneeeee.,10.0,10.0,10.0,1598839021
"Normalde çok severek yerim ama bu defa tuhaf bir koku vardı dürümlerde, bilmiyorum... Bitiremedim bile.",10.0,7.0,3.0,1598839021
"Kuryenin güler yüzlülüğü, yemeğin lezzeti tam olarak 10/10.",10.0,10.0,10.0,1598839021
Dürüm çok lezzetliydi.,10.0,10.0,10.0,1598839022
Ben gayet seviyorum tavuklu şeyleri çok hoş.,10.0,10.0,10.0,1598839022
10 numeeeerooo000.,10.0,10.0,10.0,1598839022
Sipariş değirmendere içine 45 dk da gelmemeli neyse yoğunluktandır belki ama siparis cok özensiz ve lezzetsizdi yani bir daha siparis vermeyi dusunmem. Kendinizi gelistirmelisiniz bence. Yinede bol kazanclar.,1.0,1.0,1.0,1598839022
Tantuni lezzetli patatesler hamur degildi teşekkürler.,10.0,10.0,10.0,1598839022
Sadece kola güzeldi.,9.0,10.0,2.0,1598839022
Muhteşem bir lezzet ve ustamızın harika hüneri. Ellerine sağlık ustam.,10.0,10.0,10.0,1598839022
Hala denemeyen varsa tavsiye edilir.,10.0,10.0,9.0,1598839022
Her zamanki gibi gayet güzel.,10.0,10.0,10.0,1598839022
Çok pişmiş kuru sertti.,10.0,10.0,5.0,1598839022
Soğuk geldi.,9.0,8.0,5.0,1598839022
Hızlı ve sıcak servis.,10.0,10.0,10.0,1598839022
Ustanız paketciniz 10 numaraaa.,10.0,10.0,10.0,1598839022
Kurye çok iyi.,10.0,10.0,10.0,1598839022
Hizli lezzetli guzel.,10.0,10.0,10.0,1598839022
Kuryeye10 numara 5 yıldız. Yemeklerde şahane:).,10.0,10.0,10.0,1598839022
Kurye kaan sofuoğlu gibi hızlı bir şekilde getirdi.,10.0,10.0,10.0,1598839022
Aşırı hızlı ve kaliteli.,10.0,10.0,10.0,1598839022
Çok lezzetli kurye çok hızlı tebrikler.,10.0,10.0,10.0,1598839022
Nice.,10.0,10.0,10.0,1598839022
Kurye çok hızlıydı ve sıcak geldi gerçekten başarılı.,10.0,10.0,10.0,1598839022
Tavuk tantuni kokorecle birebir ayni lezzetteydi kesinlikle tavsiye ederim cok beğendim.,10.0,10.0,10.0,1598839022
Hız süper tadı güzel malzemeler bol gerçekten süperdi ellerinize sağlık.,10.0,10.0,10.0,1598839022
Daha iyisini bulan yoruma gelsin :).,10.0,10.0,10.0,1598839022
Öksüzdoyuranın içi tam pişmiyor ama güzel.,9.0,10.0,9.0,1598839022
Tam ekmek tavuk soyledım ıcınde ki tavuklar azdı ve sadeve marul vardı.,9.0,5.0,5.0,1598839022
Sicak geldi servis cok hizli.,10.0,10.0,10.0,1598839022
Beklediğimden daha kötü çıktı.,4.0,5.0,3.0,1596209276
Patatesler hariç herşey güzeldi.,9.0,9.0,9.0,1596209276
Notu dikkata alan güzel bir isletme tavuk döner cok lezzetliydi kurye ise çok guleryuzluydu teşekkürler.,10.0,10.0,10.0,1596209276
Siparişleri dikkatli okumamaları dışında sorun yok.,10.0,9.0,10.0,1596209276
10 dakika içinde gelmesi... Daha ne kadar hızlı olabilsiniz bilmiyorum ama bayılıyoruz.,10.0,10.0,10.0,1596209276
Lezzetli ve hızlı.,10.0,10.0,10.0,1596209276
Sipariş verdikten 50 dakika sonra dayanamayıp dükkanı aradım siparişi unuttuklarını söylediler rezillik.,1.0,6.0,8.0,1596209276
Çok hızlı geldi kuryeye teşekkürler.,10.0,10.0,10.0,1596209276
Başarılı.,8.0,8.0,8.0,1596209276
Hizindan dolayi menun kaldim servisindende ve. Lezetindende kendine ait bir sos kulansa daha lezetli olacaktir buna eminim.,10.0,9.0,8.0,1596209276
Peçete tuz ketçap mayonez yoktur ve servis eksikti ve ekmeğin normal ekmek olduğunu sipariş geldiğinde kapıda söyledi.,5.0,1.0,7.0,1596209276
Çalışanları oldukça nazik ve lezzetleri mükemmel.,10.0,10.0,10.0,1596209276
Karışık tostun içerisine biraz daha kaşar eklenirse daha lezzetli olacaktır.,9.0,9.0,9.0,1596209276
Hız ve servis çok iyidi lezzeti de güzeldi öneririm.,10.0,10.0,8.0,1596209276
Bu ne hızdır arkadaş...,10.0,10.0,10.0,1596209276
Daha önce yediklerimle alakası yoktu. Tantuni istedim döner geldi.,10.0,6.0,1.0,1596209276
Hizi gayet iyi fena degil fiyat doyuruculuguna gore ucuz lezzet iyi.,7.0,8.0,7.0,1596209276
Hızlı ve sıcak.,10.0,10.0,10.0,1596209276
"Bol malzeme, hızlı teslimat, on numara lezzet.",10.0,10.0,10.0,1596209276
Hamburgerler efsane ellerinize emeğinize sağlık:).,10.0,10.0,10.0,1596209276
Okuz doyuran coook iyi bir menu.,9.0,9.0,9.0,1596209276
Aldigi para sonuna kadar helal olsun.,10.0,10.0,10.0,1596209276
"Sicacikti, hizli geldi, malzemesi boldu. Yazilan notu dikkate almislardi. Isletmeye tesekkur ediyorum. 10/10.",10.0,10.0,10.0,1596209276
Kumru çok iyide servis çok hızlıydı. Kumruyu yapan arkadaş kaç yıllık aşçı acaba onu çok merak ettim :). Kolay gelsin iyi günler dilerim.,10.0,10.0,10.0,1596209276
Kurye hizli kibar. Servis iyi yemekler lezzetli.,10.0,10.0,10.0,1596209276
Apo abinin dükkan her zaman efsane.,10.0,10.0,10.0,1596209276
Hızlı ve sıcak geldi.,9.0,9.0,9.0,1596209276
Öksüz doyurana zam yapılmasa iyiydi...,10.0,10.0,9.0,1596209276
Sadece malzeme kalitesi biraz daha iyi olabilir. Geri kalan 10 numara.,10.0,10.0,8.0,1596209276
Çok sıcak ve teslimattaki arkadaş çok kibardı değirmenderenin çok iyi bir yeri.,10.0,10.0,10.0,1596209276
"Kusursuz hizmet ve lezzet, ikramlarınız için ayrıca teşekkürler.",10.0,10.0,10.0,1596209276
3 çeyrek istedim yarım ekmek geldi tek sorun buydu onun dışında herşey harika elinize kolunuza sağlık teşekkür.,8.0,8.0,9.0,1596209276
Harikaydı.,10.0,10.0,10.0,1593579531
Tavsiye ederim.,8.0,8.0,9.0,1593579531
Çok güzeldi ve sıcaktı ama servis kısmında peçete ve ıslak mendil verilmeliydi.,10.0,7.0,10.0,1593579531
Öksüz doyuran ile ordu doyar )).,8.0,8.0,8.0,1593579531
İçeceğim gelmemişti söylemek için aradığımda da açmamışlardı.,8.0,1.0,9.0,1593579531
Lezzetli.,10.0,10.0,10.0,1593579531
 ilk defa öksüz doyuran yedim efsaneydi. Hamburgerler de çok güzeldi bayıldık ellerinize sağlık:).,10.0,10.0,10.0,1593579531
Notumu aynen uygulamışlar teşekkür ederim çok iyidi ve bu sefer 1 saat yerine 25 dk da geldi elinize sağlık mükemmeldi.,10.0,10.0,10.0,1593579531
Muhteşeeeem leziz böylesini yememiştik müptelası olduk.,10.0,10.0,10.0,1593579531
Getiren kurye arkadaş çok güleryüzlü. Döner ve amerikan salatalı sosisli çok aşırı yağlıydı ekmeği dürümü sıkıınca yağ akıyor resmen. Amerkan salatalı sosislinin içinde amerikan salatası neredeyse yoktu ama sosis fazlaydı.,7.0,6.0,4.0,1593579531
Her şey 10 numara kurye mukemmel.,10.0,10.0,10.0,1593579531
Hızlı ve sıcak.,10.0,10.0,10.0,1593579531
Lezzetli.,10.0,10.0,10.0,1593579531
Güzeldi.,10.0,10.0,10.0,1593579531
Hızlı ve sıcak.,10.0,10.0,10.0,1593579531
Notları okumayı öğrenmeliler artık.,10.0,1.0,1.0,1593579531
2 adet sinitzel ve 2 adet sosisli sandviç istedim. 1 adet şinitzel geldi içinde patates kızartması yoktu. Sosisli yerine de kumru gibi bir sandviç geldi. Ketçap mayonez zaten yoktu. Aç olduğumuz için mecbur yedik.,10.0,1.0,5.0,1593579531
Karantinadan önce her şeyi ile harikaydı 20 dakikada direkt geliyordu ama bu sefer 1 saat bekledim 2 patso için ve normal ekmekle geldiği için gram tat alamadım ekmeğin içinden çıkartıp yedim o yüzden eğer sandiviç ekmeği ile geldiyse çok güzel ama normal ekmekle geldiyse çöpe atın daha iyi.,6.0,10.0,4.0,1593579531
"Sipariş hızlı, ürünlerse lezzetli ve sıcaktı. Kuryenizin ilgisi ve hitabı da mükemmeldi. İşlerinizde kolaylıklar diliyorum.",10.0,10.0,10.0,1593579531
Doyurucu lezzetli.,10.0,10.0,10.0,1593579531
Lezzetli ve doyurucu. Getiren arkadaş ta çok güler yüzlüydü. Emeğinize sağlık.,10.0,10.0,10.0,1593579531
Lezzet gayet iyi hiz ve musteri iliskileri harika.,10.0,10.0,10.0,1593579531
1 saat 45 dk sipariş bekledim. 5 tane tam döner siparişi verdim. Ama tavuk dönersen çok herşeye benziyordu. Yanında turşu biberi özellikle söyledim o nu da göndermemisler. Güzel yorumlara aldanmayın. Herşeyiyle sınıfta kaldı.,1.0,1.0,1.0,1593579531
Elinize emeğinize sağlık. Hız lezzet servis gayet mükemmel. Getiren arkadaşta gayet güler yüzlüydü:).,10.0,10.0,10.0,1593579531
