comment_text,comment_speed,comment_service,comment_taste,comment_time
"Hızlı, herşey özenli, yeşillik bol, kurye beyefendi daha ne olsun.",10.0,10.0,10.0,1606517445
Çiğköfte baya hoştu servisci abide iyiydi.,10.0,10.0,10.0,1606344645
"Elinize, ayağınıza sağlık.",10.0,10.0,10.0,1606344645
Teşekkürler elinize sağlık.,10.0,10.0,10.0,1606344645
Paket servis işine bakan arkadaş çok naziksin...,10.0,10.0,10.0,1605135045
Berk çok tatlısınnn gerçektennnn abonesiyim buranın artık.,10.0,10.0,10.0,1604962245
Berk diyorum başka söze gerek yok.,10.0,10.0,5.0,1604530245
Güzel.,10.0,10.0,10.0,1604443845
Herşey için teşekkür ederim berk bey.,10.0,10.0,10.0,1604357445
Berk kardeşim hızır gibi yetişti valla helal olsun ve elinize emeğinize sağlık 10 numara 5 yıldız herşey.,10.0,10.0,10.0,1604271045
Paketçi arkadaş hızlı olduğu kadar çok efendi biri. Hayırlı işleriniz olsun.,10.0,10.0,10.0,1604271045
Paketçi kardeşim hızlı ve öfkeli de oynadımı acaba bu hız ne :).,10.0,8.0,8.0,1604184645
"Yeni taşındım ve ilk kez sipariş verdim buradan. Herseyi çok güzeldi servisi ve yan ürünlerin bollugu muazzamdı. Ayrıca paketçi arkadaşı da es geçmemek gerekir ilgisi, kibarlıgı ve güler yüzü için teşekkür ederim.",10.0,10.0,10.0,1604184645
Lezzet ve servis 10 numara tavsiye ederim.,10.0,10.0,10.0,1604098245
"Çiğköftesi çok sağlam, yeşilliği taze tutulursa her gün söylerim.",10.0,9.0,9.0,1604011845
Herşey güzeldi elinize sağlık paketci arkadaş çok kibardi hız konusundada iyiydi.,10.0,10.0,10.0,1603974099
Her sey cok guzeldi tesekkurler.,10.0,10.0,10.0,1603974099
Berk beye teşekkür ediyorum çok güler yüzlü bir insan siparişimi çok hızlı bir şekilde getirdiler.,10.0,10.0,10.0,1603974099
Kurye berk arkadaşıma ayrıca teşekkür ediyorum :) bu mekandaki usta da kurye de adamdır. Dertli bir akşam çiğköfte söyledim. Dertlerinizi de bana gönderin dedim. Size şeker gönderdik dediler. Burdan gece vakti dertlenip çiğköfte yemek isteyen herkese selam olsun.,10.0,10.0,10.0,1603974099
"Servisi getiren eleman 10 numara, guleryuzlu, sicak, hizli ve yemekte guzeldi. Tesekkurler.",10.0,10.0,10.0,1603974099
Paketçi berk kardeşime selam işini severek yapıyor iyi çalışmalar.,10.0,10.0,10.0,1603974099
Berk kardeşim güler yüzün için teşekkürker elinize sağlık çok güzeldi.,10.0,10.0,10.0,1603974099
Gelen kişi gayet güler yüzlüydü ve çiğ köftelerin tadı çok güzeldi ama maske taksanız daha güzel olur size puanım hepsinden on.,10.0,10.0,10.0,1603974099
Her zamanki gibi harika.,10.0,10.0,10.0,1603974099
Getiren cok tatlı konuşması filan onu için her vakit buldum da sipariş vericem.,10.0,10.0,10.0,1603974099
Tadı güzeldi hız cok iyi servise genlen berk kardeşime cok iyi servisti.,10.0,10.0,9.0,1603974099
Tost söyledim gecenin 3 ünde hem çok hızlı hemde çok lezzetliydi paket servisi yapan berk beye de çok tesekur eder paket serviscileride çok iyi ve mülayim insanlar.,10.0,10.0,10.0,1603974099
Güzel ikramınız için teşekkürler sadece paketleme kısmı daha hijyenik olur ise kutu vs gibi çok daha güzel olur.,9.0,7.0,9.0,1603974099
Işıktan bile hızlı bu kadarını beklemiyordum.,10.0,10.0,10.0,1603974099
Sipariş çok çabuk geldi lezzeti çok iyi ayrıca berk beye süper servis ve kibarığı sebebiyle çok teşekkür ederim gönül rahatlığıyla sipariş verebilirsiniz.,10.0,10.0,10.0,1603974099
Mükemmel ötesiydi. Hayatımda yediğim en lezzetli ve en keyif alarak tükettiğim yemek sepeti siparişiydi diyebilirim. Gelen arkadaşın güler yüzü ve samimi tavırları da cabası. Herkese şiddetle tavsiye ederim.,10.0,10.0,10.0,1603974100
"Lezzet, hız ve paketleme harikaydı. Sevilen lezzetlerden samsat çiğköfte. Bunlarla birlikte bir de kurye berk beyin güler yüzlülüğü de eklenince kaçınılmaz güzellikte oluyor. Tekrardan teşekkürler.",10.0,10.0,10.0,1603974100
"Berk beye teşekkürler gecenin bi saatinde istememe rağmen gayet güler yüzle getirdi siparişlerimi, lezzet olarak da gayet güzeldi beğendik. Herkese tavsiye ederim :).",9.0,10.0,10.0,1603974100
Kötü.,1.0,1.0,1.0,1603974100
Hızlı servis süper tost teşekkürler.,10.0,10.0,10.0,1603974100
Paket servis çok hızlı getiriyor başarılarınızın devamını dilerim.,10.0,10.0,10.0,1603974100
Berk arkadaşa teşekkür ediyorum hızlı geldi servis çok beğendik devamlı burdan sipariş veriiyoruz zaten.,10.0,10.0,10.0,1603974100
Lezzet hız gerçekten mükemmel aşırı ilgililer.,10.0,10.0,10.0,1603974100
Tadı güzel malzemesi boldu. Getiren arkadaşta güler yüzlü nazikti. Teşekkürler..,9.0,9.0,9.0,1603974100
Tek kelime ile mukemmel.,10.0,10.0,10.0,1603974100
"Güler yüzü kurye beyefendiye tesekkür ederim, çok kibar ve efendiydi elinize sağlık.",10.0,10.0,10.0,1603974100
Güzeldi.,10.0,10.0,10.0,1603974100
Tadı servisi ve hızı her şeyiyle açık ara 1 numara..,10.0,10.0,10.0,1603974100
On numaraydi cok guseldi lezzeti de goruntusu de sadece kolam gelmedi.,10.0,10.0,10.0,1603974100
Hersey güzeldi.,10.0,10.0,10.0,1603974100
Kuryeci arkadaş çok ilgiliydi ve kibardı lezzet de güzeldi güzel firma.,10.0,10.0,10.0,1603974100
"Çiğköfte gayet iyiydi, sipariş hızlı geldi kurye arkadaş güler yüzlü teşekkürler.",10.0,10.0,10.0,1603974100
Kurye kral adam.,10.0,10.0,10.0,1603974100
Saat 15. 56da sipariş verdim 16. 04te sipariş geldi. Bu kadar hızlı bir yer hayatımda görmedim. Lezzeti bana göre adıyamanlı çiğköfteden daha lezzetliydi. Kurye kibar ve güler yüzlüydü kendisine de ayrıca teşekkür ederiz. Kesinlikle artık burası petito içinde ayrıca teşekkür ederiz.,10.0,10.0,10.0,1603974100
Mükemmel bir lezzet. Çok kısa bir sürede elimize ulaştı sipariş.,10.0,10.0,10.0,1603974100
Teşekkür ederim berk bey herşey çok güzeldi hediye ürünler içinde ayrıca çok teşekkür ederim.,10.0,10.0,10.0,1603974100
Acı olmasın demiştim ama baya acıydı ve dürümleri yerken tam olarak 6 tane limon cekirdegi cıkarttım baya rahatsız edici bir durum. Hız ve servis basarılı.,10.0,10.0,7.0,1603974100
Petito ve şekerler için teşekkürler :) kurye çok güler yüzluydu memnun kaldık :).,10.0,10.0,10.0,1603974100
Lezzeti gayet güzeldi ama biraz küçük geldi içindeki malzemede az geldi ama puan kırmak istemedim.,10.0,10.0,10.0,1603974100
Gayet hızlı ve güvenli on numara müşteri memnuniyeti güler yüzlü sempatik. Hersey için teşekkürler.,10.0,10.0,10.0,1603974100
Elinize emeğinize ilginize sağlık.,10.0,10.0,10.0,1603974100
Beğendik.,10.0,10.0,10.0,1603974100
Lezzet hız servis yemeklerin sıcaklığı mükemmel fiyatları cok uygun ve lezzetli.,10.0,10.0,10.0,1603974100
Gayet lezzetli tatlış kuryenize de ayrıca teşekkürler güler yüzü ve üslubu için.,10.0,10.0,10.0,1603974100
Efsane lezzet güler yüzlü kurye ve hzılı sipariş daha ne olabilirki işinizi çok iyş yapıyorsunuz.,10.0,10.0,10.0,1603974100
Böyle tatlı güler yüzlü kurye var daha ne olsun acımızı tatlı yaptın gecenin bi yarısı olmuş teşekkürler berk bey...,10.0,10.0,10.0,1603974100
Gerçekten çok lezzetli tostları var ki o kadar da güler yüzlü kuryeleri.,10.0,10.0,10.0,1601344354
Efsane lezzett.,10.0,10.0,10.0,1601344354
Paketçı arkadaş çok iyi ellerine saglik güzel yapiyorlar.,10.0,10.0,10.0,1601344354
Tost çeşitleri mükemmel.,10.0,10.0,10.0,1601344354
Kuryeniz çok tatlı ve kibardı ürünler de eksiksizdi hızlı geldi teşekkür ederiz. Az acılı bile acıydı çiğköftesi dikkat edilirse daha iyi olur.,10.0,10.0,10.0,1601344354
Doyurucu ve güzeldi ben beğendim.,10.0,10.0,10.0,1601344354
Paketci kardeşimin güleryüzlülugu ve siparişimin çok özenli bi şekilde gelmesinden ötürü çok teşekkür ederim supersiniz.,10.0,10.0,10.0,1601344354
Gayet güzeldi tavsiye ederim.,10.0,10.0,10.0,1601344354
Tavsiye ederim.,10.0,10.0,10.0,1601344354
Tadı güzeldi ama servisiniz zayıf kalmış.,8.0,5.0,9.0,1601344354
Hızli güler yüzlü ve lezzetli.,10.0,10.0,10.0,1601344354
Teşekkürler.,10.0,10.0,10.0,1601344354
Başarılı getiren arkadaş gayet kibar ve güleryüzlüydü.,10.0,10.0,10.0,1601344354
Güzelllll.,10.0,10.0,10.0,1601344354
"Harikaydı, ellerinize sağlık.",10.0,10.0,10.0,1601344354
Hız servis lezzet hepsi 10 numara. Güler yüzlü bi abi getirdi siparişi. Ellerinize sağlık.,10.0,10.0,10.0,1601344354
Ikili çiğköfte dürüm menü soyledim yaninda iki tane ayran olduğu yazıyordu ayran yoktu hadi bunu geçtim acısız salgam suyu istedim acılı geldi tek güzel olan şey getiren arkadaşın samimi ve sıcak kanlı olmasıydı işinin hakkını verdiği ortada en azından.,10.0,1.0,1.0,1601344354
Çok hızlı.,10.0,10.0,10.0,1601344354
Çok geç bir saatte sipariş vermemize rağmen iptal edilmeyip çok çabuk geldi. Lezzeti ve yan ürünleri oldukça güzeldi. Teşekkürler.,10.0,10.0,10.0,1601344354
Kurye çok nazikti çiğköftede çok lezzetliydi elinize sağlık.,10.0,10.0,10.0,1601344354
Güler yüzlü ve hızlı teslimat. Çiğ köfteside güzel tavsiye ederim.,10.0,10.0,10.0,1601344354
Para üstü vermemek için 39 liralık siparişe 40 lira dedi gece yarısı paketcinin bina içinde aşırı yüksek sesle konuşması hiç hoş değil gelen çiğ köfteyi de tavsiye etmiyorum puanlara aldanmayın derim son siparisimdi.,2.0,1.0,1.0,1601344354
İlk kez sipariş verdim 17 dakika içinde getirdiler. Çiğköfte çok lezzetliydi ayrıca notlara dikkat ettiğiniz için teşekkür ederim. Güleryüzle teslimat da cabası. Çok acı sevmeyen arkadaşlar için acısı bi tık fazla gelebilir ona dikkat ederek sipariş verebilirsiniz. Her şey için teşekkürler :).,10.0,10.0,10.0,1601344354
Gayet güzeldi çiğköfte deyince tek geçerim devamlı adresimiz.,10.0,10.0,10.0,1598714608
 ekmek unutulmuş geç gelindi üstelik lezetti de orta seviye..,1.0,1.0,1.0,1598714608
"Getiren abi çok güleryüzlüydü, el değmeden paketlenmiş gibiydi ve lezzetliydi.",10.0,10.0,10.0,1598714608
Süperdi.,10.0,10.0,10.0,1598714608
Gayet iyi.,8.0,8.0,8.0,1598714608
Çiğköfte çok lezzetli malzemeler bol ve taze emeğinize sağlık güleryuz için teşekkürler.,10.0,10.0,10.0,1598714609
Bu çiğköfteyi başka yerde yiyemezsiniz.,10.0,10.0,10.0,1598714609
Bütün fast food ve çiğköfteciler kapalıyken bizim imdadımıza yetişen tek yer her zaman açık olması çok iyi.,10.0,10.0,10.0,1598714609
Çok uzak bir bölgede bölgede bulunmamıza rağmen çok kısa bir sürede elime ulaştı siparişim. Çok güler yüzlü bir teslimat vardı. Abimiz çok sıcak kanlıydı beklentimi boşa çıkarmadı. Kesinlikle tavsiye ederim.,10.0,10.0,10.0,1598714609
"Her şey çok güzeldi, muhtemelen 6 yada 7 dakika sürdü inanılmaz.",10.0,10.0,10.0,1598714609
Cok lezzetli ve servis cok iyi.,10.0,10.0,10.0,1598714609
Hızlı geldi ve güzel bi tadı vardı.,10.0,10.0,10.0,1598714609
Servis için gelen genç arkadaş çok güleryüzlü ve saygılıydı teşekkürler.,9.0,7.0,7.0,1598714609
"Hayatımda yediğim en kötü tostdu, acayip kuruydu ısırır ısırmaz 5parçaya bölündü, servis elemanı işten atılıcağı için güzel bir puan ve yorum atmam için rica etti, ama tost gerçekten çok kötüydü eleman güler yüzlüydü ama fazla adres bilgisi yoktu, işletme puanı yüksek olsun diye puan istendi gibi.",7.0,1.0,1.0,1598714609
Dürümleri güzeldi gece gelen kurye güleryüzle karşıladı nazikti.,10.0,10.0,10.0,1598714609
Tost biraz daha güzel olabilir :).,9.0,10.0,7.0,1598714609
Ha-ri-ka.,10.0,10.0,10.0,1598714609
Hızlı geldi ve tadı gayette güzeldi.,10.0,10.0,10.0,1598714609
"Kurye evi bulamıyor telefonla arayıp konum istiyor, pişkin pişkin yüksek puan verin lütfen diyor. Tadı çok güzel ama kurye tüm olayı bitiriyor.",2.0,1.0,10.0,1598714609
Servis hızlıydı çiğ köfteler lezzetliydi ellerinize sağlık.,10.0,10.0,10.0,1598714609
Çiğ köfte gayet güzeldi acısı yerindeydi siparişi getiren abi güler yüzlüydü hızlı getirdi marul fazlaydı gayet beğendim.,8.0,8.0,10.0,1598714609
Güler yüzlü kuryeniz bile yeter :).,10.0,10.0,10.0,1598714609
10 puan az bile. Iyi çalışmalar:).,10.0,10.0,10.0,1596084863
Yorumları okuyorlar çok hızlılar tostları mükemmel.,10.0,10.0,10.0,1596084863
Her zamanki gibi çok hızlı ve güler yüzlü lezzet de aynı tebrikler..,10.0,10.0,10.0,1596084863
Kesinlikle tavsiye ediyorum. Lezzeti on numara. Pakette hızlı geldi.,10.0,10.0,10.0,1596084863
Servisi yapan arkadaş gecenin 2sinde bile güleryüzlüydü. Tat olarak da gerçekten kısasının en iyisi ellerinize sağlık.,10.0,10.0,10.0,1596084863
Süper.,10.0,10.0,10.0,1596084863
Tavsiye ederim.,10.0,10.0,10.0,1596084863
Harika bi tat harika bi sunum..,10.0,10.0,10.0,1596084863
Az acılı demiştim çernobilden gelir gibi geldi çiğköfte çok acıydı.,8.0,1.0,8.0,1596084863
"Uzak mesafede olmamıza rağmen gayet hızli getirdiler çiğ köftesi harika, sadece içli köftenin dısı bırazcık yanmıstı, paketlerken de ezilmisti baska bir problem yok o kadar kusur kadı kızında da olur.",10.0,10.0,10.0,1596084863
Gayet hızlı geldi fakat nar ekşisi cok azdı vede yanında tursu vs gonderilse iyi olurdu.,10.0,8.0,8.0,1596084863
Çok lezzetliydi ve hızlı geldi.,10.0,10.0,10.0,1596084863
"Arkadaşların ellerine sağlık, gerçekten çok hızlı geldi getiren arkadaş güleryüzlüydü lafladık biraz. Çiğköftenin tadı çok iyiydi durduramadık kendimizi yerken yanındaki yeşillik çok fazlaydı bol bol koyulmuştu kazancınız bol olsun.",10.0,10.0,10.0,1596084863
Tostlar efsane.,10.0,10.0,10.0,1596084864
Çok memnun kaldım. Tavsiye ederim.,10.0,10.0,10.0,1596084864
Tost çeşitleri efsane.,10.0,10.0,10.0,1596084864
Efsane.,10.0,10.0,10.0,1596084864
Çok hızlı geldi teşekkürler..,10.0,10.0,10.0,1596084864
Servis hizmet tat mükemmmel.,10.0,10.0,10.0,1596084864
Tost söyledim rezaletti. Her şeyiyle birlikte.,1.0,1.0,1.0,1596084864
Çok hızlı ve lezzetliydi.,10.0,10.0,10.0,1596084864
Çok lezzeltiydi bol mazemeliydi sipariş hızlı geldi teşşekurler.,10.0,10.0,10.0,1596084864
Yapıyorsunuz bu işi helal olsun.,10.0,10.0,10.0,1596084864
Cok lezzetli cok guzel hersey sahane hic tereddut etmeden siparisinizi verebileceginiz temiz lezzetli cig kofte cok begendim ellerinize saglik.,10.0,10.0,10.0,1596084864
Başarılı umarım böyle devam edersiniz...,10.0,10.0,10.0,1596084864
Böyle güzel içli köfte yemedim mükemmelsiniz yahu.,10.0,10.0,10.0,1596084864
Siparişlerimiz soğuktu.,1.0,1.0,1.0,1596084864
Hizmetiniz çok güzeldi teşekkürler.,10.0,10.0,10.0,1596084864
Çiğköfte konusunda gurme olarak çok iyidi aynı zamanda hız da öyleydi teşekkürler.,10.0,10.0,10.0,1596084864
Lezzeti harika malzemeler bol kullanılmış. Getiren abi çok güleryüzlüydü.,10.0,10.0,10.0,1596084864
Hız harikaydı hemen geldi güler yüz zaten öyle lezzetide güzeldi dürümlerin ayagınza yüreğinize sağlık samsat.,10.0,10.0,6.0,1596084864
Harikaydı.,10.0,10.0,10.0,1596084864
İlk sipariş güzeldi.,9.0,9.0,9.0,1596084864
Tamamen efsane.,10.0,10.0,9.0,1596084864
Lezzet hız servis efsane.. Herkese tavsiye ediyprum.,10.0,10.0,10.0,1596084864
Cok hizli ve cabuk geldi ama sanki mega gibi degildi bilmiyorum cok hizli geldi tesekkurler.,10.0,8.0,8.0,1596084864
Dün gece yaklaşık 20 dakika içerisinde geldi. Ekstra yeşillik tabağı istemiştim ama gerek yokmuş çünkü marulu yeşilliği zaten bol bol koyuyorlar. Çiğköfte asıl işleri olmasına rağmen özlediğim eski salçalı tostu harika yapmışlardı. Gelen beyefendi gayet güleryüzlüydü ve saat 03. 00 e kadar açıklar.,10.0,10.0,10.0,1596084864
10 numara 5 yıldız.,10.0,10.0,10.0,1596084864
Gayet hızlı ve güzeldi.,10.0,10.0,10.0,1596084864
"Gayet hızlıydı, yine aç bırakmadınız beni teiekkürler.",10.0,10.0,10.0,1596084864
Tostlar ve çiğ köfteler harikaydı. Gece gece açlığımıza derman olduğunuz için teşekkür ederim.,10.0,10.0,10.0,1596084864
"Lezzet harika, hızlı servis teşe.",10.0,10.0,10.0,1596084864
Tadı lezzeti ve arasındaki sos harika hızıda güzel.,10.0,10.0,10.0,1596084864
Gece gece çok iyi gelmişti gerçekten hızlıydı ve çok lezzetliydi paketçi abi de güler yüzlü 10/10 broo.,10.0,10.0,10.0,1593455118
Çok sevemedim.,10.0,10.0,7.0,1593455118
Herşey dört dörtlük ellerinize sağlık...,10.0,10.0,10.0,1593455118
Gerçekten harikaydı.,10.0,10.0,10.0,1593455118
Çok güzeldi ellerinize sağlık kuryede güler yüzlü bir kardeşimdi teşekkürler emeğinize sağlık.,10.0,10.0,10.0,1593455118
"Hızlı geldi, çoğu yerden güzel, servis on numara teşekkürler.",10.0,10.0,10.0,1593455118
Çok özensiz sarılmıştı kağıdı açtığım gibi dağıldı.,6.0,1.0,1.0,1593455118
Yediklerimin en iyisi diyebilirim. 10 dkka gibi bir sürede gelmeside iyi.,10.0,10.0,10.0,1593455118
Gayet nazikti çalışan beklediğim gibi lezzetliydi tavsiye ederim :)).,10.0,10.0,10.0,1593455118
"Hız ve servis gayet iyiydi. Lezzete gelince mega dürüm oldukça dolu ve duyurucu. Acılı ve acısız sipariş ettik, bunları ayırt etmemiz için bir ibare bırakılmamıştı. Dürüm içerisindeki nane, turşu vs. Çeşitler olması hoş fakat bunlar müşterinin tercihine sunulmalı.",10.0,9.0,8.0,1593455118
Getiren arkadaş çok nazikti.,10.0,10.0,10.0,1593455118
Çok lezzetli idi fiyat olarakta gayet uygun gönül rahatlığı ile yiyebilirsiniz.,10.0,10.0,10.0,1593455118
"Hızlı teslimat, özenli paketleme, ideal lezzet memnun kaldım.",10.0,10.0,9.0,1593455118
Mantı çok lezzetliydi.,10.0,10.0,10.0,1593455118
Gece ekmek lazım oldu 5 lavas istedim 5 tl adamlar 2 ekmek de koyalımmi dedi valla helal olsun adamlar esnaf. Helal olsun.,10.0,10.0,10.0,1593455118
Güzeldi.,8.0,10.0,8.0,1593455118
Sipariş çok hızlı geldi tadı harika ilk defa söyledim memnun kaldım teşekkürler.,10.0,10.0,10.0,1593455118
Aşırı hızlı teslim ve mükemmel bir lezzet ayrıca siparişi getiren kişinin nazikliğide daha bir değerli. 2. Siparişimdi ama artık favorim burası oldu.,10.0,8.0,10.0,1593455118
Çok hızlı ve lezzetli.,10.0,10.0,10.0,1593455118
Superdi.,10.0,10.0,10.0,1593455118
Kral mekan.,10.0,10.0,10.0,1593455118
Hem lezzet hem de kalite olarak cidden tatmin etti. Servis hizina denecek bisey yok. Cok memnun kaldik. Ellerinize saglik.,10.0,10.0,10.0,1593455118
Her yonden mükemmeldi.,10.0,10.0,10.0,1593455118
Yav adam 20tllik çiğ kofteyi bmw ile getirdi. Para vermeye utandim. Ama işin dogrusu koftesi hem cok lezzetli hemde cok fazlaydi ellerine saglik.,9.0,9.0,9.0,1593455118
12de aklıma düştü siparişimi verdim 12. 30da hızlıca geldi. Paketleme normal çiğköfte paketlemesiydi ama gelene kdr bol nar ekşisi olduğu için çok sızmıştı burda suç bana ait :) onun haricinde tadı efsane ama turşu ve nane ekstra eklenmş turşu sevmem ama naneye bayılırm çift lavaş istedim sğolsnlr ).,9.0,8.0,9.0,1593455118
Servis lezzet 10 numara.,10.0,10.0,10.0,1593455118
"Hız ve servis konusunda, 10 numara 5 yıldızsınız. Lezzet olarak tek eksiğiniz, acısız seçeneğinin olmaması. Onu da eklerseniz, haftada bir çiğköfte siparişi vermeyi düşünebilirim.",10.0,10.0,9.0,1593455118
Gayet güzeldi ve başarılı bir sunumu vardı.,10.0,10.0,9.0,1593455118
"10/10 hız, servis, hizmet teşekkürler :).",10.0,10.0,10.0,1593455118
Başarılı.,10.0,10.0,10.0,1593455118
"Kurye arkadaşın nazikliği ve naifliğinin yanısıra çiğköftenin lezzeti de gayet güzeldi ayrıca bolca garnitür vardı, çok memnun kaldık.",10.0,10.0,10.0,1593455119
Çok hızlı 10 dkda geldi. Getiren arkadaş çok kibar ve saygılı. Ama tadı beklediğimden biraz düşüktü nar ekşisi çook az ve limon hiç yoktu. Geri kalan gayet iyiydi.,10.0,10.0,8.0,1593455119
Abartısız dolu dolu lezzet.. Yarim saatten önce teslimat yapıldı..,10.0,10.0,10.0,1593455119
"Çiğköftenin lezzeti 10 numara lokum gibi adeta, hız iyi servis de güzel lavaşlar unutulmuş getiren kişi sağolsun kendisi uyardı lavaşlar konmuş mu diye sordu unutulmuş 10 dakika içinde de hemen lavaşları getirdi tekrar hizmet güzel çok ilgililer...",10.0,10.0,10.0,1593455119
Çok hızlı ve çok lezzetliydi. Ellerinize sağlık.,10.0,10.0,10.0,1593455119
Güzeldi.,10.0,10.0,10.0,1593455119
Çok anlayışlı ve güleryüzlüler tostları harikaydı teşekkürler.,10.0,10.0,10.0,1593455119
Hızlı geldi çok lezzetlidi teşekkürler.,10.0,10.0,10.0,1593455119
Mükemmeldi. Çok nazikler.,10.0,10.0,10.0,1593455119
Herseyi ile mükemmel tavsiye ederim.,10.0,10.0,10.0,1593455119
"Elleri çok bol, lezzetli ve hızlı teslimattı teşekkürler.",10.0,10.0,10.0,1593455119
İçine konulan malzeme biraz daha arttırılabilir. Onun dışında her sey güzeldi.,9.0,9.0,5.0,1590825373
"Çöle söylesiniz aç bırakmazlar sizi, lezzet konusunda her hangi bir eksiklik yok ellerinize sağlık. Siparişi getiren arkadaşın telefonu kırılmış, cana geleceğine mala gelsin diyerek geçmiş olsun...",10.0,10.0,10.0,1590825373
Herşey gayet güzel malzemeler bol ve lezzetli.,10.0,10.0,10.0,1590825373
Gerçekten çok lezizdi ve yanındaki malzemeleri de fazla fazlaydi hizi da çok iyiydi ellerinize saglikk.,10.0,10.0,10.0,1590825373
