comment_text,comment_speed,comment_service,comment_taste,comment_time
7 lahmacun istedik ama 6 lahmacun gelmiş.,9.0,7.0,8.0,1606576725
Salata yetersiz lahmacunun yanıda onun dışında harika.,10.0,10.0,10.0,1606231125
İyi.,8.0,9.0,10.0,1606231125
Kelimenin tam anlamiyla mukemmel hiz harika servis ve leziz yiyecekler. Elinize emeginize saglik.,10.0,10.0,10.0,1606231125
İsotlu lahmacun acı değildi ama normal lahmacunun acılısı yakıyordu.,10.0,10.0,9.0,1606144725
Kola nerde.,10.0,10.0,10.0,1606058325
Lahmacunlarınız çok iyi. Uzun süredir değişmeyen lezzet. Bir de ezme gibi mezeler gönderseniz çok daha güzel olur.,9.0,8.0,8.0,1605799125
Her şey güzel ama ben sadece kendim için sipariş verdiğimden minimum sipariş tutarı biraz yüksek geliyor. Mecburen fazla söylüyorum gerçekten lezzetli lahmacunlar cunku.,10.0,10.0,10.0,1605799125
Çabuk geldi ama çiğköfte tam bir hayal kırıklıklığı.,8.0,8.0,5.0,1605712725
Enfes.,9.0,9.0,9.0,1605539925
"Pizza hem çok güzel hem çok uygun, bilindik markaya 100tl odeyeceginize burayı tercih edebilirsiniz. Cikolatali pastayı daha incecik begenmistim yine beğendim ki dolaptan çıkmasına rağmen tadı hiç degismemisti ellerinize saglik.",10.0,10.0,10.0,1605367125
Kurye hes kodu olmadığı için kampüse alınmadı. Hes kodu almasını söylediğimde alamam hes koduna ihtiyacım olmuyor dedi. Kurye yemeği bana getireceğine ben gidip yemeği almak zorunda kaldım. Ayrıca maske kullanmıyordu. Pandemi döneminde bir doktor olarak bu tavırla karşılaşmam hiç hoş olmadı.,1.0,2.0,2.0,1605367125
Hız çok iyi ama gönderilen yeşillik 1 lahmacuna yetmiyor.,10.0,10.0,10.0,1605021525
Başarılı.,9.0,9.0,9.0,1604762325
Biraz yağı ağır geliyor ama güzel.,10.0,10.0,8.0,1604416725
Pizzanız eskiden çok iyiydi ama artık eski tadı yok.,7.0,9.0,2.0,1604416725
Güler yüzlü anlayışlı ve lezzetli.,10.0,10.0,10.0,1604243925
Harika.,10.0,10.0,10.0,1604119779
Gayet lezzetliydi kıymalı kaşarlı pide.,9.0,9.0,9.0,1604119779
Pizzaya bayıldım.,10.0,10.0,10.0,1604119779
"Lahmacunlar gayet lezzetli, hız ideal, servis ise iyiydi. Tavsiyemdir.",10.0,10.0,10.0,1604119779
"Hızlı, sıcak ve lezzetli. Düşünmeden sipariş verebilirsiniz.",10.0,10.0,10.0,1604119779
Lezzetli ve cok hızlıydı teşekkürler.,10.0,10.0,10.0,1604119779
Hız iyi sıcak da geldi fakat pizza çok lezzetsiz ya sosu yok denecek kadar az peyniri kaşar peyniri gibi biraz geçince kuruyor donuyor pizzadan çok kaşarlı sebzeli pide gibi salamlarda pek kaliteli değil gibi bı tadı vardı. Kusura bakmayın. :(.,9.0,9.0,3.0,1604119779
Gelen pasta bayattı. Çiğköftesi iyiydi.,8.0,8.0,5.0,1604119779
Lahmacunlar acıydı. İçecegi sıcak istememe rağmen soğuk geldi.,10.0,10.0,7.0,1604119779
Pizzası gayet lezzetli ve uygun fiyatlı.,9.0,9.0,9.0,1604119779
"İlk kez denedik ve çok memnun kaldık, çok lezzetliydi gerçekten. Özellikle sebzeli lahmacun çok iyiydi. Bundan sonra bu restoranı daha sık tercih edeceğiz.",10.0,10.0,10.0,1604119779
"Lahmacunlar, servis, hız herşey mükemmeldi teşekkürler :).",10.0,10.0,10.0,1604119779
Harika bir restoran.,10.0,10.0,10.0,1604119779
"Sipariş gayet hızlı ulaştı, paketi getiren arkadaş çok kibar ve güleryüzlü. Ürünler de gayet temiz ve lezzetli, tavsiye ederim.",10.0,9.0,9.0,1604119780
Kurye serkan müthiş hızlı. Ayağına sağlık.,10.0,10.0,8.0,1604119780
Her zaman ki gibi mükemmel:).,10.0,10.0,10.0,1604119780
Çikolatalı pastayı kesinlikle deneyin derim. Mukemmel yapmışlar kim yapmışsa ellerinize sağlık.. Çok şekerli değil yediğinizde ağırlık yapmıyor mükemmeldi tadı damağımda kaldı.,10.0,10.0,10.0,1604119780
Çok güzeldi müthişti hamuru yumuşacıkti bence yanina minik biber turşularindan ikram koyabilirsiniz. Daha iyisini yememiştim.,10.0,10.0,10.0,1604119780
Pıde efsane.,10.0,10.0,10.0,1604119780
İlk kez siparis veriyorum pizza muazzam guzeldi ama buyuk boy diyorsak daha buyuk olmali 2kisiyi doyurmaz 1 kisiyi doyurur kesinlikle cok lezzetli dominostan daha iyiydi kurye guleryuzluydu tskler.,10.0,10.0,10.0,1604119780
Berbattı hayatımda yediğim en kötü pizzaydı ve büyük boy dedikleri pizza küçük boy boyutundaydı. Asla denemeyin. Bu arada misafirlerim den biri mantardan rahatsızlandı. Rezil ettiler beni yazıklar oldun.,1.0,1.0,1.0,1604119780
"Hızlı ve lezzetli. Ayrıca kurye arkadaş çok kibardı, teşekkürler.",10.0,10.0,10.0,1604119780
Daha hızlı gelebilirdi. Ama çok sevdim lezzetini. Kurye de güler yüzlüydü.,7.0,10.0,10.0,1604119780
1 saatte gelen soğuk lahmacun insan göndermeye utanır.,1.0,1.0,1.0,1604119780
Bu kadar bol tuzlu yemek hiç yememiştim. Resmen mide bulantısına sebep oldu. Lezzetine maalesef erişemedim.,7.0,8.0,5.0,1604119780
Pizzasını mutlaka deneyin ne diyebilirim ki harika...,10.0,10.0,10.0,1604119780
Lahmacun güzeldi ama biraz tuzu fazlaydı:( ve salata çok azdı.,10.0,10.0,9.0,1604119780
Gerçekten güzel lahmacun tavsiye ederim.,9.0,9.0,9.0,1604119780
Pide ve lahmacun güzel.,10.0,10.0,10.0,1604119780
Lahmacun harikaydı.,8.0,10.0,10.0,1604119780
Pizzalar enfesti.,10.0,10.0,10.0,1601490034
Salatayı az koymuşsunuz çok üzüldük yapmazdınız böyle.,10.0,7.0,9.0,1601490034
11 dakikada lahmacun getirmek ne demekkkk! Çok kalp size.,10.0,10.0,10.0,1601490034
Pizzayi begendik.,8.0,8.0,9.0,1601490034
Hızlı ve lezzetli.,10.0,10.0,10.0,1601490034
Sıcak ve hızlı geldi.,10.0,10.0,8.0,1601490034
Pidenin yanında biraz salata olabilirdi.,8.0,4.0,7.0,1601490034
Herşey harikaydı pizzası mükemmel ve hızlı geldi teşekkürler.,10.0,10.0,10.0,1601490034
Harika lezzetler.,10.0,10.0,10.0,1601490034
Işınlanarak getiriyorlar başka izahı olamaz. Kurye arkadaşımız her zamanki gibi çok beyefendi bir insan.,10.0,10.0,10.0,1601490034
Yeşillik soğan limon tırsımış geldi. Getiren arkadaş samimiydi. Lezzeti güzel ama yanında verilen ürünlere de önem vermenizi isterim hız konusunda çok hızlı değil çok da yavaş değil 49 dakika da geldi. Ilıktı.,8.0,4.0,10.0,1601490034
Teşekkürler.,10.0,10.0,10.0,1601490034
"Maalesef her zaman dört dörtlük gelen siparişlerde, bu sefer yeşillikler ve soğanlar lök su içinde ve oldukça hırpalanmış, kararmış geldi. Sanki buzlukta dondurulmuş ta çözülmüş gibiydi. Hoş olmadı.",9.0,9.0,9.0,1601490034
Hızlı servis. Lahmacun lezzetli.,10.0,10.0,10.0,1601490034
Kıymalı kaşarlı pide söyledim süper hızlı ve lezzetli geldi.,10.0,10.0,10.0,1601490034
Hızlı ve sıcak geldi.,10.0,10.0,8.0,1601490034
Hızda biraz gecikme yaşadık. Kurye arkadaş güler yüzlü. Pizzanız gerçekten güzel ama sosisler biraz pişmemiş gibiydi.,9.0,9.0,10.0,1601490034
Yazicioglu ailesi olarak çok lezzetli ve guzel bulduk elinize sağlık.,10.0,10.0,10.0,1601490034
Süper hızlı ve lezzetli.,10.0,10.0,10.0,1601490034
Hızlı ve lezzetli elinize sağlık.,10.0,10.0,10.0,1601490034
Bütün ürünleri tek tek denedim. Beni üzen bir ürünleri olmadı. Kuryeleri çok beyefendi bir insan. Kendisine teşekkür ederim. Keşke her kurye işine bu kadar özen gösterse. Kurye işletmenin görünen yüzü. Düzenli sipariş verirken bu önemli. Teşekkür ederim.,10.0,10.0,10.0,1601490034
Fiyatına göre çok başarılı.,7.0,9.0,9.0,1601490034
Çok başarılı.,9.0,9.0,9.0,1598860288
"Siparişi getiren arkadaş çok iyidi normalde yorum yapmak tercihim değildir lahmacun söylemiştim gayet jyidi lezzet olarak, getiren arkadaşa tekrar teşekkür ederim.",10.0,10.0,9.0,1598860288
Pizzadan nefret eden bizi 3 gündür ninja kaplumbağalara çevirdi. Teşekkürler.,10.0,10.0,10.0,1598860288
"Çok başarılı, lahmacun özellikle.",10.0,10.0,10.0,1598860288
Lahmacunlar cook tuzluydu maalesef.,9.0,9.0,6.0,1598860288
Sipariş zamanında ve güzel geldi. Tavsiye ederim. Pastaları orjinal.,7.0,8.0,7.0,1598860288
"Merhaba gerçekten süperdi ellerinize sağlık, başka biryerden denemeye gerek yok. Servis hız lezzet emeğinize sağlık...",10.0,10.0,10.0,1598860288
Çok iyiydi.,10.0,10.0,10.0,1598860288
Kaşarınızı değiştirmenizi öneririm gerçekten hem çok yağlı hemde lezzetsiz.,8.0,6.0,6.0,1598860288
Lahmacunlar süper.,10.0,10.0,10.0,1598860288
"Servis hızlı, servis çalışanı güleryüzlü, pide lezzetli.",9.0,9.0,8.0,1598860288
Her şey çok güzel sadece kurye seçimi başarısız.,10.0,10.0,10.0,1598860288
İsotlu lahmacunları güzel. Notları okumuyor olabilirler ama yine de başarılı olduklarını düşünüyorum. Ellerinize sağlık.,10.0,10.0,10.0,1598860288
Önceki siparişim soğumuş gelmişti ama bu çok hızlı ve güzeldi. Tadı gayet güzeldi. Sadece çiğ köftelerin acı olduğunu belirtseler daha iyi olurdu.,10.0,8.0,9.0,1598860288
Tam olarak 10 dakika da kapıdaydı.,10.0,10.0,10.0,1598860288
Kurye arkadaşa teşekkür ederim.,9.0,8.0,8.0,1598860288
Çok lezzetliydi.,10.0,10.0,10.0,1598860288
Kurye arkadaşa teşekkür ederim.,9.0,9.0,9.0,1598860288
Teşekkür ederim.,9.0,9.0,10.0,1598860288
Lahmacunlar çok iyi.,10.0,10.0,10.0,1598860288
Mantarsız diye belirtmistim.,9.0,9.0,9.0,1598860290
Biraz yağlıydı hız fena değildi ama soğuk geldi.,8.0,7.0,7.0,1598860290
Siz kapalıyken selda bağcandan ayrılık şarkısını dinledim.,10.0,10.0,10.0,1598860290
Hızlarına laf edemem ortalama bir sürede geldi. Ancak siparişimin sıcak ve eksiksiz gelmesini rica ediyorum notuma rağmen gelen 4adet(104tl) kuşbaşılı kaşarlı pide sıcak değildi. Kurye elinde kutularla getirdi. (poşet yok) peçete dahil hiçbir şey konulmamıştı. Lezzet ise orta altında ve yetersiz.,8.0,4.0,6.0,1598860290
"Lahmacunun lezzetine doyum yok, kuryeniz de çok efendi biri, böyle hizmet vermeye devam, bozmayın.",10.0,10.0,10.0,1596230544
Gelen şey lahmacun değildi. Lahmacun adı altında yolladığınız şeyin içinde kıyma olmadığına yemin edebilirim. Boşu boşuna midemizi bozduk. Kurye iletişim iyiydi.,6.0,8.0,2.0,1596230544
Lahmacun övme timinin öncüsü olarak buradayız.,10.0,10.0,10.0,1596230544
"Lahmacun muhteşem ya. Eti kokmuyor, hamuru muhteşem, yeşillik tam ayarında ve en önemlisi sıcacık geliyor. Cüzdanım el verdikçe desteğe devam :d.",10.0,10.0,10.0,1596230544
"Harika bir lahmacun geldi, ellerinize sağlık!",9.0,9.0,10.0,1596230544
Bu ara lahmacunun yanındaki domatesten kısmalarına rağmen 10 numara.,10.0,10.0,10.0,1596230544
Fena deil.,5.0,6.0,3.0,1596230544
Kıyma kokuyordu sanki.,1.0,1.0,1.0,1596230544
İyi.,10.0,10.0,10.0,1596230544
Pizza hamuru mayalı hamur değil ya da bayat hamur. Pizza sosu kuru kekik ile yapılmış belli mantarlar cok büyük doğranmış bu yüzden sulanmış hamurun içinde. Keyif aşmadım pizzadan birdaha söylemem yüksek ihtimal.,3.0,3.0,3.0,1596230544
İzmitte lahmacunu düzgün yapıp yeterince ve lahmacuna uygun salata getiren tek yer. Çoban salatası yolluyor başka mekanlar. Buradan söyleyince marul sumaklı soğan ve maydanoz geliyor. Respect.,9.0,10.0,10.0,1596230544
Tatlı pek iyi değil. Lahmacun şiir gibi. Ağlayacaktım yerken güzelliğinden. Servis oldukça iyi. Hızlı ve sıcak. Kurye kibar.,10.0,10.0,10.0,1596230544
Lahmacundan sonra pizzasını da denedim ve sonuç başarılı. Büyük boy olmasına rağmen çok büyük gelmedi ama genel olarak zaten her işletme porsiyonu kısmış durumda. Eskinin büyük pizzaları kalmadı maalesef.,9.0,9.0,9.0,1596230544
"Herşey çok güzeldi aynen devam lütfen, düzgün yer bulmak zaten zor izmitte aman sizi de kaybetmeyelim.",10.0,10.0,10.0,1596230544
Bu seferki hızın iyiydi teşekkürler.,10.0,10.0,10.0,1596230544
Teşekkürler.,9.0,9.0,10.0,1596230544
Arkadaşlar o kadar yavaş geldi ki pizza hamuru sertleşmiş bildiğiniz aslında böyle bir müessese değil ama nasıl oldu bu iş anlamadım.,1.0,1.0,1.0,1596230544
Güzel.,9.0,8.0,8.0,1596230544
"Lahmacun sipariş etmiştim, gayet başarılı ve genel olarak fiyat anlamında makul bir yer. Islak mendilleriniz lezzet ve servise yakışmıyor, çok önemli olmamakla birlikte değiştirmenizi öneririm :).",9.0,9.0,9.0,1596230544
Pizzası gercekten çok lezzetli. Tesekkür ederim.,10.0,10.0,10.0,1596230544
Lezzetli.,10.0,10.0,10.0,1593600798
Kocaeli deki en iyi pizza yapan lokanta tavsiye ediyorum.,10.0,10.0,10.0,1593600798
Lahmacunlar güzeldi ama acılı acısız olarak belirtseniz daha iyi olurdu. Ayrı ayrı koymuşsunuz fakat hangi ikisi acılı hangi ikisi acısız belirten birşey koymamışsınız.,10.0,10.0,10.0,1593600798
2. Ye sipariş veriyorum öncelikla harika bir lokanta lezzeti beğenmeme gibi bi ihtimal yok ama fiyatlar uçmuş biraz.,10.0,10.0,10.0,1593600798
Lezzetli ama soğuktu.,7.0,10.0,8.0,1593600798
Acılı bile acısızı ayırmamışlar uzun bir arama sürecimiz oldu tadı güzeldi ama sadece yeşillik biraz az olmuş domates şart.,9.0,5.0,9.0,1593600798
Lahmacun ve pizzayı denedim ikisi de harikaydı. İsotlu lahmacunu şiddetle tavsiye ederim.,10.0,10.0,10.0,1593600799
Kömür yemek isteseydim zonguldak mandenlerine giderdim. Bir lahmacun bu kadar da yakılmaz ki.,1.0,1.0,1.0,1593600799
İtalyan pizzası güzeldi. Tavsiye ederim. Hızı da oldukca iyiydi.,10.0,10.0,10.0,1593600799
Lahmacunlar hem lezzet hem de sıcaklık olarak on numaraydı. Tiramisu çok sarmadı ama emeğinize sağlık 10 10 10!,10.0,10.0,10.0,1593600799
Pizzanızı yerken ayrılık acısını bile unuttum o derece mükemmel :d.,10.0,10.0,10.0,1593600799
Buyuk boy pizzanin hamuru ince geliyor. Lezzeti farkli denenebilir.,10.0,10.0,10.0,1593600799
Yapıyorsunuz bu işi.,10.0,10.0,10.0,1593600799
Güzel.,10.0,10.0,10.0,1593600799
Hersey icin tesekkurler cok lezzetliyfi.,10.0,10.0,10.0,1593600799
Hem çok hızlı geldi hem de lahmacunu çok çok güzeldi. Pizzasının tadı hiçbir pizza zincir restorantında yok. Çok teşekkür ederiz.,10.0,10.0,10.0,1593600799
10 numaraydı.,10.0,10.0,10.0,1593600799
Zincir restoranların pizzasından daha lezzetli.,10.0,10.0,10.0,1593600799
"Marifet iltifata tabidir derler, işini hakkıyla yapan bu işletmeye teşekkür ediyorum. 11 olsa 11 verirdim. Kolay gelsin.",10.0,10.0,10.0,1593600799
Mantarlar çok ince ve yanmıştı. Pizzar kenarları da aynı şekilde inceydi ve kuruydu. Kekik çok fazlaydı. Umarım bir seferliğe mahsustur. Kolay gelsin.,10.0,10.0,10.0,1590971053
İyiydi.,10.0,10.0,10.0,1590971053
