comment_text,comment_speed,comment_service,comment_taste,comment_time
Kalitesi lezzeti servisi hepsi harika. Fiyatlar biraz yüksek o kadar. Kesinlikle tavsiye ederim.,10.0,10.0,10.0,1604141903
Efsane lahmacun.,10.0,10.0,10.0,1604141903
"Lezzetliydi, yanında ikram olarak gelen çiğ köfte mükemmeldi.",7.0,8.0,9.0,1604141903
Tesekkurler.,10.0,10.0,10.0,1604141903
Has konyalı lezzetini git gide düşürüyor.. Hızı ortalama servis süresini geçti. Lezzeti ve patateslerinşn bayatlığı. Sevdiğimiz bir yeri daha kaybediyoruz.,1.0,1.0,1.0,1604141903
Teşekkürler.,10.0,10.0,10.0,1604141903
Daha öncede müessesenizden çok yemek yedim lezzetli olduğunu biliyorum o yüzden puanımı düşük vermedim fakat dünki dürümümün lavaşı cidden sırılsıklamdı. Sarılı dürümü tabağa servisleyip öyle yemek zorunda kaldım lütfen dikkat ediniz. Elinize sağlık teşekkürler.,9.0,9.0,8.0,1604141903
Lezzete bayılıyoruz ama her seferinde soğuk yiyoruz maalesef.,4.0,10.0,10.0,1604141903
Sarma beyti söyledim tadı sanki 2 gündür beklemiş gibi. Gavurdagı salatası söyledim sogansız ama herşey akmıs ve soganlı geldi. İçli köfte söyledim tadı çok kötüydü. Çok geç geldi ve hetşey akmıstı.,3.0,3.0,2.0,1604141903
Sipariş hızlı ve eksiksiz geldi. Yanına çiğköfte de geldi. Çok sevindim. Teşekkürler.,10.0,10.0,9.0,1604141903
Gayette güzel her zaman istiyorum teşekkür ederim iyi çalışmalar.,10.0,10.0,10.0,1604141903
"Yüz kere sipariş verdik hala adresi bulamıyorlar. İki üst sokak, nasıl bulamıyorlar anlamadım.",1.0,1.0,1.0,1604141903
Sıcak geldi 23 dakikada. Fakat lahmacun sipariş ettim. Tadı tuzu yok. İç harcı çok lezzetsiz size yakıştıramadım. Yanınada bişeyler eklemelisiniz servis yetersiz. Maliyeti az olobilir ama müşteri devamlılığı için önemli detaylar bunlar.,8.0,6.0,3.0,1601512157
Gelen arkadas sıkıntılıydı.,1.0,1.0,8.0,1601512157
Teşekkürler.,10.0,10.0,10.0,1601512157
