comment_text,comment_speed,comment_service,comment_taste,comment_time
"Hızlı servis için teşekkürler. Hamburger ekmeğinize bayıldım, çok başarılı idi. Köftenizin lezzeti de gayet güzel ancak ufak bir tavsiye cheese sosu az koyduğunuz için hamburger kuru geliyor. Kolay gelsin ofise sık sık isterim haberiniz olsun.",10.0,10.0,8.0,1605217237
"Yemeğim soğuk ve çiğ geldi, restorana bunu bildirdiğim zaman telafi etmek istediklerini söylediler ama ciddi değildiler sanırım telafi etmediler? Müşterileriyle dalga geçen ve hatasını telafi etmeyen bir restorandan sipariş vermek istiyorsanız buyrun verin.",1.0,1.0,1.0,1605130837
Evim uzakta olasına rağmen çok kısa sürede geldi. Hizmet ve lezzet 10 numara. Teşekkürler.,10.0,10.0,10.0,1605130837
"Notları da okumayı unutmasanız sizden iyisi yok, seviyoruz.",10.0,10.0,10.0,1605130837
Çok severek sipariş veriyorduk ancak ekmek kuru hamburger köftesi yanmıştı.,6.0,6.0,2.0,1605130837
"Tek kelime ile harika, elinize sağlık, mütevazı bir restoran ne kadar övsek az.",10.0,10.0,9.0,1605130837
Tadı eskisinden daha kötüydü.,10.0,10.0,6.0,1605130837
Çıtır tavuklar yanmıştı. Geri kalan her şer harikaydı.,10.0,10.0,7.0,1605130837
Ürün soğuk geldiği için yiyemedim yarısı çöpe gitti.,1.0,1.0,1.0,1605130837
Notlarin okunmasi lazim. Onun disinda her sey mukemmel.,10.0,9.0,10.0,1605130837
Hasan beye teşekkür ederiz hızlı ve sıcak geldi.,10.0,10.0,9.0,1605130837
"Hamburger ekmeği, köftesi ve tavuklar çok kuruydu. Çözüm bulursanız çok daha lezzetli olacaktır. Teşekkürler.",10.0,10.0,3.0,1605044437
Semih ustaya sevgilerle :))).,10.0,10.0,10.0,1605044437
Güzeldi.,8.0,8.0,8.0,1605044437
