comment_text,comment_speed,comment_service,comment_taste,comment_time
Her şey harikaydı. Teşekkürler.,10.0,10.0,10.0,1601260808
Hem lezzetli hem notlar okunuyor.,10.0,10.0,10.0,1601260808
Mukemmeldi.,10.0,10.0,10.0,1601260808
"Gayet başarılı, iyi ki geldiniz ümitköye...",10.0,10.0,10.0,1601260808
Musakkanin yaninda pilav falan konmasini beklerdim.,10.0,10.0,10.0,1601260808
Beykozun lezzet hep mükemmel. Sadece siparişimiz yazan süreden çok daha geç geldi ama bir cuma akşamı olması sebebiyle kalabalıktandır diye düşünüyorum. Yine de çok sipariş olan günler için de bir b planı olsa herşey daha da iyi olur :).,6.0,10.0,10.0,1601260808
"Eksik sipariş gönderdiler, ama ücretini tam aldılar.",1.0,1.0,1.0,1601260808
"Gec saatte de iyi hizmet veriyorlar. Kaliteyi bir tik artirirlarsa daha guzel olacak, beykoza daha yakisacak.",9.0,9.0,9.0,1601260808
Güzeldi.,10.0,10.0,10.0,1601260808
Puanı kirmiyorum ama merak ettim. Belli bir standardiniz yok mu? 3 inegöl siparişimin 3unde de farklı sayıda köfte geldi (12-14-10) bu durum üzüyor.,10.0,10.0,10.0,1601260808
Daha önce bir çok kez sipariş verdik ve memnun kalmıştık. Bu sipariş tambir hayal kırıklığı oldu. Umarım uyarımız dikkate alınır.,6.0,6.0,3.0,1601260808
"3 tavuk şiş söyledik fakat 2 tane salata, ezme geldi. Onun dışında hızlı geldi ve tadı güzeldi.",10.0,7.0,10.0,1601260808
Eski halinden eser yok simdi.,1.0,1.0,1.0,1601260808
"Çorba sıcak geliyor, restaurantta gelen tüm ikramlar eksiksiz gönderilmiş.",10.0,9.0,9.0,1601260808
Ayranımızı yollamamışlar...,10.0,10.0,10.0,1601260808
Elinize saglik :).,10.0,10.0,10.0,1601260808
Kuzu sis inanılmaz kokuyordu. Bu restorantta ilk kez denedim ( daha önce hiçbir yerde kokmamisti) yiyemedim.. Adana porsiyonu büyüktü.,7.0,9.0,3.0,1598631062
"Hız/servis müthiş. Ama lütfen yeşilliklerinize bir tık daha özen gösterin, ellerinize sağlık.",10.0,10.0,9.0,1598631062
"Kazandibinin üzerine tarçın koymamanızı tercih ederdim, yiyemedim. Yanında paket şeklinde olsaydı keşke.",8.0,10.0,9.0,1598631062
Çok hızlı geldi ve tazeydi.,10.0,10.0,10.0,1598631062
Lezzettli tertemiz ve hızlı servis.,10.0,10.0,10.0,1598631062
Güzeldi.,10.0,10.0,10.0,1598631062
