comment_text,comment_speed,comment_service,comment_taste,comment_time
10/10.,10.0,9.0,10.0,1606520295
Tuz be sirke koymayın yanında gönderin tansiyon hastaları için zararlı.,9.0,9.0,6.0,1606520295
Hız güzel servis güzel lezzette güzel ama porsiypnlar çok küçük.,10.0,6.0,10.0,1606347495
Şırdan içinde kıyma olmamalıydı:(.,10.0,9.0,7.0,1606347495
Getirilen siparis yanlis geldi 40dk yeni siparisi bekledik.,1.0,1.0,5.0,1606261095
Corba biraz daha sicak olabilirdi.,10.0,10.0,10.0,1606261095
Güzel. Sebzeli olduğu açıklamaya yazılabilir.,8.0,8.0,8.0,1606261095
Geç soğuk geldi yemekler.,3.0,5.0,10.0,1606174695
"Berbatti. Bir tavuk sis bir pureli kebap 75 dkda geldi. Ha gelen hesapta kebabin fotografini da koyuyorum, etlerin tanesi 10 tlye geliyor asagi yukari :d beceremiyosaniz bosverin kardesim herkes paket servis yapmak zorunda degil kapatin gidin acilinca dukkaninizda servis verirsiniz.",1.0,1.0,1.0,1606088295
Yemekler birbirine karısmıstı.,1.0,1.0,1.0,1606088295
Hem hızlı servis hem lezzetli hem de bir dünya ikram tatlı geldi. Cok tesekkur ederiz ellerinize sağlık.,10.0,10.0,10.0,1606001895
Yuksek not verdim ama dediklerimi lutfen iyi dinleyin 1-ekmek arasi kokorec 40tl gb fahis bir fiyat olmaz bunu duzeltin 2-koskoca beykozda ayran nasil biter? 3-ekmek bayat ve kufluydu. 4-pandemiden dolayi gec geldi eyvallah 5-bu hususlari dikkate alin ve musteri kaybetmeyin.. Iyi gunler dilerim.,9.0,9.0,9.0,1606001895
Her ürünleri güzel. Biraz yavaş geldi.,7.0,10.0,10.0,1606001895
Tesekkurler elinize saglik.,10.0,10.0,10.0,1605915495
"Sirke, sarımsak sos unutulmuş. Neye yarar işkembe.",8.0,5.0,9.0,1605915495
"Islak mendil yok, geç geldi.",1.0,1.0,1.0,1605915495
Gayet guzeldi.,8.0,10.0,10.0,1605829095
Herşey harikaydı.,10.0,10.0,10.0,1605829095
Şu kelleye bak hele nasıl gelir gelmez kemirmeye başladım ben de buny seviyorum kardeşim.,10.0,10.0,10.0,1605742695
Lutfen su ekstralara dikkat edin siparise eklememize ragmen gelmiyor.,9.0,8.0,9.0,1605742695
"Yanılmıyorsam adananın içinde biraz vanilya vardı, inanılmaz yakışmış! Şefi tebrik edeiyorum.",10.0,10.0,10.0,1605742695
Mükemmel paketleme sıcak servis daha ne olsun.,9.0,10.0,10.0,1605656295
"Tabii ki beykoz kalitesi gonul ister ki toplanip gidelim ama pandemi sartlarinda, evden burnumuzu cikartamadigimiz bu gunlerde beykoza gitmis gibi olduk. Paketlemesinden, tadina kadar her zaman oldugu gibi muhtesemdi. Tum calisanlara saglikli, guzel gunler diliyoruz.",9.0,10.0,10.0,1605656295
Eve yeni tasindim catal bicak islak mendil hic bisey gondermedikleri icin cok zor yedim yemegi. Ama lezzetleri guzeldi.,10.0,2.0,10.0,1605656295
Yazdığımız notları dikkate aldiginiz için teşekkür ederim.,10.0,10.0,10.0,1605569895
"İnegöl köfte efsaneydi, çorbaya zaten muhteşem. Elinize sağlık.",10.0,10.0,10.0,1605483495
Hizli ve lezzetli.,10.0,10.0,10.0,1605483495
Çok güzel bir restoran. Paket servisi de özenli. Jokerde de görmek isteriz.,10.0,10.0,10.0,1605397095
Daimi sipariş verdiğim tek yer.,10.0,10.0,10.0,1605397095
Her şeyiyle çok güzeldi. Yemekler servis hizmet 10 numara.,10.0,10.0,10.0,1605397095
Sadece 2 tane kaşarlı köfte olurmu? Kime yeter. 70 gram köfte.,9.0,4.0,9.0,1605397095
"Çok geç geldi, özür dilediler.",1.0,5.0,6.0,1605310695
Mükemmel.,10.0,10.0,10.0,1605310695
Patates kızartması koymuyorsanız buraya da yazmayın.,10.0,8.0,8.0,1605224295
Servis mükemmel.,10.0,10.0,10.0,1605051495
Töbe daha.,1.0,1.0,1.0,1605051495
Kısa sürede sıcacık geldi. Süpersiniz.,10.0,10.0,10.0,1604965095
Yanlıs adrese göndermeme rağmen güzel geldi.,10.0,9.0,9.0,1604878695
1. 5 porsiyon istediğim çorbanın 1 porsiyon gelmesi dışında bi sıkıntı yoktu.,8.0,8.0,8.0,1604792295
Ekmek unutulmuş bu lezzete ekmeğinizin lezzti eksik kaldı.,10.0,4.0,10.0,1604792295
Su ekstrali gonderseniz harikasiniz.,9.0,7.0,9.0,1604792295
Kuzu kokoreç çok lezzetli ama biraz yağlı.,9.0,10.0,10.0,1604705895
Adana cok kötü. Corba beyogluyla ayni ayarda.,6.0,6.0,3.0,1604619495
Efsane bi yer.,10.0,10.0,10.0,1604619495
Köftesini çok beğendik.,10.0,10.0,9.0,1604619495
Beğendik.,7.0,10.0,8.0,1604619495
Yemeği bir saat 15 dakikada getirdiler. Ayrıca teslim etmeden 20 dakika önce sisteme teslim ettik diye giriyorlar.,1.0,6.0,7.0,1604619495
Aci sos unutmalari disinda hersey cok guzeldi ellwrinize saglik. Ayrica bir kurye ancak bu kadar beyefendi olur. Teşekürler.,10.0,10.0,8.0,1604533095
Baya guzel.,10.0,10.0,10.0,1604533095
Ekmek arası çok iyi.,10.0,10.0,10.0,1604533095
"Lezzetli, güvenilir.",9.0,9.0,9.0,1604446695
Kelle sert ve lezzetsizdi.,9.0,9.0,6.0,1604446695
Kötü.,1.0,1.0,1.0,1604446695
Kötü.,1.0,1.0,1.0,1604446695
"Hiçbir sipariş üzmez, eve sipariş belli bir standarta oturmuş, net.",9.0,9.0,9.0,1604446695
Güzel ama fiyatlar porsiyona göre biraz pahalı.,10.0,6.0,10.0,1604360295
Çok iyi lokanta.,10.0,10.0,9.0,1604360295
"Nezaket, özen, incelik, lezzet. Saygi duyuyoruz.",10.0,10.0,10.0,1604273895
Her şey çok güzeldi teşekkürler.,10.0,10.0,10.0,1604273895
"Tavuk şişi gerçekten lezzetli. Sipariş gönderim zamanı günden güne çok farklılık gösterebiliyor, bazen 20-25 dk içerisinde bazen 50 dk da teslim ediyorlar ama genele vurulduğunda puanım 8/10.",7.0,10.0,10.0,1604187496
Hemen hemen hergün sipariş veriyoruz. Tek kelimeyle harika.,10.0,10.0,10.0,1604187496
Çorba ve aşure çok güzeldi kelle ve inegöl köfte lezzetsiz idi.,9.0,9.0,4.0,1604187496
Kokteyl corbasi cok lezzetli ve sicacik geldi ancak yaninda gelen incecik kesilmis bakkal ekmegi yerine pide tarzi bisey koyulsa daha iyi olur.,10.0,9.0,10.0,1604187496
Elinize saglik.,10.0,10.0,8.0,1604187496
Gayet güzel.,9.0,9.0,9.0,1604101096
Teşekkürler.,10.0,10.0,10.0,1604101096
Sırdaniniz cok sert.,7.0,8.0,7.0,1604101096
Pazı güzel.,8.0,8.0,10.0,1604101096
Kotuydu.,1.0,1.0,1.0,1604101096
Lavaşlar kayış gibi soğan sumaksız.,8.0,6.0,5.0,1604101096
"Servis süresi 20-30dk yazıyor 58 dk da geldı. Mercimek corbasını sulandırıp yollamışlar yazıklar olsun koskoca beykozsunuz siz. Tavuk şiş söyledim, patates kızartması var demıssınız fakat yok. Bulgur pilavı falan aspavalar vermıyor boylesını... Umarım günlük bir sorundur.",1.0,1.0,5.0,1604014696
Herşey çok kaliteliydi. Tam puan.,10.0,10.0,10.0,1604014696
Bir cok konuda beykoz iyi olsa da rakip firmanin inegol kofteleri daha basarili.,9.0,7.0,7.0,1604014696
Biz çok beğendik yapanın ellerine sağlık.,10.0,10.0,10.0,1604014696
İlk defa sipariş verdim cok ama cok begendım cok hızlı geldı yemekler gayet sıcaktı paketleme mükemmeldi lezzetleri ise mükemmel ötesiydi özellikle kokoreç çok ama çok guzeldı uzun süredir böylesini yememiştik sadece kokoreç ekmeğini biraz daha kızartırsalar diyecek bir şey kalmaz teşekkürler..,10.0,10.0,10.0,1603928296
Cok iyi.,10.0,10.0,10.0,1603928296
"Yemekler iyi paketlenmiş, lezzetli, sıcak ve porsiyonları iyiydi. Gösterdiğiniz özen için teşekkürler.",10.0,10.0,10.0,1603890550
Mantisi gercekten cok guzel oneririm.,10.0,10.0,10.0,1603890550
Öncelikle servis kabını çok beğendim. Çorba da lezzetliydi. Kebap da fena değil. Beykoz kalitenin tartışmasız adresi.,8.0,10.0,9.0,1603890550
Teşekkürler.,10.0,10.0,10.0,1603890550
Beyin çorbası harika.,10.0,10.0,10.0,1603890550
"Yemekleri güzel ve lezzetli, siparişimde çorbayı unutmuşlar, telefon açıp söyledim, çok özür dileyip tekrar gönderdiler.",9.0,8.0,10.0,1603890550
Mumbar iyimi diye siparişden önce arayıp sorduğum halde kayış gb mumbar geldi mercimek corbası süperdi.,10.0,7.0,7.0,1603890550
Hız sorununa rağmen o kadar lezzetli ki herşey adanası şişleri ve hünkar beğendisi gerçekten başarılıydı. Kuryenin özürüne rağmen hız konusunda daha hassas olunursa tek kelime ile şahanesiniz.,8.0,10.0,10.0,1603890550
Sebzeli köftesi güzeldi.,8.0,8.0,8.0,1603890550
"Her zaman harika, diyecek bir şey yok.",10.0,10.0,10.0,1603890550
Kuzu inciğin lezzetinde düşüş var yağı da fiyatı artmış.,9.0,8.0,7.0,1603890550
Çok geç geldi. Aç olmasak iptal ederdik çorba da köfte de soğuktu.,1.0,8.0,5.0,1603890551
1. 5 saat sonra soğuk bir şekilde geldi.,1.0,6.0,6.0,1603890551
Genç arkadaş çooooook hızlı.,10.0,10.0,10.0,1603890551
Curuk efsane.,10.0,10.0,10.0,1603890551
Soğuk geldi sanırım paketlemeden.,9.0,4.0,9.0,1603890551
"Iskembe istedik kelle paca geldi, kofteler iyi pissin dedik ortalari pismemis geldi.",1.0,1.0,1.0,1603890551
Çok lezzetli ve ambalaj çok doğru.,8.0,9.0,9.0,1603890551
"İnegöl köftesi nefis. Pişmişlik oranı için rica ettiğim notu görmezden gelmemişler, tam istediğim gibi geldi. Teşekkür ederim, tavsiye ederim.",10.0,10.0,10.0,1603890551
Çok yakın mesafeye çok geç geldi.,1.0,1.0,1.0,1603890551
Ortalama servis süresini yakalıyorlar. Ekmek içi ürünleri gayet güzel. Kuru fasülye ise gerçekten başarılı değil. Servis konusunda hijyenik olduklarını kabul ediyorum ama tırtıklı kaplar sulu yemeklerde ciddi problem yaratıyor. Açarken elinize bulaşıyor. Genel olarak düzgün bir işletme diyebilirim.,8.0,8.0,8.0,1603890551
"Değerli beykoz ailesi, patates kızartmaları biraz daha özenli olabilir. Çok büyük ve lezzetsizdi. Ana yemekler yine harikaydı.",10.0,10.0,9.0,1603890551
Et her zamanki kalitesinden uzakti.,8.0,8.0,5.0,1603890551
Urfa kebap rezaletti. Cig sekilde getirmisler. Patatesler yenebilecek gibi degil lastik gibi.,4.0,10.0,1.0,1603890551
Çorba porsiyonu çok küçük.,1.0,1.0,1.0,1603890551
"1, 5 porsiyon istemistik ancak fotograftaki porsiyonda geldi. Sanirim bir yanlislik oldu, biz de tekrar beklemek istemedigimiz icin arayip soylemedik. Eksik porsiyon gelmesi disinda bir sikinti yok, her zaman yedigimiz yer.",7.0,3.0,8.0,1603890551
Elinize sağlık.,8.0,8.0,8.0,1603890551
Hız lezzet hijyen herşey dört dörtlük.,10.0,10.0,10.0,1603890551
"Beyaz ekmek yerine / yanına lütfen kepek, çavdar, tam tahıllı ekmek gibi seçenekler de konulabilir...",10.0,9.0,10.0,1603890551
Pilav gelmedi.,9.0,7.0,9.0,1603890551
Sipariş notlarını okumuyorsunuz. Zili çalmayın yazdik ona rağmen deli gibi zile basıyor gelen arkadas.,8.0,9.0,9.0,1603890551
"Mercimek çorbası çok yağlıydı. Etli yaprak sarmaları kocamandı, çok lezzetsizdi.",10.0,10.0,3.0,1603890551
Ellerinize sağlık.,10.0,10.0,10.0,1603890551
Ekmek dilimi yerine kendi üretimleri veya daha özellikli bir pide/ekmek verilebilir.,8.0,7.0,8.0,1603890551
Beyler soslu şirdan hiç pişmemişti bilginize! Diğerleri süperdi soslu şirdana biraz daha önem verirseniz süper olur.,10.0,10.0,10.0,1603890551
Her seferinde notlara lütfen fis getirin yazıyorum. Okumuyorsunuz. Okumaya da gerek yok zaten mali bir zorunluluk. Neden bizi fisin peşinden koşmak zorunda bırakıyorsunuz.,9.0,7.0,9.0,1603890551
Çorba eksik gelmişti ancak sorunu muhteşem ve hızlı şekilde hallettik ve ayrıca yemekler çok lezzetliydi.,10.0,10.0,10.0,1603890551
Öğlen yoğunluğu haricinde her zaman ki lezzet ve tadında idi bir daha sipariş verirken öğle yoğunluğunu hesaba katıp vereceğim teşekkürler.,4.0,9.0,9.0,1603890551
Tavuk şiş biraz daha fazla pişirilebilir.,9.0,8.0,8.0,1603890551
Çok güzel yemekler ve zamanın dan önce geliyor kurye arkadaşlara da teşekkür ederim çok nazikler.,10.0,10.0,10.0,1603890551
Kofte harika kokorec kuruydu.,10.0,9.0,9.0,1603890551
Çok yavaş.,1.0,10.0,10.0,1603890551
Getiren kurye gerçekten çok kıbardi yemeklerde çok lezzetli.,10.0,10.0,10.0,1603890551
"Yaklaşık 25 yıllık müşterileriyim ama bir daha tercih etmem. Çürük çorbası yerine kelle paça çorbası göndermişler. Açıklamaları aslında ikisi de aynı çorba imiş, sadece yağsız yerinden koymuşlar. Beykozda artık beyin, dil vs çürükte olmuyor, acılı salça sos yerinede meyaneli oluyor. Foto ekleseydim keşke.",8.0,1.0,1.0,1603890551
"Çok yavaş geldi. Servis çok kötü. 4 tane köfte, şekilsiz saçma sapan patates ile servis edildi. Bu servis miktarı ile istenilen ücret çok saçma.",1.0,1.0,5.0,1603890551
Teslimat süresi 35-45 dk arası gösterirken 1. 5 saatten daha fazla sürede buz gibi gelen çorbalarla bizi gerip tadımızı kaçırdığınız için teşekkür ederiz.,1.0,1.0,1.0,1603890551
Fiyatlar porsiyona göre pahalı çorbası kötüydü.,8.0,8.0,5.0,1603890551
"Her şey 10/10. Köfte o kadar lezzetli, servis o kadar başarılıydı ki içeceğin diyet gelmemesine takılmadım bile.",10.0,10.0,10.0,1603890551
Lezzet yine güzel ancak sipariş epey geç geldi. Özür dilenmesinden ötürü yazmayacaktım bunu ancak siparişte yer alan ayran da gönderilmemiş.,1.0,10.0,10.0,1603890551
Çok hızlı geldi ve çorbalar sıcacıktı.,10.0,10.0,10.0,1603890551
Lezzetli ve güzel.,9.0,9.0,9.0,1603890551
Sıcacık geldi ama şu kurunun porsiyonu biraz arttırın yav yetmiyor hiç.,9.0,9.0,9.0,1603890551
"Herşey iyi güzel de, ilk defa 1 saatte geldi.",2.0,9.0,8.0,1603890551
Lezzetine sozum yok zaten ama servis 11 puanlikti.,10.0,10.0,10.0,1603890551
Porsiyonlar lezzetli ama cok kucuk.,8.0,5.0,8.0,1603890551
Sipariş hızlı ve lezzetliydi. Fakat çatal kaşık ve şırdanın yanına kimyon koymayı unutmuşlar.,10.0,8.0,10.0,1603890551
Çorba ile nasıl plastik kaşık servisi gönderilmesi gerekir.,8.0,5.0,8.0,1603890551
Erman usta eline sağlık teşekkürler. ).,10.0,10.0,10.0,1603890551
Hızlı lezzetli ama kokoreç yerinde yemek lazım.,10.0,10.0,10.0,1603890551
Efsane.,10.0,10.0,10.0,1603890551
Çok lezzetli.,10.0,10.0,10.0,1603890551
"Porsiyonlar biraz daha fazla olabilir, yeni servis tabaklarınız cok küçük.",10.0,9.0,9.0,1603890551
70 dakikada teslimat. Üzücü.,1.0,7.0,8.0,1603890551
10109.,10.0,10.0,9.0,1603890551
Kokorec herzamanki gibi superdi elinize saglik.,10.0,10.0,10.0,1603890551
Başarılı.,10.0,10.0,10.0,1603890551
Her şeyiyle mükemmeldi. Kelle paça çorbası söylemiştim gerek yanındaki verdikleri gerekse çorbanın kendisi harikaydı. Ellerinize sağlık.,10.0,10.0,10.0,1603890551
Pilavınız daha diriydi sanki biraz lapa geldi onun dışında paketleme ve kalite her zamanki gibi beykoz kalitesi.,10.0,10.0,8.0,1603890551
"Patates kızartması yerine, elma dilim patates vardı. Yemeğin tadı tuzu yoktu, pek pişmemiş gibiydi, gramajlarıda azdı.. Yoğurt idare eder.. Aldığıma değmedi..",5.0,4.0,1.0,1603890551
Muhteşem lezzet.,10.0,10.0,10.0,1603890551
Tuzlama çorba şahane.,8.0,9.0,10.0,1603890551
Son iki siparişim de sadece 1 adet yarim limon koymustunuz.,9.0,7.0,10.0,1603890552
Elinize sağlık.,10.0,10.0,10.0,1603890552
"Hizli geldi, corba guzeldi ama kokorecler vasat. Patates kizartmasi istedik, kabuklu kalin haşlanmış patates geldi. Bekledigimizin altinda, bidaha siparis vermeyiz muhtemelen.",9.0,9.0,6.0,1603890552
Tek kelimeyle muazzam! Bu kadar iyi paketleme görmedim daha önce ayrıca yemekler çok lezzetliydi.,10.0,10.0,10.0,1603890552
Servis kasik cikmadi. Siparis notuma dikkat edilmedi. Corba eh-işte.,9.0,1.0,6.0,1603890552
Lezzet çok güzel ikramlar tatmin edici.,10.0,10.0,10.0,1603890552
Tavuk şiş söyledik fakat tavuklar pişmemişti onu da geçtim insan bi baharatlardı herhangi bir sos vs yoktu hız ve servis güzeldi biraz daha dikkat edilirse sevinirim yakışmıyor bu restorana böyle yanlışlıklar.,10.0,8.0,5.0,1603890552
Lezzetli ve hizli bir servis için teşekkür ederim harikaydı.,10.0,10.0,10.0,1603890552
"Servis cok yavaş, sanki orda yemek ile sipariş vermek arasında cok fark var baştan sagma, malzemeler eksik daha ne söyleyeyim.",1.0,1.0,1.0,1603890552
Gercekten her seyi harika olan tek işletme benim icin. Cok memnun kalıyorum her seferinde. Lezzet sunum harika. Fırında sütlaç enfesssss.,10.0,10.0,10.0,1603890552
Gayet keyifliydi.,10.0,10.0,10.0,1603890552
"Genellikle memnun kalarak yemek söylüyoruz fakat son bir kaç sipariştir hem geç geliyor hemde etli kuru fasülyede et taneyle sayılmayacak kadar az, ikramlar konusunda 3kişi yemek söylüyoruz 2salata 2ezme 1biber turşusu gönderiyorsunuz bunlar tek kişilik üstelik bu konuda biraz özen gösterebilirsiniz.",6.0,7.0,9.0,1603890552
Nefis.,10.0,10.0,10.0,1603890552
Köftenin kıyması sinirlerle doluydu yiyemedim bile ayrıca ayranın da tarihi geçmişti.,8.0,6.0,1.0,1603890552
Hersey lezzetliydi ancak kaburga dolmasinin yanina pilav yerine sebze koyulmasi tuhaf olmus.,9.0,7.0,10.0,1601260806
Tesekkurler.,10.0,10.0,10.0,1601260806
Ellerinize sağlık!,10.0,10.0,10.0,1601260806
Süper kalite ve lezzet.,10.0,10.0,10.0,1601260806
Sutlaciniz asiri lezzetli ama her siparis verdigimde rutin yasadigim bi sorun var hic bir zaman siparis verip ek ucret odedigim findiklarim gelmiyor fakat sutlacin asiri lezzetli olmasindan dolayi ben bu sutlaci inatla istiyorum ve bari bu sefer gelir diye findik istiyorum artik lutfen gonderin.,10.0,7.0,10.0,1601260806
Şevket-i bostan lezzetliydi.,8.0,8.0,8.0,1601260806
Berbattı. Gece geç saatte söyledim. Porsiyonlar çok az. Adana söyledim iki parça et gelmiş ezme yolda parçalanmış patlamış et kokuyordu pilav çok kötüydü. İlk defa denedim bidaha bedava olsa yemem.,1.0,1.0,1.0,1601260806
"En yoğun ve saatte uzağa siparişim için biraz gecikme oldu, bu yüzden suçlayamam. Şırdan dolması bir efsane diyemem ama fena değildi ve nasıl oldu ise hala sıcaktı. Kokoreç ise bulgur pilavı ile beklentimi karşılamadı, sade dürüm veya ekmek arası bekliyordum, bol amabu sunum yeterince leziz değildi.",9.0,9.0,8.0,1601260806
Bu kadar guzel bir isletme ve calisanlar daha da fazla puan hak ediyorlar... Ellerinize saglik.,10.0,10.0,10.0,1601260806
Hızlı ve guzel geldi tesekkürler.,10.0,10.0,10.0,1601260806
1 saate geldi. Böyle durumlarda keşke restoran bizi arasa da biz peşine düşmesek nerede diye. Gelen yemek inanılmaz vasat. Tavuk kupkuruydu. Bu hizmete ve lezzete fiyat maalesef çok çok fazla. Asla değmez.,1.0,1.0,4.0,1601260806
İnegöl güzeldi teşekkürler.,10.0,9.0,9.0,1601260806
Sevdiğimiz işletme. Bu siparişimizde özellikle işkembe çorbası alıştığımız beykoz lezzetinden biraz uzaktı.,10.0,10.0,8.0,1601260806
Normalde çok beğendiğim bir yer ama son siparişimde gönderdikleri ciğer bayattı.,7.0,1.0,1.0,1601260806
"Başarılı, talihsiz istisnalar hariç tartışılmaz.",10.0,10.0,10.0,1601260806
Inanilmaz bir lezzet elinize emeginize saglikcom tesekkurler.,10.0,10.0,10.0,1601260806
"Bir önceki ıspanak çok iyiydi, bu sefer fazla tuzlu geldi.",8.0,8.0,6.0,1601260807
Gerek hızlılığı olsun gerek hijyene verdikleri önem olsun gayet başarılı lezzetse beklentileri karşılıyor teşekkür beykoz.,9.0,10.0,10.0,1601260807
Şakşuka yenilemeyecek kadar sarımsaklıydı aynı zamanda patlıcanlar tam pişmemişti. Onun dışında inegöl köfte lezzetliydi ama sadece bir tavsiye olarak pilavın bulgur veya pirinç olduğu açıklamalar kısmına yazılabilir.,9.0,9.0,8.0,1601260807
Köroğlu çok iyi derdim. Yanılmışım adamlar çok daha öndeler.,10.0,10.0,10.0,1601260807
Beykoz diye yazılır adam diye okunur.,9.0,8.0,8.0,1601260807
Beyin çorbasını bu çevrede en iyi yapan restaurant.,10.0,10.0,10.0,1601260807
Çok hızlı geldi paketleme muntazam yapılmıştı yolda akma damlama kesinlikle olmamış ve çok lezzetliydi biz çok beğendik.,10.0,10.0,10.0,1601260807
Sürekli sipariş verdiğim ve beğendiğim bir restaurant. Son iki siparisimde etli kuru fasulye söyledim. İçerisinde hiç et yoktu. Sonraki siparislerde daha özen gösterirseniz sevinirim.,9.0,9.0,5.0,1601260807
Ciğer tava pamuk gibi ve çok lezzetli ikramlar da tertemiz ve nizamiydi.,10.0,10.0,10.0,1601260807
Lotus beytepeye sipariş verdik mesafe uzak olmasına rağmen çok hızlı ve sıcak geldi hız lezzet hijyen ikramlar herşey mükemmel teşekkür ederiz.,10.0,10.0,10.0,1601260807
Mükemmel.,10.0,10.0,10.0,1601260807
1 saat boyunca siparişi bekledim geldi ve ekmek yok ekmekle yenilecek büsürü siparişim vardı.. Sinirlendim yemedim ama ürün ambalajları cok güzel.,1.0,1.0,1.0,1601260807
Harikaydı ve doyurucuydu tatlı için de teşekkür ederim.,10.0,10.0,10.0,1601260807
Her şey çok güzeldi geç gelmesine rağmen güzeldi sanırım haftasonu olduğu için yoğunluktan böyle oldu umarım hep bu kalitede devam eder.,6.0,10.0,10.0,1601260807
Paketleme çok özenli. Lezzet çok iyi. Makul zamanda geldi. Teşekkürler.,10.0,10.0,10.0,1601260807
Ciğer şiş servisine patates kızartması koymanıza gerek yok. Daha bol soğan olabilir.,10.0,10.0,10.0,1601260807
Hayatımda yediğim en berbat şırdan rengi çok koyu şekli olması gerektiğinden çok farklıydı kesinlikle tavsiye etmem.,6.0,6.0,1.0,1601260807
Lezzetli.,10.0,10.0,10.0,1601260807
Harikasınız be.,10.0,10.0,10.0,1601260807
"Gerçekten çok iyi bir işletme, notları dikkate alıyorlar. Kaçıncı siparişim bir sorun yaşamadım daha. Böyle devam ederler umarım :).",10.0,10.0,10.0,1601260807
Patlıcan kebap siparişi verdim. Ama bana gelen fotoğraftaki ürün. Restorantı aradım ve ısrarla bunun patlıcanlı kebap olduğunu söyledi. Bence herkes bildiği işi yapsa daha iyi olur. Ama diğer yemeklerin tadı lezzetliydi.,8.0,1.0,7.0,1601260807
Kelle paça çorbası çok güzeldi ve sipariş çok hızlı geldi.,10.0,10.0,10.0,1601260807
Sirke ve sarımsağı ayrı gönderseniz çok daha iyi olurdu onun dışında çorbolar gayet güzeldi teşekkür ederiz.,10.0,10.0,10.0,1601260807
Hep ayni kalite.,9.0,10.0,10.0,1601260807
Çorba unutulmuştu. Aramamın akabinde mümkün olduğunca hızlı telafi ettiler. Lakin gelen çorbanın yanında limon yoktu. Umarım ileride dikkat edilir.,10.0,8.0,9.0,1601260807
2 adet yemek siparis ediyoruz 1 adet salata geliyor. Eger nota yazilmazsa asla dikkat edilmiyor.,8.0,6.0,8.0,1601260807
Elinize sağlık.,10.0,10.0,10.0,1601260807
"Merhaba, daha önce sizden tek kişilik sipariş verdiğimizde büyük temiz sunumu güzel salata göndermiştiniz. Dün verilen 2 kişilik siparişe gelen salata çok az ve çok kötüydü. Yemeklerin yanındaki pilav eskiydi. Kazandibi ve kaymaklı ekmek kadayıfı çok çok kötüydü. Hayal kırıklığı yaşadık.",4.0,3.0,2.0,1601260807
Hersey superdi.,10.0,10.0,10.0,1601260807
Köfteyi kesinlikle denemeniz gerekiyor ama şırdan biraz daha lezzetli olabilirdi.,7.0,9.0,10.0,1601260807
Her şey çok güzeldi ama ıspanak tuzluydu.,10.0,10.0,10.0,1601260807
Teşekkürler.,10.0,10.0,10.0,1601260807
Muhteşem bir şezzet muhteşem bir servis. Diyecek birşey bulamıyorum. Yine sipariş vereceğim.,10.0,10.0,10.0,1601260807
Corba sahaneydi.,10.0,10.0,10.0,1601260807
Tavuk şiş süperdi biraz geç geldi ama yoğunluktan olabilir ve sipariş anından itibaren defalarca arayıp söyledilerkusura bakmayın dedilerkeşke her işletme böyle olsa 1 saat bekledim ama hiç önemli değil.,10.0,10.0,10.0,1601260807
Çok iyi. Teşekkürler.,10.0,10.0,10.0,1601260807
Fiyat fazla :(.,10.0,10.0,10.0,1601260807
Her zaman ki gibi leziz sıcak ve kaliteli.,10.0,10.0,10.0,1601260807
Beytepe bölgesine sipariş verdim ve tahminimden çok hızlı geldi notlarıda okuyorlar hijyen kuralları paketlemeleri sıcaklık lezzet efsane güzelumarım bozulmaz çok memnun kaldık çok teşekkür ediyoruz.,10.0,10.0,10.0,1601260807
İşkembe mumbar ve kelle paçanın böyle lezzetlisini ankara da en son ne zaman yedim içtim hatırlamıyorum. Teşekkür ederiz.,10.0,10.0,10.0,1601260807
Adana biraz fazla tuzluydu.,10.0,10.0,8.0,1601260807
Çok özenilmiş bir servis ve kasik beykoz lezzeti.,9.0,10.0,9.0,1601260807
Kaliteli lezzetli ve çok hızlı teşekkürler.,10.0,10.0,10.0,1601260807
Ciger tava muthisti!,10.0,10.0,10.0,1601260807
Kaliteden ödün vermeyen hizmet.. Özellikle tüm çorbalar sırası ile denenmeli.,10.0,10.0,10.0,1601260807
Aşırı lezzetli.,10.0,10.0,10.0,1601260807
"Çorbalar da ana yemekler de çok lezzetliydi, ikramlar da hallice. Kaliteli hizmet için teşekkür ederiz.",10.0,10.0,10.0,1601260807
Pilavdan ümit ediyorum ki kemik parçası cıkmıştır ilk defa boyle bisey yasiyorum beykozdan gercekten tadim kacti.,1.0,1.0,1.0,1601260807
İncir uyutma her zamanki gibi gayet güzel ama köftelerin kiymasinda bu sefer çok sinir çıktı. Lütfen biraz daha dikkat biliyoruz aslında gayet temiz ve lezzetli bir lokantasiniz. Sizi seviyoruz. :).,10.0,10.0,10.0,1601260807
Aşure söylemiştim ve çok hızlı geldi. Tadı ve kıvamı da güzeldi.,10.0,10.0,10.0,1601260807
Mantisi ucuyor inanilmaz iyi hemde cok sicak geldi asirida hizliydi 25 dk ya hersey gelmisti tebrikler.,10.0,9.0,9.0,1601260807
Bu civarda en iyi çorba yapan yer.,10.0,10.0,10.0,1601260807
Kadayıf ın içine şeker fabrikasını boşlatmışsınız. Beklemiş şekerkenmiş.,10.0,10.0,7.0,1601260807
İnegöl köfteniz güzeldi fakat o tavuk şişe diyecek şey bulamıyorum gerçekten mükemmeldi ellerinize sağlık.,10.0,10.0,10.0,1601260807
Biraz geç geldi ancak uzun zamandır yediğim en harika adanaydı.,7.0,10.0,10.0,1601260807
Corbalari isitip gondermenizi tavsiye ederim. Gelene kadar sogumuslar.,8.0,10.0,7.0,1601260807
Mükelmel diyecek birşey bulamadım harika elinize sağlık artık benim favori yerim burası.,10.0,10.0,10.0,1601260807
Beğenmedim bu puanlar çok yüksek değmez.,1.0,1.0,1.0,1601260807
"İlk defa denedik, her kriter çok sağlamdı. Teşekkür ederiz.",10.0,10.0,10.0,1601260808
"Ciğer ve pirzola sipariş ettik. Pirzola ne kadar iyiyse ciğer o kadar tatsız, kuru ve sinirliydi. Dürümcülerin bile ciğeri daha iyi oluyor. Pirzolayı öneriyorum.",9.0,9.0,7.0,1601260808
Efsaneydi artik inegolu sizden siparis vericez.,10.0,10.0,10.0,1601260808
Özellikle köfte 10 numara 5 yıldız kelle paça ise favorimiz ellerinize sağlık.,10.0,10.0,10.0,1601260808
"Sebzeli koftenin standart bir sunumu olmamasi (bazen kasarli mantarli, bazen izmir köfte gibi) hayatimiza renk katiyor.",10.0,10.0,10.0,1601260808
Super.,10.0,10.0,10.0,1601260808
