comment_text,comment_speed,comment_service,comment_taste,comment_time
Cok güzel hızlı.,10.0,10.0,10.0,1606346061
Teşekkürler.,8.0,10.0,10.0,1606346061
Çiğ gelmişti ve çok salcaliydi hiç yakismadi.,10.0,2.0,1.0,1606346061
Corba cok guzel.,9.0,9.0,8.0,1606259661
Mercimek çorbası efsane.,10.0,10.0,10.0,1606173261
Bıraz dahaki hızlı olabilirsiniz.,9.0,10.0,10.0,1606173261
"Düşünmeden her yemeği yiyebileceğim tertemiz ve çok lezzetli bir restoran. Ellerinize sağlık, teşekkürler.",10.0,10.0,10.0,1606173261
Kotu.,1.0,1.0,1.0,1606086861
İçi bol sıcacıktı ellerinize sağlık.,10.0,10.0,10.0,1606086861
Teşekkürler.,10.0,10.0,10.0,1606086861
Diger subesi ile alakasi yok. Mumbarlar asiri kotuydu.,10.0,9.0,3.0,1606086861
Ben hayatımda bu kadar berbat bir mumbar yemedim birdaha asla kesinlike tavsiye etmiyorum dana mumbarıydı.,1.0,1.0,1.0,1606086861
Pişmemiş oluyor eski lezzeti arıyoruz.,4.0,10.0,6.0,1606000461
"Sırf getirme fiyatları tutsun diye sütlaç istedim onu da dökülmüş olarak getirdiler, çürük çorbasının yanında çeyrek ekmek yolladılar sagolsunlar düzelteceklerini soylediler fakat geç kaldılar biz oranın eski musterisiyiz.",3.0,1.0,5.0,1605914061
Sipariş notuna dikkat hiç dikkat edilmemiş lütfen notlara dikkat edin teşekkürler.,6.0,1.0,10.0,1605914061
Guzel.,9.0,9.0,9.0,1605827661
Geç geldi malesef. Onun dışında lezzetliydi.,6.0,8.0,8.0,1605654861
Oldukça geç geldi. Onun dışında bir sorun yoktu.,5.0,8.0,8.0,1605654861
Cok nefisti ilk defa sıpars verdim ama eminim son olmayack.,10.0,10.0,10.0,1605568461
Paça çorbası istiyorum çürük geliyor diğer kuruköprü ile alakası yok. Paça ile çürüğü ayırt edemeyeceğimimi sandılar.,6.0,1.0,6.0,1605568461
Güzeldi.,9.0,9.0,9.0,1605482061
Çorbalar iyi.,10.0,10.0,10.0,1605395661
Gec geldi ama lezzete diyecek sözüm yok.,5.0,10.0,10.0,1605309261
Enfesssss.,10.0,10.0,10.0,1605309261
Kesinlikle deneyin çok güzeldi.,8.0,9.0,10.0,1605309261
Mükemmel kelimesi az kalır. Çok hızlı geldi. Ağız yakacak sıcaklıktaydı. Lezzeti gelmiş geçmiş yediklerim içinde en güzeliydi. Hatta bugüne kadar restoranın kendisine gidip yediğimden bile güzeldi. Tek geçiyorum. Denemezseniz çok şey kaçırırsınız. Çürük ve tavuk çorba favorim. Mükemmeller.,10.0,10.0,10.0,1605222861
Hep 10 veririm sizin şırdana. Pirinç diriydi. Et sert ve tatsızdı. Daha uzun pişmekle çözülebilir bir sorun belki.,10.0,10.0,3.0,1605222861
Ellerinize sağlık on numaraydı.,10.0,10.0,10.0,1605050062
Daha hızlı olabilirsiniz lezzet mükemmel teşekkürler.,9.0,10.0,10.0,1605050062
Gelen kurye arkadaş ilgiliydi hızda güzel ama lezzet yoktu malesef tuz ayarı sıfır.,10.0,10.0,5.0,1604963662
Humusunuz bu defa olmamıştı üzgünüm.,10.0,10.0,1.0,1604704462
Güzeldi.,9.0,9.0,9.0,1604618062
Kelle paça suyu çok ince ve kötüydü sarımsak sirke sos yanında yoktu eski tadınız yok.,10.0,1.0,1.0,1604618062
Maalesef kotuydu.,5.0,5.0,5.0,1604531662
Içli köfte harika idi ayrıca kurye cemil abiye guleryüzlü olmasından dolayı ayrıca teşekkür ederim..,10.0,10.0,10.0,1604445262
Elinize sağlık.,10.0,10.0,10.0,1604445262
Düzelme yok.,1.0,2.0,1.0,1604358862
Soğuk geliyor.,1.0,1.0,1.0,1604358862
Domates çorbasını sevmedik.,10.0,10.0,7.0,1604358862
Sipariş çok geç geldi ve yemek geldiğinde soğuktu.,1.0,5.0,4.0,1604358862
Hayatımda ilk defa bir ürün yada hizmet ile ilgili yorum yazıyorum. O derece kötü idi. Paylaşmak zorunda hissettim kendimi. Yanlış ve geç gelen sipariş. İşkembe çorbası adı altında gelen ne olduğu belirsiz bir yiyecek. Bir daha asla.,1.0,1.0,1.0,1604186062
Biraz geç geliyor ve biraz rendelenmiş kaşar istemiştim o gelmedi ama olsun tadı çok lezzetli ve paketçi ağabey çok güleryüzlü elinize sağlık.,7.0,7.0,10.0,1604099662
Mumbar işinde prof. Lar :)).,9.0,9.0,9.0,1604013262
Şırdanlarını çok güzeldi.,10.0,10.0,10.0,1603802716
Şırdanları güzel.,10.0,10.0,10.0,1603802716
Hastaydım hızlıca gönderdiler çorbamı ve sıcacık.,10.0,10.0,10.0,1603802716
Qwerty.,10.0,10.0,10.0,1603802716
"Sıcacık geldi ve özenle paketlenmişti, lezzetine diğecek laf yok zaten herşey ortada.",10.0,10.0,10.0,1603802716
Yıldızlı sıfır benden! Tek kelimeyle berbat!,1.0,1.0,1.0,1603802716
Mükemmel.,10.0,10.0,10.0,1603802716
Rezaletti haram olsun yiyemedim.,7.0,1.0,1.0,1603802716
Çok sıcak geldi.,10.0,10.0,10.0,1603802716
Son derece yavaş yamuk yumuk gelmiş ama yine de lezzetli bir paça içtik istediğimiz her şeyi yapmışlardı.,6.0,4.0,9.0,1603802716
Çok geç geldi ve soğuktu.,1.0,8.0,8.0,1603802716
İnsan bir kaşık yollar gece çalışan işçi kesimi söyleyemezmi bu yemeği ki notlarda belirttim.,6.0,1.0,10.0,1603802716
Bu müessenin aynı zamanda müşterisiyim fakat eve siparişte de notum ve isteklerim tam olarak diklate alınmıştı. Teşekkür ediyorum ve başarılarının devamını diliyorum...,9.0,9.0,9.0,1603802716
Mukemmel ama biraz yavas geldi.,5.0,10.0,10.0,1603802717
Tavuk çorbası güzeldi beğendik.,10.0,10.0,10.0,1603802717
Böyle büyük yoğun yıllardır iş yapan müessese sütlaçın zamanı tadı tarihi vs geçmişse müşteriye sunulacak kıvamda değilse göndermeyin bi zahmet sürekli sipariş veririm ve dün akşamki şey sütlaç değildi. Beyaz bi şey geldi ama kesinlikşe sütlaç değildi eğer mekanda olsaydım anında iade ederdim.,10.0,3.0,5.0,1603802717
Teşekkürler.,8.0,8.0,8.0,1603802717
Huzurevlerine sıcak teslimat.,10.0,10.0,10.0,1603802717
Herzaman lezzetli ve güzel.,10.0,10.0,10.0,1603802717
Gelen kurye güleryüzlü idi.,8.0,8.0,7.0,1603802717
Hsnssn.,10.0,10.0,10.0,1603802717
Gut.,7.0,7.0,7.0,1603802717
Daha oncekilerden lezzetsiz geldu.,8.0,8.0,8.0,1603802717
Pirinci lapa geldi turşu kabı batlamıştı.,5.0,1.0,2.0,1603802717
Gayet hızlı güler yüzlü ve sıcak bir servis hizmeti aldım teşekkür ediyorum.,10.0,10.0,10.0,1603802717
Paketçinin baya bır adres sıkıntısı var.,1.0,1.0,10.0,1603802717
Pismemis kıtır kıtır geldi bu nedir ya aldiniz para size haram olsun ya.,1.0,1.0,1.0,1603802717
Teşekkürler.,10.0,10.0,10.0,1603802717
Şırdan boyutu biraz ufakti yaninda limon koymamislar.,9.0,7.0,10.0,1603802717
Çok güzel yapıyorlar. Fakat bu sefer bir değişiklik yapıp tereyağlı mumbar istedim. Normal suluyu tercih etmekte fayda var.,10.0,10.0,10.0,1603802717
Hamileyim gece gece aşerdim hemen gönderdiler 10 numara lezzet ve hizmet.,10.0,10.0,10.0,1603802717
Usta bütün sinirini çorbaya koymuş resmen. Eline sağlık ustam acıya doyurdun bizi.,10.0,10.0,1.0,1601172971
Elinize sağlık.,10.0,10.0,10.0,1601172971
Hepsi kuru ve yanmıştı yemek imkansızdı maalesef çöpe attık hepsini.,7.0,7.0,1.0,1601172971
Notlara dikkat etmiyorlar.,7.0,5.0,6.0,1601172971
Hersey cok lezzetli hizlida geliyor ama notlarda sıkıntı var okumuyorlar.,10.0,5.0,10.0,1601172971
Şırdanlar çok küçüktü tek sorun o.,10.0,10.0,10.0,1601172971
"Şırdanlar oldukça iyi, getiren abi de gayet güleryüzlüydü.",9.0,9.0,9.0,1601172971
Eksik gelen ürün vardı gönderdiler. İlgili kibarlardı tekrar tercih edilebilir.,9.0,8.0,9.0,1601172971
Hem telefonda ilgilendiler hem de adres için çok ilgilendirler çok anlayışlı bir işletme ilginiz için teşekkür ederiz herkese tavsiye ederim.,10.0,10.0,10.0,1601172971
Sicak hizlimükemmel servis.,10.0,10.0,10.0,1601172971
İdare eder.,5.0,5.0,5.0,1601172971
Hızlı lezzetliydi.,10.0,10.0,10.0,1601172971
Paça birbirine girmiş streçle bulamaç gibi. Olmuştu.,1.0,1.0,1.0,1601172971
Paçası güzeldi.,10.0,10.0,10.0,1601172971
Güzeldi.,10.0,10.0,10.0,1601172971
"Çekinerek verdim siparişi önce ama, şırdan paça mumbar çok iyiydi. Elinize sağlık.",10.0,10.0,10.0,1601172971
Mumbar iyi diğer yerlere göre.,7.0,7.0,7.0,1601172971
Güzel.,8.0,8.0,8.0,1601172971
"Cacık yüzüyordu salatalığı yoğurdun içine koyup geri çekmişlerdi yüzüyordu resmen içerisinde, kuru pilav güzeldi ama tuz vs eksikti ve aşırı derecede yavaş geldi 1 saatten fazla sürdü gelmesi bir daha kesinlikle buradan siparş vermem.",1.0,1.0,7.0,1601172971
Berbatti.,1.0,1.0,1.0,1601172971
Çürük soğuk tu.,5.0,5.0,5.0,1601172971
Lezzetli temiz hizli.,10.0,10.0,10.0,1601172971
Siparişimin ödemesini yapmama rağmen çorba gelmedi. Hasta oldugum için çorba istemiştim.,6.0,1.0,7.0,1601172971
Az bişey ekmek konulmuş. Kaşık gönderilmemiş. Ayrıca sarımsaklı istediğim halde sarımsak dökülmemişti.,10.0,6.0,8.0,1601172971
Sicak ve hizli idi.,10.0,10.0,10.0,1601172971
10 numaraydı.. Elinize sağlık.,9.0,9.0,10.0,1601172971
Güzel.,9.0,9.0,9.0,1601172971
Hizli lezzetli tavsiye ederim.,10.0,10.0,10.0,1601172971
"Çok hızlı geldi, hem tereyağlı mumbar hem de şırdan çok lezzetliydi.",10.0,10.0,10.0,1601172971
Çok iyi elinize sağlık.,10.0,10.0,10.0,1601172971
Lezzetli.,10.0,8.0,9.0,1601172971
Çürük çorbanın icindeki etler erimiş ve kokuyordu.,7.0,5.0,1.0,1601172971
Porsiyonlar biraz küçük.,8.0,8.0,8.0,1601172971
Yanında kaşık yoktu geç geldi soğuktu işyerinde olduğum için kaşık yoktu çöpe attım.,1.0,1.0,1.0,1601172971
Tuzlama kötüydü şırdan güzeldi.,7.0,8.0,6.0,1601172971
"Kelle istedim, susuz çürük ve beyin karıştırıp göndermişler... Ve ayrıca 2 saatte geldi. Söyleyeceklerim bu kadar.",1.0,1.0,1.0,1601172971
İdare eder...,1.0,6.0,6.0,1601172971
Humusu harikaydı:).,10.0,10.0,10.0,1601172972
Pirinç pilavı yerine bulgur geldi.,7.0,3.0,3.0,1601172972
Sizin samimiyetinize ölürüm be. Çorba da efsane.,10.0,10.0,10.0,1601172972
Şırdanlar çok lezzetliydi ellerinize sağlık.,10.0,10.0,10.0,1601172972
Sıcacık geldi lezzetliydi.,10.0,10.0,10.0,1601172972
Yedigim en güzel şırdandı hem hızlı hem lezzetliydi helal olsun.,10.0,10.0,10.0,1601172972
Şırdanları büyük istedim. Küçük göndermişler. Sipariş 1 saat sonra geldi. Ekmek azdı. Notlara dikkat ederseniz kazancınız daha da artar diye düşünüyorum.,5.0,6.0,6.0,1598543226
Hizli sicak ve guler yuzlu kurye tskler.,10.0,10.0,10.0,1598543226
Sipariş 1 saat 40 dakka sonra geldi.,1.0,1.0,4.0,1598543226
Hızlıydı sadece ekmek tüm bir şekilde geldi ve çok kuruydu.,10.0,10.0,10.0,1598543226
Adanada yendiğim en en en en en kötü şırdandı içi donuktu dünden kalanımı gönderdiler ne hiç teze değildi küçücüktü 10 tane anca doyurur kesinlikle bu yeri tavsiye etmiyorum.,1.0,1.0,1.0,1598543226
Ekmegi fazla istememe ragmen yarim parca geldi uzdun kuruköprü.,7.0,7.0,7.0,1598543226
Çorbalar gayet iyi.,10.0,10.0,10.0,1598543226
Şalgam gelmedi.,8.0,5.0,7.0,1598543226
Mükemmel ötesi gerçekten çok güzeldi ellerinize sağlık.,10.0,10.0,10.0,1598543226
Çorbalar 10 numara sadece kaşar istemiştim o gelmedi ama gud.,9.0,6.0,10.0,1598543226
Parasını alıp içeceği vermemek sonrada getirmemek gece bilmediğiniz bir çorbacıdan sipariş verirseniz başınıza gelecek şey budur. Hakkımı helal etmiyorum.,4.0,1.0,7.0,1598543226
Biraz ufacık gecikti ama lezzeten dolayı gecikmeyi görmezden geliyoruz ellerinize sağlık ustam hayırlı bol kazançlar.,10.0,10.0,10.0,1598543226
Sirdan istedim harikaydi tsk ederim.,10.0,10.0,10.0,1598543226
Çok iyi.,10.0,10.0,10.0,1598543226
Acı seven var sevmeyen var... Şırdanlar acıydı... Bırakın kim nasıl seviyorsa öle yesin...,5.0,5.0,5.0,1598543227
10 numara 5 yıldız bir şırdan dolmasıydı 1 adet ile bile doyurucu pirinçler çok güzel pişmişti sadece tek kusuru çok geç geldi.,10.0,10.0,10.0,1598543227
Çürük değişikti içli köfte efsane.,10.0,10.0,8.0,1598543227
"Harika bir işletme. Siparişimde bir hata oldu aradım bilgilendirdim, hem kısa sürede doğru siparişimi getirdiler hem de yanlış gönderilen siparişi ikram ettiler ve içli köfte, humus çok lezzetliydi. Teşekkür ediyorum.",10.0,10.0,10.0,1598543227
Hiz ve lezzet cok iyi.,10.0,10.0,10.0,1598543227
Arkadaşlar kesinlikle şırdan ve mumbar söylemeyin! O kadar küçük geldi ki tek lokmada bitti. Ayıp gerçekten çok ayıp.,7.0,1.0,1.0,1598543227
"Sipariş notu hiç dikkate alınmamıştı, yemek gelirken sallana sallana bulamaç gibi olmuştu ve suyu tüm pakete akmış herşeye bulaşmıştı. Adeta kendi kendilerini sabote etmişlerdi adamlar, oysa lokantada yediğimde memnun kaldığım bir müesseseydi...",6.0,1.0,1.0,1598543227
"Çok güzel, sıcak, düzgün geliyor, tadı zaten efsane.",10.0,10.0,10.0,1598543227
Sadece baharat eksik lezzet mükemmel.,10.0,8.0,10.0,1598543227
"Süperdi, elinize ssğlık...",10.0,10.0,10.0,1598543227
Güzeldi.,10.0,7.0,7.0,1598543227
Yemeği eksik gönderip tam parası alıp sonrada eksik olanı göndermediler.,1.0,1.0,1.0,1598543227
"3 şırdanın her birinin içi bir çeşitti, iyi pişsin yazdığım halde çiğdi, her zaman zevkle yerdik, verdiğim paraya yazık oldu.",10.0,7.0,1.0,1598543227
Tereyağlı mumbar çok guzel.,10.0,10.0,10.0,1598543227
Çok geç gelmesi dışında herşey iyiydi.,1.0,8.0,9.0,1598543227
"Gayet hızlı geldi görece uzak olmama rağmen, çok iyi paketlenmişti hiç dökülmemişti ve sıcaktı. Lezzeti zaten biliyorsunuz. (mercimek ve şırdan).",10.0,10.0,10.0,1598543227
Notlar hiç dikkate alınmıyor. Altı üstü paçanın yanında soğan istemiştik.,7.0,1.0,7.0,1598543227
Güzel.,10.0,10.0,10.0,1598543227
Şırdan istedim 1 saatte ancak geldi. Şırdan tatsiz tuzsuz iyi pismemisdi. Ayrica plastik bicak ve catal takimi birakilmamisti. Yani mekanda yemek daha iyi.,1.0,1.0,1.0,1598543227
Mumbarda destan yazmissiniz teselkurler. Corba soguk geldi. Lakin harbi kaliteli corbaniz varmiski sogukta guzeldi. Ellerinize saglik.,10.0,10.0,10.0,1598543227
Efsane.,10.0,10.0,10.0,1598543227
Her şey çok iyiydi. Lezzet güzel. Kuryede gayet beyefendi biriydi.,10.0,10.0,10.0,1598543227
"30 yıldır adana da her gün şırdan yerim nerdeyse, hayatımda yediğim en en kötü şırdan burda berbat bi tat.",7.0,5.0,1.0,1598543227
Cok kötü idi. Her halde nıtlaro olumuyorlar. En son onu gördüm bu yemek sepetinin suçu ama.,1.0,1.0,1.0,1598543227
İyi.,8.0,8.0,8.0,1598543227
Diğer şubenizle hiç bir alakası yok. Nota ekmeği bol gönderin yazdığım halde yarım ekmek geldi. Diğer şubenizde içine kaşıkbile koydukları oluyor sizde ise ıslak mendil dahi yok gerçekten çok üzücü. Aynı zamanda mercimek çorbanızın lezzeti de iyi değildi sabaha karşı içtim öğlene kadar midem rahatsızdı.,9.0,3.0,8.0,1598543227
"Yedigim en kotu şıdandı, mumbardi.",1.0,1.0,1.0,1598543227
Sütlaç dedik kazandibi getirmişsiniz nasıl işletmesiniz siz yoksa telefon açın söyleyin ben kazandibi yemek zorunda değilim diğer söylediğim yemekler de (içli köfte ve humus) alüminyüm tabak bükülü şekilde geldi serviste çok berbatsınız.,8.0,1.0,8.0,1598543227
Evime 5 dklık mesafede olmasına rağmen tam 45 dkda geldi. Mumbar söylemiştim pişmemişti. Kuru ekmek yemek zorunda kaldım.,1.0,1.0,1.0,1598543227
Mumbar ve şırdanın taneleri aşırı sertti.,8.0,2.0,1.0,1598543228
Güzel.,10.0,10.0,10.0,1598543228
Fiyatlar çok artmış fakat lezzet iyiydi.,9.0,9.0,9.0,1598543228
Adana standartlarında zayıf bir daha sipariş vermem.,8.0,7.0,6.0,1598543228
Gecen aldik begendik bu kez cok gec geldi mumbarinda sirdaninda pirincleri asiri derecede diriydi yiyemedik malesef.,1.0,7.0,3.0,1595913482
Adananın en küçük şırdanını satıyolar. Parmak kadar.,6.0,4.0,7.0,1595913482
Cok gec geldi 90dkda geldi. Bunun disinda lezzet sahane.,5.0,9.0,9.0,1595913482
Efsane sıcak ve aşırı güzeldi.,10.0,10.0,10.0,1595913482
Daha ileri.,9.0,9.0,9.0,1595913482
Hızlı ve sıcak geldi teşekkür ederim.,10.0,10.0,10.0,1595913482
Lezzetli.,7.0,10.0,10.0,1595913482
Güzrl.,8.0,9.0,9.0,1595913482
Ekmek ve turşu çok az geldi. Yemekler dökülmüştü. İnşallah bir daha ki sefere daha güzel olur.,10.0,3.0,10.0,1595913482
Good.,9.0,9.0,9.0,1595913482
Lezzete bir şey demiyeceğim güzeldi ama hız çok kötüydü.,1.0,8.0,10.0,1595913482
Eyvallah :).,10.0,10.0,10.0,1595913482
Kuru fasulye pilav söylemiştim yanında ise cacık pilav yoktu arayıp belirttiler problem olmadığını söyledim ama yinede ücret aynı kesildi.. Umarım karışıklık olmuştur yoksa pek hoş değil bence.,9.0,9.0,10.0,1595913482
Su gibiydi.,7.0,7.0,2.0,1595913482
İleri tarihli sipariş verdiğinizde sizin istediğiniz saat değilde onların keyfinin yettiği saatte getiriyorlar. Mesela ben sabah 8:30 a sipariş vermiştim ama sağolsunlar 7:45 te getirdiler. Ben zaten sabah saat 4 te uyumuşum 15 dk bile önemli benim için 45 dk erken getirmekte ne bileyim...,8.0,5.0,8.0,1595913482
Pişmemişti berbattı telafi etmelerini bekledik ama etmediler böyle restaurantların yemeksepetinde bulunmaması gerekiyor paramızda midemizde boşa gitti.,1.0,1.0,1.0,1595913482
Güzel.,9.0,9.0,9.0,1595913482
Nefis ve hizli sicak.,10.0,10.0,10.0,1595913482
Kurye çok kibar.,10.0,10.0,10.0,1595913482
Şırdan pişmemiş çürük yarım dolu tadı yok yediğim en kötü çürüktü.,10.0,1.0,1.0,1595913482
Umarım notları okurlar bir gün.,10.0,1.0,1.0,1595913483
Notlar okunmuyor.,1.0,1.0,1.0,1595913483
Şırdanları gece 5 te gelmesine rağmen lezzetliydi.,9.0,9.0,9.0,1595913483
Mercimek çorbası çok iyi emeğinize sağlık hayırlı işler.,10.0,10.0,10.0,1595913483
"Menüye kızarmış tavuk yazmışlar. Patatesli, domatesli tavuk yemeği geldi. Bu kızarmış tavuk değil diyorum, yooo fırında pişti diyorlar. Sıfır. Bir daha asla sipariş vermem.",1.0,1.0,1.0,1595913483
Mumbar istedik resmen pirinçler çiğ idi.. Servis desen hatsafada bütün suyu poşetin içindeydi.. İlk ve son siparişim.,10.0,1.0,1.0,1595913483
Aldığınız parayı hak etmediniz gelen cacık insan getirmeden tadına bakar 1 haftalık cacık ekşilikten yenmiyor şırdan desen dişimin kovugunu doşdurmadı özelliklemi en küçüğünü seçtiniz bunları görünce çorbayı içmeye korktum.,1.0,1.0,1.0,1595913483
2-3 sene öncesinin tadı yok.,8.0,8.0,8.0,1595913483
Sipariş notlarına dikkat edilmiyorçürük beyin karışık söyledim sadece çürük geldi menüde yoktu not kısmında karışık olmasını rica ettim ama 2 satırlık not ne yazık ki okunmuyor onun dışında hız lezzet vs gayet güzel başarılı.,8.0,7.0,8.0,1595913483
Harika lezzet.,10.0,10.0,10.0,1595913483
Fena deil.,10.0,10.0,10.0,1595913483
Mercimek çorbası çok iyi mumbarın biraz dışı ve içi sertti ama olsun önemli değil elinize sağlık.,10.0,10.0,8.0,1595913483
Sütlaç paket servisi yaparken biraz daha özenli paketlenirse mükemmel olur lezzet servis hız mükemmel.,9.0,9.0,9.0,1595913483
Cok hızlı servis.,10.0,10.0,10.0,1595913483
Ekmek göndermediniz.,8.0,8.0,10.0,1595913483
Mercimek çorbanız bir harika ellerinize sağlık.,10.0,10.0,10.0,1595913483
Hızlı ve lezzetliydi.,9.0,10.0,10.0,1595913483
Paketçi abi adamın dibiydi.,10.0,2.0,1.0,1593283737
İyiydi çorba ve taze ekmeğin uyumu.,10.0,10.0,10.0,1593283737
Mukemmel lezzet ve sunum. Sipariş tam vaktinde geldi.,10.0,10.0,10.0,1593283737
Gecenin 4 ünde söyledim ikram için teşekürler 10 numara.,10.0,10.0,10.0,1593283737
Yani iyi.,8.0,8.0,8.0,1593283737
İçebilirsiniz mercimek fena sayılmaz.,8.0,8.0,8.0,1593283737
Fena değil yani iyi.,8.0,8.0,8.0,1593283737
Fena değil.,8.0,8.0,8.0,1593283737
Gayet iyi.,10.0,10.0,10.0,1593283737
Gecenin 4ünde yüzüncüyıla ışık hızında geldi. Şırdan ve mumbar çok güzeldi. Elinize sağlık.,10.0,10.0,10.0,1593283737
Çok yavaş geldi ve de eskisi kadar güzel değildi.,5.0,5.0,5.0,1593283737
