comment_text,comment_speed,comment_service,comment_taste,comment_time
Adamlar yapiyor.,10.0,10.0,10.0,1606503212
Oldukça lezzetli ve sıcak sunum.,10.0,10.0,10.0,1606503212
"Elinize sağlık, hayırlı işler.",10.0,10.0,10.0,1606416812
Köfte rahatsız edecek şekilde tuzluydu.,10.0,9.0,6.0,1606330412
Guzel.,10.0,10.0,10.0,1606330412
Kurye maske kullansın!,6.0,10.0,9.0,1606244012
Kuryeniz size yakışmıyor.,1.0,1.0,5.0,1606157612
Çok iyi.,10.0,10.0,10.0,1606157612
Ciğer çok güzeldi ellerinize sağlık.,10.0,10.0,10.0,1606071212
Kelle paça çorbanın içinde tane yok denecek kadar azdı. Lezzet diye birşey yoktu.,5.0,1.0,1.0,1606071212
"Kelle paça harika, çok sıcak geldi, keşke biraz turşu da olsaydı yanında.",10.0,10.0,10.0,1606071212
"Notları dikkate alın artık lütfen. Haricinde hiç bir sorun yok, uzun zamandır sipariş veriyorum.",10.0,9.0,10.0,1605898412
Güzeldi sevdik.,8.0,8.0,9.0,1605898412
Teşekkürler.,10.0,10.0,10.0,1605812012
Özenle paketlenmiş harika bir çorbaydı ellerinize sağlık.,10.0,10.0,10.0,1605812012
Harika. Özellikle kelle pacayı öneririm.,10.0,10.0,10.0,1605812012
Acı istedim ama acı olmamıştı canınız sağolsun emek verilen birşeye düşük puan verilmez ellerinize sağlık...,10.0,10.0,10.0,1605812012
Üçüncü siparişimiz. Bu da harikaydı.,10.0,10.0,10.0,1605725612
Et pişmemiş.,8.0,8.0,5.0,1605725612
Mercimek çorbası çok güzeldi. Fakat tavuk şiş dürümu hiç beğenmedim. Tavuk sis için buradaki güzel yorumlara da şaşırıyorum açıkçası.,8.0,8.0,6.0,1605725612
Tesekkurler.,10.0,10.0,10.0,1605725612
Tavuk şiş çok güzeldi ama köftesine aynı şeyi diyemiycegim çok tuzluydu aynı şekilde mezeleri de öyle.,8.0,8.0,7.0,1605725612
Kelle paça çorbası söyledim ancak aşırı derece de duru geldi.,10.0,9.0,5.0,1605639212
Her zaman leziz ve güvenilirler 10 numara.,10.0,10.0,10.0,1605639212
Hızlı servis için teşekkürler.,10.0,10.0,10.0,1605552812
Harikaaaa.,10.0,10.0,10.0,1605552812
Çok süper değil ama yenilmicek kadarda değil.,8.0,6.0,6.0,1605466412
İyi.,8.0,8.0,8.0,1605466412
"Elinize sağlık, hayırlı işler.",10.0,10.0,10.0,1605380012
Gerçekten çok iyi bir mekan içtiğim en iyi çorba diyebilirim ekmekleri de gayet yumuşak kuryeleri gayet efendi güler yüzlü daha ne istenebilir ki?,10.0,10.0,10.0,1605380012
Çorba cidden lezzetliydi.,10.0,10.0,10.0,1605380013
Güzel.,10.0,10.0,8.0,1605293613
Sadece on dakika geç geldi ama bu mesafeye rağmen çorbanın bu denli sıcak olması muazzam bir başarı. Ellerinize sağlık.,10.0,10.0,10.0,1605293613
Tavuk şiş dürümde tavuğun hangi etini kullanıyorsunuz. Hem çok lezzetliydi dışı iyi pişmiş sevdiğim gibi içi de suluydu. Elinize sağlık. Denildiği gibi 170 180 gram vardı arkadaşlar kesinlikle bol ve doyurucu.,10.0,10.0,10.0,1605293613
"Biraz soğuk gelmişti yemek. Yoğunluktan olabilir, dürümün lavaşı baya baya el yapımı kalın lavaşlardandı. Başarılı :).",8.0,8.0,9.0,1605207213
Guzel bir işletme hızlı lezzetli porsiyon lar biraz daha fazla olabilir.,10.0,10.0,10.0,1605207213
Berbat.,1.0,1.0,1.0,1605207213
Kuru fasulye efsane gaz yapıyor pişirme tekniği değişmeli.,9.0,9.0,6.0,1605120813
Kuryeniz adam gibi adam sakın kaybetmeyin lezzete diyecek yok zaten uzak olmama ragmen sıcak ve hızlı gelmesi başarılı iyi çalışmalar.,10.0,10.0,10.0,1605120813
"Çok hızlı ve sıcacık geldi kelle paca corbası, tadı da harikaydı kesinlikle öneririm.",10.0,10.0,10.0,1605034413
Her şey çok güzeldi.,10.0,10.0,10.0,1605034413
Yemekler soğumuş bi şekilde geldi 1saati geçmiş şekilde.,1.0,3.0,5.0,1605034413
Harika.,10.0,10.0,10.0,1604948013
Sosuna kadar göndermişsiniz helal size.,10.0,10.0,10.0,1604948013
Elinize sağlık.,10.0,10.0,10.0,1604948013
Çok iyi.,10.0,10.0,10.0,1604948013
Herşey süperdi kesinlikle tavsiye ediyorum.,10.0,10.0,10.0,1604861613
Gece gece adana dürüm çok iyi gitti küçük bir yer için gayet lezzetliydi. Yanında verilen mütebbeli de sevdim elinize sağlık.,10.0,10.0,10.0,1604775213
İyi.,8.0,8.0,8.0,1604775213
Güzeldii.,10.0,10.0,10.0,1604688813
Normsl ıcılır.,8.0,8.0,8.0,1604602413
Benci fiyatı biraz abartı 15 lira olsa daha iyi olurdu hakkini vermek icin 10 puan veriyorum ama bi daha almam cunku pahalı.,10.0,10.0,10.0,1604602413
Teşekkürler.,10.0,10.0,10.0,1604602413
Hersey cok guzeldu tavuk sis ve corba fakat tek sikinti ikiside asiri tuzluydu bence bukadar atmamalisiniz sonucta tuz ayarlanabilir. (yemekleri tuzlu seven biriyim fakat bana bile tuzlu geldi).,10.0,10.0,9.0,1604602413
Kelle paça fena değildi. Elinize sağlık.,10.0,10.0,8.0,1604516013
Hızıyla lezzetiyle servisiyle herşey mükemmeldi. Tesekkürler.,10.0,10.0,10.0,1604516013
Teşekkürler.,10.0,10.0,10.0,1604516013
"Yediğim en güzel tavuk şişti, tek kelimeyle mükemmeldi. Çok teşekkür ederim elinize sağlık.",10.0,10.0,10.0,1604516013
Gayet doyurucu ve lezzetli.,8.0,10.0,10.0,1604429613
Dürüm kuruydu bi tık daha sulu olsa daha lezzetli olurdu onun dışında gayet güzel.,10.0,10.0,8.0,1604343213
Adanaya puanim 6 falan ama ezmeniz cok iyi ve paketcinizde cok iyi o yuzden 7 vercem ama adana cok da iyi degil.,10.0,7.0,7.0,1604256814
Çorbalı ızgara köfte menü söyledim köfte gelmedi :) halen şaşkınım ama lezzete diyecek yok.,8.0,8.0,10.0,1604170414
Efsane der susarım.,10.0,10.0,10.0,1604170414
Ekmeği çok güzeldi.,8.0,8.0,8.0,1604084014
Çok beğendim.,9.0,9.0,10.0,1604084014
Köfte ekmek herzamanki gibi harikaydı...,10.0,10.0,10.0,1603997614
Tatlısı ve ekmek arası köftesi enfesti ellerinize sağlık. Zamanında geldi. Fiyatlarda gayet uygun.,10.0,10.0,10.0,1603997614
On numara lezzet tavuk şiş harika.,10.0,10.0,10.0,1603911214
Kalite 10 numara servis hızlı.,10.0,10.0,10.0,1603911214
Burayı çok seviyorum elemanlar çok güler yüzlü içeri alıp birlikte yiyesim geliyor.,10.0,10.0,10.0,1603911214
Kaşık çatalları ambalajlı servis olursa daha iyi olacağını düşünüyorum özellikle bu kritik pandemi döneminde.,9.0,8.0,8.0,1603873468
Leziz.,10.0,10.0,10.0,1603873468
Oldukça güzel ve lezzetli ama dürüm bir tık kuru kalıyor.,9.0,9.0,8.0,1603873468
Hayırlı işler.,10.0,10.0,10.0,1603873468
"Adana kebabın lezzeti çok iyi, mezeler de gayet iyi ama bulgur pilavı boş suda haşlanmış gibiydi.",10.0,10.0,10.0,1603873468
Biraz yavaş ti.,7.0,8.0,9.0,1603873468
İşinin hakkını verenlere selam olsun.,10.0,10.0,10.0,1603873468
Guzeldi.,10.0,8.0,8.0,1603873468
Lezzetine diyecek bir şey yok lakin notları dikkate almamamız olmadı işkembe az taneli dedim bol taneli geldi dürüm köfte dedim servis geldi.,10.0,5.0,9.0,1603873468
Harika bir kuzu şişti işte kuzu kuzu geldim.,10.0,10.0,10.0,1603873468
Çorbalarına bayılıyorum her seferinde.,10.0,10.0,10.0,1603873468
Ezme hariç her şey güzeldi teşekkürler.,10.0,10.0,10.0,1603873468
Köfte dürüm söyledik başarılıydı. Elinize sağlık.,10.0,10.0,10.0,1603873468
"Elinize sağlık, hayırlı işler.",10.0,10.0,10.0,1603873468
Adanası güzel ve doyurucuydu.,9.0,9.0,9.0,1603873468
Lezzet güzeldi.,9.0,9.0,9.0,1603873468
Türk mutfağında kuru fasülye pilav bilindik bir yemektir lakin bulgur pilavı değil pirinç pilavı bilinir ve iyi gider oraya kuru fasülye pilav yazdığınız zaman insanın aklına pirinç geliyor haliyle böyle şeylere dikkat edin lütfen en nefret ettiğim pilavı önümde görünce aç kaldım sayenizde...,7.0,6.0,1.0,1603873468
Harika bir seçim oldu ellerinize sağlık olsun.,10.0,10.0,10.0,1603873468
Güzeldi.,9.0,10.0,10.0,1603873468
Tavuk pirzola istedik köfte göndermişler.,7.0,10.0,8.0,1603873468
Hız ve lezzet konusunda diyecek lafım yok. Sadece mezeleri bir tık artırılabilir.,10.0,9.0,9.0,1603873468
"Elinize sağlık, hayırlı işler.",10.0,10.0,10.0,1603873468
"Ekmek arası menünün gelmesi çok iyi olmuş. Fazlasıyla doyurucu. Ayrıca kurye abimle güzel kaynatıyoruz, gayet eğlenceli adam :).",10.0,10.0,10.0,1603873468
Kurye ye istediğim para üstünü söyleyince bana ters davrandı.,10.0,6.0,10.0,1603873468
Enfesti tavsiye ederim.,10.0,10.0,10.0,1603873468
Keşke tüm kuryeler ve mekanlar böyle hizmet verse.,9.0,10.0,10.0,1603873468
Tavuk şiş ve adana lezzetli tatlı efsane.,10.0,10.0,10.0,1603873468
Süper.,10.0,10.0,10.0,1603873468
"Gerek yemeksepetinden, gerek telefonla aradığım her siparişimde memnun kaldım. Bir adanalı olarak, tüm kebaplarını tavsiye ediyorum.",10.0,10.0,10.0,1603873468
"Gayet iyi, çok dışarıdan söylemem ama söylediğimde de yıllardır değişmeyen adresimsiniz..",10.0,10.0,10.0,1603873468
Başarılıııı.,10.0,10.0,10.0,1603873468
Mükemmel.,10.0,10.0,10.0,1603873468
"Tavuk şiş dürüm güzeldi, elinize sağlık, notumu dikkate aldığınız içinde ayrıca teşekkür ederim.",9.0,9.0,9.0,1603873468
Tavuk şişiniz için her şeyi yapabilirim o kadar lezzetli kii hele o mutebbel.,10.0,10.0,10.0,1603873468
Hız ve servis iyiydi ama lezzet dede yanında gelen meze çok ekşi ve bozulmuştu.,8.0,10.0,7.0,1603873468
Post calismiyo denildi bende de nakit yoktu. Arkadasimdan rica ettim. Ama onda da olmayabilirdi.,1.0,1.0,1.0,1603873468
Sipariş eksik geldi ayran yok.,8.0,3.0,9.0,1603873468
Enfes.,10.0,10.0,10.0,1603873468
Ben gayet başarılı buldum arada söylerim.,10.0,10.0,10.0,1603873468
Efso efso.,10.0,10.0,10.0,1603873468
Harika ötesi.,10.0,10.0,10.0,1603873468
Çok iyiydi.,9.0,9.0,9.0,1603873468
Her zaman şahanee.,10.0,10.0,10.0,1603873468
İşkembe çorbası yağı biraz fazla ama güzel.,9.0,10.0,7.0,1603873468
Çok kısa bir surede teslim edildi elinize sağlık temassız teslimat istediğim için kapıya bırakıp sadece kapıyı çaldılar buna dikkat ettikleri için ayrıca tesekkur ederim.,10.0,10.0,10.0,1603873468
Elinize sağlık gerçekten harikaydı işkembe çorbası.,10.0,10.0,10.0,1603873468
Tavuk şiş dürüm menüyü beğendim.,9.0,10.0,9.0,1603873468
Yedigim en iyi kelle parca corbasiydi ayrica sicak gelmesi beni benden aldı.,10.0,10.0,10.0,1603873468
"Çorbada bir dünya markası. Elinize sağlık, magmada mı ısıtıyorsunuz çorbayı içmek için yarım saat bekledim. Mükemmel.",10.0,10.0,10.0,1603873468
"Köfte lezzetliydi, fakat kırık gelen çatalla yemek biraz zor oldu. İyi çalışmalar.",9.0,8.0,8.0,1603873468
Nota dikkat ettiğiniz için teşekkürler bir de limon eklenebilir bence :).,10.0,10.0,10.0,1603873469
"Her şey çok güzeldi, elinize sağlık.",9.0,9.0,9.0,1603873469
Tavuk şiş çok lezzetli.,10.0,10.0,10.0,1603873469
Tavuk şiş dürüm muhtesem.,10.0,10.0,10.0,1603873469
Kelle paça bir harikaydı ama ekstra ekmek istediğimiz halde yollamadilar.,9.0,7.0,10.0,1603873469
Güzeldi.,9.0,9.0,9.0,1603873469
Mercimek çorbası aldım ortalamaydı.,10.0,10.0,8.0,1603873469
Hızlı ve güzel.,8.0,8.0,8.0,1603873469
Önceden daha güzeldi.,7.0,7.0,7.0,1603873469
Adana kebabı harika servisi hızı herşeyiyle on numara bı lokanta.,10.0,10.0,10.0,1603873469
Ikram tatlınız süper.,10.0,10.0,10.0,1603873469
Kuzu şiş efsaneydi kesinlikle tavsiye ederim çok doyurucu ve tadı mukemmeldi..,10.0,10.0,10.0,1603873469
"Lezzete asla bir şey diyemem çok güzel bir yemek yedim. Akşam saatlerinde verdiğim siparişlerde gelen kurye arkadaşlara mutlaka bahşiş bırakırım, gelen arkadaşa teşekkür ederim diyerek bahşişi verecektim suratıma bakmadan tek kelime etmeden sinirli bir şekilde döndü gitti, anlam veremedim.",7.0,1.0,9.0,1603873469
Servis elemanınız yüzünden bir daha sipariş vermeyi düşünmüyorum. Özünde iyi bir insan olabilir ancak müşterilere davranışı oldukça kötü.,7.0,6.0,7.0,1603873469
Kurye seçiminiz oldukça kötü. Bu kadar lakayit birisi olamaz diyordum ki varmış :/.,7.0,7.0,8.0,1603873469
Elinize sağlık.,10.0,10.0,10.0,1603873469
İi.,10.0,10.0,10.0,1603873469
Burayla ilk siparişim birkaç gün önce köfte ekmekle başladı. Açıkçası çok beğendim lezzetli ve sıcaktı. Önceki gün memnun kalınca bugün adana sipariş verdim ancak sipariş hızlı değildi. Adana pek sıcak değildi ve ayranımı sonradan getirdiler. Biraz daha hızlı olunursa ve sıcak getirirlerse güzel olur.,7.0,6.0,6.0,1603873469
İdeal dürüm.,10.0,10.0,10.0,1603873469
Gereksizce samimiyet kurmaya çalışan kuryeniz ve siparişimi eksik gönderdiğiniz için bundan sonra sipariş için tercih etmeyeceğim.,1.0,1.0,1.0,1603873469
"Belirtilen sürede, sıcak geldi. Adana dürüm lezzetliydi, teşekkürler.",8.0,9.0,10.0,1603873469
Etler lezzetliydi. Servisi beğendim. Yanında meze göndermeleri hoş olmuş.,9.0,9.0,9.0,1603873469
Kuzu çöp şiş lezzetliydi ellerinize sağlık.,7.0,8.0,9.0,1603873469
Çok lezzetli tavuk şişiniz.,10.0,10.0,10.0,1603873469
"Gayet lezzetliydi, elinize sağlık.",10.0,10.0,10.0,1603873469
Her zamanki gibi tavuk şiş leziz.,7.0,9.0,10.0,1603873469
Ekmek arası köfte harikaydı temiz olduğu görüntüsünden paketlenmesinden belliydi teşekkürler herşey için.,10.0,10.0,10.0,1603873469
Lezzetli.,10.0,10.0,10.0,1603873469
Çorba ve adana dürüm menü sipariş verdim herşey çok güzeldi tavsiye ederim notları dikkate alıp sipariş gelmeden aradığı için kurye arkadaşada teşekkür ederim iyi çalışmalar.,10.0,10.0,10.0,1603873469
"Adana dürüm çok lezzetli ve doyurucu, adresim yanlış olmasına rağmen kuryeniz başta olmak üzere nezaketiniz için de teşekkür ederim.",10.0,10.0,10.0,1603873469
Bayılıyorum buraya.,10.0,10.0,10.0,1603873470
Leziz.,10.0,10.0,10.0,1603873470
Geçen hafta kelle paça sipariş ettik çok güzeldi fakat bugün tekrar sipariş ettik aşırı tuzlu ve yağlıydı üzüldük cidden.,10.0,10.0,4.0,1603873470
Güzeldi.,9.0,10.0,9.0,1603873470
Adana dürümü gayet güzel.,9.0,9.0,10.0,1603873470
Lavaşlar daha taze olursa daha iyi olur.,10.0,10.0,8.0,1603873470
Sürekli sipariş verdiğim bir yer haline geldi harikalar.,10.0,10.0,10.0,1603873470
Mükemmelllll.,10.0,10.0,10.0,1603873470
Tavuk şiş istedik adana yolladınız siparişlere bakmıyorsunuz galiba.,10.0,5.0,5.0,1603873470
Cizbiz forever.,10.0,10.0,10.0,1603873470
Güzeldi.,9.0,9.0,9.0,1603873470
"Orta yaşlı, esmer, iri kuryeniz çok laubali ve ukalaydı. Rahatsız ediciydi.",1.0,10.0,10.0,1603873470
Bi kaç tavuk parçasında birazcık az pismislik vardı ama güzeldi...,10.0,10.0,9.0,1603873470
Kurye detayı önemli bir faktör! Sırf bu yüzden birdaha tercih etmeyeceğim.,6.0,6.0,7.0,1603873470
Paket özenli ve lezzetliydi fakat ayranlar unutulmuştu.,8.0,10.0,9.0,1603873470
Lezzetli ve doyurucuydu hızlı da geldi.,10.0,10.0,10.0,1603873470
Elinize sağlık herşey lezzetliydi.,10.0,10.0,10.0,1603873470
"Keşke kuryeniz güler yüzlü olsa, laf sokmak yerine.",7.0,7.0,8.0,1603873470
Hep harika geliyor.,10.0,10.0,10.0,1603873470
Köfte yağlıydı baya.,8.0,8.0,6.0,1601243724
Herşeyi çok güzel özellikle dürümleri çok lezzetli ve fiyat performans olarak çok iyi başarılı bir yer.,10.0,10.0,10.0,1601243724
Lezzeti güzel ama notu devamlı dikkate almıyorlar.,10.0,10.0,10.0,1601243724
İki parçaya bölüp sarıp yolluyolar tadı da gayet iyi... Tatlısı asla bayat değil çok güzel... Verdiğiniz paraya değiyorr.,9.0,10.0,10.0,1601243724
Tavuk şiş dürüme mükemmel bir tat diyemem ama lezzetliydi. Porsiyon da doyurucuydu. Memnun kaldım.,9.0,9.0,8.0,1601243724
Adana nın uzun pidesinde ciğer yolladın ya kralsın. Sadece o ekmeği yollasan bile sana 10 puan veririm. Akşam akşam kendimi memleketimde hissettim öyle diyeyim.,10.0,10.0,10.0,1601243724
İyi.,10.0,10.0,10.0,1601243724
Çok guzel.,8.0,9.0,10.0,1601243724
Süper ötesi taze sıcak çok kaliteli lezzetli idi çok keyifli idi benim için ellerinize sağlık.,10.0,10.0,10.0,1601243724
Tşkler guzeldi.,10.0,10.0,10.0,1601243724
Tavuk şiş dürüm harika. Elinize sağlık.,9.0,9.0,10.0,1601243725
"Elinize saglik oncelikle. Isinizi ciddiye alarak yaptiginiz ve ozendiginiz belli. Yemeginizin, mezelerinizin ve ozellikle de ekmeginizin tadini begendik. Sadece eti ve sebzeleri biraz daha pisirirseniz cok iyi olur. Bol kazanclar :).",10.0,10.0,9.0,1601243725
Çiğ idi.,8.0,8.0,8.0,1601243725
Notları dikkate almanız dileğiyle.,5.0,8.0,9.0,1601243725
Adana dürüm ve servis güzel. Hızlı geldi.,10.0,10.0,10.0,1601243725
Teşekkürler.,10.0,10.0,10.0,1601243725
Adana dürüm lezzetliydi. Teşekkürler.,9.0,9.0,9.0,1601243725
Hızlı ve lezzetliydi.,10.0,10.0,10.0,1601243725
"Tavuk şiş başarılıydı ama tanımadığım etmediğim kurye niye benim soyadımla ilgili şaka yapıyor onu hiç anlamadım, neyine güveniyor.",8.0,10.0,10.0,1601243725
"Köfte harikaydı, ezogelin çorbasını beğenmedik...",10.0,10.0,7.0,1601243725
Akşam 11 de işkembe söyledim ve sıcacık geldi. Lezzeti de gayet iyiydi.,10.0,10.0,10.0,1601243725
Hayatimda yedigim en iyi tavuk sisti abartmiyorum. İşiniz rast gelsin.,8.0,10.0,10.0,1601243725
Tavuk sis harika.,9.0,9.0,9.0,1601243725
"Lezzet olarak gayet doyurucu ve çorba çok sıcak gelmişti, notları her zaman dikkate almanız dileğiyle ellerinize sağlık.",8.0,9.0,9.0,1601243725
İyiydi.,8.0,8.0,8.0,1601243725
Aşırı hızlı geldi siparişte gayet güzeldi.,10.0,10.0,10.0,1601243725
Corba için tüm ekmek yollamışlar :) kebap lezzeti guzeldi. Yanında gelen tatlı var ya efsane! :).,8.0,8.0,9.0,1601243725
Tavuk sisi fena degil buranin. Degisiklik olsun dedim. Kebap yedigim en kötülerdendi. Rahatsız etti.,3.0,1.0,1.0,1601243725
Genel olarak beklentimi karşıladı. Lezzet standart olduğundan bu puanı verdim. Kötü değil ama hmmm denecek bir durum da yok. Fiyata göre gayet güzel. Ancak ankaradaki etlerle de bu kadar kebap yapılabiliyor. Sipariş notumu dikkate almaları takdire şayan.,8.0,10.0,6.0,1601243725
Eski tadı yok sanki birde minimum sipariş tutarını yukseltmeniz üzdü.,10.0,10.0,8.0,1601243725
Sarimsak ve sirke koymamıştınız işkembenin yanına haliyle lezzetsiz oldu.,8.0,1.0,1.0,1601243725
Başarılı.,9.0,9.0,9.0,1601243725
Tavuk şiş dürüm favorim.,10.0,10.0,10.0,1601243725
Mükemmel tavuk şiş anlatılmaz.,10.0,10.0,10.0,1601243725
Tavuk şiş dürüm menü söylemiştik. 2 tanesinde peçete tuz eksik geldi fakat tatlıyı 1 tane fazla göndermişsiniz. Hakkınızı helal edin :) tat güzeldi tatlılar nefisti. Eksikler olmasaydı on numara olurdu ama fazla tatlı ile amorti ettik :).,9.0,9.0,9.0,1601243725
Kurye abi olmasa ah bu hayat çekilmez.,8.0,9.0,10.0,1601243725
Güzeldi.,9.0,9.0,9.0,1601243725
"Tavuk pirzolası harika, servisi hizi ve en önemlisi lezzeti şahane, anne yemegini aratmayan bi müessese, gönül rahatsızlığıyla tavsiye ederim.",10.0,10.0,10.0,1601243725
"Her şey on numaraydı, mezeler falan hem bol hem çok güzeldi. Bundan sonra ölene kadar sizciyim.",10.0,10.0,10.0,1601243725
Tavuk şiş oldukça lezzetliydi ellerinize sağlık.,10.0,10.0,10.0,1601243725
Hepsi mukemmel zaten aboneyim tesekkurler.,10.0,10.0,10.0,1601243725
Çok hızlı ve lezzetliydi.,10.0,9.0,9.0,1601243725
Güzell.,10.0,10.0,10.0,1601243725
Çok iyi.,10.0,10.0,10.0,1601243725
10numara.,10.0,10.0,10.0,1601243725
Hoş.,10.0,10.0,10.0,1601243725
Elinize sağlık cansınız.,10.0,9.0,10.0,1601243725
Hic tavsiye etmiyorum cig adana buz gibi corba gonderdiler attim inanin ki parami da helal etmiyorum.,1.0,1.0,1.0,1601243725
Harika.,10.0,10.0,10.0,1601243725
Çorba menü seçtim köfte hariç begendim güzeldi köfte pismemisti içi kırmızı idi.,9.0,9.0,7.0,1601243725
Çok iydi teşekkürler çok beğendim.,10.0,10.0,10.0,1601243725
"Notları okumuyorlar, çok yavaşlar.",1.0,1.0,1.0,1601243725
"Herkesin bir uzmanlık alanı var, sizinki tavuk şiş. Köfteyi çok beğenemedim ama tavuk şişleriniz hatırına fazla puan kırmadım. Cin biber rica ettim sağ olsunlar bir sürü göndermişler. Teşekkürler...",10.0,10.0,8.0,1601243725
Güzel.,9.0,8.0,8.0,1601243725
Notlar okunmuyor.,9.0,7.0,8.0,1601243725
Burdan alışveriş yapın arkadaş.. Bu adamlar hem ilgili hem yardımsever:).,10.0,10.0,10.0,1601243725
"Mercimek çorbası ve adana çok lezzetliydi, üstelik çoh hızlı teslimatı gerçekleştirdiler.",10.0,10.0,10.0,1601243725
İşkembe söyledik. Son derece lezzetliydi ve hızlı bir servisti.,10.0,10.0,10.0,1601243725
Siparislerimiz de hızınıza o kadar alıştırdınız ki son siparişim bir saatten fazla bir sürede geldi. Lezzet ve sunum muhteşem iyi çalışmalar.,3.0,10.0,10.0,1601243725
Tavuk şiş dürüm çok iyi.,10.0,10.0,10.0,1601243725
Güzel bir siparişti.,7.0,9.0,10.0,1601243725
Çok beğenerek yediğim ve sürekli yüksel puan verdiğim bir restorant idi min paket tutarı arttığı için tepkimi böyle gösterebildim. Kusur bakmayın.,6.0,6.0,6.0,1601243725
Kurye arkadaşın samimiyeti ve esprilerinden dolayı 10/10.,10.0,10.0,10.0,1601243725
Durumun içindeki domates bozulmuştu.,7.0,8.0,8.0,1601243725
Lavaşı biraz kalın geldi. Onun dışında gayet lezzetliydi.,10.0,10.0,9.0,1601243725
Adana kebap güzeldi.,10.0,10.0,10.0,1601243725
Güzel köftelere devam.,10.0,10.0,10.0,1598613979
"Hastamız için işkembe çorbası geldi, lezzetliydi. Müşterisiyle ilgili bir işletme.",10.0,10.0,10.0,1598613979
Köfte effsane.,10.0,10.0,10.0,1598613979
Güzeldi.,9.0,9.0,8.0,1598613980
Tavuk şiş söyledim aşırı ağır bi koku vardı ayrıca geç geldi.,1.0,1.0,1.0,1598613980
Biraz yavaş geldi ama çok lezzetliydi paranızın hakkını alıyorsunuz.,10.0,9.0,10.0,1598613980
Adanaliyim. Adana kebabinin tadi orijinaliyle ayniydi. Elinize sağlık.,10.0,10.0,10.0,1598613980
Gayet sicak ve lezzetliydi tavuk şiş söyledim ama mutebbel olarak gönderdiğiniz mezenin mutebbel ile alakasi yok patlıcan dan yapılan bir şey ama sadece yoğurt yedim resmen :) yinede elinize saglik.,10.0,10.0,10.0,1598613980
Gayet lezzetli ve hızlı ancak adana sında değişik bir tat var. Kötü değil ama tadını biraz değiştirmiş. Sebebini anlayamadım. Onun dışında gayet güzel. Tavsiye edilir.,10.0,10.0,10.0,1598613980
Tereyağlı mercimek diyince bi garipsemiştim fakat cızbız adını görünce tamam dedim ve sonuçta gayet iyi bir çorba içmiş oldum. Elinize sağlık.,10.0,10.0,10.0,1598613980
Kurye maske takmıyordu.,9.0,1.0,9.0,1598613980
Güzel.,10.0,10.0,10.0,1598613980
Gayet hızlı ve güzeldi.,10.0,10.0,10.0,1598613980
"2 tavuk şişin ezmesi falan gönderilmemişti, onun haricinde güzeldi, ona dikkat edilse daha da iyi olur.",10.0,8.0,10.0,1598613980
Köfteleriniz bir efsane. Ellerinize sağlık.,10.0,10.0,10.0,1598613980
Usta yemek iyi mükemmel hatta da biberlerin çok acı be eklemlerime kadar yandım.,9.0,10.0,10.0,1598613980
Adana lezzetli..,9.0,9.0,9.0,1598613980
Baya iyi.,10.0,10.0,10.0,1598613980
Limonu unutmayınız lütfen :).,10.0,9.0,9.0,1598613980
Mükemmel.,10.0,10.0,10.0,1598613980
Çorba iyi değil nedense kac kere söyledim sizden hepsinde aynı tat hiç düzelmedi demekki böyle seviliyor bana yavan geldi tadı yal gibi.,8.0,10.0,8.0,1598613980
Köfte çok güzeldi.,10.0,10.0,10.0,1598613980
Guzel.,10.0,10.0,10.0,1598613980
Lezzetli hızlı.,9.0,9.0,9.0,1598613980
Çatal kaşık tuz yok.,9.0,4.0,6.0,1598613980
Tereyağlı mercimek baya iyiydi her zmaan temiz hızlı ve yemekleri lezzetli.,10.0,10.0,10.0,1598613980
Tadı güzel lakin 1 saatte falan geldi. Gelcekleri yerde oturdugum mesafe yurume bile 15 dakika. Neyse tadı guzeldi biber biraz fazla acıydi.,3.0,8.0,8.0,1598613980
Tek kelimeyle harika.,10.0,10.0,10.0,1598613980
Denenebilir.,7.0,8.0,8.0,1598613980
Ellerinize saglık süperdi.,10.0,10.0,10.0,1598613980
"Doyurucu ve lezzetli, yıllardır vazgeçilmezimsiniz.",10.0,10.0,10.0,1598613980
Dört dörtlüktü.,10.0,10.0,10.0,1598613980
