comment_text,comment_speed,comment_service,comment_taste,comment_time
Herzamanki gibi hızlı ve sıcak.,10.0,10.0,10.0,1606415968
Çok güzeldi.,10.0,10.0,10.0,1605811168
Yıllardır kumpir alırım. Kalite hep aynı hiç değişmedi. Tavsiye ederim.,10.0,10.0,10.0,1605811168
İyi.,10.0,10.0,10.0,1605724768
Hastasıyız.,10.0,10.0,10.0,1605724768
Aldığı paranın hakkını veren bir işletme teşekkürler.,10.0,10.0,10.0,1605119968
İçinde olmasın dediğimiz her şey salatanın içindeydi.,5.0,1.0,5.0,1605119968
"Tavuklu kumpiri çok beğendim, ellerinize sağlık.",10.0,10.0,10.0,1604947168
Çok güzeldi.,10.0,10.0,10.0,1603872622
Her şeyiyle çok beğendim.,10.0,10.0,9.0,1603872622
"Kumpir ankarada yediğim en güzel kumpirdi, elinize sağlık.",10.0,10.0,10.0,1603872622
Aylar sonra tekrar kumpir söyleme fırsatı buldum. Hl ankaranın 1 numarası olduğunu düşünüyorum. Şiddetle tavsiye edilir.,8.0,9.0,10.0,1603872622
Pataesler kızarmamış ve soğuk geldiği için üzüldüm...,10.0,7.0,8.0,1603872622
"Kumpir cok lezzetliydi. Daha önce restoranında da yemistim. Öneririm. Hizli servis icin de ayrıca tesekkurler. Ama bir dahaki sefere yazdigimiz notu okursaniz seviniriz, zira icinde olmasin diye belirttigimiz halde konulan malzeme, yemege ayıklama yaparak baslamamiza sebep oluyor. Iyi calismalar.",10.0,10.0,10.0,1603872622
"Beğeniyorum, sipariş notuna sanırım bakılmıyor ama.",9.0,10.0,10.0,1603872622
Karman corman olmus bi yogurtlu kebapdi cok kotuydu lezzet de hic yoktu.,4.0,2.0,1.0,1603872622
Mükemmel.,10.0,10.0,10.0,1603872622
Çok yavaş bnotlar okunmuyor?,1.0,1.0,1.0,1601242876
Tavuk ızgara baya lezzetli ama porsiyonu azz :(.,10.0,10.0,10.0,1601242876
Ben salatayı çok beğeniyorum. Kumpiri de şahane buranın. Ama eskiden salata daha buyuktu.,9.0,9.0,9.0,1601242876
Hızlı geldi ama hiç lezzetli değildi. Malzemeden de kısmamışlar aslında ama kaşar yoktu resmen.,10.0,9.0,4.0,1601242876
Ne yazık ki düşündüğüm kadar lezzetli değildi.,10.0,10.0,5.0,1601242876
Guzeldı.,10.0,10.0,10.0,1601242876
Her zamanki gibi çok iyi.,10.0,10.0,10.0,1598613130
Sıcacık ve lezzetlıydı.,10.0,10.0,10.0,1598613130
Kaşık ve peçete yoktu.,5.0,1.0,9.0,1598613130
Tavuğu pişmemiş gibiydi.,10.0,6.0,4.0,1598613130
Ketçap bir dükkanı batırmaz diye düşünüyorum. Bide tabi tarihi geçmiş acı sos. Birdaha asla.,1.0,1.0,1.0,1598613130
Barbekü tavuklu salata istemiştim. Çok lezzetli ve doyurucuydu. Yanında gönderdiğiniz kısır için de teşekkür ederim.,9.0,10.0,10.0,1595983385
Kaşar çok az. Malzemeleri koyan arkadaş bunun farkındadır.,9.0,7.0,7.0,1595983385
"Salata sebzeleri taze, porsiyonları doyurucu.",9.0,9.0,9.0,1595983385
Always delicious!,10.0,10.0,10.0,1595983385
Teşekkürler.,10.0,10.0,10.0,1595983385
"Son zamanlarda lezzeti çok bozuldu. Kumpirin patatesleri beklemiş ve bayattı, fettuchine makarna ise lapa geldi. İçinde krema yoktu. Tavuğuda ızgara tavuk yapılan baharatlı tavuk kullanılmış:)))) salataları efsaneydi ancak gitgide porsiyonları küçüldü ve şimdi minicik kaldı.",8.0,8.0,1.0,1595983385
3 tane kumpir söyledik 2 tane kaşık ve ketçap göndermişler. Çatalla yemek çok zor oldu kıraca yakışmadı bu.,9.0,7.0,9.0,1595983385
Gayet iyiydi.,9.0,9.0,9.0,1595983385
Harika bir lezzet ankarada yedigim en iyi kumpir diyebilirim. Beni tek uzen minimum siparis ucretinin bu kadar yuksek olmasi :).,10.0,10.0,10.0,1595983385
Berbat.,1.0,1.0,1.0,1595983385
"Salata gayet lezzetli, yanında kısır ikramı var, servis de hızlı geliyor.",10.0,10.0,10.0,1595983385
Alakasız adrese gidip sonra bulamadım diyerek beni 15 dk sokağa diken kurye evime 5 dk mesafedeki isyerinden kendinden geçmiş buz gibi kumpiri 1 satte getirdi. İsyeri önce kurye gelmiş kapıyı açmamışsınız sonra her aradığımda 2 dk ya orada diyerek gecistirdi.,1.0,1.0,1.0,1595983385
Sıcak ve çok lezzetliydi çalışanlar çok kibar.,8.0,9.0,10.0,1595983385
Berbat bir kumpirdi. Kumpir içine kısır eklemişler sıcak kumpir içinde soğanlı kısır kokusu rezaletti. Turşu havuç dahil ekledikleri malzemeler de taze değildi. 3 adte mantar ya var ya yoktu kumpirde.,1.0,1.0,1.0,1593353639
"Çift peynirli burger yedim gayet güzeldi, denemelisiniz.",10.0,10.0,10.0,1593353639
Kıtır tavuklu kumpirdeki tavuk miktarı çok azdı ve büyük büyük konulmuş onları küçültseniz bari de hiç değilse 8 10 lokmada bir tavuk yenilebilsin. Hızlı ve sıcak geldi fena değildi kumpiri.,9.0,9.0,8.0,1593353639
Güzel.,10.0,10.0,10.0,1593353639
Çok güzeldi.,10.0,10.0,10.0,1593353639
Kalitede geçen aya nazaran düşüş olmasına rağmen başarılı.,8.0,8.0,8.0,1593353639
Geç geldi ve yazdığım not okunmamış.,7.0,7.0,8.0,1593353639
Notları dikkate alın lütfen.,9.0,6.0,9.0,1593353639
"Harikasınız, yıllardır neredeyse hiç soru yaşamadım. Sadece biraz pahalı o da kalitesinden kaynaklanıyor.",10.0,10.0,10.0,1593353639
Garanti iyi kumpir yiyebileceğiniz bir işletme. Teşekkürler. Yalnız sipariş seçeneklerini nadiren dikkate alıyorsunuz acı sos vs şansa geliyor.,10.0,10.0,9.0,1593353639
Her zamanki gibi süper. Sipariş notları biraz daha dikkatli okunmalı.,10.0,8.0,10.0,1593353639
Her zamanki gibi kaliteli.,10.0,10.0,10.0,1593353639
Salataları harikaaaa.,10.0,10.0,10.0,1593353639
Çok yavaş geldi.,1.0,2.0,5.0,1593353639
Lezzeti çok iyi. Fiyatlar uygun. Kurye güler yüzlü ve kibar. Teşekkürler. Tavsiye ederim:).,10.0,10.0,10.0,1593353639
