comment_text,comment_speed,comment_service,comment_taste,comment_time
Boşnak böreği güzeldi. Servis ve hız iyiydi. Sütlü nuriye hayal kırıklığı. Galiba içine yer fıstığı kullanılmıştı. Şerbeti ağır geldi.,8.0,8.0,3.0,1593532173
Teşekkürler...,10.0,10.0,10.0,1593532173
Vasat.,1.0,1.0,1.0,1593532173
Jokerle beklemiş ürün gönderildi.,5.0,5.0,1.0,1593532173
Bu fiyatlara kesinlikle değmez. Jokere aldanıp şişirilmiş fiyatlarla sipariş verdim. Baklavası kızarmamış bile bembeyaz ve az fıstıklı. Dondurma ise erimiş biçimde geliyor kurubuz vs kullanmıyorlar.,5.0,1.0,2.0,1593532173
Üzgünüm ilk defa kötü oy kullanıyorum.,7.0,7.0,4.0,1593532173
Kuryeyi değiştirsinler veya uyarsinlar.,1.0,1.0,6.0,1593532173
Tam 1 saat 40 dakika sürdü haliyle börek buz gibiydi. Telefonla arayıp konuştuğum kişi kibardı lakin kurye yemeği teslim ederken dahi telefonla uğraşıp ağır hareket ediyordu. Kısa aç kaldım.,1.0,1.0,1.0,1593532173
Börek süperdi ama baklava standart klasik her tatlıcıda bulucağınız lezzette.,9.0,8.0,7.0,1593532173
"Böreğin ısıtılmamasını özellikle rica etmiştim, dolaba koyup ertesi gün kullanmak için fakat yine de sıcak servis edildi.",10.0,9.0,8.0,1593532173
Hiç memnun kalmadim.,1.0,1.0,1.0,1593532173
Antep fıstığını az buldum.,10.0,10.0,7.0,1593532173
