comment_text,comment_speed,comment_service,comment_taste,comment_time
Harikasınız( saklıbahçe).,10.0,10.0,10.0,1606681568
Eklerlerin disi iyi ancak hepsinin icinde sanki o lezzetin tatlandiricisi eklenmis muhallebi var gibi. Muzlu olan muzlu puding cilekpi olan cilekli puding gibi. Antep fistiklinin icinde gercek antep fistigi oldugunu da hic sanmiyorum malesef :/.,9.0,9.0,4.0,1606595168
Profiteroller cok guzel ama eklerlerin goruntusu cok guzel degil.,8.0,8.0,4.0,1606249568
Eklerler hep aynı lezzette olmuyor.,8.0,8.0,7.0,1606249568
"Lezzeti gayet güzeldi, kuryede çok kibardı teşekkürler.",10.0,10.0,10.0,1606249568
Güzel.,10.0,10.0,10.0,1606163168
Çok iyi.,10.0,10.0,10.0,1606163168
"500 gr istedim, gelen 300 grdan fazla değil.",8.0,6.0,9.0,1606076768
"Her seferinde hevesle sipariş veriyor, büyük bir keyifle de yiyorum. Ellerinize sağlık.",10.0,10.0,10.0,1605817568
Ekleri biraz değişmiş gibiydi geçen seneye göre geçen sene daha farklıydı içinin kreması garip geldi biraz. Ama profitrolü aynı güzel.,9.0,9.0,8.0,1605817568
Lezzet olarak tatmin etmedi krema ve çikolata sosu kalitesizdi.,5.0,7.0,3.0,1605644768
Ekler çeşitleri güzeldi.,10.0,10.0,10.0,1605558368
Profiterol ve eklerin hamurları gayet güzel elinize sağlık ama maalesef çikolata soslarınızın tadı iyi değil çok şeker tadı geliyor. Daha güzel bir çikolata sosuyla harika olabilir.,10.0,8.0,5.0,1605471968
Çok başarılı.,10.0,10.0,10.0,1605471968
Kreması bayat ve kötüydü bozulmuş gibiydi yiyemedik oderece ağır bi tat vardı.,5.0,5.0,1.0,1605299168
Sipariş hızlıydı ama eski lezzet yoktu.,10.0,4.0,6.0,1605039968
Buyuk hayallerle siparis verdim ama antep fistigi kremaniz inanilmaz yapay bir tat veriyor. Ortalama bir lezzetti benim icin.,8.0,9.0,7.0,1604953568
Tv deki yarışma programı aklımıza getirdi iyiki sizi buldum kızım bayıla bayıla yedi çok beğendi bundan sonra müdavimi olacağız belli. Teşekkürler.,10.0,10.0,10.0,1604867168
Harikaydı vanilyalı çikolata soslusu!,10.0,10.0,10.0,1604607968
"Kesinlikle herkesin yemesi, yedirtmesi gereken sonuna kadar parasının hakkını veren tatlıların bulunduğu bir işletme. İşletme sahibi çok tatlı ve kibar bir beyefendi 3.",10.0,10.0,10.0,1604607968
Çok lezzetli teşekkürler.,10.0,10.0,10.0,1604521568
Çok lezzetli.,10.0,10.0,10.0,1604521568
Teşekkürler.,10.0,10.0,10.0,1604521568
Supersiniz.,10.0,10.0,10.0,1604435168
"Ben pek tatlıcı değilimdir ama arkadaşlar beyaz soslu profiteröllerinden yemeden ben tatlı yedim demeyin, hayatımda yediğim en güzel şeylerden biriydi.",10.0,10.0,10.0,1604348768
"Jokerle aldım ve bu kadar iyi beklemiyordum. Bundan sonra siparişlere devam.. Müdavimi olabiliriz, özellikle profiterol çok iyiydi..",8.0,8.0,10.0,1604262368
Çok hızlı geldi. Gayet lezzetliydi :).,10.0,9.0,9.0,1604051822
"Hızlı geldi, lezzet iyiydi.",10.0,10.0,9.0,1604051822
Güzeldi.,10.0,10.0,10.0,1604051822
Sonunda bostanlı subeden sipariş verebildim bana yakin olan(tuna) şubenizle kalite ve tat olarak dağlar kadar fark var. 2 3 ay sonra yıllardır alistigim kadar kaliteli ekler yedim. Şubeye dikkat etmemistim bostanlı subesinden geleceğini bilseydim profiterolde soylerdim.,10.0,10.0,10.0,1604051822
"Önce arayıp ellerinde olmayan tatlı yerine başka bir tercih yapmamı istediler, sorun yok insanlık hali ama ona rağmen verdiğim adetten 1 tane eksik göndermişler. Aradığım zamansa sonra telafi edelim gibi saçma sapan tavsiyelerde bulundular.",1.0,1.0,5.0,1604051824
Siparişim eksik geldi.,7.0,4.0,8.0,1604051824
Profiterol hakikaten aşırı derecede lezzetliydi ellerinize sağlık ekleride harikaydı biz paket olarak seçtik ama tek sıkıntı pakette ekler seçerken vanilyalı seçemedik çikolatalı aldık ama gayet güzeldi.,10.0,10.0,10.0,1604051824
"Ekler söyledik, gayet lezzetliydi tavsiye ederiz.",8.0,9.0,10.0,1604051824
Antep fıstıklı ekler ve pasta sipariş verdim. Antep tadı yerine ıspanak tadı vardı.,7.0,2.0,3.0,1604051824
Çok güzeldi. Eklerin üzerine eklediğiniz çikolatalar da çok tatlıydı :).,10.0,10.0,10.0,1604051824
250 gram olan profiterol 4 büyük parça şeklinde geliyor bilginize.,9.0,9.0,7.0,1604051824
Ben bu kadar lezzetli profiterol görmedim süpersiniz ellerinize sağlık.,10.0,10.0,10.0,1604051824
Profiterol kulesi lezzetli fakat aşırı tatlı.,9.0,9.0,8.0,1604051824
Canım ekler çekti. Hemen geldi. Taze ve guzeldi.,10.0,10.0,10.0,1604051824
Yine güzeldi.,10.0,10.0,10.0,1604051824
"Lezzetli, her zamanki gibiydi.",10.0,10.0,10.0,1604051824
Güzel.,8.0,8.0,8.0,1604051824
Acayip hızlı geldi. Aromalı eklerin tadı güzel. Profiterol tadı normal ama gramajın çoğu çikolata sosu gibi sanki. (fotodaki 250gr).,10.0,10.0,9.0,1604051824
Ekler müthiş.,9.0,9.0,10.0,1604051824
Hepsine de bayıldımm...,10.0,10.0,10.0,1604051824
Mutlu profiterol kalp ben.,10.0,10.0,10.0,1604051824
Birer tane bile bitiremedik. Sunduklari aromalarin gelenlerle hic alakasi yoktu.,5.0,5.0,5.0,1604051824
"Kalitesi bozulmuş. Beyaz çikolata sosu muhallebi gibi olmuş, çikolata sosu ise bitter ağırlıklı olmuş.",8.0,1.0,1.0,1604051824
Cok lezzetli bulmadım sos kalitesi arttırılmalı.,8.0,9.0,7.0,1604051824
Başarılı.,10.0,10.0,10.0,1604051824
Hız ve servis iyi ancak lezzet hayal kırıklığı oldu maalesef.,8.0,8.0,5.0,1604051824
"Hepsi çok lezzetli, elinize saglik.",10.0,10.0,10.0,1604051824
"Açıkçası adı profiterolcü olan bir yerden çok daha fazlasını beklerdim. Eklerleri orta düzeydi ama profiterolü gerçekten hiç iyi değildi. Sosun tadı ağızda kalmalı, başta çikolatanın, frambuazın ve antep fıstığının aroması baskındır ve ayrımı lezzeti anlamalısınız bir tatlıda.",9.0,5.0,4.0,1604051824
Sizi cok seviyoruz. Kalitesini koruyan nadir isletmelerdensiniz teaelkur ederiz.,10.0,10.0,10.0,1604051824
Cok lezzetli idi. Ellerine saglik yapanlarin.,10.0,10.0,10.0,1604051824
Resmen yeni girne ye 25 dakikada geldi çok hızlılar. Portakallı ve klasikten söyledik. Uyumu inanılmazdı. Tavsiye ederim...,10.0,10.0,9.0,1604051824
Profiterol ve ekler bayat geldi kesinlikle tavsiye etmiyorum.,7.0,7.0,1.0,1604051824
Ekler istedim ne yazıkki bayat geldi.,5.0,5.0,5.0,1604051824
Servis 1 çünkü vanilyalı yerine muzlu ekler gelmiş. Lezzet 7 çünkü profiterolu ne kadar beğendiusem ekleri o kadar beğenmedim. Hamuru choux gibi değildi. Ama hızlı geldi.,9.0,1.0,7.0,1601422078
Lezzet güzeldi.,9.0,9.0,9.0,1601422079
Başarılı.,10.0,10.0,10.0,1601422079
Taze tatlılar ve kibar kurye için teşekkürler.,10.0,10.0,10.0,1601422079
Yok böyle bir lezzet.,10.0,10.0,10.0,1601422079
Profiterolün çikolata sosu çok başarılıydı. Ancak hamur ve krema soğuktu. Donmuş kıvamdaydı diyebilirim. Pek lezzet alamadım.,10.0,8.0,7.0,1601422079
"Resmen hamur bayat, içi ve sosu hazır puddinglerle yapılmış gibi aşırı yapay bir tat. Paket ve hız mukemmel. Gercekten üzülerek söylüyorum lütfen kendinizi geliştirin.",9.0,8.0,2.0,1601422079
Profiterollll mükemmel eklerler biraz bayattı.,10.0,10.0,9.0,1601422079
Oldukça lezzetli.,10.0,10.0,10.0,1601422079
Mükemmel.,10.0,10.0,10.0,1601422079
Her seferinde çok güzel lütfen bozmayın kalitenizi.,10.0,10.0,10.0,1601422079
Hızlı servis lezzetli profiteroller teşekkürler.,10.0,10.0,10.0,1601422079
Yapay bir tat aldım. Karısık prof yedim her birinin aroması cok yapay. Hamurlar kuru. Antepli ekler d oyle. Hamurlar kuru. Aromalar yapay geldi.,10.0,10.0,7.0,1601422079
Sosun kıvamı iyiydi fakat hamuru bayattı en kötüsü de bu krema fena değil.,9.0,6.0,4.0,1601422079
İyi.,8.0,8.0,8.0,1601422079
Harika ve lezzetlii.,10.0,10.0,10.0,1601422079
"Özellikle kestaneli, muzlu ve kavunlu çok başarılı. Diğerleri de başarılı ama bu saydıklarım çok başarılı.",10.0,10.0,10.0,1601422079
Lezzeti güzeldi ama belki bir tık daha artabilir diye 9 puan veriyorum. Kurabiye gibi olup içi dolgulu olan şey ise efsaneydi. Ellerinize sağlık.,10.0,10.0,9.0,1601422079
Süper tavsiye ederim.,10.0,10.0,10.0,1601422079
"Profiterol ve eklerin içindeki dolgu, muhallebimsi kıvamdan çıkmış şekerli birşeye dönüşmüş. Eski hali çok daha güzeldi hiç beğenmedim.",7.0,7.0,5.0,1601422079
Tek kelimeyle efsane.,10.0,10.0,10.0,1601422079
Profiterollerini beğeniyor ve tavsiye ediyoruz fakat bugun supangle deneyelim dedik. Profiterolun sosundan supangle yapmaya çalışmışlar ve kesinlikle o bir supangle değildi. Sosları profiterol sosu olarak güzel ama supangleye yakışmamış.,9.0,9.0,3.0,1601422079
Son verdiğim tatlının üzerinde nerdeyse çukulata sosu yoktu ekler kupkuruydu.,1.0,1.0,1.0,1601422079
Beyaz çikolatalı ve vanilyalı profiterol söyledik ikisi de mükemmeldi. Bayıldımmm.,10.0,10.0,10.0,1601422079
Profiterol da ekler de çok hüzeldii.,10.0,10.0,10.0,1601422079
Profitrol fena degildi ama eklerlerde cok yapay bir tat vardi.,9.0,8.0,3.0,1601422079
Profesyonel isletme hizli servis.,10.0,9.0,10.0,1601422079
Profiterolun dolgusu koyu kivamli muhallebi gibi. Ilk kez boyle bir profiterol yiyoruz begenemedik ne yazikki.,8.0,8.0,1.0,1601422079
Süperdi.,9.0,9.0,9.0,1601422079
Cok beğendik herkese tavsiye ederim.,9.0,9.0,10.0,1601422079
"Eklerler güzel degildi, profiterol her zaman nayslı.",9.0,9.0,7.0,1601422079
Guzeldi.,10.0,10.0,10.0,1598792334
Lezzet ve kalite çok iyi.,10.0,10.0,10.0,1598792334
Hızlı lezzetli.,10.0,10.0,10.0,1598792334
Lezzet güzel pasta biraz daha büyük olabilirdi.,10.0,9.0,9.0,1598792334
"Profiterol güzeldi ama ekler cok kötüydü bayatti icinin kremasi eksimisti, her gün karsiyakayi söylüyorum bugün degisiklik yapip bostanlı söyledim ve cok kötüydü digee subenizde böyle bir ekler hic yemedim hep tazeydi.",7.0,8.0,3.0,1598792334
Lezzetli ve taze.,9.0,9.0,9.0,1598792334
Ekler de profiterol de harikaydı...,10.0,10.0,10.0,1598792334
"Mochalı, klasik ve çikolatalı eklerlerini denedik. Klasik en güzeli. Profiterolün çikolatası pek iyi gelmedi bize ama tatlı krizimizi çözdü. Elinize sağlık.",8.0,8.0,7.0,1598792334
Yeşil dağ profiterol pasta lezzetli fakat aşırıı şekerli. Ekler malesef lezzetli değildi. Profiterol eh.,8.0,9.0,7.0,1598792334
"Ekler bayat gibiydi, profiterol iyiydi ama çikolata sosu hoşuma gitmedi.",10.0,9.0,6.0,1598792334
"Eklerlerin hamurları biraz kuruydu, onun dışında ellerinize sağlık.",10.0,10.0,8.0,1598792334
Profiterol beklentiyi karşılamadı.,10.0,8.0,7.0,1598792334
"Eklerler gayet lezzetliydi, profiteroller orta seviye.",9.0,9.0,6.0,1598792334
"Beyaz çikolatalı soslu istediğim ürün normal çikolatalı sosa karışırılmadan sadece beyaz çikolatalı gelseydi çok daha güzel olurdu ama farklı güzel bir tat oldu, elinize sağlık.",10.0,9.0,10.0,1598792334
Hayatımda yediğim en kötü profiterol. Bornova şubesi böyle değil. Ayrıca profiterol pastası söyledim içindeki kek o kadar kuruydu ki sanırım 2-3 günlüktü. Bir daha buradan almam ama bornova şubesini tavsiye ederim.,9.0,1.0,1.0,1598792334
Superdi.,10.0,10.0,10.0,1598792334
Müptelasıyım.,10.0,10.0,10.0,1598792334
Başarılı.,9.0,9.0,8.0,1598792334
Lezzetli.,7.0,7.0,7.0,1598792334
Temizsiniz hep tazesiniz. Sizi cok begeniyoruz. Bu sefer yeni tatlar denedik. Antep fistikli ve karamelli prof. Harika olmus. Lutfen kalite cizginizi koruyarak devam edin.,10.0,10.0,10.0,1598792334
Gidip aldığımızda tazecik yediğimiz eklerleri eve sipariş verdiğimizde beklemiş ve kurumuş olarak yemek zorunda kaldık malesef.,9.0,9.0,1.0,1598792334
Profiterol gayet güzeldi. Ama karışık ekler kesinlikle taze degildi.,8.0,9.0,5.0,1598792334
"Eklerler yanlış gönderilmişti, aslında çok zor bir şey değil 2 çeşit ekler söyledim yanlış göndermeyi nasıl başardınız cidden merak ediyorum, profiterol ortalamaydı ama bazı toplar sanki bayat gibiydi.",8.0,1.0,5.0,1598792334
Portakallı incirli vişneli ekler muazzamdı tavsiye ederim.,10.0,10.0,10.0,1598792334
Herzamanki gibi süperdi.,10.0,10.0,10.0,1598792334
Kırmızı meyveli olanlar favorim.,10.0,10.0,10.0,1598792334
Profiteroller fena değildi beyaz ve siyah cikolata sosları güzel değildi hele beyaz kötüydü.,8.0,8.0,8.0,1598792334
Supangle berbattı.,8.0,9.0,4.0,1598792334
Eklerlerin efendisi.,10.0,10.0,10.0,1598792334
Hızlı leziz.,10.0,10.0,10.0,1598792334
Sırf çikolata sosunu ayrı satsalar alırım valla elinize sağlık.,10.0,10.0,10.0,1598792335
Restoranın yaklaşımı harika ve lezzetleriyle de bir o kadar farklı.,10.0,10.0,10.0,1598792335
Tatlılar cok basarılı.,9.0,9.0,9.0,1598792335
Elinize sağlık.,10.0,10.0,10.0,1598792335
Kuryeye kocaman not bırakmamıza rağmen hala gidip yanlış zili çalıyor. Bu kaçıncı sipariş durum hep aynı. Çikolatalı ekleri de taze değil bayat göndermişler saolsunlar. Bu son siparişim oldu.,2.0,2.0,3.0,1598792335
Çok beğendik gerçekten.,6.0,10.0,10.0,1598792335
Şaşırtmadı.,10.0,10.0,10.0,1598792335
Servis hızınızı artırmanız iyi olabilir.,7.0,5.0,7.0,1598792335
Sakızlı dondurma harika tavsiye ederim.,10.0,10.0,10.0,1598792335
Temassız teslimatın kapı koluna asılması yerine yere bırakılması dışında herşey yolunda.,7.0,1.0,8.0,1598792335
Süper.,10.0,10.0,10.0,1598792335
Porsiyonları biraz büyütürseniz daha iyi olabilir.,7.0,7.0,7.0,1598792335
Çilekli ekler ve frambuazlı profiterol mükemmeldi.,10.0,10.0,10.0,1598792335
Taze ve güzeldi.,10.0,10.0,10.0,1598792335
Dondurma çok iyiydi.,10.0,10.0,10.0,1598792335
"Dondurma cok iyi, profiterolun cikolatasi guzel, profiterolun kendisi biraz sert.",10.0,10.0,9.0,1598792335
Çok güzel herşeyi.,10.0,10.0,10.0,1598792335
"Profiterol gerçekten güzel. Kreması, hamuru ve çikolata sosu olması gerektiği gibi. Bir kez sipariş verin sonra bir daha isteyeceksiniz.",10.0,10.0,10.0,1598792335
Profiterol cok guzel. Ozellikle sosu.,9.0,9.0,9.0,1596162589
Gerçekten profiterol bir tutkudur.,10.0,10.0,10.0,1596162589
Haaaaarrrrriiiiiiiikkkkkkaaaaaaaaaa.,10.0,10.0,10.0,1596162589
Hepsi olmasa da 90 nı damak tadımıza uygundu afiyetle yedik. Elinize sağlık.,10.0,10.0,10.0,1596162589
"Dondurmaları fazla tatlı diğer pastane dondurmaları gibi meyveden değil gibi, ama gramajları gayet fazla :).",8.0,8.0,8.0,1596162589
Profiterol güzeldi.,9.0,9.0,8.0,1596162589
Ekler ve profiterol çok taze ve güzeldi. Çikolata sosunuzun çok baymaması baya güzel olmuş. Ellerinize sağlık.,10.0,10.0,10.0,1596162589
Süper bıkmadan yediğimiz lezzetler. Limonatası mutlaka tatılmalı.,10.0,10.0,10.0,1596162589
Ekler istediğimiz gibi değildi maalesef daha öncede defalarca burda sipariş vermiştim... Cesitli ekler dedim 3 çeşit ekler geldi sitede 10 12 çeşit görünmesine rağmen... Bu arada getiren arkadaş cok kibardi... Teşekkür ediyoruz.,10.0,10.0,5.0,1596162589
Kuryeci abi fazla gergin.,10.0,5.0,10.0,1596162589
İyi.,10.0,10.0,10.0,1596162589
Güzeldi.,10.0,10.0,10.0,1596162589
20 dk da ulaştı.,10.0,10.0,10.0,1596162590
İyi.,10.0,10.0,10.0,1596162590
Mochali olan ekler eksimisti malesef :(.,8.0,9.0,7.0,1596162590
Profiterol abartıldığı kadar iyi değildi. Ve çilekli ekler kupkuru ve bayat geldi malesef :( hayal kırıklığına uğradım.,10.0,10.0,4.0,1596162590
Seviyoruz.,10.0,10.0,10.0,1596162590
Superr.,9.0,9.0,9.0,1596162590
Çok güzeldi.,10.0,10.0,10.0,1596162590
Harika.,10.0,10.0,10.0,1596162590
"Profiterolün iç kremasının hem kıvamı, hem de lezzeti iyi değildi. Bayatlamış gibiydi.",10.0,9.0,7.0,1596162590
Herşey çık taze ve lezzetliydi teşekkürler.,10.0,10.0,10.0,1596162590
Her zamanki gibi hızlı ve güzeldi. Karşıyakadaki en iyi eklerlerin burada olduğunu söylemek abartı olmaz.,9.0,8.0,10.0,1596162590
Güzel.,10.0,10.0,10.0,1596162590
Hiç baymadı ve çok tazeydi.,10.0,10.0,10.0,1593532844
Dondurma keçisütü güzel profiterol karışık ama çok aroma farkları yok ve az satılanlaar için seçenek vermiş hissettim kendimi keşke klasik tek çeşit isteseydim. Profiterol antep fıstığı ile alakası yok sadece yeşilimsi. Yine de tşk ederim hızlı ve özenli.,10.0,10.0,5.0,1593532844
"Güzel, memnun kaldık.",9.0,10.0,9.0,1593532844
Kesinlikle çok lezzetliydi. Sadece ek 2 ekler istemiştim o eksik geldi. Ama lezzetine söyleyebileceğim hiçbir şey yok mükemmel.,10.0,10.0,10.0,1593532844
Süper lezzet.,10.0,10.0,10.0,1593532844
Severiz.,10.0,10.0,10.0,1593532844
15 dakikada geldi ama vişneli profiterolün ve beyaz çikolatanın tadı eskisi gibi lezzetli değildi.,10.0,10.0,7.0,1593532844
Bu aralar klasik çikolatalı favorimizbeyaz çikolatalı fena değil.,10.0,10.0,10.0,1593532844
Bu kadar hızlı beklemiyordum teşekkürler.,10.0,10.0,10.0,1593532844
Ekler sipariş ettik. Çok güzeldi. Ellerinize sağlık.,10.0,10.0,10.0,1593532844
"Daha önce hiç sipariş vermemiştim, fırsat görünce denemek istedim çok bayat ve lezzetsizdi, çikolata sos sanki su ile yapılmış işi profitorol olan bir işletmeye bu ürünü yakıştıramadım bir daha da sipariş vermem.",8.0,8.0,2.0,1593532844
"Çok çok tazeydi, teşekkürler.",10.0,10.0,10.0,1593532844
"Yorumlarda herkes öyle bir övmüş ki, insanı büyük beklentiye sokuyor. Güzeldi fakat ben daha önce ne yiyormuşum? Dedirtecek bir farklılık göremedim. Fiyatına göre gayet iyi tabii.",9.0,9.0,8.0,1593532844
Çikolata sosu çok suluydu.,10.0,9.0,6.0,1593532844
Profiterol gerçekten çok güzeldi ancak ekler daha iyi olabilirdi elinize sağlık.,10.0,10.0,8.0,1593532844
Harikaydı elinize sağlık.,10.0,10.0,10.0,1593532844
Hayatimda yedigim en iyi profiterol ve eklerdi bi tatli nasil bu kadar hafif olabilir şoktayim.,10.0,10.0,10.0,1593532844
Maalesef gönderdiğiniz kestaneli ekler ciddi ölçüde ekşimişti. Çilekli de bayattı. Daha önceki siparislerimin hic birinde bu sorunu yaşamadım. Ciddi bir hayal kırıklığı oldu :(.,8.0,7.0,5.0,1593532846
Eklerlerde neredeyse çikolata yoktu. Üzerine yumurta fırçasıyla azıcık sürülmüş gibi.,9.0,7.0,3.0,1593532846
Çikolata sos daha kaliteli olabilir ve içler beyaz pastacı kreması olsa daha iyi olur çok yoğun bir çikolata tadı olmuş.,9.0,8.0,5.0,1593532846
Guzel.,9.0,9.0,9.0,1593532846
Daha onceki siparislerime gore cok lezzetsizdi. Sanirim kremasi eksimisti. Buna dikkat etmenizi taze urun gondermenizi rica ederim.,9.0,9.0,7.0,1593532846
Tadı bozulmuş tamamını yiyemedik bile kaldı.,1.0,1.0,1.0,1593532846
Uzun zamandır aradığım profiterol tadını buldum. Harika.. Her gün yesem bıkmam sanırım:).,10.0,10.0,10.0,1593532846
Ekler çok güzel.,9.0,9.0,9.0,1593532846
Taze ve lezzetliydi ayrıca çok hızlı geldi.,10.0,10.0,10.0,1593532846
Muazzam.,10.0,10.0,10.0,1593532846
İstediğim saatte gelmesi ve ürünlerin güzel paketlenmesi ile lezzetleri harikaydı teşekkürler.,10.0,10.0,10.0,1593532846
Klasik vanilyalı ve kavunlu profiterol çok güzel eklerler damak zevkimize uymadı malesef. Profiterol den devam.,10.0,10.0,9.0,1593532846
Harika.,10.0,10.0,10.0,1593532846
Harikaydi.,10.0,10.0,10.0,1593532846
Profiterol siparişi verdiğim halde supangle geldi. Önemli değil ama arayıp sorabilirdiniz.,10.0,10.0,1.0,1593532846
Profiterol.,10.0,10.0,10.0,1593532846
"Hız, serviz, lezzet hepsi gayet iyi. Teşekkürler.",10.0,10.0,10.0,1593532846
Frambuazlı ekleri ilk defa yedim çok güzeldi çok beğendim ve siparişim çok hızlı geldi :).,10.0,10.0,10.0,1593532846
Cok daha iyi olabilirsiniz.,9.0,9.0,9.0,1593532846
"Elinize sağlık, dört dörtlüktü.",10.0,10.0,10.0,1593532846
Ah canım profiterolcü geç buldum seni geç.,10.0,10.0,10.0,1593532846
Böylesi lezzetli ve hızlı bir tatlı keyfi yok. Ailecek bayılıyoruz teşekkürler.,10.0,10.0,10.0,1593532846
Mükemmel.,10.0,10.0,10.0,1593532846
Gayet tatmin ediciydi.,9.0,8.0,8.0,1593532846
Teşekkürler.,10.0,10.0,10.0,1593532846
"Yani cok da bir ozelligi yoktu hatta cok fazla siradandi. Sosu az geldi. Dolu dolu bir tatli keyfi drgildi. Dondurma standartti, fiyati yuksek geldi az porsiyondu.",9.0,8.0,5.0,1593532846
Profiterol tap taze sosu da çok güzel. Karşıyaka taraflarındaki en iyisi.,7.0,8.0,9.0,1593532846
Her şeyi ile süper. Tekrar sipariş veriyorum.,10.0,10.0,10.0,1593532846
Berbattı.,8.0,5.0,1.0,1593532846
Tek kelime ile mukemmel.,10.0,10.0,10.0,1593532846
Süperrrrrr.,10.0,10.0,10.0,1593532847
Ellerine sağlık çok güzel ve başarılı bir profiterol yedik teşekkür ederim hayırlı işler bol kazançlar dilerim.,10.0,10.0,10.0,1593532847
Her zamanki gibi harikaydı.,10.0,10.0,10.0,1593532847
Eklerler lezzetsizdi. Çikolatalı ekler içine beyaz krema olmalıydı.,7.0,10.0,6.0,1593532847
Her zaman mukemmel.,10.0,10.0,10.0,1593532847
15 dk geldi çok lezzetliydi.,10.0,10.0,10.0,1590903101
Işık hızıyla evimize geldi. Öyle lezzetliydi ki bayıldık.,10.0,10.0,10.0,1590903101
Harika.,10.0,10.0,10.0,1590903101
Profiterol çok iyi değildi beyaz çikolatalı söyledim ama tadı yoktu.,8.0,8.0,8.0,1590903101
Harika otesi!,10.0,10.0,10.0,1590903101
Urunler vasat ve taze degil illa tatli olsun derseniz soyleyin.,5.0,6.0,1.0,1590903101
Lezzetliydi.,10.0,10.0,10.0,1590903101
Bağımlılık yapıyoryiyomfoodblogger.,9.0,9.0,10.0,1590903101
Herşey çok güzeldi. Profiterole ve özellikle sosuna bayıldım.,10.0,10.0,10.0,1590903101
