comment_text,comment_speed,comment_service,comment_taste,comment_time
Acılı istedik acısız geldi.,1.0,1.0,1.0,1606683962
Sucukta kavurma da kokuyordu bilginiz olsun.,10.0,10.0,5.0,1606597562
Adana lezzetli.,9.0,9.0,9.0,1606597562
"Bu restoranı hiç kimseye tavsiye etmiyorum. İlk olarak dürüm alacaksanız hiç almayın daha da acıkırsınız. Başlamadan önce daha toktum. Ve kuryenin kapılara karşı bir kini var sanırsam, kapımla kavga ediyordu aşağıya indiğimde. Ne alıp veremediği var kapıyla anlamadım. Birdaha asla.",6.0,5.0,7.0,1606424762
Ellerınıze saglık çok güzeldi.,10.0,10.0,10.0,1605819962
Mükemmel.,10.0,10.0,10.0,1605474362
Porsiyon bir kişiyi doyuracak sekilde gelmedi yarm porsiyon diyebiliriz.,8.0,5.0,8.0,1605387962
Mükemmel tek tercih lahmacunlar biraz daha çıtır olabilirdi.,9.0,10.0,8.0,1605128762
"Ellerinize sağlık çok güzeldi. Bunu şikayet olarak söylemiyorum yanlış anlaşılmasın, lahmacunlar soğuktu. Fırına koydum. Çıtır çıtır oldu. Afiyetle yedim.",10.0,10.0,10.0,1605042362
İçeceğim gelmedi.,8.0,1.0,6.0,1604696762
Lezzet vasat bozmuşlar adana ve urfayi daha önceden yemistim boyle degildi ve geç geldi buz gibi.,5.0,5.0,5.0,1604610362
Qqq.,10.0,10.0,10.0,1604523962
Herşeyi çok güzel.,9.0,9.0,10.0,1604437562
Teşekkürler.,8.0,8.0,8.0,1604140616
Harikydi.,10.0,10.0,10.0,1604140616
Efsane.,10.0,10.0,10.0,1604140616
Çok amam çok geç geldi soğuk geldi servise ve lezzete gelince güzeldi.,1.0,7.0,8.0,1604140616
Gelen arkadaşın agzinda maske yoktu su pandemi süresinde insan korkuyor geri verecektim siparişi ama iki kere gidip geldi diye bozuk para için vermedim vicdanen.,10.0,1.0,10.0,1604140616
Mükemmel bi lezetti.,9.0,10.0,10.0,1604140616
Efso 10 numara.,10.0,10.0,10.0,1604140616
Böyle bir açık ayran gönderimi yok. Yaptığınız işe saygınız olsun arkadaşlar.,10.0,1.0,8.0,1604140616
Joker siparişi olmasına rağmen çok doyurucu ve lezzetliydi. Ürünler sıcak ta geldi. Mevcut puanlarından daha iyisini hakediyorlar...,9.0,9.0,9.0,1604140616
Güzeldi.,10.0,10.0,10.0,1604140616
Wq.,10.0,10.0,10.0,1604140616
Kaburga da çöp şiş de çok lezzetliydi. Fakat zaten 4 adet olan kaburgadan bir tanesinin sadece kemik çıkmış olması şaşırttı.,10.0,7.0,10.0,1604140616
Ciğer dürüm söyleyip içinde ne olduğunu anlamadığım bir dürüm geldisadece soğanında soğan tadı vardı desem yeri. Bir lokma alıp bıraktım. İlk defa olumsuz yorum yapıyorum desem onun da yeri.,4.0,1.0,1.0,1604140616
"Hızlı ve lezetliydi fakat porsiyonu azdi, salatayla karnimi doyurdum.",10.0,5.0,9.0,1604140616
Fenaa.,10.0,10.0,10.0,1604140616
Lahmacunu çok lezzetliydi. Soğanlarının baharatlı oluşu da çok güzeldi. Çabucak da geldi. Teşekkür ediyoruz.,10.0,10.0,10.0,1604140616
Lahmacunun eti çok kötü kokuyordu.,10.0,10.0,1.0,1601510871
Yani soğansiz dedik soğanlı gekdi. Künefe söyledik çatal bıçak yok tuz yok setvis berbat.,5.0,1.0,1.0,1601510871
Ciger pismemisti ama lahmacununuz harikaydi. Tesekkurler.,9.0,7.0,8.0,1601510871
Pide ve lahmacunun hamurunu beğenmedim biraz kalınmış.,5.0,5.0,3.0,1601510871
Porsiyon gayet iyiydi ama ben cigerden hiç tat alamadım.,8.0,8.0,8.0,1601510871
Hem tadı rezalet hem de hizi.,1.0,1.0,1.0,1601510871
Daha lezzetli olabilir di.,9.0,7.0,5.0,1601510871
Harikaaaa.,10.0,10.0,10.0,1601510871
Yedim yiyeceğine bin pişman oldum yabancı eleman çalışıyor durmadan adres tarif ediyoruz.,1.0,1.0,1.0,1598881125
Közlenmiş biber siparisim gelmedi ama yine de lezzet iyi. Elinize saglik.,10.0,7.0,9.0,1598881125
Hersey için teşekkür ederim.,10.0,10.0,10.0,1598881125
Süper.,10.0,10.0,10.0,1598881125
Rezalet kesinlikle burdan bı daha yemiyeceğim.,1.0,1.0,1.0,1598881125
Soğansız istememe rağmen içi full soğan dolu geldi alerjim var içinden tek tek soğan çıkartmakla uğraştım.,8.0,6.0,6.0,1598881125
Hem açık diyor hem de siparişte yok vs diye uyarı geldi uyuz oldum neyse burayı tercih etmeyin.,1.0,1.0,1.0,1598881125
Pideleriniz çok kuru ve bayat gelmiştir. Közlenmiş biber eklememe rağmen konulmamıştır. Dürüm içerisindeki malzeme zayıf ayrıca diğer kebapçılara göre gramajı yetersiz. Asla tavsiye etmiyorum.,3.0,1.0,1.0,1598881125
"Tadı çok güzeldi ama iki porsiyon istedim 1 kişilik, bir porsiyon getirdi 2 kişilik, ellerine sağlık çok güzeldi.",10.0,10.0,10.0,1598881125
Yavaş geldi yemek soğumaya başlamıştı ve posiyon diğer restourantlara göre küçüktü.,2.0,3.0,5.0,1596251379
Bir daha asla yemek istemem ordan.,1.0,1.0,1.0,1596251379
Mükemmel.,10.0,10.0,10.0,1596251379
Pide çok kuruydu :(.,9.0,1.0,1.0,1593621633
Bırak salata eezmeyi geçtim peçeteyide geçtim tuz dahi yoktu. Bildiğin sadece dürümler geldi:(.,5.0,1.0,4.0,1593621633
İkram konusunda biraz cömert olabilirsiniz dürümler harika ona lafım yok lakin müşteriyi memnun edebilirsiniz.,7.0,6.0,7.0,1593621633
Her zamanki gibi şahaneydi.,10.0,10.0,10.0,1593621633
Lahmacunu çok güzel.,10.0,10.0,10.0,1593621633
Teşekkürler.,10.0,10.0,10.0,1593621633
Tost makinesinde ısıtmak zorunda kaldım ve sade dürüm geldi bildiğin sadece dürüm bide peçete allah razı olsun iyi ki peçete koymuşsunuz ikram koyanlar restoranlar var ordan sipariş verin bence hem yavaş hem pintiler.,5.0,5.0,6.0,1593621633
Her şey çok güzeldi ama tuz gondermemeniz olumsuz değerlendirildi. Üzgünüm.,10.0,10.0,9.0,1590991887
Herşey güzel olsa bile not düşmeme rağmen acılı ezme yoktu lahmacunun yanında hangi lahmacuncu olursa olsun ezme koymassa benim gözümde 0 dır.,1.0,1.0,1.0,1590991887
İlk siparişimdi ama son olmayacak...,10.0,10.0,10.0,1590991888
