comment_text,comment_speed,comment_service,comment_taste,comment_time
Hambuş efsane!,10.0,10.0,10.0,1606525069
Kristy patty cook iyiydi.,10.0,10.0,10.0,1606525069
"Parasının hakkını veren, patatesleri çıtır, inanılmaz doyurucu bir hamburger, tek kelimeyle efsane. Yalnızca bir tavsiye olarak burger içindeki sosun geliştirilmesi yönünde bir yorum bırakıyorum buraya. Teşekkür ederiz :).",10.0,10.0,10.0,1606525069
Teşekkürler moralim bozuktu ama hamburgeriniz biraz olsun dert tasa unutturuyor.,10.0,10.0,10.0,1606525069
Mükemmel ötesiydi herşey. Getiren kurye bile çok efendi yardımseverdi.,10.0,10.0,10.0,1606438669
İyi.,10.0,10.0,10.0,1606438669
Kola unutulmuştu ama lezzet süper patatesler de çıtır.,10.0,7.0,10.0,1606352269
Kullandığınız kutu gıdayla temasa uygun değil ve patatesler kutunun içinde herhangi bir ambalajlama yapılmadan koyulmuş.,9.0,2.0,7.0,1606352269
Buradan 2. Kez söylüyorum bence guzel denemelisiniz.,10.0,10.0,10.0,1606352269
İçinde kullanılan her malzemeye ayrı ayrı bayıldım. Şu ana kadar yediğim en kaliteli ve lezzetli burgerlerden biriydi.,10.0,10.0,10.0,1606265869
"İkinci yorumum, kesinlikle parmak patatesi değiştirmeyin :) şimdi etrafta her mekanda zaten elma dilim patates var. Bu haliyle mükemmel.",10.0,10.0,10.0,1606265869
Harika.,10.0,10.0,10.0,1606265869
"Burgerlerin sırrı oran orantıda saklı :d mükemmel bir cheeseburger yedim, patates kızartmalarınız da çıtır çıtırdı! Ellerinize sağlık :).",10.0,10.0,10.0,1606265869
Hızlı ve çok lezzetli.,10.0,10.0,10.0,1606179469
"Size aradım. Birisi hayır, bu patrik demiş.",10.0,10.0,10.0,1606179469
Aşağıdaki elemanı dinlemeyin ince patatesler çok güzel.,10.0,10.0,10.0,1606179469
Sufle ile kaşık yoktu servis olarak.,10.0,7.0,10.0,1606093069
Yok boyle birsey.,10.0,10.0,10.0,1606093069
Enfes..,10.0,10.0,10.0,1606093069
"Efsane hizmet efsane lezzet, kuryeler normalde hic notu okumaz burada okudular kurye arkadaslar cok iyi.",10.0,10.0,10.0,1606006669
Bende bir esnafim lezzetli ve güzeldi.,10.0,10.0,10.0,1606006669
Bayyyyiliyorum burgerlerine o derece!,10.0,10.0,10.0,1606006669
Patateslerin tadı yoktu boştu ama burger mükemmeldi.,10.0,10.0,10.0,1606006669
"Bakin arkadaslar, ilk siparis verdigimde inanilmazdi hamburger ve patates, fakat ikinci siparisimde ben hayatimda bu kadar kotu bir patates yemedim, elma dilimden inceye gecmisler, sanirim bunu dusunen arkadas cips gibi kitir yapmak istemis ama yenilmiyordu, ve bu hamburgeride etkiliyord..",10.0,10.0,5.0,1606006669
Mükemmel. Patatesler son zamanlarda yediğim en iyi patateslerdi ve gece 3te söylememe rağmen. Hamburger zaten başka bir dünya. Şahsen fiyatının hakkını veriyor.,10.0,10.0,10.0,1606006669
Patateslerim baharat seviyesi cok iyi olmus. Her sipariste daha da iyilesiyorlar. Kurye dostuma selamlar!,10.0,10.0,10.0,1606006669
"Burger bana biraz yağlı gelse de genel olarak lezzetliydi. Aynı zamanda patatesler de çok başarılıydı. Buna ek olarak yemek hızlı geldi ve kurye fazlasıyla kibardı, teşekkür ederim.",10.0,10.0,9.0,1606006669
Hamburger cidden çok güzeldi tek sorun cheddar yerine kaşar koymuşsunuz ama saat geç olduğu için sorun yapamadım.,10.0,10.0,10.0,1605920269
Güzel.,10.0,10.0,10.0,1605920269
Tek kelime ile mükemmel ben ilk defa söyledim ama yani şahane ötesi diyebilirim ellerinize sağlık.. Şiddetle tavsiye ederim..,10.0,10.0,10.0,1605920269
Cheeseburger çok lezzetliydi fakat fiyat için boyutu küçüktü. İyi çalışmalar.,9.0,10.0,9.0,1605833870
Güzel.,10.0,10.0,10.0,1605833870
Güzeldi.,10.0,10.0,10.0,1605833870
Bu nasıl bir hamburgerdir yemeğe kıyamadık.,10.0,10.0,10.0,1605833870
"Menünün en öne çıkan burgeri kruby paty nin imza burgeriniz olması nedeniyle, önce insanın gözünü doyuran, mevcut büyüklüğünden daha büyük bir burger olması gerekiyor. Bunun dışında herşey gayet iyiydi. Elinize sağlık...",9.0,9.0,9.0,1605833870
Harika hamburgerler hızlı ve muhteşem kuryeler. Sadece hamburgerlerdeki tuz oranını 15 azaltabilirsiniz. Bunun haricinde herşey harika.,10.0,10.0,10.0,1605747470
Gerçekten çok iyi.,10.0,10.0,10.0,1605747470
"Biraz pahalı, onun harici mükemmel.",10.0,10.0,10.0,1605747470
"Cok hizli ve sicak geldi, bu paraya yiyebilecegini en iyi hamburger :) gozunuz kapali sipariz verebilirsiniz!",10.0,10.0,10.0,1605747470
Çokkk beğendik ellerinize sağlık.,10.0,10.0,10.0,1605661070
Füme burger ve sufle çok güzeldi.,10.0,10.0,10.0,1605661070
"Patatesleri yumuşamamış, sıcak ve çıtır çıtır leziz bir şekilde geldi( porsiyon olarak gayet fazla ve doyurucu ) hamburgeri gerçekten inanılmaz denemediyseniz mutlaka tavsiye ederim.",10.0,10.0,10.0,1605661070
Her şeyiyle harikaydı. Kuryeniz çok kibar yaaa ponçik deyip sarılasım geldi. Hamburger çok lezzetliydi ve patates çok çıtırdı kesinlikle favori restoranım burası artık.,10.0,10.0,10.0,1605574670
Elinize sağlık.,10.0,10.0,10.0,1605574670
"Hayatimda yedigim en iyi hamburgerdi. Hiz mukkemeldi, kurye cok kibardi, ayrica paketin yanina konulan sekeri cok sevdik. Herkese tavsiye ederim.",9.0,10.0,10.0,1605574670
Açık ara en iyi burgerci.,9.0,9.0,10.0,1605574670
Gercekten tereddutle söylediğim hamburger ve sufle inanılmaz lezzetliydi bundan sonra favorim çok teşekkür ederim böyle bir lezzeti bize sundukları için..,10.0,10.0,10.0,1605574670
50 dakikada geldi. Not okunmadı. Lezzet standart bu kadar çok neyi övülmüş anlamadım :/ hayırlı işler.,1.0,6.0,7.0,1605488270
Spongeboba teşekkür ederiz.,10.0,10.0,9.0,1605488270
Alışkanlıklarımdan kolay vazgeçen biri değilim ama denemek istedim. Gerçekten çok başarılı bir hamburger yedim. Tek sorun patatesleriniz kötü değil ama fazla kuru yerken rahatsız ediyor. Köftenin biraz yağlı olmasından kaynaklı double olduğunda ekmekte dağılma oldu. Hız lezzet servis çok başarılı.,10.0,10.0,10.0,1605488270
Gece 4 te 15 dakikada geldi inanılmaz gerçekten.,10.0,10.0,10.0,1605488270
Tadını merak ettim ve beğendim ama minimum 36 ve fiyat 35. 90 olduğu sürece söyleyemeyeceğim.,10.0,1.0,10.0,1605401870
Yediğim en lezzetli hamburgerdi. Sünger bobun eline sağlık :).,10.0,10.0,10.0,1605401870
Nerdeyse tum burgercilerden siparis verdim ama burasi kalbimden vurdu tadi sosu her seyi sahaneydi hayat zaten zor cok sukur daha da zorlastirmadiniz artik tek adresimsiniz yov.,10.0,10.0,10.0,1605401870
Elma dilim patatesler cok guzeldi burgerin koftesi baharatli bir kofte fena degil kesinlikle deneyin.,10.0,10.0,10.0,1605401870
Gerçek sünger bob burgeri. Ama o burger öyle mc donalds patatesiyle servis edilir mi hocam ya? Gerçekten çok enteresan.,9.0,5.0,9.0,1605401870
Ef-sa-ne! Böylesi burger yenmedi.,10.0,10.0,10.0,1605315470
İyi.,10.0,10.0,10.0,1605315470
"Muhteşem! Ekmekler bulut gibi yumuşacıktı, köftelerin tadı damağımızda kaldı. Harikasınız.",10.0,10.0,10.0,1605315470
Çok lezzetliydi.,10.0,10.0,10.0,1605315470
Daha dur siparişi yeni verdim demeye kalmadan geldi. Çok hızlı ve lezzetli bu hizmet için çok teşekkür ederim. Favorimsiniz artık :).,10.0,10.0,10.0,1605315470
Kesinlikle harika:) güleryüzlü paketçiye de selamlar olsun:))) daha kisa mesafelere min gönderim ücretini biraz daha düşürmenizi tavsiye ederim.,10.0,10.0,10.0,1605315470
Siparişe bastık kapı çaldı. Bu puanları kesinlikle hakediyorlar.,10.0,10.0,10.0,1605229070
Harika burgerleri.,10.0,10.0,10.0,1605229070
Patatesleri düzeltin ömrümü ömrünüze katam.,10.0,10.0,10.0,1605229070
Köftesi bu kadar iyiyse lokum burger cıkartsanız nasıl olur merak ediyorum.. Devaaasaaaa ve güzel.,10.0,10.0,10.0,1605229070
"Yeniliklere açık olmayan biri olarak sırf yorumlara güvenip sipariş verdim bu zamana kadar yediğim net en güzel hamburger olabilir, sıcacık ve çok lezzetliydi getiren arkadaş çok kibardı allah bol bereketli güzel kazançlar nasip etsin.",10.0,10.0,10.0,1605229070
Her şey 10 numara tamam da kurye arkadaşın suratı çok asıktı nedenini anlayamadım.,10.0,10.0,10.0,1605229070
Harika.,10.0,10.0,10.0,1605142670
Hamburger de patates de sufle de harikaydı. Teslimatı yapan arkadaş çok nazikti. Teşekkürler bu harika burger için.,10.0,10.0,10.0,1605142670
"Burgerleri sponge bob yapmış sanki, enfes.",10.0,10.0,10.0,1605142670
Her şeyiyle çok iyi yer.,10.0,10.0,10.0,1605056270
Herzamanki gibi lezzetli.,10.0,10.0,10.0,1604969870
Burger cok daginik geldi onun dışında iyi denebilir.,9.0,6.0,8.0,1604969870
Patates kızartmasını parmak patates olarak geldi eski patatesiniz daha güzeldi.,9.0,7.0,9.0,1604969870
Çok düşünme söyle.,10.0,10.0,10.0,1604969870
Bir önceki siparişimde patatesler daha güzeldi.,10.0,10.0,10.0,1604969870
Kesinlikle alın!,10.0,10.0,10.0,1604969870
Muhteşemdi.,10.0,10.0,10.0,1604883470
Efsane hız efsane lezzet teşekkürler.,10.0,10.0,10.0,1604883470
O burger in yanına o patates olmuş mu allh aşkına.,9.0,9.0,7.0,1604883470
Güzel ücretinin hakkını veriyo ama yine de pahalı.,10.0,10.0,10.0,1604883470
Biraz tuz oranı yüksekte olsa lezzetliydi hamburgeri.,10.0,10.0,10.0,1604883470
Hamburger de patates kizartmasi da cok iyiydi.,10.0,10.0,10.0,1604883470
Paketçi kardeşimin hatrina bidaha soylicem on numara çocuk değerini bilin.,10.0,10.0,10.0,1604797070
"Kötü değil, iyi de değil.",8.0,8.0,6.0,1604797070
Tek kelimeyle harika.,10.0,10.0,10.0,1604797070
Bu kadar lezzetli hamburgerin patatesi boyle olmamali.,10.0,10.0,9.0,1604797070
Bay yengeç indirim yapın bu kadar para bağımlısı olmayın... Şaka bi yana güzel tavsiye ederim.,10.0,10.0,10.0,1604797070
Bu hamburger değil bu başka bir şey.,10.0,10.0,10.0,1604797071
Çevrenin en hizli ve en guzel hamburgercisi.,10.0,10.0,10.0,1604797071
"Hamburger seviyorsanız bıradan sipariş verin, o kadar basit.",9.0,9.0,9.0,1604710671
Gerçekten beklediğimden daha fazla güzeldi patates kızartması da harikaydı. Ellerinize sağlık.,10.0,10.0,10.0,1604710671
Çok lezzetliydi. Teşekkürler.,10.0,10.0,10.0,1604710671
Lezzetliydi ancak fazla yağlıydı. Bu konuda daha özenli olursunuz umarım.,10.0,10.0,8.0,1604710671
Gerçekten özenli ve lezzetli tavsiye ederim.,10.0,10.0,10.0,1604624271
Verdiğiniz ücrete kesinlikle değer mükkemmel tadları var teşekkürler.,10.0,10.0,10.0,1604624271
Ayıla bayıla söylüyorduk ama birkaç hafta önceki lezzet yoktu. Tekrar deneyeceğiz ama.,8.0,8.0,6.0,1604624271
"Cok guzeldi ellerinize saglik, geceleri de acik olmalari da bir arti.",10.0,10.0,10.0,1604537871
"Tereddütsüz sipariş verebilirsiniz, kurye nazikçe temassız teslim etti. Hamburgerin ekmeği gece 2de taze ve ve hamburger çok lezzetliydi. Patates güzel kızarmıştı.",10.0,10.0,10.0,1604537871
Akdere minimum tutarı 30-35 çekerseniz sürekli duble burger yedirmeyin bize ) birde tel nonuz lazım hiçbiyerde yok.,9.0,9.0,10.0,1604537871
Patateslerin porsiyonunu biraz küçük buluyorum.,10.0,10.0,10.0,1604451471
"Gecenin 3unde sıcacık geldi, ancak hamburgeri standart.",10.0,9.0,8.0,1604451471
Nice.,10.0,10.0,10.0,1604451471
"Her şey güzeldi, kutu tasarımından minik şekere kadar. Hamburger lezzet bakımından biraz daha geliştirilebilir. Porsiyon da aynı şekilde. Yediğim en güzel patateslerden birisiydi burası. Genel olarak güzel.",10.0,10.0,8.0,1604451471
Mük.,10.0,10.0,10.0,1604451471
Harbi burger.,10.0,10.0,10.0,1604451471
"Lezzetiniz, hızınız aşırı iyi böyle devam edin ilk kez bu kadar iyi bi tavukburger yedim.",10.0,10.0,10.0,1604451471
Lezzetli bir burgerdi. Servis oldukça hızlıydı.,10.0,10.0,9.0,1604365071
Tesekkurler.,10.0,10.0,10.0,1604365071
"Gerçekten nefisti, tebrik ederim hayırlı olsun. Patatesler de gayet güzeldi bu arada. :).",10.0,10.0,10.0,1604365071
İnanilmaz otesi guzelliktesiniz3.,10.0,10.0,10.0,1604278671
Güzel.,10.0,10.0,10.0,1604278671
Sufle biraz zayıf.,10.0,10.0,10.0,1604278671
Çoooookkkk iyi! Ben hayatta duble burger yiyemem. Et tadı ağır gelir ama mexican burgeriniz enfesti!,10.0,10.0,10.0,1604278671
"Her şeye bayıldık, elimize çok sıcak ve hızlı ulaştı.",10.0,10.0,10.0,1604278671
Sıradandı aldığı puanları abartılı buldum.,9.0,9.0,7.0,1604278671
Herşeyin özenle paketlenmesi ve sıcacık hamburger ve o güzelim sos tek kelimeyle mükemmel ellerinize sağlık.,10.0,10.0,10.0,1604192271
Çok hızlı ve sıcak geldi. Lezzeti de baya güzeldi biz iyi pişmiş istedik dikkate almislar. İkramlar için teşekkür ederiz herşey güzeldi.,10.0,10.0,10.0,1604192271
Yine herşey harikaydı. Çok iyi hamburger.,10.0,10.0,10.0,1604192272
"Deeds pizzanın harika hamburger kuruluşu. Her seferinde hızlı, sıcacık ve lezzetli teslimat. Ayrıca kurye arkadaş da çok kibar. Yalnız şu an pazar, saat 09:35 ve restoran kapalı. Bu saatte de hamburger ile şampiyon kahvaltısı etmek isteyen müşterileri de düşünün lütfen :d.",10.0,10.0,10.0,1604192272
Mük.,10.0,10.0,10.0,1604192272
10 numara burgerler. Patatesleri az soslayın lütfen.,10.0,10.0,10.0,1604105872
Gerçekten hızlı geldi ve çok lezzetliydi. Bundan sonra yeni favori hamburger mekanım oldu :).,10.0,10.0,10.0,1604105872
Hamburger çok lezzetliydi çok beğendik fakat patatesler hafif çiğ kalmışlardı ve inanılmaz çok yağ kokuyorlardi. Patatesleriniz iyilestirilebilirse hersey dört dörtlük olur.,10.0,10.0,8.0,1604105872
Muhtesem.,10.0,10.0,10.0,1604105872
Baya iyiydi ya onca burger arasından en sevdiğimdi tartışmasız sadece patates bana biraz kuru geldi ama burgeri ha ri ka.,9.0,10.0,9.0,1604019472
Hamburger aşırı iyiydi.,10.0,10.0,10.0,1604019472
Çok hızlı geldi ve aşşşırı lezzetliydi herşey. Bayıldım.,10.0,10.0,10.0,1604019472
"Kuryeniz o kadar tuhaftı ki sabahın beşinde daire numarası belirtmeme rağmen alt katı uyandırdı ayrıca sanırım türkçe de bilmiyordu bir türlü anlaşamadım kendisiyle, kredi kartıyla ödeyeceğimi belirtmeme rağmen pos cihazı da yoktu, sufle fiyatına göre çok küçüktü patatesler de soğumuştu maalesef..",7.0,2.0,7.0,1604019472
"Sevgili bay yengeç, burgerleriniz harika. Patatesleriniz de git gide daha güzel gönderiliyor. İleriki zamanlarda kibrit patates de spariş verebiliyor olsak harika olurdu. Bir de soğan halkaları daha özenli seçilebilir ve kızartılabilir diye hissediyoruz. Teşekkürler yengeç restoran ailesi!",10.0,10.0,10.0,1604019472
Elerinize sağlık.,10.0,10.0,10.0,1604019472
Gerçekten uzun zamandır yediğim en güzel hamburger idi. Gerçek hamburger tadı vardı. Elinize sağlık. Getiren arkadaş yağmurlu bir akşamda getirdi bahşiş vermeyi atladık inşallah ikinci sipatişimizde telafi ederiz.,10.0,10.0,10.0,1603933072
Güzel.,10.0,10.0,10.0,1603933072
"Gercekten basarili, uzun zamandir boyle bir tad ile karsilasmadim.",10.0,10.0,10.0,1603933072
Çok başarılı hamburgerler yapıyorlar :) servis de hızlı ve seviyeli kuryeler tarafından teslim ediliyor. Teşekkürler.,10.0,10.0,10.0,1603933072
Yediğim en iyi hamburgerlerden biri.,10.0,9.0,10.0,1603933072
Sipariş biraz geç geldi ama soğumuştur diye yenisini yolladılar. Gerçekten özenerek yapıyorlar işleri. Hamburgerleri çok başarılı tavsiye ederim.,10.0,10.0,10.0,1603895326
Ayran patlamış teslim edildi yenisi getirilmedi.,8.0,5.0,8.0,1603895326
Baya iyi.,10.0,10.0,10.0,1603895326
Vejetaryen burgeri doyurucu ve lezzetliydi. Hamburger ekmeği yumuşacık ve çok güzeldi. Kesinlikle şans verilmeli.,10.0,10.0,10.0,1603895326
Servis hızı ve lezzeti gayet tatmin edici. Pişman olmazsınız.,8.0,9.0,8.0,1603895326
"Her şey çok güzeldi, teşekkür ederiz.",10.0,10.0,10.0,1603895326
Vovovovovovovharika!,10.0,10.0,10.0,1603895326
Siparişi verir vermez notu dikkate alarak hemen aramaları zaten bi artıydı.. Beklediğimden çok daha hızlı gelmesi kuryenin hem hijyenik hem güled yüzlü olması artılara devam ediyordu :) ve lezzet muh-te-şem o etin ızgara kokusu ve soslarla uyumlu bütünleşmesi ve sıcacık olması.. Herşeyiyle 10 puan.,10.0,10.0,10.0,1603895326
Hamburger içindeki kibrit patates çok azdı.,6.0,10.0,10.0,1603895326
Hıza inanamadım. 15 dakika da nasıl pişti de geldi anlamadım. Meksika hamburger çok güzel. Diğer yerler gibi vıcık vıcık değil. Mükemmeldi. Tebrik ediyorum.,10.0,10.0,10.0,1603895326
Cok lezzetliydi. Kurye çok beyefendi bir çocuktu. Kibar tavırları icin cok tesekkür ederiz.,10.0,10.0,10.0,1603895326
Kesinlikle tavsiye ederim her konuda mukemmel.,10.0,10.0,10.0,1603895326
Hamburger çok güzeldi kralsınız..,10.0,10.0,10.0,1603895326
Çok çabuk geldi. Burgerler doyurucu ve lezzetliydi. Biz çok memnun kaldık.,10.0,10.0,9.0,1603895326
Genel olarak her şey güzeldi ancak tavuk burgerin açıklamasında çıtır tavuk yazdığı için aldım. Gelen tavuk ise ızgara tavuktu bence açıklamanızı değiştirin çünkü ızgara tavuk olduğunu bilsem almazdım. Bunun dışında lezzet güzeldi. Ellerinize sağlık.,10.0,8.0,9.0,1603895326
Ekmek biraz bayattı ve peynir soğuktu lezzet fena değildi.,9.0,7.0,5.0,1603895326
Deeds pızza olarak zaten pızzalarınızı begenerek yıyıyorduk. Burger lezzetli ve doyurucu ekmek cok basarılı guzel secım olmus ben sureklı yerim.,10.0,10.0,10.0,1603895326
Kurye ağabeyimiz biraz uğraştırdı sağolsun ama değdi diyebilirim. Gayet başarılı hamburgerler.,8.0,10.0,10.0,1603895326
Hamburger gerçekten çok lezzetliydi ancak patatesler mutlaka değiştirilmeli.,10.0,10.0,9.0,1603895326
Açıkçası burger işi yapmak isteyen biri olarak çankaya civarlarında sürekli deniyorum ama yani ankara sınırları dahilinde yediğim en iyi burger bu olabilir. Kesinlikle ama kesinlikle üst sınırda bir burger. Tek kelime ile müthiş. Her şeyi bir araya yığmak burgercilik değil. Gerçekten nefis.,10.0,10.0,10.0,1603895326
Ozellikle evdekiler uyuyor nolur zile basmayin diye not biraktim. Gece 4 de siparis vermistim ve yine de 2 kere zile basildi. Cok mahcup oldum. Keske yazdigim nota azicik dikkat etseydiniz.,8.0,10.0,10.0,1603895326
Sanirim yedigim en iyi burgerdi.,10.0,10.0,10.0,1603895326
Gece 2de istedik ve inanilmazdi. Burger ekmeginiz de patatesiniz de asiri lezzetliydi. Keske min. Gonderim tutariniz bu kadar yuksek olmasa da hep isteyebilsek :).,10.0,10.0,10.0,1603895326
Hamburger mükemmeldi...,10.0,10.0,10.0,1603895326
Mexica burger çok güzeldi. Patatesler az daha baharatlı olursa mükemmel üstü olur. Herşeyiyle güzeldi.,10.0,10.0,10.0,1603895326
"Işınlanmayı keşfetmiş, gececi bir güruhun lezzetli bir deneyimiydi. Teşekkür ediyorum.",10.0,10.0,10.0,1603895326
Yedigim en iyi hamburger diyebilirim.,10.0,10.0,10.0,1603895326
Helal.,10.0,10.0,10.0,1603895326
Her şey çok güzeld teşekkürler.,10.0,10.0,10.0,1603895326
Cok güzel kesinlikle. Tek eksik patates biraz az gibi.,10.0,10.0,10.0,1603895326
Cok cok iyiydi elinize kolunuza saglik :).,10.0,10.0,10.0,1603895326
Güzeldi.,10.0,10.0,10.0,1603895326
Çok lezzetliydi. Her zamanki gibi...,10.0,10.0,10.0,1603895326
"Maske, bizi hem karşı tehditlerden, hem de karşımızdakini kendimizden korur. Kurye arkadaşa, 250 günü aşkın süredir hayatımızı ele geçiren pandemiyi ciddiye almasını öneriyorum.",8.0,5.0,10.0,1603895326
Thank you spongebob!,10.0,10.0,10.0,1603895326
Süper hızlı acayip lezzetli.,10.0,10.0,10.0,1603895326
Vegan burger kötüydü.,6.0,5.0,1.0,1603895326
"İnanılmaz güzeldi ellerinize sağlık. Ayrıca aistem arızası nedeniyle gecikme olması ama ona rağmen yemeğin çok sıcak gelmesi hakkında arayıp bilgi vermeniz, hatta özür dilemeniz inanılmaz ince bir davranıştı. Sizi tebrik ediyorum umarım lezzetinizi ve çizginizi bozmaszınız. Tekrar teşekkürler :).",10.0,10.0,10.0,1603895326
Barbekü sos mu katran mı? Karar veremedim çok ekşimsi bi tat burgere yakışmamış yani. 1 ısırık alıp çöpe attım sufle güzeldi ama.,8.0,6.0,2.0,1603895326
Ya sadece pişmiş patates istemiştik. Sadece. Pişmiş. Patates.,7.0,3.0,1.0,1603895326
Hızlı ve sıcak gelmesinden lezzetine kadar çok iyiydi. Teşekkür ederim.,10.0,10.0,10.0,1603895326
Burger çok başarılıydı ama 2 kişilik kolalı menüler olursa daha da iyi olur.,10.0,10.0,10.0,1603895326
Çok lezzetliydi şeker de göndermişler çok sevdim.,10.0,10.0,10.0,1603895327
"Herşey 4x4 lüktü. Kuryeden hıza, lezzetten sunuma... Teşekkürler...",10.0,10.0,10.0,1603895327
10 numara burgerdi herşeyiyle. Elinize sağlık. Hijyen de iyi.,10.0,10.0,10.0,1603895327
Hiç beklemediğim kadar hızlı geldi lezzeti çok iyi elinize emeğinize sağlık çok teşekkür ederim ve her zaman aynı özende devam etmenizi dilerim.,10.0,10.0,10.0,1603895327
Güzel.,9.0,9.0,9.0,1603895327
The french fries was fully raw. The burger though was perfect.,10.0,6.0,10.0,1603895327
Ekmek daha basarili olabilir.,10.0,10.0,9.0,1603895327
Cheeseburger mukemmeldi patatesler daha güzel olsa 10/10.,10.0,10.0,9.0,1603895327
Hamburgerleri çok güzel ama beni koydukları yumuşak şekerlerle tavladılar.,10.0,10.0,10.0,1603895327
Hız konusunda da lezzet konusunda da hijyen konusunda da mükemmeller umarım bu çizgiyi hiç bozmazsınız.,10.0,10.0,10.0,1603895327
918 patates tercih etmeyin lutfen zaten iyi bir urun degil ustune paket servis icin felaket oluyor. Burger ortalamanin ustunde.,10.0,9.0,8.0,1603895327
Burger efsaneviydi. Patatesler ve soğan halkaları hiç güzel değildi.,10.0,10.0,8.0,1603895327
Hamburgerler gerçekten çok lezzetliydi elinize sağlık.,10.0,10.0,10.0,1603895327
Çok beğendik. Ankara da ilk sıraya yerleşti bizim için. Teşekkür ederiz.,10.0,10.0,10.0,1603895327
Aynı mahallede olmak ayrı güzel :) burgere gelirsek tadını çok beğendim servis de güzel daha ne olsun.,10.0,10.0,10.0,1603895327
Çok lezzetliydi teşekkürler. Patateslerin içi biraz çiğ gibi daha fazla kızartılması lazım onun dışında burger efsaneydi çok lezzetli teşekkürler.,10.0,10.0,10.0,1603895327
Beğenmedim.,1.0,1.0,1.0,1603895327
Efsanesiniz.,10.0,10.0,10.0,1603895327
Hamburger güzeldi hızlı geldi.,10.0,10.0,10.0,1603895327
Patates de hamburger de muhteşem. Burgeri artık başka bir yerden yemiyorum.,10.0,10.0,10.0,1603895327
Tüm bikini teşekkürler plankton hariç.,10.0,10.0,10.0,1603895327
Teekkürler sünger bob.,10.0,10.0,10.0,1603895327
"Gayet lezzetli idi, teşekkürler.",9.0,10.0,9.0,1603895327
Hamburgerler gayet lezzetli. Paketleme çok özenli. Sadece patatesler biraz daha ince ve kıtır olabilir o kadar. Uzun zamandır yediğimiz en lezzetli burgerdi.,10.0,10.0,9.0,1603895327
"Hamburgerleri çok güzel, sufle ortalama altı.",10.0,10.0,10.0,1603895327
Guzeldi guzelll.,10.0,10.0,10.0,1603895327
Baya lezzetli bir hamburherdi.,10.0,10.0,10.0,1603895327
Alt limit azaltilsa güzel olur hamburgeri çok basarili.,10.0,10.0,10.0,1603895327
"Normalde domates ve turşuyu çıkarmıştım siparişten ama o şekilde gelmiş, aslında daha iyi olmuş. Sanki cidden spongebob yapmış gibiydi, hani çizgifilmin tadına bakmayı hepimiz hayal etmişizdir.. Gerçekten o tadı yakalamışsınız bravo!",10.0,10.0,10.0,1603895327
Herşey çok güzeldi özellikle kuryenin tavrı hoşumuza gitti dikkatli ve özenliydi. Servis ve lezzet de aynı şekilde gayet güzeldi.,10.0,10.0,10.0,1603895327
Gayet güzeldi teşekkür ederiz. Bence patatesler biraz daha çıtır olmalı ama arkadaşım sevdi.,10.0,10.0,10.0,1603895328
"Füme hamburger lezzetli denilebilir, kutu şeklindeki servisiniz güzel fakat müşteriler patatesleri eliyle yemek zorunda değil, çatal göndermeniz gerekirdi. Puanlarınızı biraz şişirilmiş buldum.",7.0,6.0,8.0,1603895328
"Burger harika patates güzel, siparişe gelen arkadaş güzel. Bir tek sufle kek olmuştu çok pişmiş.",10.0,10.0,10.0,1603895328
Lezizdi. Ancak soslardan biri dis macunu rengindeydi daha organik renkli gıda boyaları kullanılırsa veya sos kendi renginde bırakılırsa daha iştah açıcı olabilir.,10.0,10.0,10.0,1603895328
"Daha hızlı teslim edilen ve daha lezzetli hamburgerler yemiştim. Elinize sağlık, sizinki de idare ederdi.",8.0,8.0,8.0,1603895328
"Servis hızlı ve özenli geldi, krabby patty güzel et oldukça lezzetli fakat ekmeği çok lezzetli bulmadım, patatesler de lezzetliydi fakat diğer mekanlara göre miktar azdı, sufle oldukça güzeldi şeker dengesi ve kıvam olarak.",10.0,10.0,8.0,1603895328
O kadar hizli geldiki patates dilimi yakti. Cok da lezzetliydi ellerinize saglik. Insallah hep boyle devam eder.,10.0,10.0,10.0,1603895328
"Genel olarak gayet güzeldi, bence eksikleriniz soslarınız. Burgerde sos ve cheddar baya az vardı ve dogal olarak kuruydu. Ekstra olarak da menülere bir yoğurtlu sos eklemenizi öneririm.",10.0,9.0,9.0,1603895328
Gayet lezzetli ve doyurucu. Ekmeğin kuruluğuna ve biraz fazla kabarmasına bir çare bulurlarsa 10 puan bile olur.,10.0,10.0,9.0,1603895328
"Paketi gorunce burgerde de bir benzerlik yada smiley seklinde ketcap mayonez bekledim :) genel olarak lezzetliydi ama eti iyi pismisti orta olsa daha iyi olurdu, suflenin de cikolatasi akiskan degildi. İlk siparisimdi puan kirmak istemedim tekrar sans verecegim.",10.0,10.0,10.0,1603895328
Gercekten cok lezzetliydi.. Sipariş daha kibar teslim edilemez tesekkurler.,10.0,10.0,10.0,1603895328
Aşırızı lezzetli.,10.0,10.0,10.0,1603895328
Harikaydı hayran kaldım. Artık hamburgercimiz sizsiniz. Çok naziksiniz teşekkürler.,10.0,10.0,10.0,1603895328
Fikir çok iyi. Hep yengeç burgeri tatmak istemiştim. Elinize sağlık.,10.0,10.0,10.0,1603895328
Gerçekten yeni açılmış bir firmaya göre gayet başarılı güler yüzlü hizmet ellerinize sağlık bundan sonra burgerdeki tercihimiz belli oldu.,10.0,10.0,10.0,1603895328
Güzeldi.,10.0,10.0,10.0,1603895328
